name,full_name,description,created_at,pushed_at
OPTIMIZED-MACHINE-LEARNING-FRAMEWORK-FOR-HEART-DISEASE-PREDICTION-,Srikanthdasari007/OPTIMIZED-MACHINE-LEARNING-FRAMEWORK-FOR-HEART-DISEASE-PREDICTION-,OPTIMIZED MACHINE LEARNING FRAMEWORK FOR  HEART DISEASE PREDICTION ,2025-05-24T13:42:09Z,2025-05-24T14:49:17Z
PyE-Plus,MubashirWani/PyE-Plus,Multi-Criteria Decision Making (MCDM) Framework for Building Energy Systems with Expedited Computation using Machine Learning (ML) Techniques,2025-05-24T08:37:21Z,2025-05-30T18:29:23Z
DigitRecognizer,AtlantaJimmy/DigitRecognizer,"A machine learning-based digit recognition system that accurately identifies handwritten or printed digits from images. Built to demonstrate image processing, feature extraction, and classification techniques using popular frameworks.",2025-05-24T05:38:42Z,2025-05-25T18:09:42Z
Predictive-and-Spatial-Analysis-of-HIVAIDS-Outcomes-in-New-York-City,WANS170651/Predictive-and-Spatial-Analysis-of-HIVAIDS-Outcomes-in-New-York-City,A unified framework combining machine learning and spatial analysis to uncover disparities in HIV care linkage and viral suppression across NYC regions.,2025-05-24T00:38:39Z,2025-05-24T00:45:19Z
MetaReflexAI,janxhg/MetaReflexAI,"MetaReflexAI is an AI framework that equips language models with advanced metacognitive capabilities. It enables self-observation, internal behavior analysis, and autonomous adjustment during training, enhancing both the efficiency and the understanding of machine learning.",2025-05-23T21:01:28Z,2025-05-26T23:12:12Z
Data_Prep_Agent,BoyaZhangNB/Data_Prep_Agent,This project preprocess an uploaded csv data file. Many kaggle challenges involve simple data preprocessing to enable further machine learning processing. This agent streamlines the process of such preprocessing and codes in a Jupyter Notebook which the user can use directly to add more machine learning frameworks.,2025-05-23T16:49:44Z,2025-05-23T18:28:07Z
ITEC_federated-iot-anomaly-detection,priyan03/ITEC_federated-iot-anomaly-detection,"A federated learning-based IoT framework that encrypts sensor data, detects anomalies, classifies device risk levels, and visualizes blacklist data using machine learning and real-time dashboards. Intelligence trust and secure edge computing for cyber physical systems.",2025-05-23T14:25:24Z,2025-05-23T15:28:12Z
CausalML---AD,ChristinaOON/CausalML---AD,"A novel causal machine learning framework that includes feature correlation, causal network construction, and counterfactual prediction for anaerobic digestion",2025-05-23T14:24:35Z,2025-05-28T08:42:09Z
Intrusion-Detection,vedurmaliya/Intrusion-Detection,"Using Sampling Techniques, this project aims to solve the class imbalance problem in detecting various types of Network Intrusions via the use of Machine Learning and Deep Learning Frameworks.",2025-05-23T02:02:11Z,2025-06-04T15:05:32Z
AGNBoost,hamblin-ku/AGNBoost,A felxible machine learning framework for AGN identification and photometric redshift estimation,2025-05-22T23:39:21Z,2025-06-04T15:34:00Z
MathMorph,Gabriel-ds1/MathMorph,"MathMorph is a symbolic reasoning and machine learning framework designed to generate, verify and explain novel mathematical formulas.",2025-05-22T17:46:46Z,2025-05-22T19:48:51Z
quantum-ml-framework,ShengDong207/quantum-ml-framework,A tool for quantum computing approaches to machine learning,2025-05-22T17:09:43Z,2025-05-22T17:09:43Z
Car-a-ML,DanGodi/Car-a-ML,A Python-based simulation framework to emulate real-world vehicle dynamics from data. Recreate the driving behavior of any car using physics-based models and machine learning.,2025-05-22T14:03:13Z,2025-05-29T15:06:10Z
PhishGuard-Explainable-AI-for-Phishing-Website-Detection,Mados003/PhishGuard-Explainable-AI-for-Phishing-Website-Detection,An advanced machine learning framework for detecting phishing websites using multiple classification models with a focus on explainability through various XAI techniques.,2025-05-22T13:58:42Z,2025-05-22T14:00:34Z
FedAverage-NjustMachineLearning,Nana-uOvOu/FedAverage-NjustMachineLearning,"This is the machine learning final project from NJUST (Jiang Ying's class), implementing the Federated Learning framework FedAvg. All the code was written by Zijun Wang.",2025-05-22T12:54:39Z,2025-05-26T04:44:20Z
Flight-Delay-Predidction,noorchouman/Flight-Delay-Predidction,"A machine learning framework for predicting flight delays, integrating real-time weather and airport data. Uses Random Forest and XGBoost with explainability tools to uncover causal factors and provide interpretable, high-accuracy predictions for U.S. flights.",2025-05-22T11:27:27Z,2025-05-22T11:28:56Z
Phishing-Detection-Framework,Kevin-Michaelraj/Phishing-Detection-Framework,"Phishing Detection Framework is an intelligent and scalable cybersecurity solution that detects phishing URLs using a hybrid machine learning approach. It integrates deep learning, ensemble learning (XGBoost), and BBOA optimization to improve accuracy, efficiency, and robustness.",2025-05-22T10:27:49Z,2025-05-22T11:34:34Z
LTE-Coverage-Prediction-Using-Machine-Learning,Osmane97/LTE-Coverage-Prediction-Using-Machine-Learning,"This project develops a machine learning framework to predict LTE (4G) signal quality metricsRSRP, RSRQ, and SINRusing models trained on suburban and urban environments. It evaluates and compares Random Forest, Gradient Boosting, SVR, and Extra Trees for accurate signal prediction.",2025-05-22T06:49:06Z,2025-05-22T19:18:26Z
Advanced-Ensemble-Framework-For-Malware-Detection,Prannav-Bansal/Advanced-Ensemble-Framework-For-Malware-Detection,"Advanced Ensemble Framework capable of detecting and defending against obfuscated malware threats by leveraging the combined strengths of multiple machine learning models. Our core objective is to design a robust, scalable, and adaptive detection framework that intelligently integrates static, dynamic, and behavioral analysis techniques. ",2025-05-21T12:43:30Z,2025-05-21T12:48:45Z
Remote-Sensing-Landcover-Classification,vibhores19/Remote-Sensing-Landcover-Classification,"A machine learning and deep learning-based framework for classifying remote sensing data from Landsat 5 in mountainous Colorado. Includes traditional ML models (SVM, RF, DT) and deep learning architectures (CNN, LSTM, ResNet) to classify 14 land cover types with high accuracy.",2025-05-21T12:28:32Z,2025-05-21T12:29:52Z
langchain-introduction,aitho-corso-DMI-agenti-ai/langchain-introduction,"Example notebooks for the 2025 course Agenti Intelligenti e Machine Learning, focusing on the LangChain framework.",2025-05-21T11:40:24Z,2025-05-22T07:04:02Z
Analysis-of-Demographic-and-Behavioral-Factors-in-HIV-Prediction-Using-Machine-Learning,Rummonislam786/Analysis-of-Demographic-and-Behavioral-Factors-in-HIV-Prediction-Using-Machine-Learning,"A machine learning framework for predicting HIV status using demographic and behavioral risk factors. Tested on a dataset from high-risk populations in Bangladesh, Random Forest achieved 97.86% accuracy. Key predictors include age, STD history, drug use, and sexual orientation.",2025-05-21T02:48:59Z,2025-05-21T02:55:51Z
Fake-Tweet-Detection-using-Machine-Learning,ishita110/Fake-Tweet-Detection-using-Machine-Learning,"Developed a machine learning framework to detect fake tweets by analyzing tweet content and using neural networks to store credibility predictions. Tackled noisy auxiliary data to build a robust, efficient system that filters fake tweets and promotes credible info.",2025-05-20T19:26:06Z,2025-05-20T19:27:12Z
Centrality-Metrices-and-Their-Impact-on-Loan-Outcomes-in-P2P-LEnding,findingaish/Centrality-Metrices-and-Their-Impact-on-Loan-Outcomes-in-P2P-LEnding,"A framework for analyzing P2P lending using network centrality metrics and MST-based network analysis, combined with machine learning models (XGBoost, Random Forest, Logistic Regression) to predict loan success and manage risk. Validated on real datasets for improved accuracy and scalability.",2025-05-20T13:05:21Z,2025-05-20T13:39:19Z
toySSL,baihuaDaDa/toySSL,"Final Homework for Machine Learning, 2025. Toy implementation and improvement of FixMatch, which is a famous Semi-Supervised Learning framework.",2025-05-20T12:43:55Z,2025-05-26T02:57:01Z
Efficient-Pediatric-Heart-Transplant-Predictions,heyitshawaiz/Efficient-Pediatric-Heart-Transplant-Predictions,Developed an advanced machine learning framework utilizing synthetic data generation and self-supervised learning to enhance 1-year mortality prediction in pediatric heart transplantation. Achieved up to 100% accuracy using ensemble modeling techniques.,2025-05-20T10:37:37Z,2025-05-20T11:10:06Z
bitcoin-fraud-graph-temporal,mariotrerotola/bitcoin-fraud-graph-temporal,"An explainable machine-learning framework for the scalable and transparent detection of fraudulent Bitcoin addresses, leveraging structural, temporal, and monetary features extracted from the transaction graph.",2025-05-20T09:55:41Z,2025-06-05T06:22:01Z
Realtime-Fish-Detection-GUI,WilfredAuxilian/Realtime-Fish-Detection-GUI,It is an AI Hybrid Framework Graphical User Interface system consisting of Real-Time Underwater Fish Detection using two Machine Learning algorithms & traditional Computer Vision Algorithm and an Image Enhancement Pipeline to improve the Efficiency and Accuracy.,2025-05-20T07:49:51Z,2025-05-20T18:32:43Z
Made-With-ML,VedantPai24/Made-With-ML,"This project leverages the ""Made With ML"" framework and resources to explore and build machine learning applications. ",2025-05-20T05:02:32Z,2025-05-20T05:02:33Z
Machine-Learning-paper,Prashant-patil-ux/Machine-Learning-paper,"Health Insurance Premium Prediction using Machine Learning  A regression-based ML framework to predict health insurance premiums using features like age, BMI, smoking status, and more. Includes data preprocessing, multiple regression models, evaluation metrics, and visualizations.",2025-05-19T07:24:03Z,2025-05-19T07:24:51Z
Machine-Learning-Research-paper,Prashant-patil-ux/Machine-Learning-Research-paper,"Health Insurance Premium Prediction using Machine Learning  A regression-based ML framework to predict health insurance premiums using features like age, BMI, smoking status, and more. Includes data preprocessing, multiple regression models, evaluation metrics, and visualizations.",2025-05-19T07:19:59Z,2025-05-19T07:19:59Z
Machine-Learning-Based-Regression-Framework-to-Predict-Health-Insurance-Premiumss,Prashant-patil-ux/Machine-Learning-Based-Regression-Framework-to-Predict-Health-Insurance-Premiumss,"A regression-based ML framework to predict health insurance premiums using features like age, BMI, smoking status, and more. Includes data preprocessing, multiple regression models, evaluation metrics, and visualizations.",2025-05-19T06:45:04Z,2025-05-19T06:50:17Z
Machine-Learning-Based-Regression-Framework-to-Predict-Health-Insurance-Premiums,Prashant-patil-ux/Machine-Learning-Based-Regression-Framework-to-Predict-Health-Insurance-Premiums,,2025-05-19T06:42:24Z,2025-05-19T07:14:31Z
ML-With-Streamlit,amnaabdelrazek/ML-With-Streamlit,"This repository contains a collection of machine learning models deployed using Streamlit, a Python-based framework for building interactive web applications. The project demonstrates how to effectively integrate machine learning workflows with a user-friendly interface,making it easier for end users to interact with and understand machine learning",2025-05-18T21:15:08Z,2025-05-18T21:38:19Z
Matrix,NicolaiBaklund/Matrix,Linear algebra framework to use in machine learning,2025-05-18T12:51:52Z,2025-05-20T17:16:41Z
health-insurance-prediction,AshwiniN76/health-insurance-prediction,Machine Learning-Based Regression Framework to Predict Health Insurance Premiums,2025-05-18T10:56:12Z,2025-05-21T10:12:06Z
health-insurance-prediction,sukanya-hue/health-insurance-prediction,machine learning-based regression framework to predict health insurance premiums ,2025-05-18T09:18:53Z,2025-05-21T09:24:19Z
airline-satisfaction-prediction,ahsantushar12/airline-satisfaction-prediction,A school project using the CRISP-DM framework and machine learning to predict airline passenger satisfaction,2025-05-17T23:49:22Z,2025-05-18T00:49:44Z
ENERGY-LOAD-FORECASTING,ipreetamshow/ENERGY-LOAD-FORECASTING,"Develop an accurate and efficient machine learning framework for predicting the heating and cooling loads of buildings. This framework aims to provide reliable energy load estimates, supporting more energy-efficient building designs and reducing overall operational costs.",2025-05-17T19:33:43Z,2025-05-17T19:37:01Z
personality-prediction-ml,Ritesh1831/personality-prediction-ml,A personality prediction system based on text input using machine learning and the Myers-Briggs Type Indicator (MBTI) framework.,2025-05-17T19:07:53Z,2025-05-17T19:27:53Z
iris-classifier-julia-flux,AleenaTahir1/iris-classifier-julia-flux,A high-performance neural network classifier for the Iris dataset implemented in Julia using the Flux machine learning framework.,2025-05-17T19:07:19Z,2025-05-17T19:45:49Z
kidney-rejection-predictor,zhblin/kidney-rejection-predictor,Machine learning-based kidney transplant rejection prediction framework,2025-05-17T12:03:41Z,2025-05-17T12:11:44Z
TensorFlow-in-Python,younesnoorzahi/TensorFlow-in-Python,TensorFlow is an open-source machine learning framework developed by Google Brain Team.,2025-05-17T08:45:34Z,2025-05-18T11:23:05Z
HIT-OR-FLOP,JCarlosTR/HIT-OR-FLOP,"A machine-learning framework analyzing audio features, genre, and lyrics to predict and model song popularity",2025-05-16T10:27:39Z,2025-05-16T21:41:14Z
Deep-Learning-and-Machine-Learning-Based-Early-Diagnosis-of-Alzheimers-from-MRI---Clinical-Data,k-rajat42/Deep-Learning-and-Machine-Learning-Based-Early-Diagnosis-of-Alzheimers-from-MRI---Clinical-Data,"An advanced machine learning framework for early Alzheimer's diagnosis, integrating MRI imaging with clinical data. Using a fine-tuned VGG16 CNN for brain scans and an SVM model for clinical indicators, NeuroDetect ensures precise classification, aiding researchers, neurologists, and healthcare applications in neurodegenerative disease detection.",2025-05-16T08:35:00Z,2025-05-16T08:35:01Z
NBTest,seal-research/NBTest,A regression testing framework for Jupyter Notebooks used for Machine Learning tasks,2025-05-15T21:36:11Z,2025-05-27T03:07:47Z
Self-Driving-Car-JS,Izzmasri/Self-Driving-Car-JS,"This project demonstrates a complete self-driving car simulation built entirely with vanilla JavaScript, without using any external libraries or machine learning frameworks.",2025-05-15T16:36:27Z,2025-05-15T16:50:39Z
An-Efficient-Distributed-Machine-Learning-Inference-Framework-with-Byzantine-Fault-Detection,xjaweiofj/An-Efficient-Distributed-Machine-Learning-Inference-Framework-with-Byzantine-Fault-Detection,An Efficient Distributed Machine Learning Inference Framework with Byzantine Fault Detection,2025-05-14T18:46:03Z,2025-05-14T18:49:14Z
Deef_Fake-Detection,Sharath-p-g/Deef_Fake-Detection,Deepfake Detection is a machine learning project that identifies whether a video is real or fake. The model is trained on real video data to learn natural facial patterns and detects deepfakes by spotting inconsistencies in facial features or movements. Built using Python and deep learning frameworks.,2025-05-14T17:06:20Z,2025-05-14T17:06:21Z
adas,ShadyEgypt/adas,"ADAS (Advanced Driving Autonomous System) is a modular, full-stack framework for building and deploying self-driving car technologies. It includes machine learning workflows, backend services, a GraphQL API, and a user-friendly frontendorganized into clean, decoupled modules for flexibility and scalability.",2025-05-14T17:02:24Z,2025-05-14T17:09:52Z
DMAIC-Food-Delivery-Project,PraveenShivaramu/DMAIC-Food-Delivery-Project,"Analyze food delivery performance using the Lean Six Sigma DMAIC framework. Includes visual insights, control charts, and a machine learning model to predict late orders.",2025-05-14T16:48:01Z,2025-05-14T17:16:19Z
ML-UV-spectrum-prediction,RaniaZaier/ML-UV-spectrum-prediction,Machine Learning framework to reproduce TDDFT UV-Vis spectra,2025-05-14T11:29:01Z,2025-05-20T14:22:32Z
Multivariate-risk-factor-analysis-model.,rayanahmedkakomo/Multivariate-risk-factor-analysis-model.,"This machine learning framework integrates lifestyle factors, demographics, medical history, and clinical symptoms to enhance the sensitivity and accuracy of early lung cancer detection.",2025-05-14T09:59:45Z,2025-05-14T10:01:34Z
ai-dev-migration,joelcrouch/ai-dev-migration,"AI-powered tool for automating code migration between frameworks, leveraging machine learning for seamless transformation, compatibility checks, and real-time migration tracking",2025-05-13T20:30:17Z,2025-05-13T20:35:47Z
CKD-ML-Framework,anuradhaprajapati375/CKD-ML-Framework,"A hybrid machine learning framework for the early detection of Chronic Kidney Disease (CKD), using stacking with Decision Tree, Gradient Boosting, Nave Bayes, and Random Forest. Built in Python with Flask frontend, powered by UCI CKD dataset. Achieves 100% accuracy through feature  ensemble modeling.",2025-05-13T06:39:23Z,2025-05-13T07:27:06Z
CodeStresser,Sferratore/CodeStresser,"CodeStresser is a ML-driven static analysis framework that scans source code in multiple programming languages to detect security vulnerabilities. It extracts per-vulnerability features and uses machine learning models to predict severity and confidence, generating a structured, developer-friendly security report.",2025-05-12T20:24:12Z,2025-06-08T21:51:25Z
AsTRiQue,prokophanzl/AsTRiQue,ASk The RIght QUEstions: An active machine learning framework for perception experiments,2025-05-12T13:28:14Z,2025-05-14T22:27:07Z
Soil-Erodibility-by-SDA,Anastasia6633/Soil-Erodibility-by-SDA,Data of An Innovative Mapping Framework for Soil Erodibility Integrating Spatial Association Dimensions and Machine Learning,2025-05-12T07:52:49Z,2025-05-12T09:22:34Z
AI-Powered-Health-Risk-Prediction-using-Social-Determinants-and-Generative-AI,Bushra112/AI-Powered-Health-Risk-Prediction-using-Social-Determinants-and-Generative-AI,"Developed a hybrid AI framework integrating generative AI and machine learning models to assess long-term health risks by analyzing clinical metrics and Social Determinants of Health (SDOH). Used Google's Gemini 1.5 Pro for personalized reports and improved accuracy with Logistic Regression, Random Forest, XGBoost, and LightGBM.",2025-05-12T06:48:07Z,2025-05-12T06:50:45Z
peptinet,MahdiBayanloo/peptinet,A neural network-based framework for modeling and classifying peptide-like amino acid combinations using machine learning and computational chemistry techniques.,2025-05-11T21:33:24Z,2025-05-11T23:14:37Z
PanARGMiner,Ben0324/PanARGMiner,PanARGMiner: Pan-genomic Antimicrobial Resistance Gene Miner is a machine learning framework for selecting key antimicrobial resistance features from large-scale genomic data with high accuracy and interpretability.,2025-05-11T08:12:22Z,2025-06-06T09:51:56Z
Short-Rate-Forecasting,rachit-raj7910/Short-Rate-Forecasting,"A comparative study of short-term interest rate forecasting using stochastic models (Vasicek, CIR) and machine learning techniques (Random Forest, LSTM), applied to 13-week U.S. Treasury Bill rates with a rolling window framework and benchmarked against a Random Walk.",2025-05-11T04:27:40Z,2025-05-11T04:58:46Z
SparksNet,Himanshu7921/SparksNet,"SparksNet is a lightweight deep learning framework built from scratch to help you learn the core principles of neural networks and machine learning. It implements key components like activations, layers, loss functions, optimizers, and more, with a focus on simplicity and extensibility.",2025-05-10T17:25:35Z,2025-05-13T07:25:16Z
qnf-qaoa,Chiragxiao/qnf-qaoa,"Hybrid Quantum-Classical framework integrating Quantum Neural Fields (QNF) with the Quantum Approximate Optimization Algorithm (QAOA) for solving combinatorial optimization problems. Explores variational circuit design, quantum machine learning, and optimization strategies using Qiskit.",2025-05-10T13:52:38Z,2025-05-22T13:29:07Z
KnockoffCS,xiaochenzhang166/KnockoffCS,Implementation of Knockoff-Guided Compressive Sensing: A Statistical Machine Learning Framework for Support-Assured Signal Recovery,2025-05-10T13:20:55Z,2025-05-10T13:21:36Z
Machine-Learning-Framework-and-Tools,debeshkapali/Machine-Learning-Framework-and-Tools,,2025-05-10T11:12:22Z,2025-05-10T11:27:58Z
Veritas-Cardis-A-Machine-Learning-Framework-for-Detecting-Subterfuge-in-Credit-Applications-,Saranya1202/Veritas-Cardis-A-Machine-Learning-Framework-for-Detecting-Subterfuge-in-Credit-Applications-,,2025-05-10T11:09:55Z,2025-06-06T04:19:23Z
SmartML-Automated-ML-Deployment-with-MLOps-CI-CD,R-Shreyagh/SmartML-Automated-ML-Deployment-with-MLOps-CI-CD,SmartML is a robust and scalable machine learning deployment framework designed to streamline the end-to-end lifecycle of ML models using MLOps principles and Continuous Integration/Continuous Deployment (CI/CD) pipelines. ,2025-05-10T09:27:28Z,2025-05-10T09:29:12Z
mloptimizer,AntonioRamos11/mloptimizer,"MLOptimizer is a comprehensive framework for automatically generating optimized machine learning models while capturing detailed hardware performance metrics. It provides a distributed system for model training, hyperparameter optimization, and hardware resource monitoring.",2025-05-10T08:24:05Z,2025-05-10T08:47:27Z
Sustainable-Detection-of-Fake-Social-Media-Profiles-Using-Machine-Learning-and-Pattern-Analysis,Aldrin7/Sustainable-Detection-of-Fake-Social-Media-Profiles-Using-Machine-Learning-and-Pattern-Analysis,"Fake social media profiles undermine online trust,  enabling misinformation and fraud. This study presents a sus tainable framework for detecting such profiles using energy efficient machine learning and pattern mining, aligning with green computing principles.",2025-05-10T08:09:59Z,2025-05-10T08:12:18Z
Fepfm,Zong-my/Fepfm,Fepfm: A post-disturbance frequency extremes prediction framework for power systems based on machine learning,2025-05-09T20:00:46Z,2025-05-09T20:00:46Z
heat-vulnerability-research,DebosmitaGhosh2000/heat-vulnerability-research,"A machine learning-based geospatial framework for urban heat vulnerability mapping in India using high-resolution spatial, climate, and socio-economic data.",2025-05-09T19:49:48Z,2025-05-15T08:13:05Z
home-credit-default-risk,jmendozais/home-credit-default-risk,"This project provides a framework for developing and evaluating machine learning models for the Home Credit Default Risk Prediction Challenge. It supports feature engineering, configurable pipelines, and comprehensive evaluation with cross-validation and ablation studies.",2025-05-09T19:30:06Z,2025-05-09T19:30:49Z
TORCS-Self-Driving-Car-AI,sahrishmustafa/TORCS-Self-Driving-Car-AI,"A Python-based framework for TORCS that enables data collection from manual driving sessions and trains AI drivers using machine learning models such as Decision Trees, Random Forests, and MLP Regressors.",2025-05-09T13:09:21Z,2025-05-15T04:15:47Z
ML-BigData-FareAmount-LinearRegression,Iqbalrzl/ML-BigData-FareAmount-LinearRegression,"In this project, we built a Machine Learning Model using the linear regression method for a regression task predicting fares on the ""New York City Taxi Fare Prediction"" dataset. We utilized the PySpark framework to handle the large dataset of 55 million records (categorized as Big Data). ",2025-05-09T11:26:14Z,2025-05-09T11:27:19Z
digit-classifier,jacksonbuilds/digit-classifier,A demo project for TensorFlow. TensorFlow is an open-source machine learning (ML) and deep learning (DL) framework developed by Google.,2025-05-09T00:55:54Z,2025-05-26T19:46:50Z
CSCN8010_Introduction,AI-ML-Conestoga/CSCN8010_Introduction,Foundations of Machine Learning Frameworks-Week1-Introduction,2025-05-08T17:37:07Z,2025-05-08T18:21:49Z
CSCN8010_Introduction,anonduke/CSCN8010_Introduction,Foundation of machine learning framework week 1,2025-05-08T17:34:27Z,2025-05-08T18:17:19Z
CSCN8010_Introduction,tcsgik/CSCN8010_Introduction,Foundations of Machine Learning Frameworks - week 1,2025-05-08T17:32:22Z,2025-05-08T18:17:39Z
CSCN8010_Intro_lab1,Hasyashri/CSCN8010_Intro_lab1,Foundation of Machine Learning Frameworks- Week 1- Introduction,2025-05-08T17:32:07Z,2025-05-08T17:32:08Z
CSCN801_Introduction,anonduke/CSCN801_Introduction,Foundation of machine learning framework week 1-,2025-05-08T17:32:04Z,2025-05-08T17:32:05Z
CSCN8010_Introduction,ProfEspinosaAIML/CSCN8010_Introduction,Foundations of Machine Learning Frameworks - Week 1 - Introduction,2025-05-08T17:32:01Z,2025-05-08T18:21:11Z
ml-crop-recommendation-Flaskapp,vigyat13/ml-crop-recommendation-Flaskapp," Crop Prediction Web Application This project is a machine learning-powered web application that predicts the most suitable crop to cultivate based on environmental parameters. Built using Python's Flask framework, it leverages a trained Random Forest model to assist farmers and agricultural enthusiasts in making informed decisions.",2025-05-08T11:49:42Z,2025-05-08T12:11:46Z
Cultural-Ecosystem-Modelling,francesc30/Cultural-Ecosystem-Modelling,This is a methodological framework to model Cultural Ecosystem Services at large scales. It is composed by an Artificial Intelligence and a Machine Learning model.,2025-05-08T07:31:56Z,2025-05-29T09:37:50Z
product-pricing-agent,jstoops/product-pricing-agent,"Compares base LLMs, as well as fine-tuned frontier and open-sources models, to traditional machine-learning (ML) techniques and human prediction of product prices based on a description. The winner, along with 6 other agents, is productionized in an AI agentic framework that sends push notifications to you when a deal is found.",2025-05-08T05:55:29Z,2025-05-21T04:12:01Z
GitIssueStudy,ushadadi/GitIssueStudy,Evaluating Large Language Models for Repairing GitHub Issues in Machine Learning Frameworks,2025-05-07T23:06:11Z,2025-05-07T23:09:01Z
