name,full_name,description,created_at,pushed_at
Predictive-Maintenance-for-Turbofan-Engines,Srijan2424/Predictive-Maintenance-for-Turbofan-Engines," This repository presents a predictive maintenance framework for turbofan engines. It uses machine learning to analyze sensor data, classify engine degradation stages, predict Remaining Useful Life (RUL), and compute a dynamic risk score to anticipate failures and optimize maintenance.",2025-06-09T08:06:29Z,2025-06-09T08:14:30Z
Feature-engineering-enhance-machine-learning-framework-for-lignin-derived-porous-carbon,Zihao-Xie77/Feature-engineering-enhance-machine-learning-framework-for-lignin-derived-porous-carbon,,2025-06-09T06:23:45Z,2025-06-09T06:23:46Z
predictive-pantry,sdv1708/predictive-pantry,"A predictive analytics framework for customer reordering behavior on the Instacart platform, featuring in-depth market basket analysis and a comparative evaluation of machine learning models (Logistic Regression, Gradient Boosting) to generate actionable insights for inventory and marketing.",2025-06-08T23:26:26Z,2025-06-09T00:02:30Z
achine-Learning-Framework-Comparison-Project,eviser1/achine-Learning-Framework-Comparison-Project,"This project demonstrates the implementation of machine learning models using different frameworks (scikit-learn, TensorFlow, and PyTorch) on the Breast Cancer Wisconsin dataset.",2025-06-08T17:36:05Z,2025-06-08T17:37:32Z
Log-Classification-System,Phoenixarjun/Log-Classification-System,"A hybrid log classification framework built with FastAPI, combining Regex, Machine Learning, and LLMs to intelligently classify log entries and prioritize risk levels. Includes a clean, integrated frontend UI for easy CSV uploads, visual output, and downloadable enhanced results.",2025-06-08T11:57:27Z,2025-06-08T12:21:41Z
causal-machine-learning,simadma/causal-machine-learning,Exploring some causal machine learning modeling techniques. The project uses the DoWhy framework.,2025-06-07T15:29:20Z,2025-06-07T15:29:21Z
Stillbit-,StillbitTech/Stillbit-,"The silent engine beneath Stillbit. This AI framework fuses machine learning with chain logic  delivering focused, noise-free analytics for risk, volatility, and market behavior. ",2025-06-07T09:16:50Z,2025-06-07T09:28:19Z
Mock-Stock-Data-With-Sentiment-Analysis,SRIHARIKUMAR007/Mock-Stock-Data-With-Sentiment-Analysis,"Built with Python's Tkinter framework, this application provides an intuitive GUI for analyzing historical stock data, visualizing trends, and generating future price predictions using advanced machine learning techniques.",2025-06-07T09:02:17Z,2025-06-07T09:54:32Z
CleoGarda,CleoGuarda/CleoGarda,"The sentinel layer behind CleoGuardas watchful eye. This AI framework weaves advanced machine learning with deep-chain analytics to form the backbone of CleoGuardas defense grid  powering every token scan, guardian trigger, and pattern alert within the system.",2025-06-07T07:59:44Z,2025-06-07T08:24:45Z
NeuroBulla-Pipeline-Bodies-NBPB-,fra150/NeuroBulla-Pipeline-Bodies-NBPB-,A BiologicallyInspired Supervisory Framework for MachineLearning Pipelines ,2025-06-06T16:49:33Z,2025-06-06T17:22:40Z
convolutional_bell_detector.rs,cdellacqua/convolutional_bell_detector.rs,A trainable doorbell detector based on convolutional neural networks and the Burn machine learning framework,2025-06-06T16:17:58Z,2025-06-06T16:18:14Z
BB84_Simulation,RezaAramjou/BB84_Simulation,An Advanced Simulation Framework for BB84 Quantum Key Distribution: Towards Real-Network Conditions and Data Generation for Machine Learning Applications.,2025-06-06T14:30:29Z,2025-06-06T14:42:22Z
machine-learning-research-v6-707522,searchyoto231/machine-learning-research-v6-707522,Advanced machine-learning research platform 7 - Distributed computing framework using TypeScript,2025-06-06T12:41:48Z,2025-06-06T12:41:48Z
machine-learning-research-v36-707578,searchyoto231/machine-learning-research-v36-707578,Advanced machine-learning research platform 37 - Distributed computing framework using C++,2025-06-06T12:41:48Z,2025-06-06T12:41:49Z
machine-learning-research-027,searchyoto231/machine-learning-research-027,Advanced machine-learning research framework #27 - Distributed computing platform for educational and research purposes,2025-06-06T12:37:00Z,2025-06-06T12:37:03Z
machine-learning-research-007,searchyoto231/machine-learning-research-007,Advanced machine-learning research framework #7 - Distributed computing platform for educational and research purposes,2025-06-06T12:36:53Z,2025-06-06T12:36:56Z
CW-Foundations-of-Machine-Learning-Frameworks-CSCN8010,Yogesh-333/CW-Foundations-of-Machine-Learning-Frameworks-CSCN8010,,2025-06-06T12:28:39Z,2025-06-06T13:02:21Z
UniTrainer,J-b-com/UniTrainer,"A Universal Model Trainer is a flexible software framework or tool designed to train machine learning models across various algorithms, data types, and tasks. It abstracts the complexities of model training by providing a unified interface for data preprocessing, model selection, hyperparameter tuning, training, evaluation, and deployment.",2025-06-06T10:37:20Z,2025-06-06T10:38:47Z
Traffic-DSTG-Gen,Ruppin-SmartTransportation/Traffic-DSTG-Gen,"Traffic-DSTG-Gen is a flexible, open-source tool for generating dynamic, spatio-temporal graph datasets from traffic simulations. Designed to support advanced traffic prediction research, it converts vehicle and junction movements captured via traffic simulators into richly-structured graphs compatible with modern machine learning frameworks.",2025-06-06T07:51:49Z,2025-06-07T07:51:39Z
Curriculum-Content-Matching-Model,veningstonk/Curriculum-Content-Matching-Model,CCMM is an AI-powered framework designed to align digital educational content with K-12 curriculum standards while delivering personalized content recommendations for learners. It leverages sentence transformer embeddings and classic machine learning classifiers to semantically match educational resources with structured curriculum topics.,2025-06-06T06:31:43Z,2025-06-06T06:33:25Z
MachineLearningFrameworks,RehamAbuarqoub/MachineLearningFrameworks,Here you can find all In Class Activities for MLF course,2025-06-05T17:48:52Z,2025-06-05T18:31:25Z
Machine-Learning-Frameworks,RehamAbuarqoub/Machine-Learning-Frameworks,Here you can find all In Class Activities for MLF course,2025-06-05T17:37:54Z,2025-06-05T17:47:22Z
THFD-SHNML,ctr-21/THFD-SHNML,Threat Hunting Framework Development: Securing Hybrid Networks using Machine Learning,2025-06-04T20:04:51Z,2025-06-08T18:15:05Z
Implementation-of-Diffusion-Transformer-within-NNTile-Machine-Learning-Framework,joshbrown901/Implementation-of-Diffusion-Transformer-within-NNTile-Machine-Learning-Framework,"Efficient CPU-based Diffusion Transformer in NNtile (on STARPU), optimized for scalable, high-fidelity generative modeling. Benchmarked against PyTorch and Hugging Face. Roadmap includes training and generation pipelines, plus scalability testing for larger models and datasets.",2025-06-04T18:35:30Z,2025-06-05T02:33:14Z
stock-price-prediction-portal,febincf-mle/stock-price-prediction-portal,"This repository builds a complete stock prediction portal from scratch using Django REST Framework, React, and Machine Learning",2025-06-04T17:22:10Z,2025-06-08T11:32:09Z
SensePay-A-Proof-of-Concept-Smart-Security-Framework-for-NFC-Based-Transactions,Arhmfaculty/SensePay-A-Proof-of-Concept-Smart-Security-Framework-for-NFC-Based-Transactions,Embedded IMU Intelligence and Machine Learning for Relay Attack Prevention in Contactless Payments,2025-06-04T15:32:27Z,2025-06-04T16:07:13Z
Short-Term-Stock-Movement-Prediction-Long-Short-Portfolio-Optimization,GabrieleQuintavalle/Short-Term-Stock-Movement-Prediction-Long-Short-Portfolio-Optimization,"Python-based machine learning framework to forecast short-term stock price direction and dynamically construct a long-short portfolio optimized for maximum risk-adjusted returns. The project covers data cleaning, feature engineering, model evaluation, backtesting, and comprehensive risk-return analysis.",2025-06-04T14:57:57Z,2025-06-04T15:07:30Z
AI_Projects,aravabhagyasree/AI_Projects,"This repository contains a collection of my AI projects built using Python and various machine learning and deep learning frameworks. Each project explores different AI concepts, from basic models to more advanced applications.",2025-06-04T11:28:03Z,2025-06-04T11:51:03Z
Basic-Regression-Model-,Hwk-Awez/Basic-Regression-Model-,Contains beginner level regression models of Machine Learning built from scratch with any frameworks.,2025-06-04T06:42:28Z,2025-06-04T06:48:33Z
QuantKit,MuhammadAliS/QuantKit,"QuantKit is a flexible and modular framework for generating quantized machine learning models with highly customizable workflows. It supports layer-wise quantization, asymmetric/symmetric schemes, post-training and dynamic quantization, and integrates seamlessly with the Hugging Face Transformers ecosystem. ",2025-06-04T01:58:22Z,2025-06-04T02:16:12Z
Public-Transport-Flow-ML-Framework,LAN-Z-L/Public-Transport-Flow-ML-Framework,"An AI-driven machine learning framework for estimating, characterizing, and predicting public transportation flows. This repository includes models for OD flow estimation using unsupervised learning, trip purpose inference using probabilistic modeling, and long-range flow prediction using transformer-based architectures.",2025-06-03T21:24:15Z,2025-06-08T03:32:59Z
php-machine-test,ankitmishra-dev/php-machine-test,The Student Management System is a basic CRUD application developed using Core PHP and MySQL. This project demonstrates how to build a simple web-based interface for managing student records without using any frameworks. It is ideal for beginners learning PHP and web development fundamentals.,2025-06-03T16:31:56Z,2025-06-03T16:48:32Z
AIML_apple_ecosystem,tai-almeida/AIML_apple_ecosystem,"This repository explores Artificial Intelligence and Machine Learning in the Apple ecosystem, focusing on the tools and frameworks to develop high-performance AI applications.",2025-06-03T12:14:52Z,2025-06-04T12:43:42Z
Introduction-to-PyTorch,manola1109/Introduction-to-PyTorch,"This repository contains Jupyter notebooks that cover the basics and practical applications of PyTorch, a popular deep learning framework. The notebooks are designed to help you build foundational knowledge in PyTorch and guide you through hands-on implementations of various neural network architectures and machine learning task",2025-06-03T10:07:18Z,2025-06-03T10:28:30Z
Machine-Learning-R-Framework,galafis/Machine-Learning-R-Framework,Professional repository showcasing advanced development skills,2025-06-03T06:31:43Z,2025-06-03T06:31:44Z
x-tweet,Flameboy2003/x-tweet,"X-Tweet is a full-stack web application for analyzing real-time Twitter trends using NLP and machine learning. It provides insights through sentiment analysis, topic modeling, anomaly detection, influencer tracking, bot detection, and more. Built with Vue.js, Django REST Framework, PostgreSQL, and Chart.js.",2025-06-03T04:55:41Z,2025-06-03T05:06:17Z
seu-injection-framework,wd7512/seu-injection-framework,A Framework for Developing Robust Machine Learning Models in Harsh Environments,2025-06-02T17:47:46Z,2025-06-08T19:48:36Z
ML-Air_quality,matei-birleanu/ML-Air_quality,"ML-Air_quality is a project to analyze and predict air quality using machine learning. It loads datasets (pollutants, weather), preprocesses data, trains models to estimate AQI or detect pollutant trends, and validates results (MAE, RMSE) with visualizations, providing a reproducible framework.",2025-06-02T11:35:46Z,2025-06-02T12:03:33Z
EpiDynaX,CassandraDurr/EpiDynaX,EpiDynaX is a framework for discovering and modeling epidemic transition dynamics using machine learning methods.,2025-06-02T09:41:39Z,2025-06-02T09:46:15Z
Climate-Resilient-Urban-Planning-using-ML-based-simulation-frameworks.,Geraldine-Winston/Climate-Resilient-Urban-Planning-using-ML-based-simulation-frameworks.,"This project builds a machine learning-based simulation framework to predict urban resilience indices and recommend climate-resilient urban planning designs, optimizing features like green spaces, infrastructure, and population density for future-ready cities.",2025-06-01T22:00:35Z,2025-06-04T22:54:46Z
attack_detector_2025,Oluyimide25/attack_detector_2025,DEVELOPMENT OF A MACHINE LEARNING-BASED FRAMEWORK FOR REAL-TIME DETECTION AND MITIGATION OF DISTRIBUTED DENIAL OF SERVICE (DDOS) ATTACKS,2025-06-01T18:04:23Z,2025-06-01T19:17:11Z
ML---.NET-Project,Gibo-alt/ML---.NET-Project,"I'm developing a small chatbot using machine learning within the .NET Framework, leveraging C# for efficient implementation.",2025-06-01T17:08:25Z,2025-06-01T18:57:23Z
ISB---Cardiff,Ashwini-developer/ISB---Cardiff,"MEDPRIV-AI Framework  A secure and privacy-preserving machine learning pipeline for healthcare data, developed for the ISBCardiff Hackathon. Combines Federated Learning and Differential Privacy to protect sensitive medical information.",2025-06-01T16:29:52Z,2025-06-01T16:33:06Z
Pineapple,FernandoCsm-Knight/Pineapple,A machine learning framework in c++,2025-06-01T16:28:30Z,2025-06-01T17:48:05Z
onnxruntime,alinabil74568/onnxruntime,"ONNX Runtime is a powerful tool for accelerating machine learning tasks across various platforms. It enhances both inference and training, making it easier to deploy models from popular frameworks like PyTorch and TensorFlow. ",2025-06-01T13:36:38Z,2025-06-09T08:08:48Z
Tensor-Grid,Yassa777/Tensor-Grid,"A minimal, experimental framework for decentralized collaborative training of machine learning models, using spare VRAM across multiple nodes.",2025-06-01T05:19:03Z,2025-06-01T06:02:56Z
six-mpc-preprocessing,LaPetiteBird/six-mpc-preprocessing,"Implementation and evaluation of six special preprocessing protocols for secure multiparty computation (MPC) in privacy-preserving machine learning. This project benchmarks CDNN15, SecureML, SecureNN, CKRRSW20, RRHK23, and LowGear 2.0 using the MP-SPDZ framework.",2025-05-31T19:28:14Z,2025-06-01T18:19:45Z
Rollup-Sybil-Detection,aMWerLogic/Rollup-Sybil-Detection,"Implementation part of ""Airdrop Sybil Attack detection framework supported by machine learning"" paper submitted for 24th International Conference on Cryptology and Network Security.",2025-05-31T18:58:30Z,2025-05-31T19:09:06Z
software-projects,OrFachima1/software-projects,"A collection of academic and personal software projects, covering machine learning, deep learning, NLP, and data-driven applications. Implemented using Python, PyTorch, Hugging Face Transformers, and other modern frameworks.",2025-05-31T14:12:06Z,2025-05-31T22:08:41Z
GR4J-HyMoLAP-with-ML-integration,Ezesia-lab/GR4J-HyMoLAP-with-ML-integration,"This repository calibrates and validates the hybrid model combining a conceptual model (GR4J) with a physically-based model (HyMoLAP) for rainfall-runoff systems, presenting a promising new model for hydrological simulation. The framework is then further enhanced by integrating machine learning techniques such as SVR and CNN. Moreover, UQ is buit. ",2025-05-31T08:44:46Z,2025-05-31T09:13:22Z
cyber-risk-assessment,Rozzay22/cyber-risk-assessment,"The AI-Powered Cyber Risk Assessment System is a comprehensive cybersecurity platform designed to help organizations identify, assess, and mitigate cyber risks. Leveraging advanced AI algorithms and machine learning techniques, this system provides a robust framework for threat analysis, vulnerability management, and risk assessment.",2025-05-30T20:51:41Z,2025-05-30T21:11:25Z
spatial_transcriptomics_ml_frameworks-SUMMARY,TingruiZh/spatial_transcriptomics_ml_frameworks-SUMMARY,"This repository summarizes recent machine learning (ML) frameworks applied in spatial transcriptomics data analysis. These methods focus on discovering spatial domains, cell types, and embedding representations from high-dimensional single-cell gene expression data.",2025-05-30T19:10:38Z,2025-06-01T19:37:09Z
925-VideoFootage,EvanescenT07/925-VideoFootage,925 backend machine learning object detectin with FastAPI framework,2025-05-30T14:02:34Z,2025-05-30T14:03:54Z
Causal_ML_LC,SindyPin/Causal_ML_LC,Causal Machine Learning Framework for Early Detection of Long COVID,2025-05-30T05:21:24Z,2025-06-06T06:58:06Z
Interactive_Algorithm_Infographic,SolutionSandra/Interactive_Algorithm_Infographic,"a visual frameworkpresented as a structured tablethat maps ten key machinelearning algorithms to their learning style, primary domains (tabular data, computer vision, NLP, generative AI), realworld examples, and a concise explanation of how each works",2025-05-29T21:26:20Z,2025-05-29T21:26:20Z
X_Sentiment_Analysis,ShreyashSutar0404/X_Sentiment_Analysis,"X_Sentiment Analysis is a machine learning project focused on detecting offensive language and analyzing sentiment in text. It includes trained models, preprocessing tools, and Jupyter notebooks for development and testing. Designed for content moderation and emotion-aware applications, it offers a practical framework for real-world NLP solutions.",2025-05-29T14:37:18Z,2025-05-29T14:37:18Z
Explainable-Framework-for-Stroke-Prediction-Using-Class-Balancing-Techniques,abhinavreddychilkuri/Explainable-Framework-for-Stroke-Prediction-Using-Class-Balancing-Techniques,Explainable Machine Learning Framework for Stroke Prediction Using Risk Factor Analysis and Class Balancing Techniques,2025-05-29T13:52:32Z,2025-05-29T13:57:24Z
soil-moisture-bayesian-fusion,gtsagkatakis/soil-moisture-bayesian-fusion,Bayesian machine learning framework that fuses forecasting and remote sensing retrieval for accurate and uncertainty-aware soil moisture estimation.,2025-05-29T11:10:48Z,2025-05-29T11:44:19Z
TacticalCorrelator,servais1983/TacticalCorrelator, Advanced Multi-Source Forensic Correlation Framework with ML Intelligence - Neo4j + Python + Machine Learning for Digital Forensics,2025-05-28T18:38:46Z,2025-05-28T20:06:55Z
Foundations-of-Machine-Learning-Frameworks---CSCN8010,nikitha2002-bot/Foundations-of-Machine-Learning-Frameworks---CSCN8010,,2025-05-28T17:38:33Z,2025-05-28T17:39:08Z
practical-lab,akondeti7046/practical-lab,Foundations of Machine Learning Frameworks - CSCN8010,2025-05-28T16:20:46Z,2025-05-29T05:28:57Z
FastApi,fawadahmad-lab/FastApi,"Welcome to my FastAPI learning repository! This repo is dedicated to my journey of mastering FastAPI in the context of Data Science, Generative AI, and Chatbot Development.  FastAPI is a modern, fast (high-performance) web framework that enables efficient development of APIs with Python, making it an ideal choice for serving machine learning models",2025-05-28T15:35:55Z,2025-06-03T17:00:22Z
Random_Forest_ADR_Prediction,Joeroberts1601/Random_Forest_ADR_Prediction,This repository contains all the data and code used within the paper 'An Interpretable Machine Learning Framework for Adverse Drug Reaction Prediction from Drug-Target Interactions'. The data and code within this repository contain all methods used and unused,2025-05-28T12:09:59Z,2025-05-28T12:14:24Z
Hybrid-Machine-Learning-Approach-for-Cyberattacks-Correlation-and-Mitigation-in-Distribution-System,LINGAKARTHIK/Hybrid-Machine-Learning-Approach-for-Cyberattacks-Correlation-and-Mitigation-in-Distribution-System,"A hybrid machine learning framework for detecting, correlating, and mitigating cyberattacks in power distribution systems.",2025-05-28T07:24:10Z,2025-05-28T07:44:58Z
Chain-Defender-A-Blockchain-driven-Machine-Learning-Framework-For-App-Security,Sabha2209/Chain-Defender-A-Blockchain-driven-Machine-Learning-Framework-For-App-Security,,2025-05-28T05:27:09Z,2025-05-28T05:31:08Z
Foundations-of-Machine-Learning-Frameworks-CSCN8010-,Yogesh-333/Foundations-of-Machine-Learning-Frameworks-CSCN8010-,,2025-05-28T05:22:52Z,2025-05-28T23:27:16Z
Foundations-of-Machine-Learning-Frameworks,anonduke/Foundations-of-Machine-Learning-Frameworks,,2025-05-28T05:17:38Z,2025-05-28T05:17:38Z
Machine-Learning-Air-Quality-Analysis,Gabriel-Machado-GM/Machine-Learning-Air-Quality-Analysis,"Using Machine Learning Algorithms to monitor the Air Quality in an urban area, the project evolves by applying AI 4 Good Framework",2025-05-28T01:41:56Z,2025-05-29T02:16:59Z
ReedsShepp-MLOps,HoomaanMoradi/ReedsShepp-MLOps,"An MLOps framework for developing, training, and deploying machine learning models aimed at solving the Reeds-Shepp path planning",2025-05-27T23:14:51Z,2025-06-07T21:34:17Z
SharpEdge-Quant,serigela/SharpEdge-Quant,"SharpEdge-Quant is a high-performance quantitative trading framework combining Python-based machine learning with a C++ backtesting engine. It features a Flask API for serving signals, a React dashboard for visualizing strategy performance, and a modular architecture for financial experimentation. ",2025-05-27T17:46:16Z,2025-06-03T14:52:59Z
nn-framework,coezdemir/nn-framework,This a a simple framwork that allows you to create and run a neural network that. I have created this project during my Machine Learning course with a team mate and we used this framework to train a gesture classifier.,2025-05-27T16:53:22Z,2025-05-27T16:54:03Z
Advanced-Framework-for-Leaf-Disease-Detection-Using-Machine-Learning-and-MESA-Agent,Dorai-Sai-Charan/Advanced-Framework-for-Leaf-Disease-Detection-Using-Machine-Learning-and-MESA-Agent,,2025-05-27T16:01:45Z,2025-05-27T16:03:10Z
Security-ML,Rohit8983/Security-ML,"This research aims to enhance  cybersecurity by applying advanced  machine learning  techniquesRandom Forest, SVM,  Stacking Classifier, and CNN to  improve threat detection. It will  develop a comprehensive  framework integrating these  methods, assess their performance  across diverse datasets.",2025-05-27T13:47:46Z,2025-05-27T13:51:38Z
Lab-1-California-,FenilPatel1279/Lab-1-California-,This is the lab 1 of Machine learning framework (California),2025-05-27T12:42:56Z,2025-05-28T19:12:23Z
Credit_Guard,JoYBoYOO7/Credit_Guard," CreditGuard addresses this  pressing challenge by introducing a data-driven, intelligent risk evaluation system that enhances  the precision of loan default predictions. By leveraging diverse data sources and advanced machine  learning techniques, the project seeks to create a more inclusive and accurate credit assessment  framework.",2025-05-27T07:58:34Z,2025-05-27T08:19:32Z
Weather-Predictor,RekhaGiduthuri19/Weather-Predictor,"The proposed system introduces a machine learning-based framework for accurate weather prediction, designed to overcome the limitations of traditional forecasting methods. The system focuses on predicting temperature, rainfall, and humidity using historical weather data from NOAA",2025-05-27T04:14:23Z,2025-05-27T04:26:56Z
PracticalLab1---Univariate-Linear-Regression-on-the-California-Housing-Prices-Dataset,Eris-Leksi/PracticalLab1---Univariate-Linear-Regression-on-the-California-Housing-Prices-Dataset,CSCN8010 - Foundations of Machine Learning Frameworks - Practical Lab 1 ,2025-05-26T18:04:10Z,2025-05-28T17:20:21Z
Mini-AI-Chatbot-Framework,forva2025/Mini-AI-Chatbot-Framework,"Build a modular AI chatbot framework in Python that can:  Parse user input,  Choose a response using a basic machine learning model or rule-based logic,  Learn from conversations (simulated),  Support plug-and-play ""skills"" using OOP.",2025-05-26T07:16:50Z,2025-05-26T07:17:39Z
Cybersecurity-Threat-ML-Model,smitbhatt20/Cybersecurity-Threat-ML-Model,An advanced threat intelligence tool integrating MITRE ATT&CK framework with machine learning to prioritize cybersecurity threats and visualize attack tactics.  A machine learning-powered threat prioritization and visualization platform mapping cybersecurity data to MITRE ATT&CK techniques. ,2025-05-26T06:44:04Z,2025-05-26T07:04:17Z
alpha-regime,mahirshah13/alpha-regime,A machine learning framework for regime-aware market strategies.,2025-05-26T00:24:18Z,2025-05-26T22:23:39Z
Car_Auction_Predicting,yongNotgio/Car_Auction_Predicting,Predicting Car Auction Prices: A Machine Learning Approach Using the CRISP-DM Framework,2025-05-25T18:47:24Z,2025-05-25T19:01:17Z
PumpkinSeeds-ML-project,manchemshunmadhurisuryaja/PumpkinSeeds-ML-project,An Innovative Ensemble Machine Learning  Framework for  Pumpkin Seeds Classification System using the  Forward  Sequential Minimum Redundancy  Maximum Relevance Feature Engineering,2025-05-25T10:54:34Z,2025-05-25T10:57:43Z
ML-DL-fundamentals,Ravshanbe/ML-DL-fundamentals,"In this repo, I implement fundamental parts of Machine Learning and Deep Learning frameworks. ",2025-05-25T09:37:28Z,2025-05-26T03:44:00Z
Criminal-Behavior-Modeling-Simulation,arhadnane/Criminal-Behavior-Modeling-Simulation,"agent-based modeling (ABM) framework for simulating criminal behavior, environmental influences, and law enforcement strategies using machine learning and advanced visualization tools.",2025-05-25T01:12:05Z,2025-05-25T01:27:03Z
AI-Fairness-Explainability-Toolkit,TaimoorKhan10/AI-Fairness-Explainability-Toolkit,"AI Fairness and Explainability Toolkit (AFET) is an open-source project aimed at providing tools and frameworks to assess, visualize, and mitigate bias in machine learning models. It supports multiple ML frameworks and offers a comprehensive suite of metrics and visualization components to enhance model transparency and fairness.",2025-05-24T18:28:15Z,2025-05-25T16:56:09Z
Learning_JAX,hemantharaj95/Learning_JAX,This repository is for learning JAX a machine learning framework.,2025-05-24T15:12:12Z,2025-05-24T17:24:32Z
Alzheimers-disease-prediction-and-Classification,soulrin05/Alzheimers-disease-prediction-and-Classification,"This project is developed in machine learning using strealit framework. it has around 16,000 MRI images in dataset with three major algorithms K-Nearest Neighbor, Logistic Regression, Random Forest, with with highest accuracy of 96%.  This project classifies and predicts if the person has Alzheimers.",2025-05-24T14:23:33Z,2025-05-24T14:38:59Z
