name,full_name,description,created_at,pushed_at
Cognitive-Load-Driven-Academic-Optimization-Model,kritikamittal1509-sys/Cognitive-Load-Driven-Academic-Optimization-Model,"""This project investigates how study behavior patterns and cognitive load indicators influence academic performance and proposes a machine learning-based framework to generate intelligent, personalized learning recommendations.""",2026-02-15T16:33:53Z,2026-04-10T16:46:36Z
cloud-cost-prediction-idle-detection-ml,piyushdwivedi2901/cloud-cost-prediction-idle-detection-ml,Machine Learning framework for cloud cost prediction and idle resource detection.,2026-02-14T10:08:24Z,2026-04-13T10:18:36Z
ppmi-ontology-alignment,augustoielo/ppmi-ontology-alignment,"Framework for aligning longitudinal Parkinsons Progression Markers Initiative (PPMI) data with the Parkinsons Disease Ontology (PDON) and Movement Disorder Ontology (PMDO). Provides reproducible mapping, ontology instantiation, and ontology-informed machine learning workflows for analysing Parkinsons disease trajectories.",2026-02-13T14:18:36Z,2026-03-30T08:28:22Z
british-airways-data-science,charlesakinnurun/british-airways-data-science," Engineered a machine learning pipeline achieving 85% accuracy in predicting customer booking behavior, and a scalable demand forecasting framework supporting capacity planning across 1,500+ daily premium lounge departures at Heathrow Terminal 3.",2026-02-12T01:38:35Z,2026-04-15T22:40:53Z
RAIDNC,UniPV-StatML/RAIDNC,Machine learning framework for the identification of Non-Coding RNAs,2026-02-10T14:42:24Z,2026-04-15T12:00:04Z
Digital-Twin-Framework-for-Industrial-Asset-Prognostics,SarthakChandervanshi/Digital-Twin-Framework-for-Industrial-Asset-Prognostics,"This project is a Digital Twinbased predictive maintenance system that uses sensor data and machine learning to estimate the Remaining Useful Life (RUL) of industrial equipment. By forecasting failures before they occur, the system enables proactive maintenance scheduling, reducing downtime, costs, and operational risks.",2026-02-09T22:01:20Z,2026-04-17T07:18:03Z
software-cost-estimation-framework,omsai1210/software-cost-estimation-framework,Hybrid ensemble machine learning and deep learning framework for accurate and explainable software cost estimation.,2026-02-09T05:46:17Z,2026-03-30T04:50:48Z
SwarmTorch,swarmic/SwarmTorch,"A distributed machine learning framework designed for real-world edge deployments where devices are resource-constrained, connections are unreliable and trust cannot be assumed. Built in Rust from the ground up, it brings swarm intelligence and federated learning primitives to environments where PyTorch and TensorFlow cannot operate.",2026-02-08T11:02:38Z,2026-04-05T17:14:17Z
pyQit,phoeenniixx/pyQit,A high-level orchestration and pipeline framework for quantum machine learning,2026-02-07T06:53:25Z,2026-04-15T11:27:52Z
internrecom,nihalsingh571/internrecom,A Confidence-Calibrated Hybrid Machine Learning Framework for Trust-Aware Internship Recommendation,2026-02-02T18:48:51Z,2026-04-12T20:27:26Z
QRC-Volatility-Forecasting,HarshitTaneja006/QRC-Volatility-Forecasting,A Python framework for volatility forecasting using Quantum Reservoir Computing (Qiskit) and GARCH (Arch). Benchmarks quantum machine learning against econometric baselines on S&P 500 data.,2026-02-02T06:21:37Z,2026-04-07T06:04:51Z
ml-framework-comparison,GoudyMT/ml-framework-comparison,This project is my hands-on portfolio to deepen understanding of machine learning and deep learning pipelines.,2026-02-01T04:53:57Z,2026-04-17T01:13:51Z
AI2026,harshvardhan33/AI2026,"An end-to-end technical repository featuring hands-on notebooks across the full AI stack: Statistics, Machine Learning, Deep Learning, GenAI, and Agentic frameworks. Focused on 2026 industry standards, this collection bridges the gap between fundamental revision and experimental AI development.",2026-01-31T03:27:53Z,2026-04-10T07:31:45Z
MLDL_Lab,HarshalChugwani2005/MLDL_Lab,"A hands-on laboratory repository for practicing Machine Learning & Deep Learning concepts using Python, NumPy, Pandas, Matplotlib, Seaborn, and popular ML/DL frameworks.",2026-01-29T03:58:27Z,2026-04-16T03:20:57Z
Master_Thesis,kumarvaishnavi1217-cmd/Master_Thesis,Development of an Explainable Machine Learning Framework for Intelligent Train Operation,2026-01-28T09:28:52Z,2026-04-07T17:23:39Z
Sports-Performance-Analysis,amalapwork-ui/Sports-Performance-Analysis,"An end-to-end Sports Analytics Platform that leverages Machine Learning, Deep Learning (YOLOv8), and modern web frameworks to analyze football player performance, market value, injury risk, and real-time player tracking from match videos.",2026-01-28T04:40:17Z,2026-04-15T02:15:06Z
GOAL,Nourollah/GOAL,GOAL (General Open Atomistic Laboratory) is a Python framework for training machine-learning interatomic potentials (MLIPs) on atomistic systems.,2026-01-24T03:58:14Z,2026-04-13T18:13:37Z
FW_XFL,SalmaSAGH/FW_XFL,"The XFL Framework is a software platform that enables the configuration of experimentation parameters, the selection of measurement metrics, the deployment, and the visualization of results of a distributed machine learning algorithm (XFL) on real hardware nodes.",2026-01-23T13:04:43Z,2026-04-14T14:14:27Z
OmniRank,ZhaoqianXue/OmniRank,A comprehensive ranking and evaluation framework for machine learning models and algorithms,2026-01-23T02:46:45Z,2026-04-06T20:40:54Z
NLP-Review-Authenticity-Analysis,MohsinCell/NLP-Review-Authenticity-Analysis,An NLP-based framework to analyze and classify online product reviews as genuine or fake using machine learning techniques.,2026-01-22T17:15:57Z,2026-04-09T15:56:08Z
freight-rail-delay-prediction,akashgardas/freight-rail-delay-prediction,"This project investigates short-term arrival delay time prediction in freight rail operations using historical operational datasets and machine learning models. The framework captures delay propagation patterns to enhance prediction accuracy, improve operational efficiency, and assist decision-making in freight rail network management.",2026-01-22T08:27:34Z,2026-04-08T13:55:25Z
global-drought-prediction-with-credit,Rarell/global-drought-prediction-with-credit,"Code to process data to train a machine learning DroughtFormer, built in the CREDIT framework, to predict drought related variables (ML model is trained globally, but there is a regional focus on Africa). Also contains code to analyze DroughtFormer predictions.",2026-01-20T21:02:54Z,2026-03-30T17:53:11Z
CircumSpectrum,npolley/CircumSpectrum,"CircumSpectrum is a flux-based framework that converts bulk and single-cell RNA-seq data into metabolic fingerprints using genome-scale models and machine learning. It includes RADAR, SOURIS, and CORALIE modules for reaction-level, cross-cohort, and multi-tier correlation analyses.",2026-01-16T12:33:39Z,2026-04-02T14:11:14Z
endgame,allianceai/endgame,"A unified framework for tabular, time-series, and multimodal machine learning",2026-01-16T06:28:02Z,2026-03-31T18:05:15Z
Machine-Learning,AaronYounger/Machine-Learning,"Projects in this repository demonstrate the full machine learning workflow, including data preprocessing, model design, mathematical formulation of models, training, evaluation, and analysis, with implementations written from scratch or using standard ML frameworks.",2026-01-16T04:30:16Z,2026-03-31T21:45:25Z
IFRS-9-Expected-Credit-Loss-ECL-Modeling-using-Advanced-Machine-Learning,nazrulislam3626/IFRS-9-Expected-Credit-Loss-ECL-Modeling-using-Advanced-Machine-Learning,"This project develops a predictive framework for credit risk under IFRS 9 standards. It leverages a dataset of over 32,500 entries to predict the Probability of Default (PD).",2026-01-08T04:51:36Z,2026-04-08T06:55:08Z
framework,mni-ml/framework,A machine learning library with a TypeScript API and Rust backend. CUDA and WebGPU compatibility. Built to understand how ML frameworks and models work internally.,2026-01-08T00:45:53Z,2026-04-17T02:19:17Z
DistroML,keshavgarg616/DistroML,"DistroML is an enterprise-grade distributed machine learning training framework designed to accelerate deep learning workflows across multiple GPUs, nodes, and cloud environments.",2026-01-07T13:46:33Z,2026-04-16T17:01:34Z
AI4SG_UseCaseAssessment,ginic/AI4SG_UseCaseAssessment,"Interactive assessment framework for scoping AI, machine learning and data science projects for social good organizations.",2026-01-07T09:15:58Z,2026-04-09T22:50:23Z
machinelearning,reissdo/machinelearning,a simple machine learning framework build from scratch,2026-01-06T14:38:03Z,2026-04-16T08:05:37Z
ML-and-Deep-Learning-Projects-and-practice,DevaNandanJS/ML-and-Deep-Learning-Projects-and-practice,multiple machine learning and deep learning practice projects and framework practice repo,2026-01-05T08:56:09Z,2026-04-02T06:29:24Z
personal-finance-analytics,Abhishek-inc/personal-finance-analytics,"A data-driven personal finance analytics system that calculates income tax liability under the Indian tax framework, assesses financial health using key indicators, and predicts financial stress levels with explainable insights. Built as an educational decision-support tool using Python, FastAPI, and machine learning techniques.",2026-01-04T18:52:31Z,2026-04-15T17:27:36Z
LitterVision,vansh070605/LitterVision,"LitterVision AI is an edge-ready, machine-learning-powered visual intelligence framework designed to automate and optimize the classification of municipal solid waste. By leveraging modern Deep Learning, LitterVision aims to solve the critical ""last-mile"" sorting problem in global recycling infrastructures.",2026-01-04T07:42:04Z,2026-04-14T08:59:54Z
tradingsystem,ilahuerta-IA/tradingsystem,"Modular backtesting framework for algorithmic trading using Backtrader. Features a 4-phase state machine strategy, JPY pair P&L correction (ERIS logic), and professional reporting. Educational resource for learning systematic trading.",2026-01-02T09:51:28Z,2026-04-15T16:08:20Z
refiner,macrodata-labs/refiner,"Refiner by Macrodata Labs, a data processing framework for Machine Learning large scale datasets",2025-12-26T15:32:14Z,2026-04-17T09:59:26Z
U-Net-Segmentation-and-Classification-for-Predicting-Fixed-Orthodontics-Appliances,ngmattt/U-Net-Segmentation-and-Classification-for-Predicting-Fixed-Orthodontics-Appliances,This repository contains input files and code for a two-stage machine learning framework used to predict FOAs.  ,2025-12-25T19:23:54Z,2026-04-13T13:46:13Z
awesome-agentic-machine-learning,jxucoder/awesome-agentic-machine-learning,"A curated list of awesome agentic machine learning projects, frameworks, and resources.",2025-12-25T07:28:00Z,2026-04-05T07:24:49Z
autoware-ml,tier4/autoware-ml,"Autoware-ML is a machine learning framework for multiple tasks, supporting the full lifecycle - training, evaluation, optimization, and deployment of models with native runtime support in Autoware.",2025-12-23T06:15:52Z,2026-04-16T11:25:51Z
bone-fracture-detection-using-quantum-machine-learning,pramanik-souvik/bone-fracture-detection-using-quantum-machine-learning,"Quantum Transfer Learning (QTL) framework for radiographic fracture detection. Benchmarking ResNet, VGG, and DenseNet with Variational Quantum Circuits (VQC).",2025-12-21T22:41:03Z,2026-04-16T18:00:06Z
periop-prediction-framework,Amorfati123/periop-prediction-framework,"Machine learning models for predicting postoperative delirium from perioperative EHR data, including baseline models, domain-structured ensembles, interpretability, calibration, and decision curve analysis.",2025-12-20T02:44:44Z,2026-04-05T21:42:04Z
ModelComparer,lamba44/ModelComparer,"A machine learning experimentation framework that allows users to train, compare, and ensemble multiple classification and regression models on CSV datasets",2025-12-18T22:13:25Z,2026-04-15T21:04:43Z
MLFramework,HansolSon1113/MLFramework,Kotlin Machine Learning Framework Project,2025-12-18T03:33:42Z,2026-04-12T15:22:00Z
dsr-feature-eng-ml,scottroberts140/dsr-feature-eng-ml,"Machine learning model evaluation and feature engineering framework with hyperparameter tuning, data balancing, and feature importance analysis.",2025-12-17T14:47:39Z,2026-04-14T13:29:12Z
NRLMF-DTI-MurrayaBAT,TropBRC-BioinfoLab/NRLMF-DTI-MurrayaBAT,NRLMF-DTI-MurrayaBAT is a drugtarget interaction framework that applies NRLMF-based negative inference to address data imbalance and employs supervised machine learning to predict interactions between Murraya paniculata bioactive compounds and brown adipose tissueassociated proteins in obesity-related conditions.,2025-12-16T08:13:10Z,2026-04-06T21:42:51Z
ML-Based-Network-IDS,nithishm369/ML-Based-Network-IDS,An Network Intrusion Detection Framework using Machine Learning Approach,2025-12-16T06:51:58Z,2026-04-08T15:45:47Z
Survival-Analysis-Modelling,Julie-Montague/Survival-Analysis-Modelling,Using semi-parametric and machine learning frameworks to analyze time-to-event,2025-12-11T05:12:47Z,2026-04-02T15:21:59Z
CreditCardFraudDetection,surexh-exe/CreditCardFraudDetection,"This project delivers a unified, data-driven framework for credit card fraud detection and credit scoring, engineered to empower financial institutions with high-precision risk intelligence. The solution operationalizes advanced machine learning pipelinesspanning LightGBM, XGBoost, CatBoost, Random Forests, and Neural Networks",2025-12-07T04:34:58Z,2026-04-08T12:42:14Z
ML-Project,AvivBE-IS/ML-Project,"Developed within the framework of the Machine Learning curriculum at Ben-Gurion University, this project translates theoretical algorithmic concepts into a practical, end-to-end data processing pipeline.",2025-12-06T07:53:55Z,2026-04-06T15:05:03Z
Python_Frameworks_For_Machine_Learning,Sandip1000/Python_Frameworks_For_Machine_Learning,,2025-12-03T09:52:39Z,2026-04-05T17:34:40Z
Machine-Learning-Framework,hangweixu-1/Machine-Learning-Framework,,2025-12-02T14:26:54Z,2026-04-05T10:23:59Z
Cassette2Vec,RushiLagad/Cassette2Vec,Machine learning framework for Enterococcus cecorum pathogenicity prediction (Antimicrobial Resistance + genomic islands + pangenome),2025-12-01T22:52:52Z,2026-04-12T04:43:27Z
miglioratore-audio,Mattemn97/miglioratore-audio,"AudioOptimizer Pro  un framework enterprise progettato per l'ottimizzazione massiva di asset sonori. Sviluppato per podcasting, game design e dataset per il Machine Learning, questo tool automatizza la complessa catena di segnale (DSP) necessaria per trasformare registrazioni grezze in prodotti audio professionali e cristallini.",2025-11-25T13:57:02Z,2026-04-13T09:36:06Z
AIP-G-1.0,Martinajwin/AIP-G-1.0,"The AIP-G 1.0 (Alzheimers disease, Inhibitor Predictor for GSK-3, version 1.0) pipeline implements a two-stage machine learning framework for predicting GSK-3 inhibitors for Alzheimers disease.",2025-11-15T12:51:28Z,2026-04-13T13:28:27Z
Projeto-Ataques-de-Inferencia-Machine-Learning,L-Repinaldo/Projeto-Ataques-de-Inferencia-Machine-Learning,"Framework experimental para analisar o trade-off entre Privacidade Diferencial, utilidade dos dados e risco de vazamento. Avalia o impacto de diferentes valores de  usando modelos simples de ML e ataques de inferncia. Consome datasets j privatizados por pipeline externo.",2025-11-14T05:57:11Z,2026-04-10T21:23:23Z
eeg_emg_fusion_ml,Muskaan2058/eeg_emg_fusion_ml,The aim of this research is to develop and evaluate a machine-learning framework that integrates electroencephalography (EEG) and electromyography (EMG) signals to improve the recognition and prediction of upper-limb gestures,2025-11-12T16:33:31Z,2026-04-09T04:23:53Z
anomaly_detection_app,IQraTbsm/anomaly_detection_app,A machine learning and deep learning framework for early detection of abnormal physiological patterns in psychiatric patients using wearable devices.,2025-11-12T15:50:44Z,2026-04-12T08:27:02Z
Traffic-Analysis-and-Node-Categorization-Machine-Learning-Integrated-Framework,NipunAdarsh/Traffic-Analysis-and-Node-Categorization-Machine-Learning-Integrated-Framework,,2025-11-11T01:23:50Z,2026-04-10T13:31:10Z
Compensatory-Mutation-Classifier-of-HIV-1-Tat-Protein,Ridwanul-Karim/Compensatory-Mutation-Classifier-of-HIV-1-Tat-Protein,"This repository provides a machine learning framework that integrates structural and coevolutionary features to classify mutations as compensatory, offering insights into evolutionary adaptation and protein stability",2025-11-07T10:11:36Z,2026-04-02T15:07:26Z
MediPredict-A-Unified-AI-Framework-for-Early-Diagnosis-of-Cardio-Pulmonary-and-Neuro-Disorders,Kartikeya1205/MediPredict-A-Unified-AI-Framework-for-Early-Diagnosis-of-Cardio-Pulmonary-and-Neuro-Disorders,"It is an intelligent web-based disease prediction system designed to assist healthcare professionals and patients in identifying potential Heart, Lung, and Brain disorders using machine learning models.It provides an easy to use interface where users can input key health parameters, and the system predicts the disease occurrence with high accuracy.",2025-11-04T18:52:46Z,2026-04-03T10:09:20Z
AIForge,FELIPEACASTRO/AIForge,"A coleo definitiva e curada de recursos de Inteligncia Artificial (AI), Machine Learning (ML) e Deep Learning (DL). Inclui frameworks, modelos, datasets, MLOps, LLMs e aplicaes financeiras/comerciais.",2025-10-29T23:18:08Z,2026-04-15T18:50:27Z
AD-Microbiome-ML-Classification,haniya-naeem/AD-Microbiome-ML-Classification,"This project proposes a computational, data-driven diagnostic framework for Alzheimers disease (AD) by integrating microbiome-derived genome-scale metabolic models (GEMs) and machine learning to accurately predict disease stages from gut microbial activity.",2025-10-28T00:14:40Z,2026-04-10T04:38:58Z
ML-Model-Integration-for-Chip-Design-Automation,JayDS22/ML-Model-Integration-for-Chip-Design-Automation,"Machine learning integration framework for semiconductor design automation that optimizes placement, routing, and timing closure in chip design workflows.",2025-10-13T01:16:49Z,2026-04-15T05:26:43Z
Feature-Engineering-Framework-For-Traffic-Accident-Prediction-using-XAI,osoadsd/Feature-Engineering-Framework-For-Traffic-Accident-Prediction-using-XAI," Predict traffic accident severity using advanced machine learning and explainable AI, enhancing road safety with clear insights from comprehensive data analysis.",2025-10-03T23:20:34Z,2026-04-17T09:54:00Z
scene-tokens,stackav-oss/scene-tokens,A Machine Learning framework for discovering and characterizing scenarios from trajectory datasets into different interaction types by combining state-of-the-art trajectory forecasting and embedding quantization techniques.,2025-09-29T16:08:58Z,2026-04-10T20:13:35Z
quantum-neural-architecture,iCog-Labs-Dev/quantum-neural-architecture,An experiment to work with quantum machine learning framework with Variational Quantum Circuits(VQC) as a tunable circuit.,2025-09-29T05:30:49Z,2026-04-08T14:37:50Z
RECLAIM,UW-SASWE/RECLAIM,RECLAIM (Reservoir Estimation of Capacity Loss using AI-based Methods) is a globally scalable machine learning framework to predict absolute sedimentation rates using observed records and multi-decadal Earth observations from satellite data.,2025-09-28T19:31:33Z,2026-04-13T08:33:27Z
Iris-classification-model,PrateekS-99/Iris-classification-model, this is a machine learning model deployment project where we have presented the Iris classification model in an elegant basic minimal ui using flask web framework,2025-09-23T18:44:38Z,2026-04-05T19:18:00Z
Quantum_Machine_Learning,SidRichardsQuantum/Quantum_Machine_Learning,"Modular Python framework for quantum machine learning using PennyLane, including variational classifiers, quantum kernels, and reproducible workflows for hybrid quantumclassical experiments.",2025-09-23T15:16:34Z,2026-04-16T04:19:55Z
OpenPQD-Synthetic-Power-Quality-Dataset-Analysis-Toolkit-for-ML,LeonardoCorral04/OpenPQD-Synthetic-Power-Quality-Dataset-Analysis-Toolkit-for-ML,"An open-source dataset of synthetic power quality disturbances (PQD), ideal for training and validating machine learning models. Signals are generated using established mathematical models from scientific literature, with parameter ranges conforming to the IEEE 1159 standard. Includes a Python analysis framework for statistical exploration.",2025-09-19T19:19:54Z,2026-04-12T00:48:18Z
DetaNet-MD,WeiHuQLU/DetaNet-MD,A universal machine learning force field framework,2025-09-11T13:16:13Z,2026-04-01T15:20:07Z
learnify,boraderen/learnify,"A freelance from-scratch Python library project for machine learning and deep learning with visualizations, built using only raw Python and NumPy without external ML frameworks.",2025-09-07T16:10:50Z,2026-04-03T22:11:59Z
Solar_Advisor,MeharAbdulla/Solar_Advisor,"A curated portfolio of AI, Machine Learning, and Automation projects showcasing expertise in deep learning, NLP, web scraping, and data visualization. Includes work on recommendation systems, face embeddings, financial forecasting, and applied AI solutions built with Python, FastAPI, Django, and modern ML frameworks.",2025-09-07T03:23:11Z,2026-04-06T05:41:15Z
ML-APT-OCS,838615495/ML-APT-OCS,ML-APT: Machine Learning-enhanced Atom ProbeTomography Framework,2025-09-02T09:11:40Z,2026-03-30T09:20:23Z
QuChaTeR,emirkaanozdemr/QuChaTeR,"The official implementation and source code of ""QuChaTeR: A Hybrid Quantum-Chaotic Temporal Framework for Earthquake Prediction"", which has been accepted for presentation at the IEEE ICASSP 2026 conference at the Satellite Workshop on Quantum Machine Learning in Signal Processing and Artificial Intelligence.",2025-09-01T10:55:02Z,2026-04-12T12:13:38Z
accelera,Mohamed-Ashraf273/accelera," Accelera is a cutting-edge ML pipeline framework . It provides a robust, scalable solution for building and deploying machine learning workflows with optimized performance.",2025-08-31T16:24:33Z,2026-04-15T17:52:13Z
awesome-QAI-Papers-QML,Romainiaccc/awesome-QAI-Papers-QML," Discover key research papers on Quantum Machine Learning (QML) and explore transfer learning frameworks, applications, and optimization strategies.",2025-08-26T15:20:48Z,2026-04-17T09:44:41Z
NFL-Fantasy,vishnudattaj/NFL-Fantasy,A machine learning framework for fantasy football forecasting that mitigates cognitive bias in player rankings using pure XGBoost algorithmic modeling and statistical benchmarking.,2025-08-21T13:25:44Z,2026-04-02T02:25:26Z
Ensemble-Machine-Learning-Framework-for-Detection-and-Classification-of-Obfuscated-Malware-,chandanabalaji/Ensemble-Machine-Learning-Framework-for-Detection-and-Classification-of-Obfuscated-Malware-,"Developed an ensemble machine learning framework for detecting and classifying obfuscated malware using the CIC-MalMem-2022 dataset. Applied feature selection, data balancing, and models like RF, XGBoost, and MLP, achieving robust detection across binary and multiclass tasks.",2025-08-17T05:33:26Z,2026-04-15T15:07:53Z
leo-cdp-framework,trieu/leo-cdp-framework,"LEO CDP is an open-source, AI-first Customer Data Platform for building customizable, self-hosted, privacy-friendly CDP infrastructure. It unifies data collection, enables real-time analytics, audience segmentation, and personalized marketing  powered by big data and machine learning.",2025-08-13T10:14:31Z,2026-04-09T17:58:22Z
Financial-Risk-Analysis-and-Modeling,jstmahi/Financial-Risk-Analysis-and-Modeling,"This project is a comprehensive framework for credit risk analysis, designed to predict loan defaults and quantify potential losses for a lending portfolio. It utilizes a machine learning approach to build predictive models for key risk components, providing a data-driven solution for risk management.",2025-08-08T16:06:15Z,2026-04-10T04:11:18Z
A-Decentralized-Framework-for-AI-based-Resource-Allocation-in-Open-RAN,chamleyash/A-Decentralized-Framework-for-AI-based-Resource-Allocation-in-Open-RAN,"A decentralized framework for AI-based resource allocation in Open RAN optimizes network efficiency. It uses machine learning models, deployed at the network edge, to autonomously manage resources like spectrum and power, enhancing performance and scalability without a central controller.",2025-08-08T14:44:12Z,2026-04-09T05:43:19Z
zerfoo,zerfoo/zerfoo,"Pure Go machine learning framework. Train, run, and serve ML models with go build. Zero CGo.",2025-07-26T03:59:49Z,2026-04-17T07:32:56Z
Early-Detection-and-Prediction-of-Schizophrenia,Susovan12/Early-Detection-and-Prediction-of-Schizophrenia,"A comparative machine learning framework for early schizophrenia detection using 64-channel EEG data. Evaluates 11 algorithms (including LightGBM, XGBoost, Random Forest, SVM, etc.) with rigorous hyperparameter optimization and cross-validation.",2025-07-23T03:21:30Z,2026-04-05T13:44:12Z
Chonky,is-leeroy-jenkins/Chonky,A text-processing framework for machine-learning workflows based in python  ,2025-07-21T15:36:24Z,2026-04-15T08:19:03Z
data-science-practice-notebooks,Varanapat/data-science-practice-notebooks,"A curated collection of Google Colab notebooks demonstrating fundamental concepts in Data Science, AI, and Machine Learning, including OCR basics, CRISP-DM framework, and practical data analysis workflows.",2025-07-21T09:37:50Z,2026-04-15T16:03:11Z
ChromeCRISPR,Daneshpajouh/ChromeCRISPR,Hybrid Machine Learning Framework for CRISPR/Cas9 On-Target Activity Prediction,2025-07-17T23:10:47Z,2026-04-17T08:43:27Z
ecommerce-product-categorization-ml,jsandya7/ecommerce-product-categorization-ml,"Machine learning framework for multi-class product categorization in e-commerce using structured metadata and textual features. Combines TF-IDF, transformer embeddings (MiniLM), and ensemble models (Logistic Regression, XGBoost, MLP) to predict hierarchical product categories with strong F1 performance.",2025-07-05T22:42:29Z,2026-04-09T22:42:25Z
