name,full_name,description,created_at,pushed_at
endgame,allianceai/endgame,"A unified framework for tabular, time-series, and multimodal machine learning",2026-01-16T06:28:02Z,2026-04-24T14:45:17Z
automotive-demand-forecasting-framework,JuananJCobo/automotive-demand-forecasting-framework,"A scalable, market-agnostic forecasting pipeline for automotive Total Industry Volume (TIV) in multiple countries. Demonstrates high-level data preprocessing, feature engineering, model selection, and evaluation estrategies using classical, machine learning, and foundation time-series models. ",2026-01-14T20:33:15Z,2026-04-17T20:47:57Z
LTX-2-MLX,Acelogic/LTX-2-MLX,Attempt at Porting LTX-2 Video Model to Apple's MLX Machine Learning Framework,2026-01-08T23:26:37Z,2026-04-18T02:42:45Z
framework,mni-ml/framework,A machine learning library with a TypeScript API and Rust backend. CUDA and WebGPU compatibility. Built to understand how ML frameworks and models work internally.,2026-01-08T00:45:53Z,2026-04-20T15:40:12Z
DistroML,Romaisafatima1/DistroML,"DistroML is an enterprise-grade distributed machine learning training framework designed to accelerate deep learning workflows across multiple GPUs, nodes, and cloud environments.",2026-01-07T13:46:33Z,2026-04-27T21:40:36Z
machinelearning,reissdo/machinelearning,a simple machine learning framework build from scratch,2026-01-06T14:38:03Z,2026-04-16T08:05:37Z
personal-finance-analytics,Abhishek-inc/personal-finance-analytics,"A data-driven personal finance analytics system that calculates income tax liability under the Indian tax framework, assesses financial health using key indicators, and predicts financial stress levels with explainable insights. Built as an educational decision-support tool using Python, FastAPI, and machine learning techniques.",2026-01-04T18:52:31Z,2026-04-20T19:31:16Z
Final-Year-Presentation,JoelGwC/Final-Year-Presentation,Repository for Final Year Project regarding Machine Learning Framework for Analog Circuit Design Optimsation,2026-01-04T06:33:46Z,2026-04-27T13:41:23Z
tradingsystem,ilahuerta-IA/tradingsystem,"Modular backtesting framework for algorithmic trading using Backtrader. Features a 4-phase state machine strategy, JPY pair P&L correction (ERIS logic), and professional reporting. Educational resource for learning systematic trading.",2026-01-02T09:51:28Z,2026-04-25T11:33:42Z
ML_surrogate_visualcomfort_urban,zarramezani/ML_surrogate_visualcomfort_urban,"This Repository you can see the document and data used in this research ""Data-driven machine-learning framework for faade-level visual comfort mapping at the urban-block scale""",2025-12-29T17:39:05Z,2026-04-26T17:58:37Z
Numpy-and-Tensorflow-for-Meachine-learning-,RaufFauzanRambe/Numpy-and-Tensorflow-for-Meachine-learning-,This project leverages the high-performance computational power of NumPy alongside the scalable machine learning framework TensorFlow to build a robust end-to-end data pipeline and predictive model.,2025-12-29T09:37:41Z,2026-04-16T14:50:16Z
bias-fairness-framework,bhueetaran/bias-fairness-framework,"End-to-end framework for detecting, evaluating, and mitigating bias in machine learning models with fairness metrics and SHAP-based explainability.",2025-12-28T14:35:23Z,2026-04-23T14:03:16Z
Quantum-Machine-Learning-Framework-Based-on-Nystr-m-Approximation,mhrezvannia/Quantum-Machine-Learning-Framework-Based-on-Nystr-m-Approximation,,2025-12-28T11:31:49Z,2026-04-18T08:42:58Z
refiner,macrodata-labs/refiner,"Refiner by Macrodata Labs, a data processing framework for Machine Learning large scale datasets",2025-12-26T15:32:14Z,2026-04-28T10:13:18Z
U-Net-Segmentation-and-Classification-for-Predicting-Fixed-Orthodontics-Appliances,ngmattt/U-Net-Segmentation-and-Classification-for-Predicting-Fixed-Orthodontics-Appliances,This repository contains input files and code for a two-stage machine learning framework used to predict FOAs.  ,2025-12-25T19:23:54Z,2026-04-13T13:46:13Z
autoware-ml,tier4/autoware-ml,"Autoware-ML is a machine learning framework for multiple tasks, supporting the full lifecycle - training, evaluation, optimization, and deployment of models with native runtime support in Autoware.",2025-12-23T06:15:52Z,2026-04-18T15:42:26Z
bone-fracture-detection-using-quantum-machine-learning,pramanik-souvik/bone-fracture-detection-using-quantum-machine-learning,"Quantum Transfer Learning (QTL) framework for radiographic fracture detection. Benchmarking ResNet, VGG, and DenseNet with Variational Quantum Circuits (VQC).",2025-12-21T22:41:03Z,2026-04-16T18:00:06Z
ModelComparer,lamba44/ModelComparer,"A machine learning experimentation framework that allows users to train, compare, and ensemble multiple classification and regression models on CSV datasets",2025-12-18T22:13:25Z,2026-04-15T21:04:43Z
MLFramework,HansolSon1113/MLFramework,Kotlin Machine Learning Framework Project,2025-12-18T03:33:42Z,2026-04-12T15:22:00Z
dsr-feature-eng-ml,scottroberts140/dsr-feature-eng-ml,"Machine learning model evaluation and feature engineering framework with hyperparameter tuning, data balancing, and feature importance analysis.",2025-12-17T14:47:39Z,2026-04-27T15:46:17Z
DyMoN,Ofen-Lovers/DyMoN,DyMoN (Dynamic Motion in Networks) is a machine learning framework that applies kinematic principles to detect anomalies in dynamic network embeddings.,2025-12-16T19:03:11Z,2026-04-21T15:37:39Z
macecvs,thomaspigeon/macecvs,macecvs is a Python package that leverages machine learning toolds and the MACE framework for the definitions of collective variable. ,2025-12-16T09:23:15Z,2026-04-20T09:43:53Z
routing-prediction,Malmusidi/routing-prediction,"Machine learning framework to predict pedestrian routing disagreements among Google Maps, ArcGIS, and OpenRouteService",2025-12-08T01:29:07Z,2026-04-18T17:15:43Z
Hybrid-AgriPrice-Forecaster,akashg7/Hybrid-AgriPrice-Forecaster,A Hybrid Machine Learning and Foundation Model Framework for Multi-Market Agricultural Price Forecasting in India with Weather-Integrated Agriculture Analytics,2025-12-07T13:08:47Z,2026-04-20T17:32:19Z
Cassette2Vec,RushiLagad/Cassette2Vec,Machine learning framework for Enterococcus cecorum pathogenicity prediction (Antimicrobial Resistance + genomic islands + pangenome),2025-12-01T22:52:52Z,2026-04-26T04:55:02Z
ML-CRISPR-Integration,mahajanmuskaan/ML-CRISPR-Integration,"This repository contains the complete, end-to-end reproducible pipeline developed for the manuscript:  Integrated Machine Learning and CRISPR Scoring Framework for Prioritizing Therapeutic gRNAs Targeting TCF7L2 in Type 2 Diabetes.",2025-12-01T12:38:27Z,2026-04-28T08:06:41Z
scenario-analysis-framework,SAAAHco/scenario-analysis-framework,A machine learning and Monte Carlo framework for scenario-based geopolitical analysis,2025-11-29T21:32:16Z,2026-04-23T18:23:49Z
supplementary-materials-alfian2026,ndarualfian/supplementary-materials-alfian2026,"This repository contains the supplementary materials for the paper: Machine Learning Framework for Speech Intelligibility Prediction using Binaural Room Impulse Responses (Alfian et al., 2026)",2025-11-27T22:17:25Z,2026-04-22T00:11:21Z
OSM-3D-Building-Quality-Assessment,Longtao2002/OSM-3D-Building-Quality-Assessment,Implementation of a framework that combines comparative metrics and machine learning to evaluate OSM 3D building data quality.,2025-11-27T15:05:20Z,2026-04-25T18:38:25Z
miglioratore-audio,Mattemn97/miglioratore-audio,"AudioOptimizer Pro  un framework enterprise progettato per l'ottimizzazione massiva di asset sonori. Sviluppato per podcasting, game design e dataset per il Machine Learning, questo tool automatizza la complessa catena di segnale (DSP) necessaria per trasformare registrazioni grezze in prodotti audio professionali e cristallini.",2025-11-25T13:57:02Z,2026-04-13T09:36:06Z
Zi,mf2023/Zi,"A high-performance data processing engine built with Rust, designed for modern machine learning workflows. Zi provides a unified framework for data quality assessment, cleaning, transformation, sampling, and augmentation with exceptional speed and reliability.",2025-11-15T15:21:55Z,2026-04-25T06:16:16Z
AIP-G-1.0,Martinajwin/AIP-G-1.0,"The AIP-G 1.0 (Alzheimers disease, Inhibitor Predictor for GSK-3, version 1.0) pipeline implements a two-stage machine learning framework for predicting GSK-3 inhibitors for Alzheimers disease.",2025-11-15T12:51:28Z,2026-04-28T04:16:47Z
Projeto-Ataques-de-Inferencia-Machine-Learning,L-Repinaldo/Projeto-Ataques-de-Inferencia-Machine-Learning,"Framework experimental para analisar o trade-off entre Privacidade Diferencial, utilidade dos dados e risco de vazamento. Avalia o impacto de diferentes valores de  usando modelos simples de ML e ataques de inferncia. Consome datasets j privatizados por pipeline externo.",2025-11-14T05:57:11Z,2026-04-24T03:19:39Z
anomaly_detection_app,IQraTbsm/anomaly_detection_app,A machine learning and deep learning framework for early detection of abnormal physiological patterns in psychiatric patients using wearable devices.,2025-11-12T15:50:44Z,2026-04-12T08:27:02Z
opioid-cost-prediction-pbm-sdoh,singhlamohit87/opioid-cost-prediction-pbm-sdoh,"Machine learning framework predicting U.S. county-level opioid cost per capita (20132023) by integrating Pharmacy Benefit Management (PBM) levers and Social Determinants of Health (SDOH). Includes data pipelines, simulation code, and reproducible figures.",2025-11-02T22:29:01Z,2026-04-27T02:59:55Z
AIForge,FELIPEACASTRO/AIForge,"A coleo definitiva e curada de recursos de Inteligncia Artificial (AI), Machine Learning (ML) e Deep Learning (DL). Inclui frameworks, modelos, datasets, MLOps, LLMs e aplicaes financeiras/comerciais.",2025-10-29T23:18:08Z,2026-04-15T18:50:27Z
Volta,rlarson20/Volta,A Rust powered PyTorch-like Machine Learning framework.,2025-10-23T19:29:28Z,2026-04-19T01:57:06Z
rice-irrigation-mapping-s1s2,microsoft/rice-irrigation-mapping-s1s2,A framework for classifying rice field irrigation methods (AWD vs CF) and sowing practices (DSR vs PTR) using Sentinel-1/2 satellite time series and machine learning. Paper: https://arxiv.org/pdf/2507.08605,2025-10-16T13:42:34Z,2026-04-21T16:25:40Z
ML-Model-Integration-for-Chip-Design-Automation,JayDS22/ML-Model-Integration-for-Chip-Design-Automation,"Machine learning integration framework for semiconductor design automation that optimizes placement, routing, and timing closure in chip design workflows.",2025-10-13T01:16:49Z,2026-04-15T05:26:43Z
AutoIQ-prostateDWI,sunhPG/AutoIQ-prostateDWI,Automatic quantification and classification of geometric distortion in prostate diffusion-weighted MRI using an ensemble machine learning framework.,2025-10-07T17:58:38Z,2026-04-17T23:56:24Z
Feature-Engineering-Framework-For-Traffic-Accident-Prediction-using-XAI,osoadsd/Feature-Engineering-Framework-For-Traffic-Accident-Prediction-using-XAI," Predict traffic accident severity using advanced machine learning and explainable AI, enhancing road safety with clear insights from comprehensive data analysis.",2025-10-03T23:20:34Z,2026-04-28T08:55:40Z
TabAutoSyn,Samp0rt/TabAutoSyn,"A comprehensive tabular data synthesis framework for automated machine learning, featuring advanced genetic algorithms and hyperparameter optimization for generating high-quality synthetic datasets.",2025-10-03T12:58:14Z,2026-04-24T16:55:31Z
Quantum_Machine_Learning,SidRichardsQuantum/Quantum_Machine_Learning,"Modular Python framework for quantum machine learning using PennyLane, including variational classifiers, quantum kernels, and reproducible workflows for hybrid quantumclassical experiments.",2025-09-23T15:16:34Z,2026-04-18T02:41:16Z
OpenPQD-Synthetic-Power-Quality-Dataset-Analysis-Toolkit-for-ML,LeonardoCorral04/OpenPQD-Synthetic-Power-Quality-Dataset-Analysis-Toolkit-for-ML,"An open-source dataset of synthetic power quality disturbances (PQD), ideal for training and validating machine learning models. Signals are generated using established mathematical models from scientific literature, with parameter ranges conforming to the IEEE 1159 standard. Includes a Python analysis framework for statistical exploration.",2025-09-19T19:19:54Z,2026-04-12T00:48:18Z
alpha-signal-discovery,deyingsong/alpha-signal-discovery,"Python framework for building, validating, and backtesting quantitative trading strategies with machine learning, featuring robust data analysis, realistic backtesting, and comprehensive risk analytics.",2025-09-19T14:34:33Z,2026-04-26T18:02:37Z
QuChaTeR,emirkaanozdemr/QuChaTeR,"The official implementation and source code of ""QuChaTeR: A Hybrid Quantum-Chaotic Temporal Framework for Earthquake Prediction"", which has been accepted for presentation at the IEEE ICASSP 2026 conference at the Satellite Workshop on Quantum Machine Learning in Signal Processing and Artificial Intelligence.",2025-09-01T10:55:02Z,2026-04-24T15:29:32Z
accelera,Mohamed-Ashraf273/accelera," Accelera is a cutting-edge ML pipeline framework . It provides a robust, scalable solution for building and deploying machine learning workflows with optimized performance.",2025-08-31T16:24:33Z,2026-04-25T10:45:01Z
awesome-QAI-Papers-QML,Romainiaccc/awesome-QAI-Papers-QML," Discover key research papers on Quantum Machine Learning (QML) and explore transfer learning frameworks, applications, and optimization strategies.",2025-08-26T15:20:48Z,2026-04-28T08:44:06Z
Machine-Learning-Agentic-System-LangChain-Framework,Dalbirsm03/Machine-Learning-Agentic-System-LangChain-Framework,,2025-08-18T07:53:29Z,2026-04-19T12:26:04Z
Ensemble-Machine-Learning-Framework-for-Detection-and-Classification-of-Obfuscated-Malware-,chandanabalaji/Ensemble-Machine-Learning-Framework-for-Detection-and-Classification-of-Obfuscated-Malware-,"Developed an ensemble machine learning framework for detecting and classifying obfuscated malware using the CIC-MalMem-2022 dataset. Applied feature selection, data balancing, and models like RF, XGBoost, and MLP, achieving robust detection across binary and multiclass tasks.",2025-08-17T05:33:26Z,2026-04-15T15:07:53Z
leo-cdp-framework,trieu/leo-cdp-framework,"LEO CDP is an open-source, AI-first Customer Data Platform for building customizable, self-hosted, privacy-friendly CDP infrastructure. It unifies data collection, enables real-time analytics, audience segmentation, and personalized marketing  powered by big data and machine learning.",2025-08-13T10:14:31Z,2026-04-18T10:36:41Z
A-hybrid-AI-model-integrating-LSTM-XGBoost-and-K-means-for-interpretable-prediction-_-clustering,Okes2024/A-hybrid-AI-model-integrating-LSTM-XGBoost-and-K-means-for-interpretable-prediction-_-clustering,A Hybrid Machine Learning Framework for Water Quality Assessment and Contamination Clustering in the Niger Delt,2025-07-27T11:38:37Z,2026-04-18T05:18:44Z
zerfoo,zerfoo/zerfoo,"Pure Go machine learning framework. Train, run, and serve ML models with go build. Zero CGo.",2025-07-26T03:59:49Z,2026-04-28T08:42:55Z
Chonky,is-leeroy-jenkins/Chonky,A text-processing framework for machine-learning workflows based in python  ,2025-07-21T15:36:24Z,2026-04-15T08:19:03Z
data-science-practice-notebooks,Varanapat/data-science-practice-notebooks,"A curated collection of Google Colab notebooks demonstrating fundamental concepts in Data Science, AI, and Machine Learning, including OCR basics, CRISP-DM framework, and practical data analysis workflows.",2025-07-21T09:37:50Z,2026-04-15T16:03:11Z
CKD-Classification-ML-XAI,rizwanawan612/CKD-Classification-ML-XAI,"An AI-powered framework for early detection of chronic kidney disease (CKD) using clinical features, including machine learning and explainable AI techniques. Built using real-world data from Pakistan.",2025-07-20T05:29:34Z,2026-04-21T15:01:16Z
ChromeCRISPR,Daneshpajouh/ChromeCRISPR,Hybrid Machine Learning Framework for CRISPR/Cas9 On-Target Activity Prediction,2025-07-17T23:10:47Z,2026-04-17T08:43:27Z
AnisONet,prokash122/AnisONet,Machine Learning Pipeline Frameworks to Predict Directional Anisotropic Permeabilities From Porous Media Image,2025-07-15T17:09:18Z,2026-04-24T21:08:43Z
LEMONsc,Milo-Jsb/LEMONsc,Framework for  mass estimation of massive objects in astrophysical collision-driven systems using machine learning models,2025-07-11T02:07:25Z,2026-04-24T15:31:09Z
tenflowers,cool-japan/tenflowers,"A pure Rust implementation of TensorFlow, providing a full-featured machine learning framework with Rust's safety and performance.",2025-07-01T06:24:05Z,2026-04-25T15:56:04Z
awesome-mlops,brandonhimpfen/awesome-mlops,"A curated list of tools, frameworks, platforms, and resources for Machine Learning Operations (MLOps).",2025-06-28T22:59:32Z,2026-04-27T17:59:42Z
mirage,my-awesome-quant-portfolio/mirage,Linear regression framework for quant finance and machine learning,2025-06-28T01:08:43Z,2026-04-20T04:51:37Z
c60.ai,irhyl/c60.ai,"C60.ai is a full-stack AutoML framework that builds, optimizes, and explains machine learning pipelines. C60 is experimental, deeply modular, and focused on adaptability, introspection, and autonomy  almost like a DAG-based scientific research assistant",2025-06-22T03:18:27Z,2026-04-26T04:30:45Z
PhaseForge,dogusariturk/PhaseForge,"PhaseForge is a framework for high-throughput alloy phase diagram prediction using machine learning interatomic potentials (MLIPs) integrated with ATAT and CALPHAD modeling. Includes tools for structure relaxation, molecular dynamics, and TDB generation.",2025-06-20T00:59:50Z,2026-04-26T02:28:54Z
astro-lab,synapticore-io/astro-lab,Astronomical machine learning framework with advanced data analysis and interactive 3D visualization capabilities.,2025-06-18T05:25:38Z,2026-04-27T06:31:18Z
waqarahmed.xyz,Waqar-ahmedkhan/waqarahmed.xyz,"Hi there! I'm Waqar, a passionate Full Stack Developer, DevOps Engineer, and Machine Learning enthusiast currently exploring the world of Agentic AI. I specialize in building intelligent, scalable, and automated systems using modern tools and frameworks  from infrastructure to intelligent apps.",2025-06-14T18:51:31Z,2026-04-26T07:55:57Z
aDeepLearning,Mintinson/aDeepLearning,This is a machine learning framework built by C++ with C++ metaprogramming. It is built just for fun.,2025-05-29T07:01:48Z,2026-04-15T11:42:29Z
continuous_condition_optimiser,callumrjohn/continuous_condition_optimiser,Screening framework for chemical featurisation methods from SMILES and machine learning model architectures to predict optimum ranges of continuous reaction parameters from experimental datasets.,2025-05-22T11:54:54Z,2026-04-28T09:38:12Z
survalis,ielbadisy/survalis,Interpretable Survival Machine Learning Framework,2025-05-13T21:56:16Z,2026-04-22T14:57:49Z
pontos,AslinaBegam-N/pontos," Build and deploy machine learning models with Pontos, an efficient framework that simplifies workflows using Python, PyTorch, and Docker.",2025-05-09T07:44:34Z,2026-04-28T06:33:34Z
EquiML,mkupermann/EquiML,A Framework for Equitable and Responsible Machine Learning & Validation of AI,2025-05-03T13:27:32Z,2026-04-27T07:51:15Z
XaiGis,DennisWayo/XaiGis,Classical and quantum machine-learning framework for detecting and mapping natural hydrogen prospectivity in Kazakhstan using Sentinel-2 satellite imagery.,2025-04-28T12:10:49Z,2026-04-19T08:42:16Z
gospel,fullscreen-triangle/gospel,"Framework  for comprehensive variant detection in whole genome sequences using advanced machine learning models for cross domain pattern recognition in fitness, pharmacogenetics and nutritional aspects of sprint running",2025-04-25T00:01:52Z,2026-04-27T21:29:59Z
Cross_Domain_Predictive_Analytics_Dashboard,damsolanke/Cross_Domain_Predictive_Analytics_Dashboard,An advanced web-based data platform using Python frameworks that integrates multiple data sources and applies machine learning for predictive analytics.,2025-04-22T02:41:40Z,2026-04-15T01:17:26Z
AI-Predictive-Model,Rono-Boy7/AI-Predictive-Model,Designed a machine learning model using Python and frameworks such as Scikit-learn and TensorFlow to predict human brain awareness using EEG brain signals.,2025-02-10T00:58:46Z,2026-04-17T13:32:58Z
QuantTradeAI,AKKI0511/QuantTradeAI,A comprehensive machine learning framework for quantitative trading strategies,2025-02-08T03:39:44Z,2026-04-25T07:58:53Z
amiteshks,amiteshks/amiteshks,"This repository serves as a hub for my ML/AI explorations, implementations, and tutorials. It includes:   Exploratory Data Analysis (EDA) projects  Machine Learning models for predictions and classifications  Deep Learning projects using frameworks like TensorFlow, PyTorch, and Hugging Face  Natural Language Processing (NLP) applications ",2025-01-18T14:49:47Z,2026-04-13T00:26:29Z
pipeML,VeraPancaldiLab/pipeML,A flexible and modular machine learning framework designed to support leakage-free model training through custom cross-validation fold construction,2025-01-18T10:52:51Z,2026-04-19T11:11:02Z
AIML,neonite2217/AIML,"This repository contains a collection of AI and Machine Learning projects built using various libraries and frameworks such as TensorFlow, PyTorch, Scikit-learn, and others. It includes algorithms, models, and applications that demonstrate the power of machine learning and artificial intelligence to solve real-world problems.",2024-12-24T10:17:12Z,2026-04-25T14:56:44Z
jace.ai,VRichardJP/jace.ai,Jace is a work-in-progress machine learning framework for training neural networks models to analyze Magic: the Gathering drafts.,2024-12-15T08:26:30Z,2026-04-19T05:55:49Z
vibrolearn,fboldt/vibrolearn,A Python framework for machine learning experiments in industrial machinery fault diagnosis through vibration analysis.,2024-11-22T16:13:38Z,2026-04-27T20:27:03Z
FSCTEP,Parity-LRX/FSCTEP,"A Multi-Operator Equivariant Framework for High-Performance Machine Learning Force Fields, supporting External Fields embedding and Physical Tensors prediction.",2024-11-09T15:58:30Z,2026-04-28T10:14:36Z
portafolio,TheIonicDiamond82/portafolio,"Portafolio de desarrollador con experiencia en frameworks como Angular, Vue, Ionic, Node.js, React, C# y .NET Core. Ingeniero en Sistemas Computacionales, cursando una maestra en IA, especializndome en Data Science y machine learning. Actualmente, trabajo como Software Developer Analyst gestionando APIs con IBM API Connect.",2024-10-22T19:42:10Z,2026-04-23T05:50:25Z
SynapseEngine,KAMEHAMEHA-05/SynapseEngine,Julia based Machine Learning framework for developing innovative avenues in Meta-Learning and AGI.,2024-10-22T13:39:39Z,2026-04-26T17:41:26Z
Kaggle-ML-Portfolio,SajjadKhanYousafzai/Kaggle-ML-Portfolio,"Collection of machine learning projects spanning healthcare prediction, business analytics, and NLP - built with Python, scikit-learn, and deep learning frameworks.",2024-10-18T06:50:00Z,2026-04-17T17:44:08Z
Generative-Motion-Planner,PRX-Kinodynamic/Generative-Motion-Planner,A framework for motion planning using generative machine learning methods,2024-09-30T19:18:01Z,2026-04-13T10:24:17Z
LLM,godrays/LLM,LLM implementations with AIX machine learning framework.,2024-08-25T10:12:53Z,2026-04-15T18:32:57Z
global-socioeconomic-ml-analysis,NathanGhenassia/global-socioeconomic-ml-analysis,"Machine learning framework combining clustering, classification, and regression to analyze global socioeconomic vulnerability.",2024-08-23T22:15:50Z,2026-04-16T01:45:49Z
AIX,godrays/AIX,A lean Torch like C++ machine learning framework with multiple device acceleration support.,2024-08-08T19:32:47Z,2026-04-22T13:01:01Z
CatBench,JinukMoon/CatBench,CatBench - Benchmark Framework of Machine Learning Interatomic Potentials in Adsorption Energy Predictions,2024-08-05T04:30:28Z,2026-04-19T08:33:17Z
brain4j,brain4j-org/brain4j,Open-source machine learning framework for Java. Designed with speed and lightweight in mind.,2024-07-28T11:54:08Z,2026-04-22T18:17:36Z
azheraly,azheraly/azheraly,"I'm a passionate Data Scientist and AI/ML Engineer with hands-on experience building intelligent systems using machine learning, deep learning, and natural language processing. I specialize in developing scalable models using frameworks like PyTorch, TensorFlow, and Python  from research to real-world deployment.",2024-07-25T05:47:19Z,2026-04-18T08:35:20Z
LightGBM,JeanLescutMuller/LightGBM,"A fast, distributed, high performance gradient boosting (GBT, GBDT, GBRT, GBM or MART) framework based on decision tree algorithms, used for ranking, classification and many other machine learning tasks.",2024-06-30T18:52:50Z,2026-04-27T11:00:18Z
ML-Framework_Checker,Xza85hrf/ML-Framework_Checker,"ML Framework and CUDA Checker is a Python-based GUI application for checking PyTorch, TensorFlow, and CUDA installations. It provides detailed system specs, compatibility checks, advanced GPU management, and offers options to view instructions, export logs, and update machine learning frameworks.",2024-05-20T22:17:44Z,2026-04-24T10:19:42Z
MassBalanceMachine,ODINN-SciML/MassBalanceMachine,"Global machine learning glacier mass balance framework, capable of assimilating all sources of glaciological and remote sensing data",2024-04-03T17:19:48Z,2026-04-28T09:50:23Z
secure-ml,ThalesGroup/secure-ml,"Explore ThalesGroup's comprehensive framework for secure machine learning systems on this repository. Developed by Thales experts, this framework encompasses essential security requirements, guidelines, tools, and privacy recommendations tailored specifically for machine learning applications.",2024-04-03T09:24:47Z,2026-04-14T02:36:58Z
equitrain,BAMeScience/equitrain,Equitrain: A Unified Framework for Training and Fine-tuning Machine Learning Interatomic Potentials,2024-03-21T08:36:52Z,2026-04-19T19:27:09Z
days-since-last-ml-framework,ninpnin/days-since-last-ml-framework,Keep track of the newest machine learning frameworks on GitHub,2024-02-27T17:18:31Z,2026-04-27T10:25:11Z
