name,full_name,description,created_at,pushed_at
ml-training-framework,patangal/ml-training-framework,"A comprehensive, extensible machine learning framework supporting neural networks with PyTorch/TensorFlow backends.",2026-04-16T14:50:09Z,2026-04-16T14:52:58Z
Physics-Informed-Explainable-Machine-Learning-for-Hardness-Prediction-in-High-Entropy-Alloys,ABHISHEKTA-VARMA/Physics-Informed-Explainable-Machine-Learning-for-Hardness-Prediction-in-High-Entropy-Alloys,"Physics-informed and explainable machine learning framework for predicting hardness in high-entropy alloys. Integrates descriptor-based modeling, SHAP interpretability, statistical validation, and finite element simulations to ensure physically consistent and reproducible results.",2026-04-16T12:51:37Z,2026-04-20T05:45:15Z
TBM-MULTI-MODEL-ENSEMBLE-FRAMEWORK,umaira-lab/TBM-MULTI-MODEL-ENSEMBLE-FRAMEWORK,"A comprehensive machine learning framework for Tunnel Boring Machine (TBM) performance prediction, uncertainty quantification, and predictive maintenance using multi-model ensemble learning with Dempster-Shafer evidence theory.",2026-04-16T12:33:00Z,2026-04-18T12:08:51Z
ML-based-alloy-density-and-phase-prediction-tool,SwatiMahato/ML-based-alloy-density-and-phase-prediction-tool,Generative Bayesian Machine Learning Framework for Inverse Alloy Designing of Lightweight High Entropy Alloy with Target Density and Experimental Validation,2026-04-16T09:58:33Z,2026-04-16T12:29:13Z
career-guidance-backend,Fathimaswabrii/career-guidance-backend,AI-powered career guidance system built with Django REST Framework and machine learning.,2026-04-16T09:34:57Z,2026-04-17T09:04:51Z
A-Two-Stage-Fully-Unsupervised-Learning-Framework-for-Liquid-State-Machines,ajsx2/A-Two-Stage-Fully-Unsupervised-Learning-Framework-for-Liquid-State-Machines,,2026-04-16T05:37:14Z,2026-04-16T06:45:30Z
Privilege-Escalation-Attack-Detection-and-Mitigation-in-Cloud-Using-Machine-Learning,jayanth-goud/Privilege-Escalation-Attack-Detection-and-Mitigation-in-Cloud-Using-Machine-Learning,"This project uses ensemble machine learning, specifically LightGBM and CatBoost, to detect privilege escalation attacks in cloud environments. By analyzing user behavior and logs, it identifies malicious insider threats and anomalous activities with high accuracy, providing a robust framework to prevent unauthorized data access.",2026-04-16T03:51:07Z,2026-04-16T03:55:05Z
tdp43-small-molecule-prediction,SofiaKapsiani/tdp43-small-molecule-prediction,Discovery of TDP-43 aggregation inhibitors via a hybrid machine learning framework,2026-04-16T01:27:53Z,2026-04-16T06:53:59Z
decentra,ShimJuhyun/decentra,Decentra(Decision Central) is a Decision-Oriented Machine Learning framework for transforming predictive models into actionable decision systems.,2026-04-16T01:07:40Z,2026-04-21T12:23:14Z
npm-malware-detection-research,sihina3436/npm-malware-detection-research,"A comprehensive research framework combining static code analysis, dynamic  behavioral monitoring, and machine learning to detect malicious npm packages.  Final year project from University of Ruhuna.",2026-04-15T20:19:38Z,2026-04-15T20:19:39Z
DEB_paradigm_comparison,sciom/DEB_paradigm_comparison,"Reproducible benchmark code for: ""Dynamic Energy Budget Theory, Bayesian Inference, and Machine Learning: A Comparative Review with a Decision Framework for Ecological Modelling"" (Hackenberger & Djerdj, Ecological Modelling, 2026) ",2026-04-15T19:20:56Z,2026-04-15T20:45:25Z
MULTI-DISEASE-PREDICTION-FRAMEWORK,sibisidhdharth/MULTI-DISEASE-PREDICTION-FRAMEWORK,"This project presents a Multi-Disease Prediction Framework Using Machine Learning, which integrates multiple machine learning and deep learning models into a unified, multimodal health risk assessment system.",2026-04-15T16:31:51Z,2026-04-15T16:34:58Z
masters-thesis-AI-reliability-assessment-framework,malstrom82/masters-thesis-AI-reliability-assessment-framework,"The development and evaluation of the RAF, a reliability and trustworthiness assessment framework for any AI project. Tested through a practical use case, involving machine learning-driven prediction of heartbeats in radar signals.",2026-04-15T15:03:13Z,2026-04-15T15:20:51Z
csfraud,magloireguillet/csfraud,A time-safe machine learning framework for fraud detection in China's A-share market (2025),2026-04-15T13:29:25Z,2026-04-15T13:29:36Z
A-Machine-Learning-Framework-for-Early-Detection-of-Student-Dropout-in-Online-Higher-Education-,siddhu09876/A-Machine-Learning-Framework-for-Early-Detection-of-Student-Dropout-in-Online-Higher-Education-,Machine Learning Framework for Early Detection of Student Dropout ,2026-04-15T09:38:47Z,2026-04-15T09:50:11Z
Generative-AI-Assignment-Perceptron-Convolution-CNN-RNN-Implementations,dev-mzainulabideen/Generative-AI-Assignment-Perceptron-Convolution-CNN-RNN-Implementations,"This repository contains Assignment #1 for the Generative AI course, focused on implementing fundamental machine learning and deep learning concepts from scratch and using modern frameworks.",2026-04-15T04:49:57Z,2026-04-15T04:52:17Z
FRIS-Predictive-Risk-Framework,glaubinhofranca-dotcom/FRIS-Predictive-Risk-Framework,"Financial Risk Intelligence System (FRIS): A modular machine learning framework developed for New England College to predict student loan default risk, optimize institutional retention, and ensure federal compliance.",2026-04-15T03:22:12Z,2026-04-23T21:52:14Z
METI-FS,zhenzhensiat/METI-FS,"A computational framework for discovering sparse, reproducible biomarkers from time-series transcriptomics data. METI-FS integrates differential expression, temporal trend analysis, co-expression networks, machine-learning stability selection, and protein-protein interaction evidence into a unified pipeline.",2026-04-15T01:39:17Z,2026-04-15T02:00:25Z
Orchestration_Engine,ChouaibMediana/Orchestration_Engine,"ML Pipeline Orchestrator  Framework Python modulaire pour automatiser le cycle de vie complet d'un projet Machine Learning : ingestion de donnes, preprocessing, entranement concurrent, et dploiement via FastAPI. Conu autour de classes abstraites (ABC), de dcorateurs de tracking d'tat et d'une architecture extensible pense pour le travail ",2026-04-14T21:36:28Z,2026-04-24T01:25:44Z
Flood-Resilient-Digital-Twin,noorahmednn2nn2-create/Flood-Resilient-Digital-Twin,"A Global Climate Digital Twin framework integrating Machine Learning (Random Forest) and Blockchain to optimize flood aid equity. Comparing advanced models from Germany and China to implement solutions in the GBM Basin, Libya, South Sudan, and Vietnam",2026-04-14T21:08:04Z,2026-04-14T21:50:25Z
An-End-to-End-Machine-Learning-Framework-for-Credit-Card-Fraud-Risk-Management-in-Banking-Systems,shavanashaik12/An-End-to-End-Machine-Learning-Framework-for-Credit-Card-Fraud-Risk-Management-in-Banking-Systems,Fraud Risk Management in Banking Systems by Shavana Shaik,2026-04-14T19:30:02Z,2026-04-26T21:24:12Z
A-Decentralized-IoT-and-Machine-Learning-Framework-for-Hyperlocal-Cloudburst-Prediction,mageshit24/A-Decentralized-IoT-and-Machine-Learning-Framework-for-Hyperlocal-Cloudburst-Prediction,"Final Year B.Tech Project: Designed and developed a decentralized IoT and Machine Learning-based system for real-time hyperlocal cloudburst prediction, featuring sensor-based data acquisition, predictive analytics using Random Forest, and automated early warning alerts.",2026-04-14T14:53:35Z,2026-04-14T15:17:36Z
rock-failure-classification,ErickChauke/rock-failure-classification,"Supervised machine learning framework for automated failure mode classification in rock mechanics using laboratory test data (Brazilian, Uniaxial, and Triaxial tests).",2026-04-14T14:09:25Z,2026-04-15T02:02:35Z
Intelligent-Hybrid-AI-Cybersecurity-Threat-Detection-Anomaly-Analysis,Akanksha0454/Intelligent-Hybrid-AI-Cybersecurity-Threat-Detection-Anomaly-Analysis,"An intelligent hybrid AI framework for real-time cybersecurity threat detection and anomaly analysis, integrating machine learning, anomaly detection, and human-in-the-loop validation to enhance accuracy, minimize false positives, and adapt to evolving cyber threats.",2026-04-14T13:53:11Z,2026-04-14T17:00:25Z
edilia,grezac/edilia,"Code related to the article ""Spatial Predictor Selection for Next-Day Minimum Temperature Forecasting: An Automated Machine Learning Framework Applied Across European Climate Regimes""",2026-04-14T12:28:34Z,2026-04-14T12:32:14Z
AI-Based-Log-Investigation-Framework-for-Cyber-Forensics,Aadiii24/AI-Based-Log-Investigation-Framework-for-Cyber-Forensics,"About AI-powered cyber forensics tool that automatically analyzes system logs, detects anomalies using Machine Learning, reconstructs attack timelines, and generates forensic reports.",2026-04-14T10:05:01Z,2026-04-14T10:06:16Z
ETAS-diagnostic-framework,Computational-Geophysics/ETAS-diagnostic-framework,A Machine Learning Diagnostic Framework for Nonstationary ETAS Aftershock Modeling,2026-04-14T08:12:26Z,2026-04-14T08:58:06Z
A-Machine-Learning-Approach-to-CLV-Estimation-and-CAC-Evaluation-along-with-Causal-Inference-,smitaldbritto/A-Machine-Learning-Approach-to-CLV-Estimation-and-CAC-Evaluation-along-with-Causal-Inference-,"This project enhances CLV prediction (BG-NBD, Gamma-Gamma, clustering, stacking) with causal inference. It applies ATE, CATE, DML, Causal Forests, along with naive & partial correlations, using a DAG framework and handling collider bias, to uncover true drivers of customer value for better decision-making.",2026-04-14T05:40:18Z,2026-04-14T10:04:30Z
Fraud-Detection-in-Carbon-Markets,yogithaaah/Fraud-Detection-in-Carbon-Markets,Comprehensive framework of Machine Learning and Blockchain to detect and prevent fraud in carbon credit market,2026-04-14T02:58:25Z,2026-04-14T18:08:28Z
AI-powered-cybersecurity-detection,Majhail22/AI-powered-cybersecurity-detection,"A comprehensive machine learning framework for network intrusion detection, including data preprocessing, feature engineering, model training, and performance evaluation on cybersecurity datasets.",2026-04-13T20:59:50Z,2026-04-13T21:00:41Z
transformer-,noormaahnaveed2/transformer-,"Transformers: the model-definition framework for state-of-the-art machine learning models in text, vision, audio, and multimodal models, for both inference and training",2026-04-13T17:00:46Z,2026-04-13T17:23:56Z
Google_colab_learning_files,Confy-Code/Google_colab_learning_files,"This repository hosts some of the important files that helped me to learn effectively all about some Machine learning frameworks, especially based on Python.",2026-04-13T16:48:34Z,2026-04-13T17:23:28Z
AI-Energy-Forecasting,dalimkumar452-sudo/AI-Energy-Forecasting,"A machine learning framework for time-series energy forecasting, utilizing deep learning and exogenous weather data to predict power grid demand and generation.""",2026-04-13T15:59:17Z,2026-04-13T16:03:57Z
Physical_Unclonable_Functions,DhruvGupta2701/Physical_Unclonable_Functions,Developing a simulation framework to model and analyze PUF vulnerabilities using machine learning techniques on large-scale CRP datasets.,2026-04-13T15:38:07Z,2026-04-13T15:57:50Z
honours_project,paulmorrison2004/honours_project,Forecasting Population Shifts Using Machine Learning Models of Thermal Tolerance: A Scalable Framework for Climate-Aware Decision-Making,2026-04-13T14:33:10Z,2026-04-19T08:58:16Z
bare-metal-ml,arora-abhinav/bare-metal-ml," A machine learning framework built from mathematical foundations, implementing classical ML algorithms from scratch in Python and C++ without the use of high-level ML libraries. All linear algebra operations, probability distributions, and optimization techniques are derived and implemented manually.",2026-04-13T14:31:56Z,2026-04-16T00:45:14Z
RECLAIM-Web-Application,SanchitMinocha/RECLAIM-Web-Application,Deployment of Machine Learning Framework to predict Reservoir Sedimentation using Django on Apache Server,2026-04-13T12:47:09Z,2026-04-14T20:21:50Z
go-ai-inference-service,Parin1946/go-ai-inference-service,"A high-performance AI inference service built with Go, designed for low-latency model serving and integration with various machine learning frameworks.",2026-04-13T11:27:22Z,2026-04-13T13:36:57Z
Hybrid-Deep-Learning-Framework-for-Smartphone-Addiction-Risk-Prediction,vikasinisukumar68/Hybrid-Deep-Learning-Framework-for-Smartphone-Addiction-Risk-Prediction,"Smartphone addiction is a major behavioral health issue today, contributing to anxiety, sleep disturbance, and loss of productivity. This work proposes an astute and privacy-preserving method to smartphone addiction risk prediction and control using cutting-edge machine learning and deep learning methods",2026-04-13T08:49:59Z,2026-04-13T08:59:40Z
explainable-ai-framework,Thim1991/explainable-ai-framework,Tools and methodologies for interpreting and explaining machine learning model predictions using LIME and SHAP.,2026-04-13T08:30:42Z,2026-04-13T10:07:13Z
cloud-integrated-machine-learning-framework-for-intrusion-detection-system,Venishaa07/cloud-integrated-machine-learning-framework-for-intrusion-detection-system,,2026-04-13T08:20:20Z,2026-04-13T08:27:14Z
AI_Projects,Bhagyashree444/AI_Projects,"A curated collection of AI and software engineering projects covering machine learning, deep learning, and generative AI applications built with Python and modern AI frameworks.",2026-04-12T23:05:00Z,2026-04-12T23:50:28Z
synthesizer_project,Jacky-ChunChi-Yang/synthesizer_project,"Reproduction of a chemistry-aware machine learning framework for nanocrystal growth control, based on Gaussian Process regression and Bayesian optimization.",2026-04-12T21:20:27Z,2026-04-12T22:15:01Z
senegal-yield-climate-extremes,sarraliounesarraliounebadara-oss/senegal-yield-climate-extremes,Machine learning framework (Random Forest and LASSO) to assess the impact of climate extremes on crop yield anomalies in Senegal using CMIP6 projections and SHAP analysis.,2026-04-12T17:04:50Z,2026-04-16T18:48:10Z
rust-ml-framework,Thatiand1989/rust-ml-framework,Foundational Machine Learning (ML) framework in Rust.,2026-04-12T13:18:57Z,2026-04-12T13:19:15Z
AutoFE-ShiftBench,mdshoaibuddinchanda/AutoFE-ShiftBench,"A reproducible, data-centric benchmarking framework evaluating the robustness of tabular machine learning models under systematic feature shift using OpenML-CC18 datasets and automated feature engineering.",2026-04-12T11:49:54Z,2026-04-13T20:30:42Z
Iris-ml-project,Swapnaneel07/Iris-ml-project,"Iris Machine Learning Project to learn the basics of Data Visualization, EDA, Machine Learning and different classifiers. SeaBorn and Matplotlib Frame word will be used for data visualization and Scikit Learn Framework will be used for the Machine Learning part. ",2026-04-12T11:29:45Z,2026-04-12T12:41:12Z
mlops-deployment-framework,Wealwasely1987/mlops-deployment-framework,Framework for deploying machine learning models to production using Docker and Kubernetes.,2026-04-12T10:33:43Z,2026-04-12T12:04:15Z
ML-MCTS,lucastrickett-dev/ML-MCTS,An optimised modular C++ Monte Carlo Tree Search framework for machine learning experiments based on AlphaZero and AlphaGo theory.,2026-04-12T10:27:47Z,2026-04-27T14:23:14Z
Automated-CTI-Triage-Framework,Aakash01-hash/Automated-CTI-Triage-Framework,Hybrid machine learning and live-API framework for automated SOC threat triage,2026-04-12T03:39:11Z,2026-04-12T04:04:25Z
Forge,SrihariSr/Forge,A differentiable Machine Learning framework built from scratch purely using Python.,2026-04-11T22:46:25Z,2026-04-12T19:00:57Z
end-to-end-data-science-playbook,iparimalrajb/end-to-end-data-science-playbook,"A comprehensive repository covering Data Science, Machine Learning, Deep Learning, Data Analytics, and Generative AI  from fundamentals to real-world production systems using modern tools and frameworks.",2026-04-11T17:59:47Z,2026-04-15T16:54:43Z
flash-crash-detection,Mattosterone/flash-crash-detection,Master's Thesis Project Binary classification of flash-crash-like events in 1-minute EUR/USD OHLCV data using a leakage-aware machine learning framework with Purged-Embargo Cross-Validation and adaptive Triple Barrier labeling.,2026-04-11T15:25:02Z,2026-04-21T16:13:14Z
AI-Engineer-Stack,Soumyajeet2002/AI-Engineer-Stack,"A production-ready AI engineering stack built with Python, combining modern backend development and machine learning workflows. This repository showcases how to design, build, and deploy intelligent systems using FastAPI, ML/DL frameworks, and scalable architecture.",2026-04-11T12:53:13Z,2026-04-15T18:31:48Z
automl-framework,alkhushayni/automl-framework,AutoML framework for comparative analysis of machine learning models,2026-04-11T08:37:56Z,2026-04-13T06:39:55Z
ML-Selective-Image-Encryption,sandy8084/ML-Selective-Image-Encryption,"IOP Published Research | A Machine Learning-driven selective image encryption framework combining SVM-based ROI detection with chaos (Henon, CLS) and DNA encoding for high security and reduced computational complexity.",2026-04-11T05:36:09Z,2026-04-14T12:31:44Z
A-Multi-Modal-Machine-Learning-Framework-for-Bankruptcy-Prediction-Using-Textual-and-Numerical-Data,salainimalan/A-Multi-Modal-Machine-Learning-Framework-for-Bankruptcy-Prediction-Using-Textual-and-Numerical-Data,,2026-04-11T05:30:36Z,2026-04-12T07:03:34Z
Donation-forecasting-research,tavishijain456-alt/Donation-forecasting-research,"This research aims to develop and compare multiple time-series machine learning models to predict future donation trends for community food assistance programs. The core contribution is an anomaly-aware, multivariate forecasting framework that not only predicts donation volume but specifically identifies upcoming donation drought periods ",2026-04-11T05:08:32Z,2026-04-19T16:33:53Z
warp_tension,Toufique-TextileAI/warp_tension,"This repository, provides a comprehensive framework for analyzing and predicting yarn behavior in textile weaving using machine learning. The project bridges the gap between traditional textile manufacturing and data-driven optimization by focusing on the relationship between yarn parameters and loom performance.",2026-04-10T13:51:50Z,2026-04-12T01:11:26Z
An-Interpretable-Machine-Learning-Framework-for-Predicting-the-Popularity-of-YouTube-News-Shorts,CMLai-LAB/An-Interpretable-Machine-Learning-Framework-for-Predicting-the-Popularity-of-YouTube-News-Shorts,,2026-04-10T06:25:51Z,2026-04-16T01:51:45Z
Triangle-AI,marcushyungseok/Triangle-AI,"Triangle AI is a distributed machine learning framework for detecting file-based malware (PDF, SWF, Doc, Html).",2026-04-10T04:08:36Z,2026-04-12T13:12:51Z
Autonomous-Trading-Signal-Engine-Quantitative-Trend-Prediction-Framework,arun17oct2006/Autonomous-Trading-Signal-Engine-Quantitative-Trend-Prediction-Framework,"This project integrates historical stock data, technical indicators, sentiment analysis, and machine learning (XGBoost, Random Forest) to predict trends and generate Buy/Sell/Hold signals.",2026-04-09T02:25:34Z,2026-04-17T02:46:15Z
Decoding-Attrition-A-Data-Driven-Revenue-Risk-Customer-Retention-Intelligence-Framework,shrirangbondre28/Decoding-Attrition-A-Data-Driven-Revenue-Risk-Customer-Retention-Intelligence-Framework,"This project delivers a complete, end-to-end churn intelligence system from raw CSV files to an interactive Power BI dashboard and a machine learning prediction model, using a SQL first, analytics engineering approach.",2026-04-08T20:14:03Z,2026-04-14T19:52:12Z
Hydra-Flow,Issac-Moses/Hydra-Flow,"Hydra-Flow is a machine learning workflow framework that integrates powerful configuration management with experiment tracking to simplify, automate, and scale ML development. It enables developers and researchers to define, execute, and analyze experiments efficiently,",2026-04-08T16:27:12Z,2026-04-23T19:05:32Z
Turingz,nithiladilsh/Turingz,"A hybrid machine learning and classical numerical framework for solving Partial Differential Equations (PDEs) , featuring real-time failure detection , robustness evaluation , and adaptive resource orchestration (deployment and computational cost)",2026-04-08T13:48:51Z,2026-04-27T16:49:44Z
c-machine-learning-framework,eltonlima01/c-machine-learning-framework,"A high-performance, zero-dependency Machine Learning framework implemented from scratch in pure C, utilizing OpenMP for parallel workload distribution and Modern CMake for scalable build management.",2026-04-08T01:31:02Z,2026-04-25T19:29:49Z
python-ml-framework,BesserwisserErsterKlasse/python-ml-framework,Machine Learning framework written in pure Python 3.14,2026-04-07T19:46:54Z,2026-04-26T19:00:44Z
GCE-Framework,shoaibkareem9-svg/GCE-Framework,GCE framework for interpretable modeling in cardiac sarcoma survival using machine and deep learning. It captures complex feature relationships to enhance predictive insights and clinical understanding.,2026-04-07T18:38:24Z,2026-04-13T17:11:08Z
leakage-aware-cvd-phenotyping,CaoTri253/leakage-aware-cvd-phenotyping,"A Leakage-Aware, Clinically Constrained Machine Learning Framework for Multi-Class Cardiovascular Phenotyping from EHR Data",2026-04-07T18:00:48Z,2026-04-16T06:38:14Z
Python_with_Mosh,CollinsIkiara/Python_with_Mosh,"Covered Python fundamental topics as well as 3 Python projects related to Automation Scripts, Machine Learning and Building an E-commerce website using the Django framework",2026-04-07T14:52:47Z,2026-04-27T15:36:31Z
Predictive-Maintenance-and-Simulation-Framework-for-Aircraft-Fleet-Operations,chibuikeemmanuelh/Predictive-Maintenance-and-Simulation-Framework-for-Aircraft-Fleet-Operations,This project develops a predictive maintenance framework for aircraft turbofan engines using NASA's C-MAPSS dataset. It combines machine learning (LightGBM) for Remaining Useful Life (RUL) prediction with discrete-event simulation (SimPy) to model the impact of maintenance queue delays on engine fleet health.,2026-04-07T08:56:13Z,2026-04-11T22:23:28Z
DpointTrader_deeplearning,DandelionYe/DpointTrader_deeplearning,"This repository is a machine learning and deep learning research framework for A-share basket stock selection, covering the full workflow from data loading and feature engineering to time-aware validation, model training, portfolio construction, backtesting, and reporting. A ",2026-04-07T01:06:27Z,2026-04-12T08:17:01Z
Diabetes-Risk-Stratification-Framework-,shahzainaslam11/Diabetes-Risk-Stratification-Framework-,"This repo contains the code structure of the IEEE paper ""A Machine Learning Framework for Patient Stratification & Complications Prediction""",2026-04-06T23:10:18Z,2026-04-22T16:32:29Z
research2repo,nellaivijay/research2repo,"Research2Repo is an advanced, agentic framework designed to bridge the gap between academic machine learning research and functional codebase implementations. Specifically optimized for the Google Gemini ecosystem, it translates complex AI papers directly into modular, decoupled GitHub repositories.",2026-04-06T22:36:17Z,2026-04-26T17:16:03Z
AI-Based-Log-Investigation-Framework-for-Cyber-Forensics,Diya-Goswami-13/AI-Based-Log-Investigation-Framework-for-Cyber-Forensics,"AI-powered cyber forensics tool that automatically analyzes system logs, detects anomalies using Machine Learning, reconstructs attack timelines, and generates forensic reports.",2026-04-06T09:13:28Z,2026-04-17T20:02:29Z
qml-fourier-dynamics,thomaslagoutte/qml-fourier-dynamics,"A high-performance quantum machine learning framework for PAC-learning quantum dynamics via Fourier feature extraction and Quantum Overlap Kernels (Barthe et al., 2025).",2026-04-06T07:50:59Z,2026-04-28T06:37:01Z
Positive-Unlabeled-Prediction-Framework-for-Molecular-Synthesizability,NING18888888/Positive-Unlabeled-Prediction-Framework-for-Molecular-Synthesizability,PU prediction framework composed of traditional machine learning models and deep learning models,2026-04-06T03:24:11Z,2026-04-13T15:57:00Z
MIE424-group13-project-shortcut-learning,jlim0918/MIE424-group13-project-shortcut-learning,Experimental framework for studying shortcut learning under spurious correlations in machine learning models.,2026-04-05T19:18:35Z,2026-04-15T02:31:27Z
Neuro-Symbolic-AI-for-Automated-Cyber-Threat-Intelligence-Generation,tilakkm20225-maker/Neuro-Symbolic-AI-for-Automated-Cyber-Threat-Intelligence-Generation,"Neuro-Symbolic AI framework for automated cyber threat intelligence generation using hybrid reasoning, machine learning, and knowledge graphs.",2026-04-05T17:26:05Z,2026-04-15T15:00:17Z
ketml,CodingTrue/ketml,KetML is a python machine learning framework with an OpenCL backend,2026-04-04T20:10:18Z,2026-04-18T13:32:01Z
ml_in_c,Ade20boss/ml_in_c,A growing collection of bare-metal machine learning experiments. Building everything from single-weight optimizers to full C-based AI frameworks without external libraries,2026-04-04T01:27:20Z,2026-04-12T23:23:43Z
capstone,2020jalenjackson-coder/capstone,Machine learning framework for sarcoidosis classification using gene expression data,2026-04-03T23:55:10Z,2026-04-27T05:03:53Z
PondRecharge,YaggeshSharma/PondRecharge,"Computational framework for pond-based groundwater recharge estimation using multi-source geospatial data and machine learning models (GB, XGBoost, Random Forest) in the Ramganga Basin, India. Includes data processing workflows, model implementation, and recharge prediction outputs.",2026-04-03T12:46:53Z,2026-04-15T04:38:25Z
ML-From-Scratch,sschettinii/ML-From-Scratch,End-to-end Machine Learning algorithms implemented from scratch using only Python and NumPy. Focused on understanding the underlying mathematics and linear algebra without high-level frameworks.,2026-04-02T20:28:38Z,2026-04-13T22:51:49Z
