name,full_name,description,created_at,pushed_at
ciferai,CiferAI/ciferai,"Cifer provides a decentralized AI development ecosystem with data-ownership proof on the Cifer blockchain, using a Privacy-Preserving Machine Learning (PPML) framework offers several methods for secure, private, collaborative machine learning Federated Learning and Fully Homomorphic Encryption",2024-09-30T13:03:26Z,2025-06-05T08:38:18Z
QuantitativeMomentumInvestmentFramework,dkumar0501/QuantitativeMomentumInvestmentFramework, It is a  Python based machine learning model that identifies the top 50 stocks based on price momentum and generates clear financial reports for informed investment decisions.,2024-09-27T19:05:30Z,2025-05-27T03:29:41Z
IntermediateDragon,Teijen/IntermediateDragon,The main reposititory that holds the submodules for the analysis on the impact of different intermediate language representations of the Dragon Type Identification Machine Learning Framework,2024-09-25T04:30:11Z,2025-06-01T18:35:23Z
LegalizeMe,CheropS/LegalizeMe,machine learning model that check legal framework ,2024-09-24T09:37:50Z,2025-05-25T13:53:29Z
IPL_Score_And_Win_Probability_Predictor,kaminiyuvaraju/IPL_Score_And_Win_Probability_Predictor,An IPL score prediction web app built using machine learning and Flask. The model predicts match scores based on historical IPL data. The Flask framework provides the backend for serving the model and handling user input via an intuitive web interface,2024-09-18T18:49:26Z,2025-05-13T04:35:05Z
AutoMol-v2,ai-wes/AutoMol-v2,"The AutoMol Framework is a multi-phase computational pipeline designed for the automated generation, analysis, and testing of novel molecular structures. This system integrates machine learning techniques, molecular dynamics simulations, and bioinformatics tools to create and optimize molecules tailored to specific biological functions.",2024-09-15T17:44:22Z,2025-05-15T15:04:46Z
gbdtsvm,mariamuna04/gbdtsvm,A machine learning-based efficient framework for snoRNA-disease association prediction.,2024-09-12T16:22:36Z,2025-05-10T05:11:50Z
ml-framework-bot,SauravMaheshkar/ml-framework-bot,An agentic workflow to translate machine learning codebases across ML frameworks reliably at scale.,2024-09-12T09:11:32Z,2025-05-29T16:19:27Z
web-frameworks,VED-PRAKA5H/web-frameworks,multiple frameworks for machine learning projects.,2024-08-16T08:17:07Z,2025-04-25T16:55:01Z
AIX,godrays/AIX,A single header Torch like C++ machine learning framework with multiple device acceleration support.,2024-08-08T19:32:47Z,2025-05-25T19:52:23Z
masfi,joekelly211/masfi,"Mapping Alternate Scenarios of Forest Intactness (MASFI) is a cloud-based machine learning framework. It uses XGBoost regression and remote sensing data such as GEDI LiDAR to create high-resolution maps and statistics, supporting protected area planning and management.",2024-08-06T06:34:23Z,2025-06-07T13:51:56Z
CatBench,JinukMoon/CatBench,CatBench - Benchmark Framework of Machine Learning Interatomic Potentials in Adsorption Energy Predictions,2024-08-05T04:30:28Z,2025-05-20T13:36:27Z
all.this,neurons-me/all.this,"All.This is a modular framework for managing and standardizing data structures, enabling seamless interaction across the neurons.me ecosystem. It transforms objects like images, text, and audio into structured formats optimized for machine learning and deep learning applications.",2024-08-02T04:19:20Z,2025-06-02T19:36:26Z
hyrax,lincc-frameworks/hyrax,Hyrax - A framework for machine learning in astronomy,2024-08-01T22:51:04Z,2025-06-06T23:30:12Z
C964_Capstone,drusso97/C964_Capstone,This application uses Python libraries and web frameworks to build an interactive dashboard showing the effectiveness of using machine learning to detect Twitter bots. ,2024-07-30T21:49:48Z,2025-06-02T19:58:41Z
brain4j,brain4j-org/brain4j,Open-source machine learning framework for Java. Designed with speed and lightweight in mind.,2024-07-28T11:54:08Z,2025-06-08T22:06:53Z
3DAnimals,3DAnimals/3DAnimals,3DAnimals: A machine learning framework for reconstructing articulated 3D animals from images,2024-07-25T20:17:35Z,2025-04-21T15:10:53Z
azhermurad,azhermurad/azhermurad,"I'm a passionate Data Scientist and AI/ML Engineer with hands-on experience building intelligent systems using machine learning, deep learning, and natural language processing. I specialize in developing scalable models using frameworks like PyTorch, TensorFlow, and Python  from research to real-world deployment.",2024-07-25T05:47:19Z,2025-05-09T02:15:57Z
Machine-Learning-of-Lipid-Nanoparticles,grvkr0807/Machine-Learning-of-Lipid-Nanoparticles,Machine Learning Framework to predict activity and cell viability of LNPs for gene delivery,2024-07-12T04:15:48Z,2025-05-01T14:17:39Z
ML_Projects,Jignesh749/ML_Projects,This repository contains various Machine Learning Projects built using different frameworks and libraries.,2024-07-11T03:08:34Z,2025-05-08T12:24:31Z
fastapi-vss,mbari-org/fastapi-vss,RESTful API for vector similarity search. It uses the Python web framework FastAPI.  This accelerates machine learning workflows that require vector similarity search using classification models.,2024-07-10T22:48:24Z,2025-06-03T17:06:26Z
ZeoPropNet,mfaria-p/ZeoPropNet,A TensorFlow-based machine learning framework for predicting zeolite propertiesparticularly framework densityusing neural networks and composite building unit fingerprints,2024-07-03T23:26:16Z,2025-04-20T19:23:33Z
IPL-Win-predictor-Using-Python,kanishk2909/IPL-Win-predictor-Using-Python,"Developed an IPL (Indian Premier League) win predictor system using Python and Streamlit framework, leveraging data analysis and machine learning techniques.",2024-07-03T13:47:16Z,2025-05-03T13:48:22Z
Altfit,KABEER-AHMED/Altfit,"Altfit is an advanced movement analysis framework powered by machine learning. It utilizes TensorFlow Lite models to process motion-related data, enabling applications in fitness tracking, rehabilitation, sports performance optimization, and biomechanical assessments.",2024-07-02T17:49:43Z,2025-05-19T13:52:28Z
tennis_model,douglasbc/tennis_model,"End-to-end tennis prediction model. Data ingested with Python and transformed with dbt on BigQuery. Model implemented with Google JAX, a Python machine learning framework.",2024-06-26T02:27:35Z,2025-06-07T23:09:12Z
Fair-IRT,IRON13/Fair-IRT,A framework that uses Item Response Theory to evaluate fairness in machine learning models.,2024-06-13T02:28:23Z,2025-04-23T23:22:46Z
Multi_Omics_Integration,JaCar-868/Multi_Omics_Integration,"This project creates a machine learning framework to integrate and analyze multi-omics data (genomics, transcriptomics, and proteomics). Using unsupervised learning techniques like clustering and dimensionality reduction, the framework uncovers patterns and correlations across omics layers, offering insights into biological and disease processes.",2024-06-09T21:24:18Z,2025-05-12T20:48:12Z
Loan-Approval-Prediction,Tynoee/Loan-Approval-Prediction,"This project is a web application for predicting loan approval status based on various financial and personal attributes. It uses a machine learning model that I trained on historical loan data to make predictions. I built the web application using Flask for the web framework, SQLite for the database, and the pre-trained model saved with joblib.",2024-06-06T05:37:58Z,2025-05-09T02:48:21Z
QuAIRKit,QuAIR/QuAIRKit,"QuAIRKit is a Python research framework for quantum computing, quantum information, and quantum machine learning algorithm development. It focuses on flexible design, real-time simulation and rapid verification of quantum and classical algorithms.",2024-05-28T08:48:52Z,2025-05-29T06:00:33Z
machine-learning-repos,recodehive/machine-learning-repos,"A curated list of awesome machine learning frameworks, libraries and software (by language). I",2024-05-26T16:04:28Z,2025-05-03T15:46:58Z
BenchNIRS,HanBnrd/BenchNIRS,Benchmarking framework for machine learning with fNIRS,2024-05-18T09:03:38Z,2025-06-05T20:32:45Z
jams-rs,gagansingh894/jams-rs,Rust based model serving solution for popular machine learning frameworks,2024-05-17T00:23:31Z,2025-05-30T02:03:08Z
GreatLakes-TempSensors,great-lakes-ai-lab/GreatLakes-TempSensors,Collaborative repository for optimizing the placement of temperature sensors in the Great Lakes using the DeepSensor machine learning framework. Aiming to enhance the quantitative understanding of surface temperature variability for better environmental monitoring and decision-making.,2024-05-06T00:46:32Z,2025-06-07T17:34:04Z
miglan,formiga-tecnologia/miglan,Framework for Data Science and Machine Learning ,2024-04-24T12:23:19Z,2025-05-13T20:01:14Z
MachineLearning,BarionLP/MachineLearning,A performant and dynamic MachineLearning framework written in .NET,2024-04-14T20:02:57Z,2025-05-10T14:26:22Z
EnDM-CPP,tudou1231/EnDM-CPP,A Multi-View Framework Based on Deep Learning and Machine Learning for Identifying Cell-Penetrating Peptides with Transformers and Analyzing Sequence Characterizations,2024-04-13T03:55:53Z,2025-05-27T18:37:52Z
FSM-PK,waleedgeo/FSM-PK,"The repository contains data for the paper titled""High-resolution flood susceptibility mapping and exposure assessment in Pakistan: An integrated artificial intelligence, machine learning and geospatial framework""",2024-04-02T08:10:45Z,2025-06-03T05:34:32Z
FedEasy,nclabteam/FedEasy,"FedEasy is an intuitive powerful yet simple to use Federated Learning framework. Our goal is to streamline the process of setting up and running federated learning experiments with ease, making advanced machine learning techniques accessible to researchers and developers alike.",2024-03-29T08:45:49Z,2025-05-20T03:37:49Z
HLSFactory,sharc-lab/HLSFactory,HLSFactory: A Framework Empowering High-Level Synthesis Datasets for Machine Learning and Beyond,2024-03-28T19:06:57Z,2025-06-06T02:31:33Z
equitrain,BAMeScience/equitrain,Equitrain: A Unified Framework for Training and Fine-tuning Machine Learning Interatomic Potentials,2024-03-21T08:36:52Z,2025-06-03T17:23:51Z
mlx-notes,uogbuji/mlx-notes,Shared personal notes created while working with the Apple MLX machine learning framework,2024-03-20T05:49:30Z,2025-05-22T17:39:03Z
Classic-ML-Models,jibbs1703/Classic-ML-Models,"This repository contains scripts for developing, training and evaluating machine learning models using several python frameworks.",2024-03-15T22:30:53Z,2025-06-04T00:07:54Z
Ibrahim-Afsar,Ibrahim-Afsar/Ibrahim-Afsar,"IGCSE student at Roots International Schools & Colleges, tech enthusiast, and beginner in machine learning. Skilled in many relevant Python frameworks. Passionate about contributing to impactful projects.",2024-03-08T22:28:39Z,2025-06-03T22:49:53Z
MoleculeBind,lamalab-org/MoleculeBind,"MoleculeBind is a machine-learning framework for chemistry, where we target unifying various molecular representations into one common latent space (SELFIES, SMILES, Graph, Structures, Fingerprints, Molecular Spectra)",2024-03-08T10:55:30Z,2025-06-08T12:50:38Z
days-since-last-ml-framework,ninpnin/days-since-last-ml-framework,Keep track of the newest machine learning frameworks on GitHub,2024-02-27T17:18:31Z,2025-06-08T09:40:39Z
django_project,izzad2413/django_project,This is a simple example of deploying machine learning model using django framework,2024-02-07T01:45:59Z,2025-05-07T06:04:39Z
PerfVec,PerfVec/PerfVec,A generalizable machine learning-based performance modeling framework.,2024-02-02T14:13:32Z,2025-06-07T01:12:21Z
sundial,eMapR/sundial,Workflow / framework for machine learning with data sourced from Google Earth Engine on a bare metal machine.,2024-02-01T19:10:47Z,2025-05-12T23:06:32Z
pfund,PFund-Software-Ltd/pfund,"An All-in-One Algo-Trading Framework: Backtest -> Train -> Trade -> Monitor. Machine / Deep Learning Ready. Supports All Trading: TradFi+CeFi+DeFi. Code Once, Trade Anywhere.",2024-01-30T15:00:51Z,2025-05-16T07:35:28Z
Minerva,discovery-unicamp/Minerva,Minerva is a framework for training machine learning models for researchers.,2024-01-11T18:13:09Z,2025-05-23T04:01:39Z
nnbench,aai-institute/nnbench,A small framework for benchmarking machine learning models.,2024-01-11T10:54:12Z,2025-06-06T09:34:06Z
Deep-Dive-Into-AI-With-MLX-PyTorch,neobundy/Deep-Dive-Into-AI-With-MLX-PyTorch,"""Deep Dive into AI with MLX and PyTorch"" is an educational initiative designed to help anyone interested in AI, specifically in machine learning and deep learning, using Apple's MLX and Meta's PyTorch frameworks.",2024-01-01T16:02:00Z,2025-05-06T01:10:53Z
MMLB,negativa-ai/MMLB,A Framework for Measuring and Analyzing Machine Learning Deployment Bloat.,2023-12-18T15:49:29Z,2025-05-12T14:24:05Z
C-ML,jaywyawhare/C-ML,Machine learning framework written in C.,2023-12-04T11:17:09Z,2025-05-29T19:15:36Z
flux-lima,converged-computing/flux-lima,Flux Framework running in a LIMA (Linux Virtual Machine) with eBPF stuffs installed for learning!,2023-11-19T06:16:21Z,2025-05-13T05:53:41Z
MoIma,fate1997/MoIma,Molecule Imagination: A framework aims to accelare machine learning in Chemistry,2023-11-01T18:07:26Z,2025-06-03T21:18:25Z
aliad,AlkaidCheng/aliad,Framework for anomaly detection with machine learning,2023-10-08T05:38:29Z,2025-06-01T03:53:51Z
Optimizing-File-Similarity-Search-Techniques-in-Data-Lakes-using-Big-Data-Frameworks-,saracherif123/Optimizing-File-Similarity-Search-Techniques-in-Data-Lakes-using-Big-Data-Frameworks-,This project explores scalable techniques for detecting similar or duplicate datasets in large-scale data lakes using Big Data frameworks like Apache Spark. It reimplements the DS-Prox early pruning algorithm and evaluates two machine learning modelsRandom Forest and Multilayer Perceptron (MLP).,2023-09-27T12:06:39Z,2025-05-04T08:43:28Z
ARTIST,ARTIST-Association/ARTIST,A differentiable ray tracer using the PyTorch machine-learning framework in Python.,2023-09-26T12:40:33Z,2025-06-04T07:54:24Z
BioM2,cran/BioM2,:exclamation:Thisisaread-onlymirroroftheCRANRpackagerepository.  BioM2BiologicallyExplainableMachineLearningFramework  ,2023-09-21T19:30:37Z,2025-05-14T13:01:30Z
reactive_active_learning,siddarthachar/reactive_active_learning,This is an active learning framework that uses single-ended growing string method and neural networks to build machine learning forcefields that quickly understands reactive energy landscape.,2023-09-12T17:01:36Z,2025-06-06T21:37:47Z
symphonyGPT,2ndthoughts/symphonyGPT,"A platform developed from an open framework to help AI researchers and developers to rapidly prototype, test and deploy workflows that include machine learning models as worker components. The workflow can be invoked on command line or web service, as well as integrated into UX/UI as part of a larger intelligent solution.",2023-09-03T03:04:56Z,2025-05-18T04:29:02Z
frogbox,SimonLarsen/frogbox,An opinionated machine learning framework.,2023-09-01T15:23:29Z,2025-05-13T13:47:03Z
hyfi-ml,entelecheia/hyfi-ml,A Python package that extends the Hydra Fast Interface (HyFI) framework with machine learning capabilities.,2023-08-31T22:28:45Z,2025-06-01T18:11:05Z
secretpad,secretflow/secretpad,"SecretPad is a privacy-preserving  computing web platform based on the Kuscia framework, designed to provide easy access to privacy-preserving data intelligence and machine learning functions. ",2023-08-25T07:22:55Z,2025-06-06T02:50:45Z
dacapo,janelia-cellmap/dacapo,"A framework for easy application of established machine learning techniques on large, multi-dimensional images.",2023-08-24T20:18:00Z,2025-05-12T14:28:39Z
optimal-rs,justinlovinger/optimal-rs,Mathematical optimization and machine learning framework and algorithms.,2023-08-23T20:06:38Z,2025-05-02T17:56:08Z
lotus,rajveerb/lotus,Lotus: Characterization of Machine Learning Preprocessing Pipelines via Framework and Hardware Profiling,2023-08-23T15:41:47Z,2025-05-02T17:07:21Z
MASPY,laca-is/MASPY,A Python Framework for Multi-Agent Programming with Machine Learning,2023-08-22T19:11:38Z,2025-06-07T03:27:35Z
X-ANFIS,thieu1995/X-ANFIS,X-ANFIS: An Extensible and Cross-Learning ANFIS Framework for Machine Learning Tasks,2023-08-08T15:27:47Z,2025-06-07T11:08:24Z
IntelELM,thieu1995/IntelELM,IntelELM: A Python Framework for Intelligent Metaheuristic-based Extreme Learning Machine,2023-08-08T13:18:41Z,2025-06-04T09:24:37Z
Machine-Learning-Projects,ParamThakkar123/Machine-Learning-Projects,"This repository contains all the machine learning and deep learning model I have implemented using various frameworks like keras, tensorflow, scikit-learn, pytorch, etc.",2023-07-24T04:30:08Z,2025-06-04T06:50:25Z
anacostia-pipeline,anacostiaAI/anacostia-pipeline,Anacostia is a framework for creating machine learning operations (MLOps) pipelines,2023-07-14T19:44:55Z,2025-06-08T00:37:46Z
caretSDM,luizesser/caretSDM,"caretSDM applies a geoprocessing framework to the caret machine learning package, facilitating the access of Species Distribution Modeling community to state-of-the-art methods.",2023-07-13T20:52:50Z,2025-05-28T15:07:00Z
ryzen-ai-documentation,amd/ryzen-ai-documentation,Onboarding documentation source for the AMD Ryzen AI Software Platform.   The AMD Ryzen AI Software Platform enables developers to take pretrained machine learning models in popular frameworks and run them on laptops powered by AMD Ryzen AI technology.,2023-07-07T08:19:22Z,2025-06-03T15:08:33Z
MOFGalaxyNet,MehrdadJalali-AI/MOFGalaxyNet,MOFGalaxyNet aims to create a social network for Metal-Organic Frameworks (MOFs) and predict their properties using Graph Convolutional Networks (GCN). It fosters collaboration and exploration in the field of MOFs through social network analysis and machine learning.,2023-07-03T17:08:54Z,2025-05-23T03:56:01Z
molpot,MolCrafts/molpot,[WIP] Machine Learning Molecular ForceField Training and Deploying Framework,2023-07-01T12:30:01Z,2025-06-07T06:44:37Z
Fruitify,aryainjas/Fruitify,"Fruitify is a charming fruit recognition project that harnesses the power of TensorFlow, an advanced machine learning framework.",2023-06-23T18:53:24Z,2025-05-20T18:47:44Z
Football-1-vs-1-Shot-Taking-Situations-Analysis,calvinyeungck/Football-1-vs-1-Shot-Taking-Situations-Analysis,"Repo for the paper ""A Strategic Framework for Optimal Decisions in Football 1-vs-1 Shot-Taking Situations: An Integrated Approach of Machine Learning, Theory-Based Modeling, and Game Theory""",2023-06-19T02:31:36Z,2025-05-01T17:39:22Z
SC-MLIDS,Hongwei-Z/SC-MLIDS,SC-MLIDS: Fusion-based Machine Learning framework for intrusion detection in wireless sensor networks,2023-05-29T11:24:58Z,2025-05-04T05:07:19Z
mobiml,movingpandas/mobiml,Framework for machine learning from movement data,2023-05-27T10:41:13Z,2025-05-21T13:17:59Z
reductionml,jackgerrits/reductionml,Reduction-based machine learning framework with a focus on contextual bandits,2023-05-25T16:00:01Z,2025-05-23T00:31:45Z
CalFram,lorenzofamiglini/CalFram,Calibration Framework for Machine Learning and Deep Learning,2023-05-10T16:28:27Z,2025-05-30T16:23:40Z
sagemaker-distribution,aws/sagemaker-distribution,"A set of Docker images that include popular frameworks for machine learning, data science and visualization.",2023-05-03T21:04:42Z,2025-06-09T08:03:42Z
gomlx,gomlx/gomlx,GoMLX: An Accelerated Machine Learning Framework For Go,2023-04-23T19:30:48Z,2025-06-08T06:12:05Z
grundner23james_EquationDiscovery_CloudCover,EyringMLClimateGroup/grundner23james_EquationDiscovery_CloudCover,"A hierarchical modeling framework to discover new machine learning-based equations for cloud cover, including symbolic regression",2023-03-20T13:04:23Z,2025-05-28T11:56:18Z
Research,RamanEbrahimi/Research,Implementing the mathematical modeling and machine learning algorithms in analysis of complex multi-layer networks. The research involves developing new mathematical optimization frameworks and simulation environments.,2023-02-22T16:37:00Z,2025-05-23T16:12:00Z
CynkyAutomation,DeLaphante/CynkyAutomation,"Powered by Selenium, Reqnroll and ML.Net with detailed HTML reporting, Machine Learning Analysis and Logging capabilities - CynkyAutomation framework can handle any website that is built using AJAX, React, AngularJS, Vue.js, Single Page Applications, Salesforce, Dynamics 365 CRM and many more.",2023-02-02T16:46:43Z,2025-06-06T11:21:43Z
AI-Frameworks,ZygoteCode/AI-Frameworks,"A complete, curated list of all Open Source frameworks for developing Artificial Intelligences and Machine Learning Algorithms for Python, C++ and C#.",2023-01-30T16:38:16Z,2025-04-20T19:00:39Z
pybroker,edtechre/pybroker,Algorithmic Trading in Python with Machine Learning,2023-01-16T01:11:52Z,2025-04-28T04:34:57Z
graphstorm,awslabs/graphstorm,Enterprise graph machine learning framework for billion-scale graphs for ML scientists and data scientists.,2022-12-02T11:20:38Z,2025-06-04T21:02:11Z
ROHE,rdsea/ROHE,An orchestration framework for End-to-End Machine Learning Serving with Resource Optimization on Heterogeneous Edge,2022-11-24T11:28:44Z,2025-05-20T13:19:19Z
apax,apax-hub/apax,A flexible and performant framework for training machine learning potentials.,2022-11-18T12:31:19Z,2025-06-05T10:54:38Z
Used-Vehicle-Price-Prediction-System,Jepleting/Used-Vehicle-Price-Prediction-System,End-to end machine learning project with website built using flask framework,2022-08-25T13:11:28Z,2025-06-05T12:26:51Z
matbench-discovery,janosh/matbench-discovery,An evaluation framework for machine learning models simulating high-throughput materials discovery.,2022-06-20T18:32:44Z,2025-06-05T15:01:00Z
paxml,google/paxml,"Pax is a Jax-based machine learning framework for training large scale models. Pax allows for advanced and fully configurable experimentation and parallelization, and has demonstrated industry leading model flop utilization rates.",2022-06-14T16:04:48Z,2025-05-23T03:31:34Z
mlgrid-services,openlangrid/mlgrid-services,A framework to serve various generative AIs and other machine learning functions via WebSocket and JSONRPC.,2022-05-10T08:30:07Z,2025-04-25T01:01:44Z
DeepGNN,microsoft/DeepGNN,DeepGNN is a framework for training machine learning models on large scale graph data.,2022-04-21T17:24:28Z,2025-05-23T22:44:28Z
pennylane-qrack,unitaryfoundation/pennylane-qrack,The PennyLane-Qrack plugin integrates the Qrack quantum computing framework with PennyLane's quantum machine learning capabilities.,2022-04-18T11:59:23Z,2025-06-06T23:39:12Z
secretflow,secretflow/secretflow,A unified framework for privacy-preserving data analysis and machine learning,2022-04-15T09:07:44Z,2025-05-21T08:22:47Z
numpy-nn-model,AkiRusProd/numpy-nn-model,"ustom torch style machine learning framework with automatic differentiation implemented on numpy, allows build GANs, VAEs, etc.",2022-02-21T22:07:07Z,2025-04-25T16:20:30Z
cihna-dictatorshrip-8,R7w726fYrfritM7zPJCO/cihna-dictatorshrip-8,"Anti Chinese government propaganda. https://github.com/cirosantilli/china-dictatorship backup.  996.ICU709Friends who live in China and have real name on account, please don't star this repo, or else the police might pay you a visit.  Home to the mega-FAQ, news compilation, restaurant and music recommendations.Heil Xi . ",2022-02-07T13:01:46Z,2025-05-19T11:35:14Z
fucking-awesome-machine-learning,Correia-jpv/fucking-awesome-machine-learning,"A curated list of awesome Machine Learning frameworks, libraries and software. With repository stars and forks",2022-02-06T12:07:40Z,2025-06-08T03:42:01Z
Model_Data_Fusion,ninjach/Model_Data_Fusion,An automated machine learning-assisted ensemble framework (AutoML-Ens) for assembling multiple models in geosciences.,2021-12-13T07:56:27Z,2025-05-27T03:09:49Z
dgbpy,OpendTect/dgbpy,dgbpy is a framework for research and deployment of machine learning models from seismic and well data.,2021-11-06T19:55:20Z,2025-05-30T10:19:10Z
AgML,Project-AgML/AgML,"AgML is a centralized framework for agricultural machine learning. AgML provides access to public agricultural datasets for common agricultural deep learning tasks, with standard benchmarks and pretrained models, as well the ability to generate synthetic data and annotations.",2021-10-29T13:44:40Z,2025-04-22T00:44:51Z
Chemsy,tsyet12/Chemsy,A Minimalistic Automatic Framework for Chemometrics and Machine Learning,2021-10-20T16:42:42Z,2025-05-13T14:29:44Z
mlcolvar,luigibonati/mlcolvar,A unified framework for machine learning collective variables for enhanced sampling simulations,2021-09-21T21:32:04Z,2025-06-09T08:46:25Z
galaxies_datasets,lbignone/galaxies_datasets,Galaxies Datasets is a collection of ready-to-use extragalactic astronomy datasets for use with TensorFlow and other Machine Learning frameworks.,2021-09-21T02:19:07Z,2025-06-01T14:49:20Z
china-dictatroship-7,cirosantilli/china-dictatroship-7,"Anti Chinese government propaganda. https://github.com/cirosantilli/china-dictatorship backup.  996.ICU709Friends who live in China and have real name on account, please don't star this repo, or else the police might pay you a visit.  Home to the mega-FAQ, news compilation, restaurant and music recommendations.Heil Xi . ",2021-08-18T08:11:03Z,2025-05-19T11:35:14Z
MLPro,fhswf/MLPro,MLPro - The Integrative Middleware Framework for Standardized Machine Learning in Python,2021-08-10T16:57:36Z,2025-06-08T18:00:21Z
CreditCard-Fraud-Detection,solankinupur/CreditCard-Fraud-Detection,In this project I build an end to end framework to predict fraudulent transactions by applying various machine learning models with a special focus on sampling techniques and standardization.,2021-07-14T02:58:27Z,2025-05-12T20:18:46Z
GelGenie,mattaq31/GelGenie,Open-Source package for segmentation and analysis of gel electrophoresis images using machine learning.  Both a python framework for training/running models and a QuPath GUI extension are available.,2021-05-25T22:10:37Z,2025-05-20T14:28:04Z
mala,mala-project/mala,Materials Learning Algorithms. A framework for machine learning materials properties from first-principles data.,2021-03-31T11:40:38Z,2025-06-05T09:41:07Z
