name,full_name,description,created_at,pushed_at
fraud-detection-banking,Usman-87/fraud-detection-banking,IoT-Driven Machine Learning Framework for Fraud Detection and Customer Risk Prediction in Retail Banking,2026-04-22T10:20:39Z,2026-04-22T15:47:41Z
fraud-detection-iot-banking,Usman-87/fraud-detection-iot-banking,IoT-Driven Machine Learning Framework for Fraud Detection and Customer Risk Prediction in Retail Banking,2026-04-22T10:16:57Z,2026-04-22T10:16:57Z
GEO-Ontology-Framework,Kamilgr1/GEO-Ontology-Framework,A machine learning approach to Generative Engine Optimization. Moving beyond classical SEO to structural dataset embeddings.,2026-04-22T08:22:24Z,2026-04-22T11:16:40Z
An-Integrated-Data-Engineering-and-Data-Science-Framework-for-Machine-Learning,vikasvarun/An-Integrated-Data-Engineering-and-Data-Science-Framework-for-Machine-Learning,,2026-04-22T08:10:56Z,2026-04-24T04:28:38Z
tsunami-prediction-ml,Chiragdhakad/tsunami-prediction-ml,Machine learning framework for tsunami prediction using earthquake parameters with imbalanced learning (SMOTE),2026-04-22T05:09:45Z,2026-04-27T10:07:25Z
DBPs_ML,StarVeI/DBPs_ML,Machine learning framework for DBP formation prediction and toxicity modeling.,2026-04-22T01:16:20Z,2026-04-22T01:16:21Z
funcml,cran/funcml,:exclamation:Thisisaread-onlymirroroftheCRANRpackagerepository.  funcmlFunctionalMachineLearningFramework.Homepage:https://github.com/ielbadisy/funcml  Reportbugsforthispackage:https://github.com/ielbadisy/funcml/issues,2026-04-21T23:55:29Z,2026-04-21T23:55:32Z
AI-pentesting-methodology,Mr-Infect/AI-pentesting-methodology,"The ultimate open-source framework for AI Security, LLM Pentesting, and Adversarial Machine Learning. Curated by Mr-Infect, this repository is the definitive guide to mastering the OWASP LLM Top 10 and securing agentic AI architectures",2026-04-21T18:45:30Z,2026-04-24T06:04:04Z
ML-Project,HSKdeveloper/ML-Project,"A comprehensive Machine Learning project developed at SDAIA AI bootcamp, focusing on the full ML lifecycle: from problem framing and dataset exploration to feature engineering and model evaluation. This repository showcases applied skills in predictive modeling and the ART (Accountability, Reliability, Transparency) framework.",2026-04-21T17:55:29Z,2026-04-25T14:28:46Z
MachineLearningFrameworks_FinalProject,muthuacumen/MachineLearningFrameworks_FinalProject,Foundation of Machine Learning Frameworks - Final Project,2026-04-21T14:41:40Z,2026-04-21T14:41:41Z
hidden-regime-models,Bigjay101/hidden-regime-models,"A probabilistic machine learning framework for modeling latent regimes in sequential data. Uses Hidden Markov Models to infer hidden states driving financial market behavior and sports performance dynamics, enabling regime detection, transition analysis, and interpretable time-series insights across domains.",2026-04-21T14:20:54Z,2026-04-21T14:20:55Z
DigitalDNA,dtalesara/DigitalDNA,"DigitalDNA is a bio-inspired machine learning framework that encodes features as DNA sequences (A, C, T, G) and applies epigenetic modulation for context-aware predictions.",2026-04-21T13:03:30Z,2026-04-21T13:21:48Z
deloitte_presents_machine_learning_challenge_predict_loan_defaulters-,Ankit-ally/deloitte_presents_machine_learning_challenge_predict_loan_defaulters-,Credit Risk Modeling at Scale: ML System for Loan Default Prediction Smart Lending AI: End-to-End Loan Default Prediction using Machine Learning RiskLens: Machine Learning Framework for Predicting Loan Defaults Loan Default Prediction using Advanced ML & Feature Engineering Predictive Credit Risk Analytics with Machine Learning (Deloitte Challenge),2026-04-21T12:31:59Z,2026-04-21T12:38:21Z
cloud-cost-optimizer,Mounishroyal990/cloud-cost-optimizer,"""An AI-driven framework for cloud cost optimization using Machine Learning (Random Forest) and Explainable AI (Ollama/Llama-3) to predict costs and suggest rightsizing strategies.""",2026-04-21T11:59:01Z,2026-04-21T16:17:45Z
Airline-Market-Intelligence,mateomunozluisalonso-source/Airline-Market-Intelligence,"High-precision, two-layer machine learning architecture to predict flight pricing and execute a triple-cluster segmentation framework",2026-04-21T08:13:11Z,2026-04-21T09:34:09Z
Eco-Vivah-AI,Manikanta-20-11/Eco-Vivah-AI,"An AI-driven framework for eco-friendly Indian weddings using a tri-layer architecture: machine learning for demand prediction, optimization for logistics, and LLMs for decision support, delivering real-time strategies to reduce carbon emissions, food waste, and resource misuse.",2026-04-21T05:00:53Z,2026-04-21T08:29:24Z
sar-optical-crossmodal-uncertainty,sanatladkat/sar-optical-crossmodal-uncertainty,Cross-modal machine learning framework for analyzing uncertainty and predictive disagreement between SAR and optical remote sensing models for agricultural classification.,2026-04-21T03:08:37Z,2026-04-21T03:12:17Z
Bigmart-Sales-Prediction,Nimrazia/Bigmart-Sales-Prediction,A machine learning framework to predict BigMart sales with featuring tier-specific retail insights.,2026-04-21T00:44:02Z,2026-04-21T00:52:53Z
MarellaReliabilityModel,rammar876/MarellaReliabilityModel,"Marella Reliability Model (MRM)an AI-driven framework designed to improve reliability in multi-cloud financial systems. It focuses on moving from reactive monitoring to predictive observability, enabling organizations to detect issues early, automate incident response, and optimize cloud costs. The approach combines SRE, machine learning, FinOps",2026-04-20T22:55:57Z,2026-04-28T03:31:05Z
QuantumCortex,moggan1337/QuantumCortex,"Quantum Neural Network Framework - Advanced quantum machine learning with VQC, QNN, and hybrid classical-quantum models",2026-04-20T20:23:12Z,2026-04-21T18:10:51Z
MSc-thesis-documents,stevenandoh-hash/MSc-thesis-documents,A PREDICTIVE PROJECT MANAGEMENT FRAMEWORK FOR CLOUD-BASED ERP IMPLIMENTATION WITHIN MEDIUM SIZED ENTERPRISES: A MACHINE LEARNING APPROACH.,2026-04-20T19:19:28Z,2026-04-20T19:22:06Z
Medical-Insurance-Premium-Prediction-System,Jayalakshmi45/Medical-Insurance-Premium-Prediction-System,"This project is a medical insurance premium prediction system built using machine learning and a Flask web framework. It allows users to input personal and health-related details such as age, BMI, number of dependents, smoking habits, and region to estimate their insurance premium.",2026-04-20T17:12:39Z,2026-04-20T17:31:32Z
code,dohare25/code,"Python code for training and evaluating a traceelementbased automated machinelearning classification framework for identifying mantle reservoirs (DM, EM1, EM2, HIMU) using MORB and OIB data.",2026-04-20T17:10:49Z,2026-04-20T21:39:15Z
ml-provenance-defense,shreyamarde/ml-provenance-defense,"This project implements a robust provenance and defense framework for machine learning pipelines, designed to mitigate risks of ML supply chain poisoning. It provides tools to track, verify, and secure model lineage, ensuring transparency and trustworthiness across datasets, preprocessing steps, and training artifacts.",2026-04-20T16:53:39Z,2026-04-20T16:53:39Z
heart-disease-prediction-and-detection,vanshitlovesfootball/heart-disease-prediction-and-detection,"The HEART-DISEASE-PREDICTION-AND-DETECTION repository is a high-performance medical AI framework designed to provide precise cardiovascular risk assessments. By merging classical machine learning with advanced deep learning and signal processing, this project bridges the gap between raw medical data and actionable clinical insights.",2026-04-20T16:03:53Z,2026-04-20T16:11:12Z
Surrogate-Assisted-MultiObjective-Optimization,misaghzz/Surrogate-Assisted-MultiObjective-Optimization,Development of a surrogate-assisted multi-objective optimization framework for thermal systems using machine learning models and evolutionary algorithms such as NSGA-II.,2026-04-20T15:50:55Z,2026-04-21T23:00:17Z
scientific_fastapi,Artem7898/scientific_fastapi,"High-performance, strictly-typed API framework for computational physics and scientific machine learning.",2026-04-20T15:39:06Z,2026-04-20T17:33:42Z
HEART-DISEASE-PREDICTION-AND-DETECTION,NeonVoyage/HEART-DISEASE-PREDICTION-AND-DETECTION,"The HEART-DISEASE-PREDICTION-AND-DETECTION repository is a high-performance medical AI framework designed to provide precise cardiovascular risk assessments. By merging classical machine learning with advanced deep learning and signal processing, this project bridges the gap between raw medical data and actionable clinical insights.",2026-04-20T14:54:15Z,2026-04-20T15:01:58Z
HEART-DISEASE-PREDICTION-AND-DETECTION,bhupender24hrs/HEART-DISEASE-PREDICTION-AND-DETECTION,"The HEART-DISEASE-PREDICTION-AND-DETECTION repository is a high-performance medical AI framework designed to provide precise cardiovascular risk assessments. By merging classical machine learning with advanced deep learning and signal processing, this project bridges the gap between raw medical data and actionable clinical insights.",2026-04-20T14:53:07Z,2026-04-20T14:59:06Z
early-life-aging-multimodal-framework,hefengh41-tech/early-life-aging-multimodal-framework,"Multimodal prediction of biological aging using DNA methylation, EHR-derived features, and machine learning",2026-04-20T13:52:57Z,2026-04-20T16:26:14Z
doML,wpalace/doML,A meta-prompting framework for machine learning,2026-04-20T11:54:56Z,2026-04-22T14:51:40Z
MSc-Final-Project,atal7/MSc-Final-Project,An Explainable Multi-Feature Machine Learning Framework for Predicting Soccer Pass Outcomes ,2026-04-20T11:04:33Z,2026-04-20T11:12:02Z
security-automation,joshuaguda281-stack/security-automation,"AI-Powered Security Automation Framework - Machine learning for alert prioritization, anomaly detection, and intelligent threat response",2026-04-20T10:33:47Z,2026-04-20T10:34:53Z
Machine-Learning-Enhanced-Molecular-Dynamics-Simulation-Framework,AkM4N0/Machine-Learning-Enhanced-Molecular-Dynamics-Simulation-Framework,,2026-04-20T10:16:42Z,2026-04-20T11:20:10Z
Sentiment-Analysis-ML-Pipeline,farwa-ch/Sentiment-Analysis-ML-Pipeline,"An intelligent sentiment classification framework integrating advanced text preprocessing, feature engineering, and machine learning techniqu",2026-04-20T10:12:01Z,2026-04-20T10:24:57Z
Movie-recommendation-system,archna1212/Movie-recommendation-system,"A content-based movie recommendation engine developed in Python using the scikit-learn framework. The system performs exploratory data analysis and feature engineering on a dataset of over 5,000 movies, leveraging machine learning techniques to generate accurate, personalized movie predictions tailored to individual user preferences.",2026-04-20T10:09:36Z,2026-04-20T10:10:11Z
MASI4_Framework_Machine_Learning,justinFransolet/MASI4_Framework_Machine_Learning,,2026-04-20T10:06:28Z,2026-04-27T22:10:15Z
malware-analyzer,joshuaguda281-stack/malware-analyzer,"AI-Powered Malware Analysis Framework - Static analysis, machine learning classification, and GPT integration for intelligent threat detection",2026-04-20T08:55:16Z,2026-04-20T08:56:32Z
NeuroWeave,HariniKartheeswaran/NeuroWeave,"NeuroWeave is an interactive Cybersecurity Command Center and Adversarial Machine Learning Framework. It simulates live Projected Gradient Descent (PGD) viruses to expose the catastrophic structural vulnerabilities of Neural Networks, while analyzing the mathematical limits of Spatial Sieve defense pipelines.",2026-04-20T08:41:38Z,2026-04-25T04:04:22Z
An-Adaptive-Large-Neighbourhood-Search-Framework-with-Machine-Learning-Enhancements-for-the-CVRP,JAlmheiri/An-Adaptive-Large-Neighbourhood-Search-Framework-with-Machine-Learning-Enhancements-for-the-CVRP,,2026-04-20T08:13:57Z,2026-04-20T19:12:43Z
Low-Code-Framework,Chandrimadas2005/Low-Code-Framework,A low-code machine learning and exploratory data analysis (EDA) framework that combines traditional data processing with LLM-powered automation to simplify end-to-end ML workflows.,2026-04-20T06:54:19Z,2026-04-20T07:41:13Z
QCOP,hekimoghlu/QCOP,"Code for the paper ""A Unified Framework for Calibration, Decoding, and Resource-Aware Processing in Hybrid Quantum-Classical Machine Learning""  Tunjay Akbarli (April 2026)",2026-04-20T06:03:56Z,2026-04-20T06:10:03Z
my-ecg-project,Dhanu3679/my-ecg-project,CARDIAC CLARITY: AN EXPLAINABLE MACHINE LEARNING FRAMEWORK FOR EARLY HEART DISEASE PREDICTION,2026-04-20T05:18:45Z,2026-04-20T05:19:49Z
Final-Year-Project-,DevanshChauhan123/Final-Year-Project-,Decoding Linear A with Artificial Intelligence:A  Comprehensive Machine Learning and NLP Framework,2026-04-19T20:30:23Z,2026-04-19T20:46:31Z
automotive-defect-detection,Allammo/automotive-defect-detection,"This project implements a machine learning pipeline for classifying engine valve defects in high-precision automotive manufacturing, framed within the Quality 4.0 PMQ (Predictive Maintenance & Quality) framework.",2026-04-19T18:42:54Z,2026-04-19T19:13:23Z
Customer-Churn-Prediction-with-Profit-Optimized-Machine-Learning-Business-Decision-Framework,chrisProj91/Customer-Churn-Prediction-with-Profit-Optimized-Machine-Learning-Business-Decision-Framework,"End-to-end customer churn prediction system using machine learning, feature engineering, and probability calibration. The project goes beyond prediction by optimizing decision thresholds based on business profit, implementing customer segmentation, lift analysis, and explainable AI (SHAP) to support data-driven retention strategies.",2026-04-19T14:25:36Z,2026-04-19T17:21:27Z
RABCS-Bias-Correction-System,Archana24272427/RABCS-Bias-Correction-System,"Real-Time Adaptive Bias Correction System (RABCS)  A machine learning framework that detects, measures, and corrects bias in AI models during runtime using a dual-model approach, fairness metrics, and explainable AI.",2026-04-19T14:01:51Z,2026-04-24T16:11:56Z
Carbon-MRV-India,tanaveligapalli/Carbon-MRV-India,"Automated carbon credit monitoring system using NASA satellite data and machine learning to track reforestation in Rajasthan, generating verified reports for India's CCTS framework.",2026-04-19T13:55:52Z,2026-04-19T14:27:23Z
AI-DRIVEN-SAFETY-AND-RISK-MANAGEMENT-FRAMEWORKFORMININGOPERATIONS,15keerthana71/AI-DRIVEN-SAFETY-AND-RISK-MANAGEMENT-FRAMEWORKFORMININGOPERATIONS,"Mining operations are high-risk environments requiring safety, efficiency, and reliability. This project proposes an AI-driven framework using computer vision, machine learning, and predictive analytics to monitor hazards, predict risks, analyze ore quality, and improve decision-making, ensuring safer and more efficient mining operations.",2026-04-19T12:50:44Z,2026-04-19T12:57:17Z
An-Integrated-Machine-Learning-and-Deep-Learning-Framework-for-Flood-Hazard-Mapping-in-Swat-Valley,rameelarustam47/An-Integrated-Machine-Learning-and-Deep-Learning-Framework-for-Flood-Hazard-Mapping-in-Swat-Valley,Flood hazard mapping system using physically-informed machine learning and deep learning models for Swat Valley.,2026-04-19T10:37:27Z,2026-04-19T10:50:26Z
JSHT-Project,EnvBioLab111/JSHT-Project,"MSS-ML-Framework, a proof-of-concept application of machine learning to assess gut microbiota shifts during an intervention",2026-04-19T10:07:11Z,2026-04-19T10:10:04Z
API-TESTER,dhruv-005/API-TESTER,"API TESTER is a full-stack, intelligent API testing platform developed using modern web technologies including Python (Flask framework), HTML, CSS, JavaScript, MySQL, and Machine Learning models. The system is designed to automate API validation, analyze responses, and generate detailed reports for developers and testers.",2026-04-19T08:05:48Z,2026-04-19T10:47:32Z
interference-robust-causal-inference,QingwenDeng0920/interference-robust-causal-inference,"R framework for causal inference when SUTVA fails  covering spillover-robust DiD, double machine learning with spatial HAC, and near/far designs applicable to environmental policy, crime, labor, and political science.",2026-04-19T01:39:51Z,2026-04-19T01:50:51Z
ai-malware-detector,wil-ckaew/ai-malware-detector,"Plataforma Enterprise de SOC - SIEM em tempo real, automao SOAR, framework MITRE ATT&CK, deteco de anomalias com Machine Learning (TensorFlow), dashboard profissional e WebSocket. Desenvolvido em Rust para mxima performance.",2026-04-19T01:06:40Z,2026-04-19T18:01:15Z
transformers,zhshgmail/transformers," Transformers: the model-definition framework for state-of-the-art machine learning models in text, vision, audio, and multimodal models, for both inference and training. ",2026-04-18T20:49:06Z,2026-04-27T07:02:55Z
ai-fraud-detection-dotnet,SaadHassanFaisal/ai-fraud-detection-dotnet,"A secure .NET 9 financial app with real-time AI fraud detection. It bridges C# transaction routing with a Python machine learning API, using both Entity Framework and ADO.NET to ensure fast, safe, and accurate money transfers.",2026-04-18T20:29:01Z,2026-04-18T20:45:50Z
centrality-information-diffusion-social-networks,Pasquale01-unisa/centrality-information-diffusion-social-networks,"A modular analytical framework for modeling centrality evolution and information diffusion during high-activity events in social networks, combining MongoDB, Neo4j, graph-based analysis, and machine learning.",2026-04-18T17:33:10Z,2026-04-18T17:35:46Z
qoptlib,rehanguha/qoptlib,A framework of quantum-inspired classical optimizers for machine learning.,2026-04-18T17:29:32Z,2026-04-18T21:05:13Z
FriktionVol,giewan/FriktionVol,"Decentralized Adaptive Orchestration enables Scalable, Autonomous System Management through Integrated Machine Learning and Auto-Scaling Framework.",2026-04-18T11:49:10Z,2026-04-18T11:50:03Z
bristol-ml,samdrew/bristol-ml,"Framework code to discuss, design and implement in Bristol Machine Learning and Data Science meetups",2026-04-18T11:41:07Z,2026-04-27T12:21:53Z
TerraNova-Disaster-Recovery-Cost-Forecasting-Framework,Ekeminimbabah/TerraNova-Disaster-Recovery-Cost-Forecasting-Framework,"A project focused on forecasting disaster recovery costs using historical data and socio-economic indicators. It uses machine learning to estimate costs early, with support for scenario analysis and continuous model updates.",2026-04-18T09:43:47Z,2026-04-25T10:17:41Z
Production-Machine-Learning-Model-Monitoring-and-Management-Framework,Asingh-2430/Production-Machine-Learning-Model-Monitoring-and-Management-Framework,A demo of Prometheus+Grafana for monitoring an ML model served with FastAPI.,2026-04-18T08:51:08Z,2026-04-18T08:59:09Z
AcadeScore,alimusharraf/AcadeScore,A Random Forest Machine Learning Framework for Tracking Student Performance Based on Lifestyle Factors,2026-04-18T06:22:22Z,2026-04-22T13:28:53Z
Glassdoor-turnover-analysis,welaine123/Glassdoor-turnover-analysis,This project builds a machine learning framework to predict employee turnover risk and identify key drivers of dissatisfaction using Glassdoor reviews.,2026-04-18T03:17:08Z,2026-04-18T03:18:31Z
torsion-prediction-ml-framework,Mehta-eng/torsion-prediction-ml-framework,"Physics-informed and graph-based machine learning framework for predicting torsional strength of reinforced concrete beams, with VAE-based data augmentation and dataset support.",2026-04-17T21:19:06Z,2026-04-17T21:50:25Z
materials-informatics-aluminum-alloys,chaudhry268/materials-informatics-aluminum-alloys,Materials informatics framework for predicting microstructuremechanical property correlations in non-heat-treatable aluminum alloys (5xxx/3xxx series) using machine learning.,2026-04-17T18:12:59Z,2026-04-17T18:41:28Z
Heart-Disease-Prediction-Using-Machine-Learning-Classification-Models,2328170-ui/Heart-Disease-Prediction-Using-Machine-Learning-Classification-Models,"This project focuses on developing a machine learning framework for the early and accurate prediction of heart disease. By leveraging medical parameters like age, cholesterol, and ECG results, the project aims to replace traditional, time-consuming diagnostic methods with efficient classification models.",2026-04-17T17:25:24Z,2026-04-17T17:26:54Z
Predictive-Modelling-of-Gene-Regulation-Status-A-Machine-Learning-Framework,satya04042004/Predictive-Modelling-of-Gene-Regulation-Status-A-Machine-Learning-Framework,,2026-04-17T17:05:09Z,2026-04-17T17:24:34Z
AvailD,jackweirds/AvailD,Artificial-Intelligence AvailDA platform featuring Predictive-Maintenance-Scheduling technology and advanced Machine-Learning-Driven-Insights for modern Data-Scalability-Framework,2026-04-17T17:00:20Z,2026-04-17T17:01:47Z
Student_Dropout_Prediction,NedumCares/Student_Dropout_Prediction,This repository contains the implementation and research documentation for a machine learning framework designed to predict university student dropouts. The project focuses on addressing class imbalance using SMOTE and ensuring model transparency through SHAP (Shapley Additive Explanations).,2026-04-17T16:55:25Z,2026-04-17T17:03:41Z
VulnSight,Mxnn2309/VulnSight,"VulnSight is an automated vulnerability triage framework that combats alert fatigue. It combines active infrastructure reconnaissance with Random Forest Machine Learning for context-aware risk prioritization, and leverages Google Gemini to generate tailored, 3-step remediation strategies.",2026-04-17T15:11:47Z,2026-04-17T15:22:54Z
BittensorT,yulicwan/BittensorT,Edge-Aware Auto-Scaling Distributed Ledger Fabric with Machine-Learning Orchestrator Framework featuring Edge-Computing capabilities with Real-time architecture,2026-04-17T14:47:16Z,2026-04-17T14:48:15Z
PhalaCloud,jackweirds/PhalaCloud,"Machine-Learning Orchestration Engine enables Scalable, Intelligent Distributed Processing through Auto-Scaling and High-Throughput Capabilities Framework.",2026-04-17T14:13:04Z,2026-04-17T14:14:02Z
FuturesHub,yulicwan/FuturesHub,"Artificial-Intelligence powered FuturesHub enables Scalable, Intelligent, Distributed Real-time Data Processing with Advanced Machine Learning Integration Framework.",2026-04-17T12:30:20Z,2026-04-17T12:31:21Z
Capture-of-Gaseous-VOCs-Using-Gold-Nanobipyramid-Covalent-Organic-Framework-for-SERS-Detection,hw2001/Capture-of-Gaseous-VOCs-Using-Gold-Nanobipyramid-Covalent-Organic-Framework-for-SERS-Detection,We further introduced PCA and four machine learning models to evaluate the recognition ability of SERS sensing platform for different volatile organic compounds.,2026-04-17T12:19:19Z,2026-04-17T12:19:23Z
LDopa-ml,SandipGarai/LDopa-ml,"This repository provides data and Python code for machine learningbased optimization of L-DOPA extraction from Vicia faba. It uses CART and ensemble models to identify high-yield conditions, offering an interpretable decision-support framework for scalable and industrial extraction processes.",2026-04-17T11:56:50Z,2026-04-17T11:57:38Z
air-pollution-forecast,nudaypaul2567/air-pollution-forecast,Ensemble Machine Learning Framework for Ground-Level O and NO Forecasting using CAMS Reanalysis Data,2026-04-17T09:26:17Z,2026-04-17T09:53:33Z
ais-anomaly-detection-ml,vishnupriya513/ais-anomaly-detection-ml,"Machine learning-based framework for anomaly detection and route optimization in AIS data using multi-phase analysis including preprocessing, MARL-based scenario generation, and predictive modeling.",2026-04-17T09:10:49Z,2026-04-17T09:14:31Z
Multitask-Machine-Learning-for-News-Classification-and-Sentiment-Analysis,5tap/Multitask-Machine-Learning-for-News-Classification-and-Sentiment-Analysis,"Based on DistilBERT, a multi-task learning framework was constructed, integrating Dropout and residual connections. Through grid search and early stopping methods, the hyperparameters were optimized to achieve joint modeling of six categories of news and sentiment classification.",2026-04-17T07:12:43Z,2026-04-17T07:14:16Z
California-Earthquake-Forecasting-and-Analysis,avantika2408/California-Earthquake-Forecasting-and-Analysis,"A physics-informed machine learning framework for earthquake forecasting in California (1995-2025). This project integrates statistical seismology (Gutenberg-Richter law, Omori's Law) with XGBoost to identify predictive precursors to major seismic events.",2026-04-17T06:21:37Z,2026-04-17T06:47:51Z
FPGA-Based-Machine-Learning-Framework-for-Fault-Classification-in-12V-PMDC-Motor-Using-SVM,pavan6851/FPGA-Based-Machine-Learning-Framework-for-Fault-Classification-in-12V-PMDC-Motor-Using-SVM,,2026-04-17T02:38:04Z,2026-04-17T02:38:46Z
data-prep-practices-length-of-stay-analysis,calebw12345/data-prep-practices-length-of-stay-analysis,"This repository contains the full analysis, methodology, and results for a machine learning study focused on predicting Length of Stay in hospital admissions using **Electronic Health Record (EHR)** data.   The project explores how different preprocessing strategies and model frameworks impact predictive performance and feature interpretability.",2026-04-16T21:51:29Z,2026-04-16T21:57:59Z
Quasai,danusan-s/Quasai,Machine learning framework built in C++,2026-04-16T18:22:24Z,2026-04-28T10:03:47Z
ML-EdgeArchitecture,M1ke14/ML-EdgeArchitecture,"framework IoT implementazione di una pipeline completa per il training, la distribuzione e l'inferenza di modelli di Machine Learning",2026-04-16T17:14:32Z,2026-04-16T17:18:40Z
Project,Prerana11sep/Project,SecureShield: A machine Learning framework for Credit Card Fraud Detection,2026-04-16T16:43:27Z,2026-04-16T16:43:27Z
About-me,DavidBentum/About-me,I am MSc Data Science student dedicated to bridging the gap between statistical theory and computational application. With a foundational background in Statistics. I specialize in transforming complex datasets into actionable insight. Technical Toolkit: Python | R | Machine Learning | Statistical Analysis | MEL Frameworks | Program Management,2026-04-16T15:20:45Z,2026-04-16T15:20:46Z
NET-HA-ML,kabhinara/NET-HA-ML,Network Hardware-Aware Machine-Learning Data Classifier : Framework for Reduced Complexity Encrypted Traffic Classification at the Organization Edge,2026-04-16T15:09:48Z,2026-04-17T09:48:31Z
