name,full_name,description,created_at,pushed_at,is_framework
Stroke-Classification-and-Detection-Using-Neuroimage-Based-ML-Models,NaveenNani25/Stroke-Classification-and-Detection-Using-Neuroimage-Based-ML-Models,"Developed a machine learning framework for stroke detection and classification using MRI/CT neuroimages. Applied preprocessing, segmentation (U-Net, CNN), and feature extraction to distinguish ischemic vs. hemorrhagic strokes. Achieved high accuracy with ML/DL models, enabling faster, reliable, and AI-driven clinical decision support.",2025-09-01T11:30:21Z,2025-09-01T11:44:22Z,yes
BioAgeXplain,13579zCBmadgl/BioAgeXplain,BioAgeXplain: A Causally Informed and Interpretable Machine Learning Framework for Biological Age Prediction in Large-Scale Cohorts,2025-09-01T12:23:14Z,2025-09-01T13:49:57Z,yes
xai-healthcare-poisoning-detection,Eyadmegdadi/xai-healthcare-poisoning-detection,"An open-source framework for detecting data poisoning attacks in healthcare machine learning models using Explainable AI (XAI) techniques. Includes reproducible experiments, datasets, and visualization tools to support secure and interpretable ML in clinical settings.",2025-09-01T18:32:43Z,2025-09-09T17:17:39Z,yes
GPR-Steel-Design,lxdsg2010/GPR-Steel-Design,A machine learning framework for predicting and designing the mechanical properties of low-carbon steel.,2025-09-02T01:05:25Z,2025-09-02T01:54:45Z,yes
LSTM-from-scrach,KodeCharya/LSTM-from-scrach,A complete implementation of Long Short-Term Memory (LSTM) neural networks using only Python's standard libraries and NumPy. No external machine learning frameworks required!,2025-09-02T08:38:05Z,2025-09-02T08:40:21Z,yes
ifmalam3d1,Juni-Viaa/ifmalam3d1,Machine Learning Testing dan Optimasi Framework untuk Prediksi komposisi Produk Fraksinasi Pada Industri Oleokimia,2025-09-02T11:43:36Z,2025-09-02T11:43:36Z,yes
Machine-Learning-Framework-for-Compiler-Optimization,ragnarok003/Machine-Learning-Framework-for-Compiler-Optimization,,2025-09-02T16:53:43Z,2025-09-02T16:59:04Z,yes
MalScan-AI,ahsanwaseem2000/MalScan-AI,"This study presents MalScanAI, a modular machine learning framework designed for malware detection across two  primary pipelines: PE HeaderBased Malware Detection and Malicious URL Detection",2025-09-02T17:53:22Z,2025-09-02T17:53:22Z,yes
aiirmap,rfhhunter/aiirmap,A framework for machine learning enhanced design.,2025-09-02T18:23:44Z,2025-09-02T18:29:37Z,yes
rust-machine-learning,stephenlb/rust-machine-learning,Rust simple machine learning framework with deep learning,2025-09-03T17:46:58Z,2025-09-04T17:15:34Z,yes
PROG--CSCN8010,abdullahiabdirizak32-hub/PROG--CSCN8010,Foundation of Machine Learning Frameworks,2025-09-03T21:19:21Z,2025-09-03T22:18:34Z,yes
IRAK4-QSAR-ML-Docking-MD,Isahjosiah/IRAK4-QSAR-ML-Docking-MD,"From Scaffold to Candidate: An Integrated Machine Learning, QSAR, Docking, and Molecular Dynamics Framework for the Rational Design of IRAK4 Inhibitors in Diffuse Large B-Cell Lymphoma",2025-09-03T21:33:06Z,2025-09-03T21:48:22Z,yes
GlacierThicknessPrediction,Tracyszy/GlacierThicknessPrediction,"Machine learning framework for glacier ice thickness estimation. Includes data preprocessing, training of XGBoost, LightGBM, CatBoost, MLP models, ensemble model development, and SHAP-based interpretability analysis with visualizations.",2025-09-04T01:33:26Z,2025-09-05T02:05:26Z,yes
aedificare,selfapplied/aedificare,"CE1: CurvatureModeKernel Framework - A comprehensive framework for emergent machine learning grammar, morphological analysis, and code optimization",2025-09-04T08:06:54Z,2025-09-04T08:57:34Z,yes
Machine-Learning-Framework-for-the-Detection-of-Mental-Stress-main,ananta-01verma/Machine-Learning-Framework-for-the-Detection-of-Mental-Stress-main,,2025-09-04T08:34:29Z,2025-09-04T08:34:42Z,yes
TC3006C_ML_Algorithm_Implementation,maxdlcl/TC3006C_ML_Algorithm_Implementation,Implementation of a Machine Learning algorithm without making use of frameworks such as scikit-learn,2025-09-04T20:32:07Z,2025-09-05T19:33:29Z,yes
SBA-Loan-Default-Prediction-and-Profit-Optimization-using-ML,saiteja0737/SBA-Loan-Default-Prediction-and-Profit-Optimization-using-ML,Machine learning framework for predicting Small Business Administration loan defaults with profit-maximizing decision thresholds,2025-09-04T21:03:58Z,2025-09-04T21:41:50Z,yes
SmartHealth,KrishnaMridha/SmartHealth,SmartHeart: A Conceptual Framework for Explainable Machine Learning in Cardiovascular Risk Prediction,2025-09-06T13:50:25Z,2025-09-15T00:43:53Z,yes
BalancedMaritimeAccidentXAI,AdvMarTech/BalancedMaritimeAccidentXAI,"RESS""Improving maritime accident severity prediction accuracy: A holistic machine learning framework with data balancing and explainability techniques""",2025-09-06T16:11:06Z,2025-09-06T16:15:14Z,yes
Machine-Learning-Based-Trading-Strategy-Backtesting-Framework,davelamtrader/Machine-Learning-Based-Trading-Strategy-Backtesting-Framework,This repo provides a solid foundation for a production-grade backtesting framework for the Machine learning models based trading strategies.,2025-09-08T18:25:25Z,2025-09-08T18:44:06Z,yes
MOF-Methane-PINN,Dark-LJY/MOF-Methane-PINN,Insights into Methane Adsorption in Metal-organic Frameworks through Physics-informed Machine Learning,2025-09-09T08:36:37Z,2025-09-10T07:45:19Z,yes
CreditShield-End-to-End-Machine-Learning-Framework-for-Detecting-and-Preventing-Credit-Card-Fraud,TITANx2003/CreditShield-End-to-End-Machine-Learning-Framework-for-Detecting-and-Preventing-Credit-Card-Fraud,,2025-09-09T17:39:16Z,2025-09-09T17:55:06Z,yes
crossMat,ccv81121/crossMat,"CrossMat is a specialized machine learning framework designed for complex crystalline systems, including high-entropy alloys, multi-element doped perovskites/spinels, and defect-engineered materials.",2025-09-10T10:43:49Z,2025-09-12T18:15:44Z,yes
SafeSpace_DigitalBehaviourMonitor,Khushboo-Mittal/SafeSpace_DigitalBehaviourMonitor,"SafeSpace is a machine learning and NLP-based framework designed to detect cyberbullying behaviour in real-time, particularly focusing on Hinglish (Hindi + English) text.",2025-09-10T12:09:41Z,2025-09-10T12:11:25Z,yes
Lab-Animal-Growth-Prediction,Ibrahim-El-Khouli/Lab-Animal-Growth-Prediction,"A reproducible, species-agnostic machine learning framework to predict laboratory animal growth trajectories using Linear Regression and Decision Tree models. Includes synthetic datasets, trained models, and veterinary-focused annotations for interpretable insights. Ideal for research, education, and translational studies.",2025-09-10T17:05:57Z,2025-09-18T16:38:24Z,yes
TC3006C_ML_Algorithm_Employment,maxdlcl/TC3006C_ML_Algorithm_Employment,Implementation of a Machine Learning algorithm making use of framework such as scikit-learn ,2025-09-10T22:22:59Z,2025-09-10T22:53:49Z,yes
Portafolio_Uso-de-framework_Machine_Learning,A01750817/Portafolio_Uso-de-framework_Machine_Learning,,2025-09-11T01:43:44Z,2025-09-11T12:01:38Z,yes
AI-Lab-Task2,FarhaaanAhmad/AI-Lab-Task2,"Basic Python Code, Machine Learning, Searching Algorithms, DI, Library, Framework",2025-09-11T10:48:40Z,2025-09-18T10:31:26Z,yes
AILABTask2,112233osamakhan-del/AILABTask2,"Basic Python Code, Machine Learning, Searching Algorithms, DI, Library, Framework",2025-09-11T11:10:15Z,2025-09-11T11:10:44Z,yes
Memristor-Model,Davide-Rossetti-PhD/Memristor-Model,"Framework combining Python and LTSpice for extended memristor modeling, calibration, and machine learningbased parameter optimization.",2025-09-11T22:33:07Z,2025-09-12T00:05:28Z,yes
mqttset-dt-rf-replication,Yasmiinmuniz/mqttset-dt-rf-replication,"Reproduo simplificada dos experimentos Decision Tree e Random Forest do artigo ""Secure Enhancement for MQTT Protocol Using Distributed Machine Learning Framework"".",2025-09-12T18:30:36Z,2025-09-12T20:00:22Z,yes
ml-template,thomastschinkel/ml-template,"A clean, framework-agnostic template for organizing and starting any Machine Learning project",2025-09-12T18:33:39Z,2025-09-13T09:29:24Z,yes
fake-news-evaluation,lakshmi-nsk/fake-news-evaluation,"A machine learning framework for Fake News Detection leveraging Logistic Regression and Random Forest classifiers. Utilizes advanced NLP preprocessing, Word2Vec embeddings, and confusion matrix evaluation to rigorously assess and classify news authenticity.",2025-09-13T11:35:05Z,2025-09-18T15:12:31Z,yes
Machine_Optimization_Crew,sachin-india/Machine_Optimization_Crew,A learning setup using CrewAI framework to solve a machine optimization problem,2025-09-13T16:58:47Z,2025-09-15T17:20:30Z,yes
-Diabetes-Prediction-Using-Streamlit-,Smarttoolz/-Diabetes-Prediction-Using-Streamlit-,A Diabetes Prediction Model Using Machine Learning and Streamlit Framework for Enhanced User Accessibility,2025-09-13T18:26:00Z,2025-09-14T09:58:27Z,yes
Hypersonic-Boundary-Layer-Transition-Prediction,Sain-Kai/Hypersonic-Boundary-Layer-Transition-Prediction,A comprehensive physics-informed machine learning framework for predicting laminar-to-turbulent transition in hypersonic flows. This repository combines traditional stability analysis with modern deep learning techniques to accurately estimate critical transition parameters for aerospace vehicle design.,2025-09-13T20:28:50Z,2025-09-16T22:03:14Z,yes
Machine-Learning-Advance-Python-Flask-FrameWork,rasheed89034/Machine-Learning-Advance-Python-Flask-FrameWork,,2025-09-13T20:34:46Z,2025-09-13T20:42:58Z,yes
caracal,skizlik/caracal,A Python framework for rigorous analysis of machine learning model variability and performance stability across multiple training runs.,2025-09-14T03:46:58Z,2025-09-19T19:07:43Z,yes
Sentiment-driven-Stock-Prediction,arbitcoper/Sentiment-driven-Stock-Prediction,A machine learning framework for stock price movement prediction that integrates social media sentiment with traditional market indicators to improve the reliability of short-term forecasts.,2025-09-14T06:54:45Z,2025-09-14T06:57:25Z,yes
Interpretable-Machine-Learning-Framework-for-Liver-Cancer-Diagnosis-from-Gene-Expression-Data-,sagar-2425/Interpretable-Machine-Learning-Framework-for-Liver-Cancer-Diagnosis-from-Gene-Expression-Data-,,2025-09-14T18:30:30Z,2025-09-14T18:31:45Z,yes
penguin_net,hwang2409/penguin_net,machine learning framework,2025-09-15T00:04:46Z,2025-09-15T00:05:34Z,yes
ML_Framework_Ecosystem_Flowchart,hoyathalis/ML_Framework_Ecosystem_Flowchart,"Explore how machine learning frameworks transform your Python code into optimized instructions that run efficiently on diverse hardware platforms including CPUs, GPUs, TPUs, and specialized AI chips.",2025-09-15T01:53:18Z,2025-09-15T09:07:06Z,yes
Final-Year-Project,naufalalfaris/Final-Year-Project,"Developed a machine learning framework for dynamic stock portfolio optimization (IDX) integrating K-Means, DBSCAN, and Agglomerative Clustering. Applied multivariate LSTM for Sharpe Ratio forecasting and SVM for market regime detection",2025-09-15T15:03:51Z,2025-09-15T15:16:54Z,yes
TurbidityML-Sentinel2-USGS,Ehsankahrizi/TurbidityML-Sentinel2-USGS,"Machine Learning-based framework for predicting high-turbidity events in reservoirs using Sentinel-2 satellite imagery, meteorological data, and USGS in-situ observations. Includes data preprocessing, feature engineering, model training, and performance evaluation for real-time water quality monitoring applications.",2025-09-15T18:16:33Z,2025-09-15T18:16:34Z,yes
deepfake-detection-generation,Rayyanalik/deepfake-detection-generation,"Comprehensive Python framework for detecting and generating deepfake content using advanced computer vision, machine learning, and AI techniques",2025-09-15T23:30:22Z,2025-09-16T00:07:59Z,yes
Predicting-Student-Success,dan-paquin/Predicting-Student-Success,"This project investigates whether machine learning models can accurately predict student academic performance using demographic, social, and early academic indicators, developing a comprehensive framework that identifies at-risk students, reveals key performance factors, and enables targeted interventions before critical learning gaps develop.",2025-09-16T00:18:51Z,2025-09-16T00:18:51Z,yes
synthetic-data-generator,Diyarino/synthetic-data-generator,"A Python framework for generating class-conditional synthetic datasets with controllable properties and high-dimensional embeddings, suitable for benchmarking machine learning models.",2025-09-16T09:44:11Z,2025-09-16T09:53:55Z,yes
sp500-regime-forecasting,huongtang183-sketch/sp500-regime-forecasting,"A regime-based machine learning framework for S&P 500 forecasting and dynamic risk management. It builds a Market Volatility Index with Principal Component Analysis, detects structural shifts using Bayesian Online Change Point Detection, models regime-specific returns with XGBoost, and interprets feature effects using SHAP.",2025-09-16T09:49:47Z,2025-09-16T10:31:12Z,yes
ml-pipeline-framework,ns0329/ml-pipeline-framework, ML Pipeline Framework for reproducible machine learning    projects,2025-09-16T15:42:27Z,2025-09-16T15:50:08Z,yes
Malware_Detection_Using_ML_Technique,Rohit-coder7/Malware_Detection_Using_ML_Technique,"A machine learningbased malware detection framework that benchmarks Logistic Regression, Random Forest, and Support Vector Machine models on the IEEE Top 1000 PE Imports dataset.",2025-09-16T21:32:01Z,2025-09-16T21:34:37Z,yes
kwisatz-haderach,fullscreen-triangle/kwisatz-haderach,A Machine Learning Framework for Automated Validation of Text in Academic Writing,2025-09-17T14:09:47Z,2025-09-17T22:43:31Z,yes
pd-novel-motor-assessment,lj-open-research/pd-novel-motor-assessment,Machine learning framework for evaluating a novel clinical motor assessment in Parkinsons disease diagnosis using wearable sensor data.,2025-09-17T14:31:35Z,2025-09-17T14:31:35Z,yes
team-lead-Ml-optimazation-project,boulasalib/team-lead-Ml-optimazation-project,"Aggressive ML Trading System is a machine learningdriven backtesting framework that fetches market data, trains predictive models, generates trading signals, executes trades with risk controls, and evaluates performance through detailed portfolio and risk-adjusted return metrics.",2025-09-17T20:55:04Z,2025-09-17T20:56:51Z,yes
lab-tasks,Abdullah15742/lab-tasks,"Basic Python Code, Machine Learning, Searching Algorithms, DI, Library, Framework",2025-09-18T10:36:32Z,2025-09-18T10:38:08Z,yes
SweepSembleSearch,AbhikSarkarIASRI/SweepSembleSearch,Machine Learning framework for Selective Sweep Analysis,2025-09-18T12:43:58Z,2025-09-18T13:29:37Z,yes
forex-pattern-mining-dashboard,PcityB/forex-pattern-mining-dashboard,Machine Learning Dashboard for Forex Pattern Mining with Kaggle Integration - Research-based algorithmic framework,2025-09-19T05:55:14Z,2025-09-19T06:01:40Z,yes
vibe-forex,PcityB/vibe-forex,A comprehensive machine learning dashboard for forex price pattern mining based on algorithmic framework research,2025-09-19T06:02:36Z,2025-09-19T06:07:54Z,yes
Project_Stephen,AFBI-FAB/Project_Stephen,"My research aims to help realise the implementation of selective breeding on commercial farms, via the use of novel machine learning approaches, including the development of innovative predictive models and frameworks, as well as bespoke analytical solutions.",2025-09-19T07:35:47Z,2025-09-19T07:35:48Z,yes
Machine-Learning-Framework-From-Scratch,Aman100/Machine-Learning-Framework-From-Scratch,Creating machine learning framework from scratch,2025-09-19T16:47:38Z,2025-09-19T16:54:35Z,yes
Early-Prediction-of-Alzheimer-s-Disease-A-Machine-Learning-Framework-Leveraging-Clinical-Biomarkers,ayesharazakh/Early-Prediction-of-Alzheimer-s-Disease-A-Machine-Learning-Framework-Leveraging-Clinical-Biomarkers,"A machine learning analysis of Alzheimer's biomarkers using clinical data from 2,149 patients. Gradient Boosting achieved 95% accuracy in prediction. SHAP interpretation identified key clinical factors. Supports early detection approaches in neurodegenerative disease care.",2025-09-19T18:19:24Z,2025-09-19T18:36:41Z,yes
PINNs,AnisTcherak/PINNs,Physics-Informed Machine Learning Framework for Solving NavierStokes Equations with Application to Airfoil Flows,2025-09-19T20:30:35Z,2025-09-19T20:33:32Z,yes
Thesis,RuosangShi/Thesis,Master-Thesis --- Development of a Machine Learning Framework for Cleavage Site and Substrate Prediction of ADAM17,2025-09-20T09:10:21Z,2025-09-20T09:16:15Z,yes
