name,full_name,description,created_at,pushed_at,is_framework
moa,Waikato/moa,"MOA is an open source framework for Big Data stream mining. It includes a collection of machine learning algorithms (classification, regression, clustering, outlier detection, concept drift detection and recommender systems) and tools for evaluation.",2014-05-02T05:44:33Z,2025-09-01T03:11:18Z,yes
tensorflow,tensorflow/tensorflow,An Open Source Machine Learning Framework for Everyone,2015-11-07T01:19:20Z,2025-09-20T09:33:18Z,yes
assignPOP,alexkychen/assignPOP,"Population Assignment using Genetic, Non-genetic or Integrated Data in a Machine-learning Framework.    Methods in Ecology and Evolution. 2018;9:439446. ",2016-06-14T19:31:56Z,2025-09-12T18:19:36Z,yes
LightGBM,microsoft/LightGBM,"A fast, distributed, high performance gradient boosting (GBT, GBDT, GBRT, GBM or MART) framework based on decision tree algorithms, used for ranking, classification and many other machine learning tasks.",2016-08-05T05:45:50Z,2025-09-20T06:20:02Z,yes
Paddle,PaddlePaddle/Paddle,PArallel Distributed Deep LEarning: Machine Learning Framework from Industrial Practice &,2016-08-15T06:59:08Z,2025-09-20T09:37:12Z,yes
rasa,RasaHQ/rasa,"   Open source machine learning framework to automate text- and voice-based conversations: NLU, dialogue management, connect to Slack, Facebook, and more - Create chatbots and voice assistants",2016-10-14T12:27:49Z,2025-09-08T12:22:50Z,yes
MultiScaleArrays.jl,SciML/MultiScaleArrays.jl,A framework for developing multi-scale arrays for use in scientific machine learning (SciML) simulations,2016-10-20T06:39:02Z,2025-09-07T12:32:48Z,yes
seldon-core,SeldonIO/seldon-core,"An MLOps framework to package, deploy, monitor and manage thousands of production machine learning models",2017-12-20T14:51:54Z,2025-09-19T06:47:19Z,yes
nnpdf,NNPDF/nnpdf,An open-source machine learning framework for global analyses of parton distributions.,2018-01-19T14:30:29Z,2025-09-19T17:00:39Z,yes
ModelingToolkit.jl,SciML/ModelingToolkit.jl,An acausal modeling framework for automatically parallelized scientific machine learning (SciML) in Julia. A computer algebra system for integrated symbolics for physics-informed machine learning and automated transformations of differential equations,2018-02-27T01:36:26Z,2025-09-19T13:44:37Z,yes
heat,helmholtz-analytics/heat,Distributed tensors and Machine Learning framework with GPU and MPI acceleration in Python,2018-05-17T12:16:27Z,2025-09-17T11:30:57Z,yes
MLJ.jl,JuliaAI/MLJ.jl,A Julia machine learning framework,2018-08-01T06:29:39Z,2025-09-18T22:18:07Z,yes
transformers,huggingface/transformers," Transformers: the model-definition framework for state-of-the-art machine learning models in text, vision, audio, and multimodal models, for both inference and training. ",2018-10-29T13:56:00Z,2025-09-20T08:53:56Z,yes
sktime,sktime/sktime,A unified framework for machine learning with time series,2018-11-06T15:08:24Z,2025-09-20T08:32:03Z,yes
MLJBase.jl,JuliaAI/MLJBase.jl,Core functionality for the MLJ machine learning framework,2018-12-11T14:42:03Z,2025-09-04T23:41:38Z,yes
tensorflow-federated,google-parfait/tensorflow-federated,An open-source framework for machine learning and other computations on decentralized data.,2018-12-12T23:15:35Z,2025-09-19T21:49:40Z,yes
ytopt,ytopt-team/ytopt,ytopt: machine-learning-based autotuning and hyperparameter optimization framework using Bayesian Optimization,2019-01-15T18:31:40Z,2025-09-02T19:39:24Z,yes
FEDOT,aimclub/FEDOT,Automated modeling and machine learning framework FEDOT,2020-01-13T12:48:37Z,2025-08-26T11:00:05Z,yes
MLJTuning.jl,JuliaAI/MLJTuning.jl,Hyperparameter optimization algorithms for use in the MLJ machine learning framework,2020-01-14T18:48:56Z,2025-08-25T23:58:21Z,yes
quantum,tensorflow/quantum,An open-source Python framework for hybrid quantum-classical machine learning.,2020-02-06T19:58:35Z,2025-09-14T20:21:17Z,yes
aiko_services,geekscape/aiko_services,"Distributed service framework using asynchronous messages supporting IoT, Machine Learning and Video",2020-03-02T04:06:53Z,2025-09-16T15:56:27Z,yes
modeltime,business-science/modeltime,Modeltime unlocks time series forecast models and machine learning in one framework,2020-04-17T13:00:41Z,2025-08-29T12:09:42Z,yes
NErlNet,leondavi/NErlNet,Nerlnet is a framework for research and development of distributed machine learning models on IoT,2020-05-13T03:34:41Z,2025-08-22T21:41:59Z,yes
DeepMol,BioSystemsUM/DeepMol,DeepMol: A Machine and Deep Learning Framework for Computational Chemistry,2020-09-08T14:47:20Z,2025-09-08T16:28:25Z,yes
ApraPipes,Apra-Labs/ApraPipes,A pipeline framework for developing video and image processing application. Supports multiple GPUs and Machine Learning tooklits,2020-11-09T10:29:06Z,2025-09-11T07:36:47Z,yes
Forex-Price-Prediction-Using-Machine-Learning-and-Technical-Indicators,yididiya1/Forex-Price-Prediction-Using-Machine-Learning-and-Technical-Indicators,"Machine learning framework for Forex prediction using OHLCV data and engineered technical indicators, featuring model training, backtesting, and real-time forecasting with Yahoo Finance data.",2020-11-25T06:52:25Z,2025-08-19T16:22:41Z,yes
ivy,ivy-llc/ivy,Convert Machine Learning Code Between Frameworks,2021-01-19T08:37:25Z,2025-09-18T01:55:49Z,yes
torchquantum,mit-han-lab/torchquantum,"A PyTorch-based framework for Quantum Classical Simulation, Quantum Machine Learning, Quantum Neural Networks, Parameterized Quantum Circuits with support for easy deployments on real quantum computers.",2021-02-04T19:42:30Z,2025-08-20T13:56:24Z,yes
mala,mala-project/mala,Materials Learning Algorithms. A framework for machine learning materials properties from first-principles data.,2021-03-31T11:40:38Z,2025-09-17T06:08:32Z,yes
haferml,emptymalei/haferml,the HomemAde FramEwoRk for Machine Learning,2021-04-14T15:14:05Z,2025-08-18T07:19:07Z,yes
MLPro,fhswf/MLPro,MLPro - The Integrative Middleware Framework for Standardized Machine Learning in Python,2021-08-10T16:57:36Z,2025-09-19T17:26:22Z,yes
pyBIA,Professor-G/pyBIA,"Machine learning-based classification framework for detecting spatially extended and diffuse emission in the high redshift universe, using multi-band broadband imaging.",2021-09-09T23:13:15Z,2025-09-19T16:06:17Z,yes
mlcolvar,luigibonati/mlcolvar,A unified framework for machine learning collective variables for enhanced sampling simulations,2021-09-21T21:32:04Z,2025-09-19T09:37:26Z,yes
Geochemistrypi,ZJUEarthData/Geochemistrypi,an open-sourced highly automated machine learning Python framework for data-driven geochemistry discovery,2021-10-13T01:53:14Z,2025-09-08T07:43:08Z,yes
DeepGNN,microsoft/DeepGNN,DeepGNN is a framework for training machine learning models on large scale graph data.,2022-04-21T17:24:28Z,2025-09-02T15:31:47Z,yes
paxml,google/paxml,"Pax is a Jax-based machine learning framework for training large scale models. Pax allows for advanced and fully configurable experimentation and parallelization, and has demonstrated industry leading model flop utilization rates.",2022-06-14T16:04:48Z,2025-09-03T06:53:52Z,yes
matbench-discovery,janosh/matbench-discovery,An evaluation framework for machine learning models simulating high-throughput materials discovery.,2022-06-20T18:32:44Z,2025-09-10T09:58:24Z,yes
coracle,SebastianStaab/coracle,Machine Learning Framework to Identify Coral Bacteria Associated with Thermal Resilience ,2022-07-29T12:18:25Z,2025-08-22T11:35:11Z,yes
dasf-core,discovery-unicamp/dasf-core,Framework for computing Machine Learning algorithms in Python using Dask and RAPIDS AI. ,2022-08-24T13:58:55Z,2025-09-01T14:28:27Z,yes
Learnsat,rhod-dev/Learnsat,"Learnsat is a collection of frameworks, libraries, software and resources for machine learning and AI within the space industry",2022-08-26T14:39:59Z,2025-08-28T17:19:47Z,yes
mlexperiments,kapsner/mlexperiments,An extensible framework for reproducible machine learning experiments,2022-09-27T06:45:12Z,2025-09-09T06:55:25Z,yes
apax,apax-hub/apax,A flexible and performant framework for training machine learning potentials.,2022-11-18T12:31:19Z,2025-09-19T09:22:01Z,yes
graphstorm,awslabs/graphstorm,Enterprise graph machine learning framework for billion-scale graphs for ML scientists and data scientists.,2022-12-02T11:20:38Z,2025-09-08T16:47:55Z,yes
ALF,lanl/ALF,A framework for performing active learning for training machine-learned interatomic potentials.,2023-01-04T23:13:24Z,2025-09-18T13:06:21Z,yes
Research,RamanEbrahimi/Research,Implementing the mathematical modeling and machine learning algorithms in analysis of complex multi-layer networks. The research involves developing new mathematical optimization frameworks and simulation environments.,2023-02-22T16:37:00Z,2025-09-02T00:43:35Z,yes
gomlx,gomlx/gomlx,GoMLX: An Accelerated Machine Learning Framework For Go,2023-04-23T19:30:48Z,2025-09-19T08:08:46Z,yes
The-Lord-of-The-Words-The-two-frameworks,SoyGema/The-Lord-of-The-Words-The-two-frameworks,Translation exploration with Transformers and Machine Learning Experimentation Platfroms,2023-05-30T19:30:15Z,2025-09-10T11:26:17Z,yes
anacostia-pipeline,anacostiaAI/anacostia-pipeline,Anacostia is a framework for creating machine learning operations (MLOps) pipelines,2023-07-14T19:44:55Z,2025-09-17T21:23:56Z,yes
MASPY,laca-is/MASPY,A Python Framework for Multi-Agent Programming with Machine Learning,2023-08-22T19:11:38Z,2025-09-11T17:47:16Z,yes
lotus,rajveerb/lotus,Lotus: Characterization of Machine Learning Preprocessing Pipelines via Framework and Hardware Profiling,2023-08-23T15:41:47Z,2025-09-09T18:53:32Z,yes
dacapo,janelia-cellmap/dacapo,"A framework for easy application of established machine learning techniques on large, multi-dimensional images.",2023-08-24T20:18:00Z,2025-09-15T19:14:05Z,yes
frogbox,SimonLarsen/frogbox,An opinionated machine learning framework.,2023-09-01T15:23:29Z,2025-09-11T12:38:32Z,yes
reactive_active_learning,siddarthachar/reactive_active_learning,This is an active learning framework that uses single-ended growing string method and neural networks to build machine learning forcefields that quickly understands reactive energy landscape.,2023-09-12T17:01:36Z,2025-09-05T19:08:24Z,yes
pyroml,peacefulotter/pyroml, Machine Learning framework allowing plug-and-play training for pytorch models,2023-11-07T11:00:16Z,2025-09-18T18:42:29Z,yes
neuralnetlib,marcpinet/neuralnetlib, A flexible machine & deep learning framework built from scratch using only NumPy,2023-11-09T20:32:00Z,2025-08-24T19:43:31Z,yes
grads,DatoXx8/grads,A machine learning framework in Zig.,2024-02-03T14:32:26Z,2025-09-06T22:08:49Z,yes
Brain-Age-prediction,Cannistra94/Brain-Age-prediction,A Machine Learning framework for brain age prediction using MRI scans,2024-02-05T16:56:24Z,2025-09-03T21:13:45Z,yes
secs,lamalab-org/secs,SECS is a machine learning framework designed for structure elucidation from spectra such as NMR and IR.,2024-03-08T10:55:30Z,2025-09-16T15:04:23Z,yes
HLSFactory,sharc-lab/HLSFactory,HLSFactory: A Framework Empowering High-Level Synthesis Datasets for Machine Learning and Beyond,2024-03-28T19:06:57Z,2025-09-17T06:09:50Z,yes
MaterialsFramework,dogusariturk/MaterialsFramework,"A modular Python framework for deploying, benchmarking, and analyzing state-of-the-art machine learning potentials and simulation workflows in materials science.",2024-04-17T17:53:29Z,2025-08-19T15:56:15Z,yes
LightGBM,JeanLescutMuller/LightGBM,"A fast, distributed, high performance gradient boosting (GBT, GBDT, GBRT, GBM or MART) framework based on decision tree algorithms, used for ranking, classification and many other machine learning tasks.",2024-06-30T18:52:50Z,2025-09-18T10:00:09Z,yes
brain4j,brain4j-org/brain4j,Open-source machine learning framework for Java. Designed with speed and lightweight in mind.,2024-07-28T11:54:08Z,2025-09-19T14:12:16Z,yes
hyrax,lincc-frameworks/hyrax,Hyrax - A framework for machine learning in astronomy,2024-08-01T22:51:04Z,2025-09-20T01:37:53Z,yes
CatBench,JinukMoon/CatBench,CatBench - Benchmark Framework of Machine Learning Interatomic Potentials in Adsorption Energy Predictions,2024-08-05T04:30:28Z,2025-09-18T10:33:02Z,yes
AAGP,saptawtf/AAGP,AAGP: A machine learning framework for prediction of anti-aging peptides using diverse physicochemical and compositional features,2024-08-08T13:12:44Z,2025-09-06T06:54:38Z,yes
EXGEP,AIBreeding/EXGEP,EXGEP: a framework for predicting genotype-by-environment interactions using ensembles of explainable machine-learning models,2024-08-16T08:25:06Z,2025-09-12T03:37:21Z,yes
SplitFederated,Jeonseungwoo1/SplitFederated,A privacy-preserving distributed machine learning framework combining Split Learning and Federated Learning for medical image classification,2024-08-29T07:43:18Z,2025-08-29T01:23:41Z,yes
TimeFlies,rsinghlab/TimeFlies,"  Machine learning framework for aging analysis in Drosophila single-cell RNA-seq   data. Deep learning models with SHAP interpretability, batch correction, and   comprehensive research workflows.",2024-09-26T15:15:59Z,2025-09-07T18:22:23Z,yes
hybrid-heart-classifier,aldojacopovirno/hybrid-heart-classifier,Heart Hybrid Classifier is a machine learning framework focused on cardiovascular risk prediction. The goal is to evaluate accuracy and interpretability of the models in a clinical setting.,2024-10-05T11:13:02Z,2025-09-16T13:40:13Z,yes
folax,RezaNajian/folax,Folax (Finite Operator Learning with JAX) is a framework for solving and optimizing PDEs by integrating machine learning with numerical methods in computational mechanics.,2024-10-21T03:55:14Z,2025-09-19T10:46:35Z,yes
npmod,CryAndRRich/npmod,Building a simple deep learning framework and some machine learning/deep learning models from scratch (pure Numpy and Pytorch),2024-11-09T06:58:38Z,2025-09-13T10:24:16Z,yes
vibrolearn,fboldt/vibrolearn,A Python framework for machine learning experiments in industrial machinery fault diagnosis through vibration analysis.,2024-11-22T16:13:38Z,2025-09-08T21:15:00Z,yes
A-Machine-Learning-Framework-for-Detecting-Hate-Speech-and-Fake-Narratives-in-Hindi-English-Tweets,Knnivedh/A-Machine-Learning-Framework-for-Detecting-Hate-Speech-and-Fake-Narratives-in-Hindi-English-Tweets,A Machine Learning Framework for Detecting Hate Speech and Fake Narratives in Hindi-English Tweets,2024-11-30T12:43:20Z,2025-09-04T16:16:51Z,yes
Sentry,Andrew-Gan/Sentry,An end-to-end GPU framework for authenticating machine learning artifacts.,2024-12-06T01:29:24Z,2025-09-01T21:47:14Z,yes
pamiq-core,MLShukai/pamiq-core,Framework for building AI agents with real-time adaptive learning capabilities.,2024-12-10T05:45:44Z,2025-09-15T19:20:33Z,yes
Weather-Research-,sakshikrai/Weather-Research-,INTEGRATED METEOROLOGICAL SENSING: A SYNERGISTIC FRAMEWORK OF IOT-DRIVEN WEATHER STATIONS AND ADVANCED MACHINE LEARNING ALGORITHMS,2025-01-13T17:34:12Z,2025-09-08T08:38:21Z,yes
waveform-prediction,ahsnuet/waveform-prediction,Harnessing Machine Learning Framework for Data-Driven Predictive Waveform Optimization in Piezoelectric Inkjet Printing Utilizing Multi-Material Inks for Enhanced Droplet Control,2025-01-17T07:13:48Z,2025-09-18T11:02:03Z,yes
lamppp,clay-arras/lamppp,"lamp++ fast and lightweight machine learning framework in cpp, supporting tensors and autograd. includes implementations of basic neural networks",2025-01-21T04:38:05Z,2025-08-24T16:41:40Z,yes
modelcraft,arpans2112/modelcraft,"ModelCraft is an open-source, end-to-end machine learning framework designed to simplify and accelerate the development, training, and deployment of ML models. It provides a streamlined workflow for building scalable, production-ready machine learning applications across industries such as finance, healthcare, and e-commerc",2025-02-03T00:56:07Z,2025-09-15T02:59:54Z,yes
QuantTradeAI,AKKI0511/QuantTradeAI,A comprehensive machine learning framework for quantitative trading strategies,2025-02-08T03:39:44Z,2025-09-06T21:37:04Z,yes
oikan,silvermete0r/oikan,"OIKAN is a neuro-symbolic machine learning framework inspired by Kolmogorov-Arnold representation theorem. It combines the power of modern neural networks with techniques for extracting clear, interpretable symbolic formulas from data. OIKAN is designed to make machine learning models both accurate and Interpretable.",2025-02-12T18:29:12Z,2025-09-06T10:55:52Z,yes
OptimML-Framework,AndresACV/OptimML-Framework,"A comprehensive machine learning framework that automates model selection and hyperparameter optimization using genetic algorithms and exhaustive search methods. Features an interactive Streamlit dashboard for visualizing model performance, comparing algorithms, and exporting results to Excel.",2025-03-26T06:26:29Z,2025-08-27T19:17:28Z,yes
share_wgpu_between_bevy_and_burn,janhohenheim/share_wgpu_between_bevy_and_burn,A minimal example of how to share a common wgpu device between the Bevy game engine and the Burn machine learning framework,2025-03-26T19:50:21Z,2025-09-18T13:56:56Z,yes
Sake,is-leeroy-jenkins/Sake,"A modular machine learning framework for budget execution & data analysis built in Python with Scikit, XGBoost, PyTorch, and TensorFlow. ",2025-04-06T14:40:10Z,2025-09-03T12:32:20Z,yes
property-driven-ml,tflinkow/property-driven-ml,"A generalised framework for property-driven machine learning, combining input region specification via hyper-rectangles with differentiable logics to compile logical constraints into loss.",2025-04-23T20:33:45Z,2025-09-18T11:08:40Z,yes
gospel,fullscreen-triangle/gospel,"Framework  for comprehensive variant detection in whole genome sequences using advanced machine learning models for cross domain pattern recognition in fitness, pharmacogenetics and nutritional aspects of sprint running",2025-04-25T00:01:52Z,2025-09-12T01:09:13Z,yes
PredicTick,mrturo/PredicTick,Framework for forecasting market direction using technical indicators and machine learning.,2025-04-26T21:24:50Z,2025-09-20T03:39:07Z,yes
Space-Radiation-Tolerant,r0nlt/Space-Radiation-Tolerant,"Space Labs AI presents: A radiation-tolerant machine learning framework enabling neural networks to operate reliably in space environments. Features adaptive protection, Reed-Solomon error correction, and breakthrough architecture optimizations that improve performance under radiation.",2025-05-02T10:04:34Z,2025-09-10T18:54:58Z,yes
astrogea,FisGeoUnipg/astrogea,AstroGea is a Python-based framework designed to bridge the realms of astrophysics and geoscience through advanced machine learning and intuitive data visualization,2025-05-06T10:57:28Z,2025-09-04T07:52:43Z,yes
Fepfm,Zong-my/Fepfm,Fepfm: A Post-Disturbance Frequency Extremes Prediction Framework for Power Systems Based on Trustworthy Machine Learning,2025-05-09T20:00:46Z,2025-09-09T04:48:15Z,yes
mloptimizer,AntonioRamos11/mloptimizer,"MLOptimizer is a comprehensive framework for automatically generating optimized machine learning models while capturing detailed hardware performance metrics. It provides a distributed system for model training, hyperparameter optimization, and hardware resource monitoring.",2025-05-10T08:24:05Z,2025-08-15T05:53:55Z,yes
AsTRiQue,prokophanzl/AsTRiQue,ASk The RIght QUEstions: An active machine learning framework for perception experiments,2025-05-12T13:28:14Z,2025-09-10T07:52:10Z,yes
NBTest,seal-research/NBTest,A regression testing framework for Jupyter Notebooks used for Machine Learning tasks,2025-05-15T21:36:11Z,2025-09-16T19:41:00Z,yes
NeuroForge,slavatlsn/NeuroForge,A framework that allows to perform machine learning on embedded devices. Light and efficient,2025-05-23T19:25:00Z,2025-09-04T08:23:18Z,yes
PumpkinSeeds-ML-project,manchemshunmadhurisuryaja/PumpkinSeeds-ML-project,An Innovative Ensemble Machine Learning  Framework for  Pumpkin Seeds Classification System using the  Forward  Sequential Minimum Redundancy  Maximum Relevance Feature Engineering,2025-05-25T10:54:34Z,2025-08-30T06:35:54Z,yes
ml-ecolyzer,JomaMinoza/ml-ecolyzer,ML-EcoLyzer: Machine Learning Environmental Impact Analysis Framework,2025-05-27T22:17:30Z,2025-08-20T01:55:02Z,yes
nba-stats-prediction,dh-dz/nba-stats-prediction, A machine learningdriven framework for predicting NBA game outcomes and designing a profitable betting strategy on moneyline bets.,2025-05-30T16:39:33Z,2025-08-28T19:31:44Z,yes
merlin,merlinquantum/merlin,Photonic Quantum Machine Learning Framework,2025-06-06T12:21:57Z,2025-09-19T16:28:45Z,yes
CryptureVault-,CryptureVauIt/CryptureVault-,"AI framework for the CryptureVault ecosystem  blending machine learning with on-chain analytics to power secure tracking, smart predictions, and vault-grade intelligence",2025-06-19T13:57:13Z,2025-09-17T11:39:02Z,yes
PhaseForge,dogusariturk/PhaseForge,"PhaseForge is a framework for high-throughput alloy phase diagram prediction using machine learning interatomic potentials (MLIPs) integrated with ATAT and CALPHAD modeling. Includes tools for structure relaxation, molecular dynamics, and TDB generation.",2025-06-20T00:59:50Z,2025-09-12T19:46:09Z,yes
A-Machine-Learning-Framework-for-Predicting-Cancer-Risk-in-Type-2-Diabetes,bakhita11/A-Machine-Learning-Framework-for-Predicting-Cancer-Risk-in-Type-2-Diabetes,,2025-07-01T05:39:36Z,2025-09-13T21:48:31Z,yes
data-science-r-section,Andru-1987/data-science-r-section,"""Modelos de data science con R como lenguaje de programacion y sus frameworks para machine learning""",2025-07-02T09:31:58Z,2025-08-27T12:27:24Z,yes
ProgrammerProductivityMeasurement,BellowAverage/ProgrammerProductivityMeasurement,A programmer productivity (DevOps) measurement tool that uses an innovative machine learning framework based on torque clustering and DORA metrics.,2025-07-04T20:41:23Z,2025-08-24T23:32:44Z,yes
TinyTorch,MLSysBook/TinyTorch,TinyTorch is a minimalist framework for building machine learning systems from scratchfrom tensors to systems.,2025-07-09T02:47:00Z,2025-09-18T18:19:50Z,yes
LEMONsc,Milo-Jsb/LEMONsc,Framework for experiments regarding the mass estimation of massive objects in astrophysical collision-driven systems using machine learning models,2025-07-11T02:07:25Z,2025-09-17T13:37:35Z,yes
Integrated-ML-with-NLP-framework-for-Drug-Recommendation-System-,Nikhil30072/Integrated-ML-with-NLP-framework-for-Drug-Recommendation-System-,Machine Learning,2025-07-14T10:09:51Z,2025-08-20T05:29:09Z,yes
GRB-ML,Adrita-Khan/GRB-ML,Machine Learning-based framework for redshift estimation and cosmological parameter inference using Gamma-Ray Bursts as potential standard candles.,2025-07-14T11:45:45Z,2025-09-05T16:43:10Z,yes
Discount-and-Campaign-Optimization-Framework-DISCOF-,Rutuja-117/Discount-and-Campaign-Optimization-Framework-DISCOF-,"A machine learning framework that personalizes discount strategies at the user-product level and forecasts campaign outcomes such as GMV, CVR, and Margin.",2025-07-16T10:35:56Z,2025-08-19T07:05:04Z,yes
ChromeCRISPR,Daneshpajouh/ChromeCRISPR,Hybrid Machine Learning Framework for CRISPR/Cas9 On-Target Activity Prediction,2025-07-17T23:10:47Z,2025-09-12T02:44:46Z,yes
E2E,XIAOJIE0519/E2E,"E2E (Easy to Ensemble) is a novel R package designed to provide a comprehensive and flexible framework for ensemble machine learning, specifically tailored for medical applications like diagnosis and prognosis.",2025-07-19T13:32:31Z,2025-09-02T07:24:26Z,yes
Chonky,is-leeroy-jenkins/Chonky,A text-processing framework for machine-learning workflows based in python  ,2025-07-21T15:36:24Z,2025-09-17T16:28:26Z,yes
Deep-Learning-Framework-for-Acoustic-Anomaly-Detection-in-Industrial-Machines,sarweshwaran-rs/Deep-Learning-Framework-for-Acoustic-Anomaly-Detection-in-Industrial-Machines,,2025-07-25T07:42:07Z,2025-09-15T07:47:19Z,yes
unified-ai-library,KodeCharya/unified-ai-library,"A powerful and extensible deep learning + machine learning + NLP framework built in Python. Designed to be educational, modular, and production-ready.",2025-07-28T06:24:37Z,2025-08-26T13:37:49Z,yes
cloud-security-ml-detection,abdulrhmanAtassi/cloud-security-ml-detection,Machine Learning framework for cloud security threat detection with realistic performance evaluation and data leakage prevention,2025-07-30T11:26:19Z,2025-08-16T10:53:55Z,yes
MORSE,naikp13/MORSE,MORSE (Model Optimization tools for Remote Sensing Data Analysis) is a Python-based framework for optimising machine learning models for multi-modal remote sensing data.,2025-08-01T13:05:35Z,2025-08-17T11:29:43Z,yes
MScProject,manguyen670/MScProject,A Hybrid Framework for Money Laundering Detection: Integrating Machine Learning Predictions with Graph-Based Smurfing Pattern Analysis,2025-08-01T15:01:10Z,2025-08-28T17:54:40Z,yes
exstraqt,phd-mht/exstraqt,A supervised machine learning framework for identifying money laundering transactions in bank data.,2025-08-02T10:37:14Z,2025-08-18T06:42:28Z,yes
CruxML,JagjeevanAK/CruxML,(Under-Development) A minified Machine Learning and Deep learning Framework/Library.,2025-08-02T17:51:06Z,2025-09-10T19:16:50Z,yes
PhonoMatic,huiju-lee/PhonoMatic,A high-throughput framework for automated harmonic and anharmonic phonon calculations using DFT and machine learning interatomic potentials (MLIPs).,2025-08-07T10:27:48Z,2025-09-13T23:05:51Z,yes
Contaminant-Transport-ML,gstinoco/Contaminant-Transport-ML,"Advanced computational framework combining numerical modeling of contaminant transport with machine learning for environmental risk assessment. Features 2D advection-diffusion simulation, multi-algorithm ML classification, and comprehensive visualization tools.",2025-08-08T14:20:05Z,2025-09-09T19:55:59Z,yes
