name,full_name,description,created_at,pushed_at,is_framework
PSO-SVR-GMPEs,l123qh/PSO-SVR-GMPEs,"A near-fault ground-motion prediction equations for constant-strength relative input energy based on machine learning  A support vector regression (SVR) framework is employed to predict constant-strength relative input energy, with model hyperparameters globally optimized using the particle swarm optimization (PSO) algorithm.",2026-06-17T07:26:30Z,2026-06-17T07:29:43Z,yes
BlockWave,Michel66/BlockWave,"Self-healing, adaptive architecture integrates machine learning and real-time data streaming across highly-distributed cloud-agnostic infrastructure frameworks.",2026-06-17T07:26:31Z,2026-06-17T07:27:23Z,yes
A-REFINED-MACHINE-LEARNING-SENSOR-FUSION-FRAMEWORK-FOR-HIGH-FIDELITY-VEHICLE-ACCIDENT-CLASSIFICATION,DevrajShukla45/A-REFINED-MACHINE-LEARNING-SENSOR-FUSION-FRAMEWORK-FOR-HIGH-FIDELITY-VEHICLE-ACCIDENT-CLASSIFICATION,,2026-06-17T09:24:54Z,2026-06-17T10:01:31Z,yes
credit-risk-modeling-stress-testing,khushikakani/credit-risk-modeling-stress-testing,"End-to-end credit risk assessment framework using machine learning, stress testing, and Expected Credit Loss (ECL) modeling.",2026-06-17T09:51:29Z,2026-06-17T09:59:35Z,yes
hybrid-ransomware-defense-framework,Haziq-Jasni/hybrid-ransomware-defense-framework,Research and structural design for a Hybrid Ransomware Defense Framework integrating dual-model machine learning and Zero Trust Architecture,2026-06-17T16:44:10Z,2026-06-17T16:49:34Z,yes
BlockBase,Michel66/BlockBase,"Hyper-Converged Edge Computing Architecture Enabling Auto-Scaling, Real-Time Machine-Learning, and Intelligent Fault-Tolerant Framework.",2026-06-17T16:52:15Z,2026-06-17T16:53:11Z,yes
Binary-Regression-3D-Objects-using-ML,NainitharaoB/Binary-Regression-3D-Objects-using-ML,A computationally efficient 3D object analysis framework that uses digital holographic 2D phase data and traditional Machine Learning regressors to predict structural object-pair relationships.,2026-06-17T17:11:12Z,2026-06-17T17:17:31Z,yes
Machine-Learning-in-NeuroImaging,saeed-soleimani98/Machine-Learning-in-NeuroImaging,"An advanced computational framework for translating high-dimensional neurobiological data into predictive insights, focusing on robust feature engineering and reproducible machine learning pipelines in clinical neuroscience.",2026-06-17T19:14:33Z,2026-06-18T08:25:53Z,yes
rental-yields-in-Dubai-real-estate-market,ashanp/rental-yields-in-Dubai-real-estate-market,Machine Learning-based screening framework aimed at predicting rental yields in Dubai's real estate market,2026-06-18T03:23:47Z,2026-06-18T03:24:17Z,yes
Mantle,shivasankarka/Mantle,A Mojo-native machine learning framework built from the ground up for performance and flexibility.,2026-06-18T07:00:17Z,2026-06-18T07:20:40Z,yes
BTech_3MiniProject,SaiKarthik807/BTech_3MiniProject,SCALABLE AND ADAPTABLE MACHINE LEARNING FRAMEWORK FOR INDUSTRIAL AUTOMATION IN SMART PRODUCTION SYSTEMS,2026-06-18T08:46:39Z,2026-06-18T08:47:50Z,yes
Multimodal-AI,Sanidhya-pawar/Multimodal-AI,"A comprehensive end-to-end Multimodal Machine Learning Framework designed to benchmark, compare, and deploy AI models across multiple data modalities including Text, Image, Audio, Video, and Tabular/Sensor data, allowing each modality to be developed, tested, and extended independently while maintaining a common evaluation and deployment pipeline.",2026-06-18T10:39:26Z,2026-06-19T07:54:20Z,yes
Neural-Network-From-Scratch,South-EastOfficial/Neural-Network-From-Scratch,"Implemented a feedforward neural network from scratch using Python and NumPy, including forward propagation, backpropagation, gradient descent, and training without machine-learning frameworks such as TensorFlow or PyTorch.",2026-06-18T10:46:22Z,2026-06-18T11:14:48Z,yes
CreditCardFraudDetection,aadyamoh/CreditCardFraudDetection,An end-to-end Machine Learning system implementing a custom Random Forest ensemble framework to classify fraudulent credit card transactions.,2026-06-18T12:50:20Z,2026-06-18T12:52:38Z,yes
ExplainableAIWithDiabetes,HusnainDilawar/ExplainableAIWithDiabetes,"Hybrid Explainable AI framework for diabetes prediction combining ensemble machine learning, fuzzy logic, SHAP, and LIME. Delivers accurate risk assessment with transparent, human-interpretable explanations to support clinical decision-making and improve trust in healthcare AI systems.",2026-06-18T13:04:10Z,2026-06-18T13:11:07Z,yes
RNA-Secondary-Structure-Prediction,mitchell-logann/RNA-Secondary-Structure-Prediction,"Machine learning framework for RNA secondary structure prediction using contact map generation, ViennaRNA benchmarking, and Transformer-based deep learning models.",2026-06-18T15:33:54Z,2026-06-19T14:24:03Z,yes
ims680-hybrid-anomaly-detection,vikrantdete/ims680-hybrid-anomaly-detection,"Hybrid SPC, machine learning, and LLM-assisted anomaly detection framework for the Tennessee Eastman Process dataset.",2026-06-18T16:12:01Z,2026-06-18T16:12:02Z,yes
user-centric-ml-framework-for-cyber-security-opearations-center,Saiteja1807200/user-centric-ml-framework-for-cyber-security-opearations-center,a user centric machine learning framework for cybersecurity operations centers to reduce false positives and improve threat detection using machine learning,2026-06-18T16:35:42Z,2026-06-18T16:35:43Z,yes
Credit-Risk-Management-and-Portfolio-Optimization,ikaustav/Credit-Risk-Management-and-Portfolio-Optimization,"An end-to-end machine learning framework for credit risk assessment, explainable lending decisions, customer segmentation, and portfolio optimization using LightGBM and SHAP. Developed as part of the IIT Guwahati project initiative.",2026-06-18T17:09:08Z,2026-06-19T03:11:16Z,yes
AI-Fake-Account-Detection-System,yashasvii6/AI-Fake-Account-Detection-System,"An intelligent machine learning framework for detecting fake social media accounts through behavioral, content, network, and metadata analysis.",2026-06-18T17:48:06Z,2026-06-18T17:50:27Z,yes
AI-Optimization-lab,mgupta97/AI-Optimization-lab,"AI-enabled optimization framework integrating machine learning, uncertainty quantification, and mathematical optimization for workforce planning under uncertainty.",2026-06-18T19:00:57Z,2026-06-18T19:40:12Z,yes
ProbioticMAG,NatalieGo/ProbioticMAG,Interpretable machine learning framework for probiotic potential assessment of metagenome-assembled genomes,2026-06-18T19:17:38Z,2026-06-19T20:13:48Z,yes
Comprehensive-Dimensionality-Reduction-Frameworks-PCA-vs.-LDA-vs.-Kernel-PCA,AtaForouzesh/Comprehensive-Dimensionality-Reduction-Frameworks-PCA-vs.-LDA-vs.-Kernel-PCA,"A comprehensive machine learning benchmark comparing Unsupervised Linear (PCA), Supervised Linear (LDA), and Non-Linear (Kernel PCA) dimensionality reduction techniques.",2026-06-18T21:06:04Z,2026-06-18T21:46:39Z,yes
unsupervised-clustering-benchmarks,mrhashx/unsupervised-clustering-benchmarks,"An end-to-end unsupervised machine learning framework benchmarking K-Means, Agglomerative Hierarchical, and DBSCAN clustering topologies on the Iris dataset using Silhouette and Davies-Bouldin metrics.",2026-06-18T21:24:40Z,2026-06-18T21:33:02Z,yes
Pseudo-Absence_Sample_Generator,HoomanAI/Pseudo-Absence_Sample_Generator,"A framework for generating and evaluating pseudo-absence samples for presence-only machine learning and spatial prediction tasks, with support for multiple sampling strategies, spatial validation, and comparative performance analysis.",2026-06-18T21:34:13Z,2026-06-18T21:37:11Z,yes
ml-framework,d3lacroiks/ml-framework,Framework genrico de Machine Learning para clasificacin binaria,2026-06-18T22:40:31Z,2026-06-19T02:49:19Z,yes
energy-poverty-ml-project,AyeEiKo/energy-poverty-ml-project,"A comparative machine learning framework for multidimensional energy poverty prediction using DHS datasets, evaluating traditional ML, deep learning models, and the effect of wealth index inclusion.",2026-06-19T01:54:44Z,2026-06-19T02:26:07Z,yes
Rare-Event-Simulation-Framework,avi-nz/Rare-Event-Simulation-Framework,"Estimating extremely unlikely events using Monte Carlo simulation, importance sampling, adaptive sampling, and modern machine learning methods.",2026-06-19T03:53:57Z,2026-06-20T00:21:29Z,yes
XAI-Liver-Disease-Prediction,PRANAYSHIRULKAR/XAI-Liver-Disease-Prediction,"Explainable AI (XAI) system for early liver disease prediction using Machine Learning, leveraging SHAP and LIME frameworks to deliver transparent, clinically interpretable diagnostic insights.",2026-06-19T06:11:28Z,2026-06-19T06:22:44Z,yes
EXPLAINABLE-AI-FOR-BLACK-BOX-CREDICT-SCORING.-THE-SHAP-BASED-TRANSPERANCY-FAIRNESS-AND-FRAMEWORK,bharathselvam2005-hub/EXPLAINABLE-AI-FOR-BLACK-BOX-CREDICT-SCORING.-THE-SHAP-BASED-TRANSPERANCY-FAIRNESS-AND-FRAMEWORK,"Explainable AI for Black-Box Credit Scoring: A SHAP-Based Transparency, Fairness, and Interpretability Framework that enhances trust in machine learning credit risk predictions through feature attribution, bias detection, fairness evaluation, and model explainability.",2026-06-19T06:37:34Z,2026-06-19T06:40:59Z,yes
Digital-Twin-Metro,27Shambhavi/Digital-Twin-Metro,"Machine Learning-driven Digital Twin framework for traffic prediction and mitigation in metro construction zones using SUMO simulation, XGBoost, Random Forest, LSTM, and GRU.",2026-06-19T07:40:20Z,2026-06-19T09:24:29Z,yes
A-Resource-Aware-Machine-Learning-and-Quantum-Framework-for-Depression-Detection-,cavik81/A-Resource-Aware-Machine-Learning-and-Quantum-Framework-for-Depression-Detection-,Dabcon paper,2026-06-19T07:55:42Z,2026-06-19T09:37:41Z,yes
AI-Network-Intrusion-Detector,karan150205/AI-Network-Intrusion-Detector,An end-to-end Machine Learning network intrusion detector featuring a live-streaming Streamlit dashboard integrated with the MITRE ATT&CK framework.,2026-06-19T10:24:55Z,2026-06-19T10:33:38Z,yes
ethiopian-scales,seifukaleab/ethiopian-scales,"Machine Learning framework for EMIR audio classification using MFCC, Chroma, Spectral Features, SVM, Random Forest, XGBoost, and SHAP-based explainability.",2026-06-19T11:16:51Z,2026-06-19T11:36:39Z,yes
federated-mnist,Hadiqa-Ehsan/federated-mnist,"A complete, framework-free implementation of Federated Learning for privacy-preserving machine learning.",2026-06-19T12:23:02Z,2026-06-19T12:33:34Z,yes
Adaptive-Residual-Partitioning-Framework,jassinghjatt/Adaptive-Residual-Partitioning-Framework,"Iterative machine-learning framework that partitions residuals into dynamic categories, trains specialized predictors for each category, and updates the partitions during learning to improve structured residual modelling.",2026-06-19T12:32:31Z,2026-06-19T17:40:46Z,yes
portfolio-optimization,14haripriya-cyber/portfolio-optimization,Quantitative portfolio optimization framework for NIFTY 50 stocks by integrating machine learning-based return forecasting with Modern Portfolio Theory (MPT). ,2026-06-19T14:26:53Z,2026-06-19T14:34:23Z,yes
synth-engine,myranarka/synth-engine,"A comprehensive framework for optimizing machine learning model training, dependency resolution, and conditional data generation.",2026-06-19T15:11:02Z,2026-06-19T15:11:06Z,yes
framework-benchmark-suite,leonardo28dias/framework-benchmark-suite,"A declarative, validation-first data refinery pipeline for automated machine learning benchmarking.",2026-06-19T16:25:05Z,2026-06-19T17:02:04Z,yes
HAB_Phase1,gourab-saha010/HAB_Phase1,"Machine learning framework for CHAB Toxicity Risk Prediction for the SacramentoSan Joaquin Delta. Analysis scripts include feature combination screening, cross-validation and hyperparameter optimization, partial dependence analysis, and leave-one-station-out spatial validation.",2026-06-19T17:18:34Z,2026-06-19T18:52:44Z,yes
AI-Carbon-Footprint-Prediction,SameeulKhondokerJisan/AI-Carbon-Footprint-Prediction,"An AI-powered machine learning framework for predicting individual carbon footprints using behavioral and energy consumption data, featuring XGBoost, Random Forest, MLP, and SHAP-based explainability.",2026-06-19T17:46:56Z,2026-06-19T17:49:23Z,yes
insurance-risk-threshold-optimization-porto-seguro-risk-assessment,Sreten56/insurance-risk-threshold-optimization-porto-seguro-risk-assessment,A cost-sensitive machine learning framework using Random Forest and XGBoost to minimize financial losses under extreme class imbalance.,2026-06-19T18:02:44Z,2026-06-19T18:06:54Z,yes
single-cell-concept-interpretability,Sally332/single-cell-concept-interpretability,A rigorous evaluation framework for interpretable machine learning in single-cell transcriptomics.,2026-06-19T19:01:47Z,2026-06-19T20:06:06Z,yes
GNSS-Based-Precipitable-Water-Prediction-using-Machine-Learning,ManthanDixit089/GNSS-Based-Precipitable-Water-Prediction-using-Machine-Learning,"Developed a machine learning framework for predicting atmospheric Precipitable Water (PW) using GNSS-derived Zenith Total Delay (ZTD), spatial coordinates, and temporal features. Implemented Random Forest, XGBoost, time-series forecasting, and spatial interpolation techniques for meteorological analysis.",2026-06-19T21:19:37Z,2026-06-19T21:42:48Z,yes
CausalFin-Causal-Inference-Double-Machine-Learning-DML-for-Quantitative-Trading,DGskywalker/CausalFin-Causal-Inference-Double-Machine-Learning-DML-for-Quantitative-Trading,"An advanced causal AI framework built from scratch to evaluate quantitative trading strategies. Implements Double Machine Learning (DML), HMM market regimes, and NOTEARS causal discovery to bypass backtest overfitting using real SPY & VIX data up to 2025.",2026-06-20T07:32:30Z,2026-06-20T07:32:30Z,yes
SPO-Portfolio-Optimization,Shridipa/SPO-Portfolio-Optimization,"An end-to-end framework integrating Machine Learning, Portfolio Optimization, and Differentiable Programming. ",2026-06-20T07:48:16Z,2026-06-20T07:53:06Z,yes
HydroGraph,JihoTheCoder0607/HydroGraph,"HydroGraph is an AI-powered framework for assessing pipe risk and maintenance priority in Ottawa's water infrastructure network using machine learning, engineering heuristics, and graph-based risk propagation.",2026-06-20T08:54:34Z,2026-06-20T08:59:30Z,yes
LucidEpoch,MAZ-MG15/LucidEpoch,LucidEpoch: A machine learning framework and Streamlit dashboard for predicting and explaining sleep disorder risks using wearable data.,2026-06-20T09:42:45Z,2026-06-20T09:43:36Z,yes
