framework,full_name,description
,lkx0127/MyProjects,"This portfolio website showcases my key projects in AWS cloud development, web development, machine learning, mobile app development, and RPA. Each project includes a detailed description and a video explanation, allowing users to explore the projects purpose and technologies used, such as AWS services, web frameworks, and machine learning models."
,hsuehyt/CheckCudaVersion,This repository contains a Python script to check the installed CUDA version using PyTorch. It helps ensure compatibility with machine learning frameworks that require GPU acceleration.
,bonkooo/iris-flower-prediction,"Web application that uses machine learning to predict the species of an iris flower based on input parameters such as petal length, petal width, sepal length, and sepal width. It uses Flask, a Python web framework, to create a user-friendly interface for making predictions using a trained machine learning model."
,luca-vita/Implementing-core-Machine-Learning-models-to-predict-the-popularity-of-online-news-articles,From scratch and framework free implementation of core machine learning models
,alexsanderthorne/formacaoMachineLearningSpecialist,"Neste repositrio so apresentadas tcnicas avanadas  exibindo o potencial ilimitado de algoritmos de Machine Learning, envolvendo modelos de Deep Learning e outras tcnicas do estado-da-arte, tcnicas de aprendizado supervisionado e no supervisionado, modelos implementados em Python e R, os principais frameworks e bibliotecas."
,Shivam67678/Car-Price-Prediction,The Car Price Prediction project aims to develop a machine learning model that predicts the price of a car based on various features. This project involves building a Linear Regression model to make the predictions and deploying the model using the Flask framework to create a web application 
,nazil-the-professor/Machine-Learning_Diabetes_Prediction_system,Machine Learning Diabetes Prediction System using django framework
,chrispfae/ART-SM,Fragment-based machine learning framework for backmapping CG structures to atomistic resolution
,easyAGI/.github,easy Augmented Generative Intelligence LLM enhancement framework
,devpsiarch/Nero,A framework for machine learning written from scratch in C 
,jaseempaloth/nifty50-index-ml-forecasting,"A project implementing machine learning techniques to forecast the Nifty 50 index using a Random Forest classifier. It involves data preprocessing, feature engineering, model training, and evaluation, along with a backtesting framework to assess prediction accuracy."
,entelecheia/hyfi-ml,A Python package that extends the Hydra Fast Interface (HyFI) framework with machine learning capabilities.
,tum-pbs/PhiFlow,A differentiable PDE solving framework for machine learning
,AI-fatima/Mastering-AI-02---Python-Libraries-Frameworks-for-AI,"Welcome to the `Mastering AI 02 - Python Libraries/Frameworks for AI` repository! This repository aims to provide a detailed and structured overview of essential Python libraries and frameworks for AI, including data handling, machine learning, deep learning, and more."
,justin-vocke/machine-learning,"ML/DL practice with Python and popular frameworks like sklearn, numpy, pandas, tensorflow, keras, etc."
,ThalesGroup/secure-ml,"Explore ThalesGroup's comprehensive framework for secure machine learning systems on this repository. Developed by Thales experts, this framework encompasses essential security requirements, guidelines, tools, and privacy recommendations tailored specifically for machine learning applications."
,generalaimodels/hffinetuning,"hfopensource is an open-source repository aimed at simplifying the process of fine-tuning machine learning models on custom datasets. The project provides a framework that allows users to take pre-trained models and adapt them to specific tasks, making it highly versatile for a variety of AI applications. "
,AkiRusProd/numpy-nn-model,"ustom torch style machine learning framework with automatic differentiation implemented on numpy, allows build GANs, VAEs, etc."
,Elhamn20/Synthetic-Data-Generation,A Machine Learning Framework Coupled with Data Augmentation Algorithms to Speed up the Diagnosis of Coronary Artery Disease 
,Sammybounce/AutoIntel_prediction_project_frontend,"Using Machine Learning to create a predictive framework for the UK Automotive industry, and then implementing the created models with a user interface."
,TimothyOlsson/G.U.A.R.D.I.A.N,An experimental machine learning framework
,abinashsahoo007/Campus-Placement-Prediction,The Campus Placement Prediction project is a machine learning-based application built using Python and the Django framework. The goal of this project is to predict whether a student is likely to be placed during campus recruitment based on their academic and personal data.
,NikhilShankar/CSCN8010-FoundationsOfMachineLearning,Foundations of Machine Learning Frameworks
,JackVittori/QML-early_exit,A repositories that contains strategies about how to implement Early-Exit in a Quantum Machine Learning Framework 
,frost-beta/node-mlx,Machine learning framework for Node.js.
,AIBreeding/EXGEP,EXGEP: a framework for predicting genotype-by-environment interactions using ensembles of explainable machine-learning models
,Ku0904/Portfolio-kunal-rawat,"Showcasing my projects and skills in web development, data analysis, and machine learning, leveraging modern technologies and frameworks."
,IntelPython/scikit-learn_bench,"scikit-learn_bench benchmarks various implementations of machine learning algorithms across data analytics frameworks. It currently support the scikit-learn, DAAL4PY, cuML, and XGBoost frameworks for commonly used machine learning algorithms."
,dotnet/machinelearning,ML.NET is an open source and cross-platform machine learning framework for .NET.
,LeoCossio/Evidencia2MachineLearning_A01753898,"Evidencia 2 del mdulo de aprendizaje mquina. Consiste en hacer uso de un modelo de machine learning utilizando un Framework, en este caso: Scikit-Learn en Python."
,SimonLarsen/frogbox,An opinionated machine learning framework.
,vishalharkal15/BERT-model-ML-NLP-,BERT language model is an open source machine learning framework for natural language processing (NLP). BERT is designed to help computers understand the meaning of ambiguous language in text by using surrounding text to establish context.
,Mir-Ilham/ML-Service,Machine learning web service implemented using Django REST Framework
,neoml-lib/neoml,Machine learning framework for both deep learning and traditional algorithms
,RauPro/Torogoz-Trade-Engine,Torogoz Trade Engine is a trading framework for MT5 that uses machine learning and personalized indicators.
,ppdebreuck/modnet,MODNet: a framework for machine learning materials properties
,ShravaniVitekar/Machine-Learning-Project,"Social Network Advertisement Prediction using machine learning classifier algorithm.In that we used framework such as Flask ,Bootstrap."
,meghalbothra/Portfolio,"This repository houses my personal portfolio website, featuring a blend of expertise in web development and machine learning. Discover innovative projects, crafted with technologies like React, Node.js and Python frameworks. Explore how I merge creative web design with intelligent functionality to deliver impactful solutions."
,KOSASIH-CORP/nexuscore-smart-city-platform,"NexusCore is a comprehensive, AI-powered platform that integrates IoT devices, blockchain technology, and machine learning to create a hybrid, cyber-physical system for smart cities. This project would involve developing a robust IoT framework, AI-driven analytics, and a decentralized, blockchain-based data management system."
,j03m/machine-learning-intuitions,A free book I started writing aimed at helping folks using machine learning frameworks everyday have a better intuition about what is happening under the hood!
,mryogeshneupane/machinelearningframeworksem1,This repo handles all the projects for subject Machine Learning Framework from Semester 1.
,awslabs/graphstorm,Enterprise graph machine learning framework for billion-scale graphs for ML scientists and data scientists.
,yogeshtarone/Design-and-Implementation-of-Diabetes-Detection-using-Machine-Learning,"A robust framework was proposed where outlier rejection, filling the missing values, data standardization, K-fold validation, and different Machine Learning (ML) classifiers were used. Finally, to improve the result, weighted ensembling of different ML models also proposed."
,adster283/ML-Frameworks,Implementing machine learning regression and classification algorithms in python.
,dobesjan/machine-learning,Machine learning framework with web interface
,microsoft/DeepGNN,DeepGNN is a framework for training machine learning models on large scale graph data.
,DeLaphante/CynkyAutomation,"Powered by Selenium, Specflow and ML.Net with detailed HTML reporting, Machine Learning Analysis and Logging capabilities - CynkyAutomation framework can handle any website that is built using AJAX, React, AngularJS, Vue.js, Single Page Applications, Salesforce, Dynamics 365 CRM and many more."
,JSiegel0516/Gesture-Detection,"By employing a dataset containing hundreds of images and videos showcasing various Sign Language gestures, we harness the power leading machine learning framework via Python, to train our model. The system meticulously analyzes the gestures and accurately translates them into corresponding textual outputs displayed on the console."
,rdsea/ROHE,An orchestration framework for End-to-End Machine Learning Serving with Resource Optimization on Heterogeneous Edge
,ivy-llc/ivy,Convert Machine Learning Code Between Frameworks
,inferless/pyannote-speaker-diarization-3.1,"Pyannote/speaker-diarization-3.1 is an open-source toolkit written in Python for speaker diarization, which is the task of determining ""who spoke when"" in an audio recording. It is based on the PyTorch machine learning framework and provides a set of trainable end-to-end neural building blocks that can be combined and jointly optimized."
,tf-encrypted/tf-encrypted,A Framework for Encrypted Machine Learning in TensorFlow
,AlvaroBishop/ML-DL-Projects,"This repository serves as a collection of various Machine Learning and Deep Learning projects that I am currently developing. Each project utilizes frameworks such as Scikit-learn, TensorFlow, and PyTorch to address real-world problems using datasets from platforms like Kaggle."
,stan-dot/awesome-synchrotron,"Curated list of resources, tools, and software projects related to synchrotrons, particle accelerators, and synchrotron radiation, including control frameworks, data acquisition tools, and machine learning applications."
,joecode77/subzero,A machine learning framework for AI enthusiasts.
,Jdewbury/SpectroMIND,"SpectroMIND: A framework for uploading, preprocessing, and training machine learning models on spectral data, designed for seamless integration and advanced analytics."
,saptawtf/AAGP,AAGP: A machine learning framework for prediction of anti-aging peptides using diverse physicochemical and compositional features
,pavenvivek/Machine-Learning-based-Ensemble-Framework-for-Binary-Function-Similarity-Detection,
,nzolman/unified-symmetry-ml,"Code used for ""A unified framework to enforce, discover, and promote symmetry in machine learning"" by Otto et al. "
,Artificial-Intelligence-Computer-Vision/BAI-CVRI-Machine-Learning-Artifitial-Inteligence-Models-Framework-Security-Community-Group,
,recodehive/machine-learning-repos,"A curated list of awesome machine learning frameworks, libraries and software (by language). I"
,Ali-Ghanizadeh/ML-Multi-Objective-Optimization,This repository contains codes of a machine learning predictive framework for multi-objective optimization purpose
,renzh1998/CORA,A zero-copy communication framework for Secure Collaborative Machine Learning over RDMA
,roodriigoooo/Machine-Learning-in-Finance-Exploration,"Exploration of ML applications in finance, drawing inspiration and summarizing the currently available and relevant literature. The objective is to deepen my understanding of key concepts, re-implement them with improvements, and explore alternative, non-widely used frameworks. "
,Boehm92/cagr_framework,Machine learning framework with data generator for CAD meshes and Graph Neural Network Regression
,codecentric-oss/niceml," niceML  is a Python-based MLOps framework designed to streamline the development and maintenance of machine learning projects, offering efficient and scalable pipelines using TensorFlow and Dagster."
,leondavi/NErlNet,Nerlnet is a framework for research and development of distributed machine learning models on IoT
,Shivangimodi1/College_Enquiry_Chabot,"Python is a versatile tool for developing a College Inquiry Chatbot, utilizing advanced technologies like NLP libraries, machine learning frameworks, and database management systems to understand natural language queries, classify intents, and provide personalized responses."
,HackXIt/lvgl-ui-detector,A machine learning project to detect widgets of the LVGL framework from screenshots for test automation
,laca-is/MASPY,A Python Framework for Multi-Agent Programming with Machine Learning
,xavier-orcutt/TrialTranslator-notebooks,"A collection of Jupyter Notebooks demonstrating data cleaning, machine learning model development, and trial emulation for the TrialTranslator framework."
,BhardwajArjit/static_analyzer,"This project aims to provide a comprehensive static analysis framework for detecting common vulnerabilities in Android code (currently only for Java). It uses machine learning models fine-tuned on CodeBERT to detect security issues, suggest fixes, and classify the severity of the vulnerabilities."
,dotnet/machinelearning-samples,"Samples for ML.NET, an open source and cross-platform machine learning framework for .NET."
,778569/Regression-model-selection,"Automated machine learning framework for regression and classification. It supports various regression models, including linear regression, decision trees, and more, with automatic tuning and model selection. In here data set is Combined Cycle Power Plant which included 10000- instances."
,Dojo2024/IPL-API-SERVICE,"This repository hosts an AI-driven service for analyzing and predicting Indian Premier League (IPL) cricket matches, built using the Flask framework. The service leverages machine learning models to provide insights, predictions, and analytics based on historical IPL data."
,jiahzengW/IL-Research-in-PSCs,All machine learning frameworks and codes from IL Research in PSCs
,jysru/ML_Tools,Regular tools for Machine Learning Frameworks such as Pytorch or Tensorflow
,vrorato/stocks-ai,"This code was created using Django framework and machine learning modules in python. It receives a stock symbol, start date and end date as inputs and delivers 3 predictions for the next day, using 3 different machine learning caluclations - "
,markdewing/AI_kernels,Machine learning and AI kernels implemented in various languages and frameworks
,ninpnin/days-since-last-ml-framework,Keep track of the newest machine learning frameworks on GitHub
,CAIYIAHUAI/Optimizing-Diabetes-Classification-with-a-Machine-Learning-Based-Framework,Optimizing Diabetes Classification with a Machine Learning-Based Framework
,imSkyAK/MultiDisease-predictor,This is a Multiple disease predictor website with an interactive user UI . It is based on the continuous machine learning algorithm . It is developed using python language and html templates . It is developed on the Flask framework
,eniocc/viana_ff,"VIANA Forensic Framework is a solution for forensic analysis of video, image, and audio data using neural networks. It provides tools for identification, authentication, and enhancement of multimedia evidence, applying advanced machine learning techniques. Ideal for digital forensics, security, and law enforcement professionals."
,ahmed0moh/Quantum-Binary-Classification,classification model uses a quantum machine learning framework called pennylane to training and fitting the model. 
,Sinasrfz/GUI,Exploring the Stainless-steel Beam-to-column Connections Response: A Hybrid Explainable Machine Learning Framework for Characterization
,alex-w-99/ML-predictive-machinery-maintenance,"A predictive maintenance framework contrasting feed-forward and sequential machine learning models to forecast industrial machinery failures, achieving near-perfect AUROC scores with GRU models."
,fhswf/MLPro,MLPro - The Integrative Middleware Framework for Standardized Machine Learning in Python
,devyanshbatra/TENSOR-FLOW,"TensorFlow is an open-source machine learning framework developed by Google Brain, primarily used for deep learning applications. With TensorFlow, you can build, train, and deploy various machine learning models efficiently."
,cntrvsy/burn-ids,attempt at building a regression model using burn (machine learning framework) using the  UNSW-NB15 dataset
,PRITHIVSAKTHIUR/How-to-run-huggingface-spaces-on-local-machine-demo,"Running Hugging Face Spaces on a local machine / colab T4 GPU involves several steps. Hugging Face Spaces is a platform to host machine learning demos and applications using Streamlit, Gradio, or other frameworks."
,Kartik-3-programmer/Computer-Networks-Project,Strategic Framework for Network Anomaly Detection Using Hybrid Machine Learning
,rajveerb/lotus,Lotus: Characterization of Machine Learning Preprocessing Pipelines via Framework and Hardware Profiling
,s-hironobu/pg_plan_inspector,A framework to monitor and improve the performance of PostgreSQL using Machine Learning methods.
,NavinAnik/Applied-Machine-Learning-Framework,
,bukovszki-viktor/JUSTNature-utils,Auxiliary mechanisms compiled as a machine learning toolkit for the long-term curation of the Monitoring and Evaluating framework.
,izam-mohammed/ML-Tools,"This repository contains a curated collection of machine learning libraries, tools, and frameworks. It's designed to help developers, data scientists, and ML engineers quickly find and integrate powerful resources into their projects."
,unitaryfund/pennylane-qrack,The PennyLane-Qrack plugin integrates the Qrack quantum computing framework with PennyLane's quantum machine learning capabilities.
,JosuaLimbu/hand-landmark,"Hand Landmark is a system for recognizing and tracking key points on the hand using MediaPipe technology, a machine learning and computer vision framework from Google."
,pneff93/ml-frameworks,Playground for machine learning frameworks
,EngMuhammadAtef/Guard-Model,"A content moderation model in AI is a sophisticated framework designed to ensure that online content adheres to community standards and legal guidelines. It leverages machine learning and AI technologies to automatically detect and manage inappropriate content, thereby creating a safer and more respectful online environment."
