framework,full_name,description
,Dalbirsm03/Machine-Learning-Agentic-System-LangChain-Framework,
,Milo-Jsb/LEMONsc,Framework for experiments regarding the mass estimation of massive objects in astrophysical collision-driven systems using machine learning models
,Anushika1234/AI-Driven-Project-Timeline-Forecasting-for-Defence-R-D,"y work focused on developing a predictive framework that integrates analytical methods, clustering algorithms, and machine learning techniques to:  Assess schedule volatility  Forecast Probable Dates of Completion (PDC)  Enhance decision-making in defence R&D project management"
,silvermete0r/oikan,"OIKAN is a neuro-symbolic machine learning framework inspired by Kolmogorov-Arnold representation theorem. It combines the power of modern neural networks with techniques for extracting clear, interpretable symbolic formulas from data. OIKAN is designed to make machine learning models both accurate and Interpretable."
,tensorflow/tensorflow,An Open Source Machine Learning Framework for Everyone
,BharathU2207/airfoil-optimization,A data-driven framework for optimizing low-Reynolds number UAV airfoils using a machine learning surrogate and a genetic algorithm.
,micah-raney/emotive-computing-wgu,Machine Learning project for emotional recognition using a neural net. Running on the Django web framework and using TensorFlow for ML.
,microsoft/DeepGNN,DeepGNN is a framework for training machine learning models on large scale graph data.
,doreenmwangi/Quantifying-Climate-Change-Impacts-on-Global-GDP,"This project builds a predictive modelling framework to assess how climate change affects global GDP. Using World Bank, OWID, and ERA5 data, it applies econometric and machine learning methods to forecast GDP growth under scenarios (Baseline, RCP 2.6, RCP 4.5, 30% CO), with rolling-origin validation and uncertainty analysis."
,vishuRizz/vishuml-docs,VishuML is a comprehensive machine learning library implementing fundamental algorithms from scratch in Python. This library provides educational implementations of popular ML algorithms without relying on external ML frameworks like scikit-learn
,adam-pop/assesment-elec,"A 2-day side project assesment to understand basic machine learning model and frameworks using Liner Regression, Random Forest, and gradient boosting and deploying it in Jupyter and Streamlit."
,zolydiac/Advanced-ML-Enhanced-Test-Failure-Prediction-Framework,This framework demonstrates advanced machine learning techniques including: - Deep learning models for sequential test pattern recognition - Real GitHub API integration for authentic data collection - Ensemble methods with statistical significance testing - Time-series analysis for temporal test behaviour patterns
,BOTRE20/Microsoft,"Dans cet article, nous allons implmenter la prdiction du cours de l'action Microsoft grce  une technique de Machine Learning. Nous utiliserons TensorFlow , un framework de Machine Learning Python open source dvelopp par Google"
,Catjane816/volcanic_prediction,"A machine learning framework for predicting rare extreme volcanic eruptions (VEI  6) using ensemble models, SHAP explainability, and calibrated probability assessment. Features comprehensive rare event detection metrics, baseline comparisons, and publication-quality visualizations for volcanic risk research."
,IAchaos/Hands-On-ML-Frameworks,A series of hands-on projects and code examples for building machine learning applications using industry-standard frameworks.
,sandibrrm/MlflowTracking,"Pioneering machine learning model management architecture for cloud-ready, modern-design analytics framework featuring modern-design capabilities"
,leocodeio/Cropto,"Cropto is a full-stack machine learning-based web application designed to predict crop success based on dependent factors. The frontend is powered by the Remix framework and its advanced data handling,  backend is driven by FastAPI, which supports efficient handling of ML operations, cropto blends modern web technologies and ML algorithms."
,SoyGema/The-Lord-of-The-Words-The-two-frameworks,Translation exploration with Transformers and Machine Learning Experimentation Platfroms
,nmit-1NT22CS108/AdaptiveGuard-Real-Time-Cyber-Threat-Classification-and-Novel-Attack-Detection-Using-AI-ML,"A Intelligent framework that leverages machine learning and advanced anomaly detection to identify both known and zero-day threats in real time. It combines scalable data processing with explainable AI to ensure fast, accurate, and transparent cyber defense."
,PaddlePaddle/Paddle,PArallel Distributed Deep LEarning: Machine Learning Framework from Industrial Practice &
,Professor-G/pyBIA,"Machine learning-based classification framework for detecting spatially extended and diffuse emission in the high redshift universe, using multi-band broadband imaging."
,Ezzio11/sharkpy,A friendly machine learning framework with shark-themed feedback 
,pirinth0403/ML-APTDetection-SmartCity-IoT,"Machine Learningbased framework for detecting Advanced Persistent Threats (APTs) in Smart City IoT environments using LSTM Autoencoder, CNNLSTM, and XGBoost on the Edge-IIoTset dataset."
,fims9000/XAI-CausalLayered,"A research framework for next-generation Explainable AI (XAI 2.0) based on multi-layer neuro-symbolic architectures. The project advances from post-hoc explanations toward embedded causal interpretability, combining machine learning with fuzzy logic, rule extraction, SHAP analysis, and dynamic trust validation (Trust-ADE)."
,nclabteam/FedEasy,"FedEasy is an intuitive powerful yet simple to use Federated Learning framework. Our goal is to streamline the process of setting up and running federated learning experiments with ease, making advanced machine learning techniques accessible to researchers and developers alike."
,khutaleanant/MyProjects," What Youll Find Here:  Python Automation  Scripts for simplifying tasks  Data Science & Analytics  Pandas, NumPy, and Matplotlib-based projects  Machine Learning Models  Using Scikit-Learn and other frameworks  Jupyter Notebooks  Interactive data analysis and visualization"
,Pranita-2145/Machine-Learning,"Contains Machine learning from scratch including all libraries, Algorithms and Frameworks"
,Shreyas7-10/IPL-Outcome-Prediction,Machine learning framework for IPL match outcome prediction and player role segmentation.
,douglasbc/tennis_model,"End-to-end tennis prediction model. Data ingested with Python and transformed with dbt on BigQuery. Model implemented with Google JAX, a Python machine learning framework."
,PVirgil/Quantum-Machine-Learning-QML-Framework-Prototype,
,amd/ryzen-ai-documentation,Onboarding documentation source for the AMD Ryzen AI Software Platform.   The AMD Ryzen AI Software Platform enables developers to take pretrained machine learning models in popular frameworks and run them on laptops powered by AMD Ryzen AI technology.
,pv-is-nrt/pub-pose-to-behavior,Repository for the publication titled - A Machine Learning Framework for Automated Computational Ethology Using Markerless Pose Estimation
,laca-is/MASPY,A Python Framework for Multi-Agent Programming with Machine Learning
,Maruf346/AI-ML-with-python,"This repository contains a collection of Python programs and Jupyter notebooks focusing on Artificial Intelligence (AI) and Machine Learning (ML) algorithms. It covers implementations, experiments, and hands-on code examples using popular libraries and frameworks in Python."
,lukewilliams16/ai-ml-portfolio,"Showcasing a range of machine learning projects from concept to deployment, using a variety of frameworks including TensorFlow"
,BarionLP/MachineLearning,A performant and dynamic MachineLearning framework written in .NET
,is-leeroy-jenkins/Chonky,A text-processing framework for machine-learning workflows based in python  
,sockeye44/transformers," Transformers: the model-definition framework for state-of-the-art machine learning models in text, vision, audio, and multimodal models, for both inference and training. "
,senbarnika/Customer-Segmentation-and-Churn-Prediction,"This is not just another predictive model, it's a strategic weapon for business growth, forged by a fusion of machine learning and actionable intelligence. This project integrates customer segmentation using K-Means clustering with XGBoost for churn prediction, providing a comprehensive framework to identify at-risk customers."
,Faisalse/Intrusion_Detection_Framework_using_Machine_Learning,
,stopdragonn/OECD-COMTOX,"OECD Test Guidelines-based toxicity prediction using machine learning. Comprehensive computational toxicology framework with pre-trained models for genotoxicity, carcinogenicity, acute toxicity, DART, and ecotoxicity endpoints."
,KodeCharya/LSTM-from-scrach,A complete implementation of Long Short-Term Memory (LSTM) neural networks using only Python's standard libraries and NumPy. No external machine learning frameworks required!
,MartijnPetersNL/PhP_Machine_Learning_Basics_No_Framework,PHP files that are related to machine learning with either PHP-ML or Rubix libraries. 
,yididiya1/Forex-Price-Prediction-Using-Machine-Learning-and-Technical-Indicators,"Machine learning framework for Forex prediction using OHLCV data and engineered technical indicators, featuring model training, backtesting, and real-time forecasting with Yahoo Finance data."
,pic-ai-robotic-chemistry/BOMLIP-CSP,"An open-source Python framework that integrates machine learning interatomic  potentials (MLIPs) with a tailored batched optimization strategy, enabling rapid,  unbiased structure prediction across the full density range"
,ElusAegis/ai-passport,"AI Passport delivers cryptographic passports for machine learning models, enabling the tamper-proof verification of AI outputs. This project represents a major advancement in AI governance, providing a critical framework for tracking AI threats and validating the authenticity of harmful content to ensure greater safety and transparency."
,WOLVS/AditoryAttention,A deep learning framework for real-time auditory attention detection using functional Near-Infrared Spectroscopy (fNIRS) signals. This project implements state-of-the-art machine learning techniques to decode which audio stream a listener is attending to in a controlled environments.
,Dibastyle95/dibastyle-my-repo,"Project Nebula addresses the critical challenge of training machine learning models on decentralized sensitive data while maintaining GDPR/CCPA compliance. Unlike traditional centralized approaches, our framework implements a hybrid federated learning architecture that supports both cross-silo and cross-device scenarios. "
,selfapplied/aedificare,"CE1: CurvatureModeKernel Framework - A comprehensive framework for emergent machine learning grammar, morphological analysis, and code optimization"
,huynhtnhut97/HEA-Gibbs-ML-LLM,Hybrid machine learning framework for predicting Gibbs free energy of nitrate adsorption on high-entropy alloys (HEAs) using Pair Distribution Function (PDF) data.
,abiruth29/CogniThreat,"A cutting-edge AI-driven network intrusion detection system that combines classical deep learning, quantum machine learning, probabilistic reasoning, and explainable AI into a unified framework."
,holy-not-shit/Catboost_Predict_pullout_capacity,"    This graphical user interface (GUI) is the practical application tool accompanying the research paper:     ""A Physics-Informed, Interpretable Machine Learning Framework to Calibrate the Pull-out Capacity of Anchors in SFRC"""
,tantowjy/heart-signal-arrhythmia-analysis,A machine learning and deep learning framework for arrhythmia detection and classification using ECG and PPG signals.
,yashab-cyber/HackGpt,"HackGPT Enterprise is a production-ready, cloud-native AI-powered penetration testing platform designed for enterprise security teams. It combines advanced AI, machine learning, microservices architecture, and comprehensive security frameworks to deliver professional-grade cybersecurity assessments."
,slavatlsn/NeuroForge,A framework that allows to perform machine learning on embedded devices. Light and efficient
,ParamThakkar123/ML_and_DL-algos,"This repository contains all the machine learning and deep learning model I have implemented using various frameworks like keras, tensorflow, scikit-learn, pytorch, etc."
,Aman-Negi07/Movie_Recommendation_System,"This project is a web-based Movie Recommendation System built with Python, leveraging the power of machine learning and the Streamlit framework. It recommends movies to users based on the similarity of movie attributes, providing a user-friendly interface to find new films."
,ashwathyashokan97/Big-data-frameworks,This repository serves as a portfolio to showcase practical applications of data analytics and machine learning skills across various domains.
,AlexisBal/specialized-nmt-framework,Multi-Stage Domain Adaptation for Neural Machine Translation: A Hybrid Learning Framework for Specialized Terminology and Low-Resource Language Pairs
,JoelHeinz/AI-THREAT-MODELING,"AI-powered Threat Modeling framework that leverages machine learning to identify, analyze, and predict potential system vulnerabilities. Designed to assist developers and security teams in automating risk analysis and strengthening cybersecurity architectures."
,maxdlcl/TC3006C_ML_Algorithm_Implementation,Implementation of a Machine Learning algorithm without making use of frameworks such as scikit-learn
,CryptureVauIt/CryptureVault-,"AI framework for the CryptureVault ecosystem  blending machine learning with on-chain analytics to power secure tracking, smart predictions, and vault-grade intelligence"
,CodeRyFer/investing-strategy-project,"Imports financial (stock) data into Python using the Pandas framework. It then manipulates the data and attempt to come up with some sort of system for investing in companies, and then applies some machine learning and deep learning with back-testing."
,Kalyani-565/Data-Science-Project,"I am a passionate data scientist skilled in Al, Machine Learning, saind Deep Learning, with experience in data analysis and visualization. My strong command of Python and various frameworks allows me to design impactful solutions. I thrive in dynamic environments and am focused on leveraging my technical expertise to drive data-informed Innovation."
,krittika004/RealTime-ML-IDS,RealTime-ML-IDS is a Python-MATLAB framework that simulates and benchmarks machine learning-based intrusion detection systems under real-time cloud traffic conditions. It integrates offline accuracy metrics with latency-aware evaluation using cloudlet-based simulations.
,rsinghlab/TimeFlies,"  Machine learning framework for aging analysis in Drosophila single-cell RNA-seq   data. Deep learning models with SHAP interpretability, batch correction, and   comprehensive research workflows."
,akash-kumar5/CryptoMarket_Regime_Classifier,"CryptoMarket Regime Classifier is a machine learning framework that detects market regimes (Trend, Range, Squeeze, etc.) in crypto markets using multi-timeframe data and Hidden Markov Models. The project provides plug-and-play labeled datasets and trained models (HMM + LSTM) for downstream strategy development, position sizing, and risk management."
,ACM40960/Fair-Loan-Default-Prediction,"End-to-end machine learning pipeline for credit default risk modeling on tabular data. Features class-imbalance handling, advanced evaluation (ROC/PR-AUC, threshold tuning), SHAP explainability, and fairness auditing across demographic groups. Includes Optuna hyperparameter tuning and a reusable evaluation framework for deployment."
,aseio6668/MathTables,"A comprehensive mathematics framework for Rust, providing modular access to diverse mathematical domains including Number Theory, Linear Algebra, Machine Learning, Signal Processing, Cryptography, Financial Mathematics, and much more."
,Emvlt/polyhex,Polyhex helps you build regular polyhexes from hexagons and export them to machine-learning frameworks 
,anonymous-author-pub/FEVA-ICS-Framework,"Repository for Paper ""Benchmarking Adversarial Robustness of Machine Learning-based   Intrusion Detection Systems in Industrial Control Systems"""
,brain4j-org/brain4j,Open-source machine learning framework for Java. Designed with speed and lightweight in mind.
,Andrew-Gan/sentry,An end-to-end GPU framework for authenticating machine learning artifacts.
,NNPDF/nnpdf,An open-source machine learning framework for global analyses of parton distributions.
,Daneshpajouh/ChromeCRISPR,Hybrid Machine Learning Framework for CRISPR/Cas9 On-Target Activity Prediction
,had2020/RCMLRS,Machine learning framework in Rust
,rfhhunter/aiirmap,A framework for machine learning enhanced design.
,albertobusci/Early-Warning-System,"Machine learning framework for real-time detection of risk-off market conditions. Compares supervised, unsupervised, and deep learning models for anomaly detection to classify market regimes and support hedging or speculative strategies. Best performance is achieved with ensemble methods combining GMM, SVM, COPOD, and XGBoost."
,anannyay/AI-CAPTCHA-Solver-,CAPTCHA-X is an advanced AI-powered vulnerability assessment framework that evaluates the security effectiveness of text-based and image-based CAPTCHAs against modern machine learning attacks. This project helps organizations identify weaknesses in their human verification systems and provides actionable recommendations for improvement.
,sagarpwr/ml-research-companion,"ML Research Companion is my curated log of research papers in Machine Learning. It progresses from core foundations (optimization, CNNs, transformers) to practical frameworks (TensorFlow, PyTorch, ONNX) and advanced ML systems (deployment, edge AI, scalability), with concise notes, key ideas, and insights."
,tensorflow/quantum,An open-source Python framework for hybrid quantum-classical machine learning.
,dineshbekkam41/Social-Media-Driven-Big-Data-Analysis-for-Disaster-Situation-Awareness,"A Big Data and AI-driven framework for disaster situation awareness using social media analytics.  Implements distributed processing with Apache Spark, Hadoop HDFS, NLP, and machine learning  (Random Forest, DBSCAN, Sentiment Analysis) to classify disaster-related tweets, detect hotspots,  and predict disaster severity in real time."
,manvendrasingh108/RTrap-Ransomware-Detection-Containment-using-Decoy-Files-and-ML,"RTrap is a Python research framework that detects and contains ransomware attacks using decoy (honeypot) files and machine learning clustering. It plants realistic fake files in user directories and monitors them. If ransomware touches a decoy, RTrap kills the malicious process and disconnects the network to stop damage and spread."
,RezaNajian/folax,Folax (Finite Operator Learning with JAX) is a framework for solving and optimizing PDEs by integrating machine learning with numerical methods in computational mechanics.
,fboldt/vibrolearn,A Python framework for machine learning experiments in industrial machinery fault diagnosis through vibration analysis.
,SahanaG2003/AI-Driven-Password-Strength-Checker-with-Real-Time-Web-Interface,"AI-Powered Password Strength Checker  A lightweight web application that uses machine learning to evaluate password strength in real time. Features secure SHA-256 password hashing, dynamic feedback with improvement suggestions, and easy deployment using Python CGI and vanilla HTML/JS without heavy frameworks."
,dh-dz/nba-stats-prediction, A machine learningdriven framework for predicting NBA game outcomes and designing a profitable betting strategy on moneyline bets.
,ninpnin/days-since-last-ml-framework,Keep track of the newest machine learning frameworks on GitHub
,ARTIST-Association/ARTIST,A differentiable ray tracer using the PyTorch machine-learning framework in Python.
,akanbiusman/A-Data-Driven-Framework-for-Spam-Classification-in-Online-Social-Networks-,This project implements a hybrid machine learning framework for spam detection across multiple Online Social Networks (OSNs).
,Eiekama/ML-Training-Skeleton,"A skeleton project containing a framework for defining datasets, models and training that can be built off of for future machine learning projects"
,goeckslab/Galaxy-AutoGluon,"This repository provides tools to integrate Autogluon, an automated machine learning framework, into the Galaxy workflow environment"
,JomaMinoza/ml-ecolyzer,ML-EcoLyzer: Machine Learning Environmental Impact Analysis Framework
,MLShukai/pamiq-core,Framework for building AI agents with real-time adaptive learning capabilities.
,m-falkowski/pylibxai,Machine learning explanation framework for audio models
,leondavi/NErlNet,Nerlnet is a framework for research and development of distributed machine learning models on IoT
,kapsner/mlexperiments,An extensible framework for reproducible machine learning experiments
,Amanmishra2226/-BT-AI-ML-OCT-2025-198-,"During my AIML internship at Badkul Technology, I worked on real-world projects involving data preprocessing, machine learning, and deep learning model development. I contributed to building AI-driven solutions like predictive analytics, recommendation systems, and automation tools, gaining hands-on experience with frameworks."
,SuyashJindal/Options_Strategy_Quantitative_Task,Options Trading Strategy Backtested on Nifty 50. Machine Learning+ Statistical Framework on Derivatives CE & PE
,business-science/modeltime,Modeltime unlocks time series forecast models and machine learning in one framework
