framework,full_name,description
,cmcmicrosystems/FPGA-GPU-Cluster,"The FPGA/GPU cluster is a cloud-based, remotely accessible compute infrastructure specifically designed to accelerate compute intensive applications, such as machine learning training and inference, video processing, financial computing, database analytics networking and bioinformatics. Latest state of the art acceleration technologies including the Alveo FPGAs, and Tesla V100 GPUs, closely coupled with server processors constitute the backbone of this cluster. The software stack consists of a c"
,justinuliu/PyMLB,Machine Learning Benchmark framework for Python
,ahmedhesham47/Machine-Learning-Integrative-Framework-for-Predicting-ICB-Response,A Machine Learning project that aims to predict the response to ICB therapy using integrative data sources
,calvinyeungck/Football-1-vs-1-Shot-Taking-Situations-Analysis,"Repo for the paper ""A Strategic Framework for Optimal Decisions in Football 1-vs-1 Shot-Taking Situations: An Integrated Approach of Machine Learning, Theory-Based Modeling, and Game Theory"""
,Data-Science-Community-SRM/Resourceify,"A curated list of everything you need in the field of Data Science, Machine Learning, and Artificial Intelligence including but not limited to Online Courses, Documentations, Blogs, Podcasts, Cheatsheets, research papers, latest developments etc.. arranged in sub-domains and further by the language or framework being used. "
,WalaaSoudy/ML-project,"The MNIST dataset is a widely used collection of handwritten digits, serving as a benchmark for various machine learning tasks. This project aims to leverage the Tensorflow framework and the Scikit-Learn library to explore and implement both K-Nearest Neighbors (K-NN) and Artificial Neural Network (ANN) algorithms ."
,maon007/Binary_Classification_Model,"This Python code provides a comprehensive framework for building, evaluating, and tuning binary classification models using various machine learning algorithms."
,MisterAare/telecom_churn_prediction,"In this repository, I've developed a machine learning solution to predict customer churn in the telecom industry, utilizing a diverse set of Python libraries and frameworks."
,Hacker1337/QML-frameworks,Reviews of quantum machine learning frameworks pennylane and TensorFlow Quantum
,Hamza-Abbasi222/IoT_CyberAttack_Classification_Thesis,"In the rapidly evolving landscape of Internet of Things (IoT), ensuring the security of connected devices is of paramount importance. This project or Master's thesis aims to address this critical concern by proposing a robust framework for the classification of cyber attacks on IoT using advanced machine learning techniques."
,Mohit197/Flight_delay_prediction_ML,Develop machine learning classification models to predict flight delays using PySpark and MapReduce Framework for cloud computing
,aryainjas/Fruitify,"Fruitify is a charming fruit recognition project that harnesses the power of TensorFlow, an advanced machine learning framework."
,annonymous-axe/ml-projects-collection,"Welcome to the ml-projects-collection! This repository serves as a collection of various machine learning projects, algorithms, and techniques implemented using popular libraries and frameworks."
,Pathakisha18101/Minor_Project_mca_jims,Developing a Music Recommendation system based on Machine Learning and Python Django Framework
,cirosantilli/china-dictatorhsip-7,"Anti Chinese government propaganda. https://github.com/cirosantilli/china-dictatorship backup.  996.ICU709Friends who live in China and have real name on account, please don't star this repo, or else the police might pay you a visit.  Home to the mega-FAQ, news compilation, restaurant and music recommendations.Heil Xi . "
,miguelrabuge/fedora,The Fedora Framework is an evolutionary feature engineering framework designed to optimize features for machine learning tasks
,Rumermustafa/PyTorch_100_Days,"""PyTorch_100_Days"" is my learning program designed for accelerate proficiency in PyTorch, a popular open-source machine learning framework. Over the course of 100 days, I learn and engage in structured daily learning activities, exercises, and projects aimed at mastering PyTorch's core concepts, functionalities, and best practices."
,ayush1399/skMX,Machine Learning on Macs using Apple's MLX framework
,ZoiaDakhovnyk/Stroke-Prediction,"This project involves the development of a Dockerized RESTful API for predicting stroke occurrence based on a dataset using a Random Forest machine learning model. The project utilizes the Flask framework in Python to create the API endpoints, allowing seamless interaction with the model."
,secretflow/secretpad,"SecretPad is a privacy-preserving  computing web platform based on the Kuscia framework, designed to provide easy access to privacy-preserving data intelligence and machine learning functions. "
,google/space,Unified storage framework for the entire machine learning lifecycle
,uchihapk07/IPL-Score-Predictor-Web-Application,"The IPL Score Predictor project aims to create a user-friendly web application that predicts cricket scores for Indian Premier League (IPL) matches using machine learning techniques. The project utilizes various Python libraries for data science, machine learning, and web application development using Streamlit framework."
,celestialmk/learn-pytorch,Code from learning about the pytorch machine learning framework
,himanshu-03/Flight-Price-Prediction-Streamlit,"A Flight Price Prediction System, which is a machine learning-based web application. Users can predict the cost of a flight based on their desired travel details. The project has been implemented using the Streamlit framework for hosting the application and providing a user interface for flight price predictions."
,kabuur/Prediction-of-diabetes-using-machine-learning-algorith-whit-Django-framework,graduation_project
,basalt-org/basalt,A Machine Learning framework from scratch in Pure Mojo 
,ANL-CEEESA/MIPLearn,Framework for solving discrete optimization problems using a combination of Mixed-Integer Linear Programming (MIP) and Machine Learning (ML)
,1203gauri/threat-detection,"Framework Model for Identifying, detecting and Report for Cyber Security on Bhuvan Portal Using Machine Learning"
,oliverfelix/Parkinson-s-disease-prediction-app,"This application leverages machine learning techniques to develop a predictive model employing various algorithms. Through the integration of Flask, a web framework, an application has been developed to facilitate the classification of patients based on the presence or absence of Parkinson's disease."
,AbductiveLearning/ABLkit,"An efficient Python toolkit for Abductive Learning (ABL), a novel paradigm that integrates machine learning and logical reasoning in a unified framework."
,Rutuja0596/machine-learning,In this Machine Learning Project on Multiple disease Prediction I have used streamlit framework to deploy the Web app and integrated it with Firestore Database. 
,helmholtz-analytics/heat,Distributed tensors and Machine Learning framework with GPU and MPI acceleration in Python
,Keerthu8999/A-Machine-Learning-Framework-for-DGA-Based-Malware-Detection,
,ci-group/learning_machines_robobo,Framework for the Learning Machines Course at VU Amsterdam
,josephassiga/tensorflow-and-keras-tutorial,Machine Learning with Tensorflow and Keras Frameworks
,IT21305382/Football-Players-Image-Classification-Project,"The Football Players Image Classification project utilizes a Python-based backend, Flask framework, and HTML with CSS for the frontend to create an interactive platform. The core of the project involves a machine learning model trained on football players' images to classify and identify five popular players. "
,yazhinisivaraj/COURSE-COMPLETION,"Hello all, I'm excited to announce that I have completed my online course in GREAT LEARNING, ""Python for Machine Learning"". It models due to their ease of use, extensive framework library  , flexibility, and more. Python brings exceptional versatility to machine-learning environments  with High-performance computing . #greatlearningacademy "
,gabriel-messas/sAIfe,Artificial Intelligence/Machine Learning Application and Pipeline Security-Focused Development Framework
,bing93wang/COF-NEP,Support Information for Thermomechanical Properties of Two-Dimensional Covalent Organic Frameworks Studied by Machine-Learning Molecular Dynamics
,Piyush866/Capstone---Project,I am developing a capstone machine learning project called DocAssist using Python and the Flask framework. DocAssist utilizes machine learning techniques to enhance document-related tasks. The project involves implementing functionalities through Flask to create a user-friendly web application that streamlines document processing. 
,deepflow-cognit/Cognit,Cognit is a streamlined neural computation framework and API engineered with Numpy fine-tuned for advanced machine learning operations and swift adaptability.
,mimiquate/candlex,An Nx backend for candle machine learning framework
,sujitmahapatra/Diabetes-Prediction-ML-Web-App,"Diabetes Prediction ML Web App. Includes machine learning models such as Logistic Regression, Random Forest, Gradient Boosting, and Support Vector Machine (SVM). For Web App - HTML, CSS and Django framework."
,yu-hsun/MachineLearning_MLP_LGBM_CNN,"This machine learning framework tackles classification and regression with models like MLP, LightGBM, and CNN. It features advanced preprocessing, PCA, and k-means clustering for enhanced performance. Designed for flexibility, it suits both beginners and experts, enabling easy model switching and optimization."
,suhas2228/Political-Security-Threat-Prediction,Political Security Threat Prediction Framework Using Hybrid Lexicon-Based Approach and Machine Learning Technique
,dwarnecke/Machine-Learning-Framework,An MNIST digit recognition machine learning model build entirely from scratch.
,nsswifter/AISightQuest,"Utilizing AI and machine learning, the project extracts text from images via Apple's Vision Framework and offers instant answers to questions in documents through the BERT model."
,emran771/Apple-Quality-Prediction,This project tackles the challenge of predicting apple quality using machine learning techniques. It provides a framework for analyzing apple characteristics and estimating their grade or marketability.
,waleedgeo/FSM-PK,"The repository contains data for upcomming paper on ""An Integrated Approach based Machine Learning Framework for High-resolution Flood Susceptibility Mapping and Exposure Analysis at a national scale: A Case Study of Pakistan"""
,gbragafibra/Random_Learning,Exploring some machine learning frameworks.
,sktime/sktime,A unified framework for machine learning with time series
,ankumar/Programming-machine-learning,"The landscape of machine learning (ML) is constantly evolving with new techniques, tools, and frameworks emerging at a rapid pace."
,GeorgeJoLo/ENFusion,A machine learning fusion framework for classification audio recordings utilizing ENF signals
,SergeNanou/Flask-API-Project-Random-Forest-API,This project contain a model machine learning Random Forest . This model have been transformed in API With frameWork Flask.
,Ankitach780/Indian-Restaurant-and-location-Prediction-,Welcome to Indian Restaurant Name and Location Prediction Project! This innovative project leverages machine learning techniques and is implemented using the Python Flask framework. 
,Sebastian352/Numpy-Neural-Network-for-MNIST-Letter-Classification,"This project implements a neural network from scratch using only the power of NumPy, bypassing the reliance on large machine learning frameworks like TensorFlow. The primary objective is to classify letters from the MNIST dataset with high accuracy."
,dotnet/machinelearning,ML.NET is an open source and cross-platform machine learning framework for .NET.
,JuliaAI/MLJBase.jl,Core functionality for the MLJ machine learning framework
,ZachsCoffee/jneuroevolution,"A mini framework written in Java, to solve optimization and machine learning problems, using evolution/neuroevolution algorithm."
,nazil-the-professor/ML_Diabetes_Pred,Machine Learning Diabetes Prediction System using django framework
,Nikitaspat/CapstoneProject,"Title of project: Student learning style prediction based on VARK using Machine learning algorithms Tecnical Specification:Programming Language: Python, Machine Learning Framework: scikit-learn. Storage: CSV file Development Environment: Cocalc Jupyter Notebook. "
,zugzwang03/eduApp,"Our EduApp is specifically designed to address the educational challenges faced by rural students. It uses an Angular frontend with robust Express engine facilitating the Node.js framework and uses MongoDB for scalable data handling. To enhance the user experience, we've implemented machine learning techniques with the help of the Gemini Pro model "
,SimonLarsen/frogbox,An opinionated machine learning framework.
,Wittelab/orchid,"A novel management, annotation, and machine learning framework for analyzing cancer mutations "
,ChideraBel/MLProjects,"ML projects worked on while learning new machine learning concepts and AI engineering. Includes linear, multi-linear & logistic regression models as well as classification models. Additionally, learning concepts of classification and regression using deep learning neural networks. Frameworks used: PyTorch, Keras, TensorFlow, Pandas, Numpy, e.t.c"
,OpendTect/dgbpy,dgbpy is a framework for research and deployment of machine learning models from seismic and well data.
,abhisekjha/SimpleLinReg,"This framework is a minimalistic approach to linear regression, one of the simplest forms of machine learning models. It's designed to demonstrate the core components of a machine learning workflow: data handling, model definition, training, and evaluation."
,DEREL93/EMPATHY-EMOTION-AND-PERSONALITY-DETECTION-IN-INTERACTIONS-DEEP-LEARNING,"This research explores the role of empathy, emotion, and personality traits in human-computer interactions (HCI). The goal is to develop and test a machine-learning framework for detecting and analyzing these factors in HCI data"
,eMapR/sundial,Workflow / framework for machine learning with data sourced from Google Earth Engine on a bare metal machine.
,bytedance/fedlearner,A multi-party collaborative machine learning framework
,khoaguin/PocketHHE,"An Integer-only, Lightweight Privacy-preserving Machine Learning Framework with Hybrid Homomorphic Encryption"
,SeldonIO/seldon-core,"An MLOps framework to package, deploy, monitor and manage thousands of production machine learning models"
,phngbh/IMML,An interpretable multimodal machine learning framework that utilises prior biological knowledge to study complex multifactorial diseases
,Manoj-A-Anandan/Calories_burnt-Machine-Learning-using-Manual-and-Automl-frameworks,Here the calories dataset is taken and XGBoost Regression is used and predicted manually and then Two AutoMl frameworks are also used(H2O.ai and TPOT) which is deployed using Gradio
,omkarmurlidhardabade/Loan-Prediction,Machine Learning Project for Loan Prediction Website using Flask as a Backend framework in Python
,C5T/Current,C++ framework for realtime machine learning.
,abctechlabs/awesome-machine-learning,"A curated list of awesome machine learning frameworks, libraries and software (by language)"
,RodrigoSdeCarvalho/pyEasyML,"Python version of my machine learning framework that provides data preprocessing, feature selection, classification, regression and even more complex deep learning models, model persistence, autoencoders and anomaly detection"
,hpides/End-to-end-ML-System-Benchmark,"A modular suite for benchmarking all stages of Machine Learning pipelines. To find bottlenecks in such pipelines and compare different ML tools, this framework can calculate and visualize several metrics in the data preparation, model training, model validation and inference stages."
,Rohit10Joshi/XGBoost_Classifier_Regressor,"XGBoost, or Extreme Gradient Boosting, is a powerful ensemble machine learning algorithm known for its exceptional performance in regression and classification tasks. It utilizes a boosting framework with decision trees, handles overfitting, and is efficient for large datasets, making it widely used across various domains for accurate predictions."
,secretflow/secretflow,A unified framework for privacy-preserving data analysis and machine learning
,Manam-7/MATLAB_Arthritis_Detection,This repository offers a comprehensive framework for analyzing and detecting arthritis in medical images using MATLAB. It leverages various image processing and machine learning techniques to provide valuable insights into joint health.
,Monchiwjxie/Hazardous-waste-generation,"A machine learning based and data-driven methodological framework to predict the generation quantity of HW at the firm-level in every month through linking different datasets across domains, which were used as proxies to indicate both static characteristics and real-time activities of enterprises."
,junayed-hasan/Quantum-Machine-Learning-Qiskit-PyTorch,"This repository contains codes and tutorials for quantum machine learning using PyTorch and Qiskit. It covers topics such as qiskit basics, deep learning fundamentals, and hybrid quantum-classical models. It also demonstrates how to use TorchQuantum, a PyTorch-based framework for quantum neural networks."
,usaeedcs/HousingPriceDataAnalysis,"Using Python's machine learning frameworks, this project does an analysis of an housing dataset to establish correlations between variables and the sale price of houses. Using machine learning practices, we created a model that could determine the Sale Price of houses."
,drmnislam/Tensor-Flow-Developers-Roadmap,"TensorFlow is an open-source machine learning framework developed by Google. It provides a versatile platform for creating and deploying machine learning models, particularly neural networks, enabling tasks like image recognition, natural language processing, and more."
,PaddlePaddle/Paddle,PArallel Distributed Deep LEarning: Machine Learning Framework from Industrial Practice &
,SCAI-BIO/causal-npi-effects,A causal machine learning framework to assess effects of non-pharmaceutical interventions on pandemic disease spread.
,12sachingupta/RAJ_POLICEHACK_61_DEEP_FAKE_DETECTION,"Detect and combat the rising threat of deep fake content with our Deep Fake Detection Framework. This open-source project is designed to empower developers, researchers, and organizations in identifying manipulated media content using state-of-the-art machine learning techniques."
,Waikato/moa,"MOA is an open source framework for Big Data stream mining. It includes a collection of machine learning algorithms (classification, regression, clustering, outlier detection, concept drift detection and recommender systems) and tools for evaluation."
,Nishantwale/rest-recomm-sys,Created Popularity-based and Collaborative Filtering based Restaurant Recommendation System Using Machine Learning Model and Flask Framework
,centaurusgod/DjangoBirdClassifier,A flutter application that connects to the api made from django rest framework. The machine learning model is deployed  in the server. The app sends API request to the server sending an image and gets resposne related to birds detail.
,kapsner/mlexperiments,An extensible framework for reproducible machine learning experiments
,fairen-group/mof-biocompatibility,Guiding the rational design of biocompatible metal-organic frameworks for drug delivery using machine learning
,alexkychen/assignPOP,"Population Assignment using Genetic, Non-genetic or Integrated Data in a Machine-learning Framework.    Methods in Ecology and Evolution. 2018;9:439446. "
,codecentric-oss/niceml," niceML  is a Python-based MLOps framework designed to streamline the development and maintenance of machine learning projects, offering efficient and scalable pipelines using TensorFlow and Dagster."
,jmtech-0/Network-troubleshooting-Framework,This is a hybrid network troubleshooting framework that integrate the strengths of machine learning with wireshark for  a better detection of abrupt surges in a network.
,Mirko-A/minitorch,A machine learning framework written from scratch for educational purposes. Inspired by PyTorch and tinygrad.
,Frobeniusnorm/Flint,Tensor math framework for machine learning
,usaeedcs/InsurancePolicyDataAnalysis,"Employing Python's machine learning frameworks, this project analyzes Insurance Policy Data Sets to discern correlations between variables and the Total Payment."
