framework,full_name,description
,bniladridas/distributed_ml,High-performance distributed machine learning framework leveraging MPI for parallel training across multiple nodes.
,Wondermongering/Blanchotian-Components-for-a-Poetics-of-Machine-Learning,"Instead of treating neural networks as mechanisms for classification and certainty, this framework embraces liminality, recursion, absence, and hesitation as fundamental design principles."
,sumithkumar07/Rice_type_classifiers_by_optuna,"This project focuses on classifying different types of rice using machine learning techniques. It leverages Optuna, a powerful hyperparameter optimization framework, to fine-tune the model for better accuracy and performance. The workflow typically involves:"
,Malikanwark/Audio-Based-Stress-Detection-Through-Vocal-Pattern-Analysis,Design and implement robust audio feature extraction pipeline (process of analyzing an audio signal and extracting key characteristics) - Develop efficient machine learning models for stress detection - Create real-time processing framework for immediate feedback - Performance Targets:   - Achieve >85% accuracy detection
,Harshu075/Code_Alpha_AIChat,"TASK 3: Artificial Intelligence Chatbot Objective: Implement a chatbot with AI capabilities, including:  Natural Language Processing (NLP) to understand user queries.  Machine learning models for automated responses.  Interactive conversation handling.  Implementation: Use AI/ML frameworks like TensorFlow, OpenAIs GPT"
,Robert-Gomez-AI/jet_ml,A framework for fast machine learning prototype
,Finexeagle/Pytorch-for-Beginners,This is a Fudemental Machine Learning Course about Pytorch Framework .
,jim-schwoebel/allie," An automated machine learning framework for audio, text, image, video, or .CSV files (50+ featurizers and 15+ model trainers). Python 3.6 required."
,IRON13/Fair-IRT,A framework that uses Item Response Theory to evaluate fairness in machine learning models.
,In-Network-Machine-Learning/Planter,Planter is a modular framework for realising in one-click in-network machine learning algorithms. 
,google/paxml,"Pax is a Jax-based machine learning framework for training large scale models. Pax allows for advanced and fully configurable experimentation and parallelization, and has demonstrated industry leading model flop utilization rates."
,aluiziobrito/CADIM-,Cloud-Aware DEM Inundation Mapping (CADIM) : A geospatial framework for flood mapping under cloud cover using machine learning and digital elevation models (DEMs).
,etorresram/LPI-Prediction-with-MLModels,This repository presents a machine learning-based framework to predict the World Bans's Logistics Performance Index (LPI). 
,gunashri2003/MachineLearningSecurityFramework,
,SCEcust/Aero-hydrocyclone_ML-GA_interpretable-framework,Design and machine learning optimisation of ultra-clean mini-hydrocyclones for aero-engine lubricant oil systems
,gruchh/FactoryMaintenanceManagement,"This project was created for learning Java, specifically the Spring framework. The application aims to manage machines, breakdowns, and maintenance staff in a factory."
,SriramR02/Twitter_Sentiment_Analysis,"The Twitter Sentiment Analysis project classifies tweets as positive, negative, or neutral using NLP and logistic regression, deployed via Streamlit and FastAPI for real-time analysis and visualization. It integrates machine learning with modern web frameworks for an end-to-end solution."
,GustavoWidman/ml-rust,A machine learning application demonstrating neural networks implementation in Rust using the Burn framework. This project showcases an Iris flower classifier with a simple multilayer perceptron.
,lanl/ALF,A framework for performing active learning for training machine-learned interatomic potentials.
,rust-ml/linfa,A Rust machine learning framework.
,Arnav6595/AI-Driven-Secure-Web-Application-Penetration-Testing,". This research explores the integration of artificial intelligence (AI) in web application penetration testing to discover security vulnerabilities, automate detection, prioritize threats, and improve accuracy. The proposed AI-powered framework leverages machine learning and deep learning algorithms to detect security weaknesses etc."
,secretflow/secretflow,A unified framework for privacy-preserving data analysis and machine learning
,haifeng-jin/readable-ml-framework,A machine learning framework with readable source code
,recodehive/machine-learning-repos,"A curated list of awesome machine learning frameworks, libraries and software (by language). I"
,SauravMaheshkar/ml-framework-bot,An agentic workflow to translate machine learning codebases across ML frameworks reliably at scale.
,saiprashanth06-krishnan/Machine_learning_framework,
,had2020/RCMLRS,"Machine learning framework in Rust, ramless, cluster compute"
,JinukMoon/CatBench,CatBench - Benchmark Framework for Machine Learning Interatomic Potentials in Adsorption Energy Predictions
,Aashish-05/202401100300002_DigitDetection,"This project focuses on image classification and digit detection using both machine learning (ML) and deep learning (DL) techniques. The implementation includes CNN-based models, object detection frameworks, and classical ML approaches for recognizing and detecting digits in images."
,HULTIG/semantic-graph-ml-framework,A unified semantic framework leveraging graph-based machine learning for IoT-healthcare data interoperability using RDF and R2RML.
,Thuang6413/CSCN8010-25W-MachineLearningFramework,Conestoga Foundations of Machine Learning Frameworks Assignment
,Akshatb848/Degraded-Devanagari-and-Bangla-Script-Identification-Using-CNN-Frameworks,"This repo showcases a collection of innovative Machine Learning (ML) and Deep Learning (DL) projects, demonstrating expertise in cutting-edge technologies and algorithms. Explore this repo to find practical implementations and solutions for various AI-driven tasks."
,NNPDF/nnpdf,An open-source machine learning framework for global analyses of parton distributions.
,eZWALT/eZAutoML,"A Democratized, lightweight and modern framework for Python Automated Machine Learning"
,eteh1/Hybrid-Machine-Learning-Framework-for-Water-Quality-Assessment-and-Contamination-Clustering,Hybrid Machine Learning Framework for Water Quality Assessment and Contamination Clustering in the Niger Delta
,CryptolWhile/Streamlit,Streamlit l mt framework m ngun m cho php to ng dng web t m Python mt cch d dng. N thng c s dng trong khoa hc d liu v machine learning  xy dng giao din trc quan cho cc m hnh.
,sneha11naidu/Marketing-Campaign-Performance-Prediction-using-Machine-Learning,"Developed a marketing campaign analysis framework using machine learning and data visualization to evaluate ROI, customer acquisition, and key profitability factors. Implemented a Random Forest Classifier for multiclass classification of profitability levels, leveraging feature engineering to enhance predictive accuracy."
,maliknaik16/machine-learning,"ML journey to explore concepts and framework through code and math. It serves as a personal log of my learning experiences, revisiting foundational topics, and delving into new areas within the field."
,ghubnerr/machine-learning,"A dump to all things LLMs, CUDA, DL frameworks, Tokenization Methods, and latest stuff Im building/researching with"
,Cambricon/CNStream,CNStream is a streaming framework for building Cambricon  machine learning pipelines http://forum.cambricon.com    https://gitee.com/SolutionSDK/CNStream
,nicolePalo/DenguePredictionApp,Dengue Prediction App using supervised machine learning called as an API in the Django REST framework
,helmholtz-analytics/heat,Distributed tensors and Machine Learning framework with GPU and MPI acceleration in Python
,Mattbusel/NeuroPulseML-AI-for-Human-Electrical-Signal-Diagnostics,NeuroPulseML is an experimental machine learning framework designed to detect early-stage medical conditions by analyzing the electric signals emitted from the human body. 
,Woodsy2660/Ctrl-Alt-De-Risk,The aim of this project is to develop a machine learning framework that will learn from safe traffic environments and use that data to propose improvements in high risk traffic areas.
,Reckadon/STTAI-Assignment-9-MLRun,"This assignment introduces us to CI/CD for Machine Learning using MLRun, a powerful orchestration and automation framework for deploying ML pipelines."
,PennyLaneAI/pennylane-qulacs,The PennyLane-Qulacs plugin integrates the Qulacs quantum computing framework with PennyLane's quantum machine learning capabilities.
,fhswf/paper-mlwa-mlpro-2.0,"Paper ScienceDirect MLWA - Arend e.a. - ""MLPro 2.0 - Online machine learning in Python"""
,oaustegard/ihp-framework,"Integrative Historical Prediction (IHP) Framework: Analyzing and forecasting complex societal phenomena. Combines Riemannian geometry, network theory, and machine learning to model societal dynamics. Includes case studies on Arab Spring, cryptocurrency adoption, and climate migration. Advanced math meets data science meets history meets AI fiction."
,daireto/phishing-url-detector,"A phishing URL detection application using machine learning, built with Starlette framework."
,mattaq31/GelGenie,Open-Source package for segmentation and analysis of gel electrophoresis images using machine learning.  Both a python framework for training/running models and a QuPath GUI extension are available.
,lbignone/galaxies_datasets,Galaxies Datasets is a collection of ready-to-use extragalactic astronomy datasets for use with TensorFlow and other Machine Learning frameworks.
,abdulkaderhajjouz/IIOT,Proactive Detection of APTs in IIoT Using a Real-Time Machine Learning Framework
,elhamsha/ai,"A collection of AI and machine learning projects covering deep learning, computer vision, NLP, and data analysis. Includes implementations of classification, clustering, PCA, and more using popular frameworks like TensorFlow, PyTorch, and Scikit-learn."
,AnonymousAppdx/Unified-Framework-for-Defining-Security-Boundary-of-PUFs-Against-Machine-Learning-Attacks,
,shumwaymark/sentinelcam,A computer vision and machine learning pipeline on a distributed framework. Designed for an embedded network on low voltage IoT hardware.
,chamiz/ai_test_framework,AI Test Framework is a robust and flexible tool designed to simplify and streamline the testing of AI and machine learning (ML) models.
,Teijen/IntermediateDragon,The main reposititory that holds the submodules for the analysis on the impact of different intermediate language representations of the Dragon Type Identification Machine Learning Framework
,dougdotcon/bigger-fish,Um framework para ataques de canal lateral baseados em machine learning
,pillutlanaveen/Main-Project,This Is My MCA Academic Main project developed by full stack with python by using backend flask framework and utilized by Machine Learning
,alwaysramesh/Machine_learning,"This repository documents my daily learning journey in Machine Learning. I upload ML code, experiments, and projects regularly to enhance my understanding of concepts like data preprocessing, model training, evaluation, and deployment. Follow along as I explore algorithms, frameworks, and real-world applications in ML! "
,CodliRo/PrompTEA,"PrompTEA is an open-source framework that optimizes prompts for language models using NLP and machine learning. It generates high-quality, customizable prompts to improve model performance across various tasks."
,mpakdehi/ML-flood-model-for-Southern-Florida,"This contains Machine Learning framework for hindcasting maximum flood depths using stream gauges and high-water marks (HWMs), incorporating hydraulic infrastructure features and uncertainty. Includes evaluation of model performance and transferability across multiple hurricane events (Ian and Irma) in regulated coastal watersheds."
,Failed-Developer/Python_Revision,"Commencing my Machine Learning journey, I embark on this endeavor as my initial step in mastering Python programming. My objective is to attain proficiency in Python and its associated frameworks."
,Jomol200577097/Final-Group-Project-Machine-Learning-Frameworks,"A Flask-based machine learning web API for real-time tweet sentiment analysis. This project uses the Sentiment140 dataset to train a logistic regression model that classifies tweets as positive or negative. The API accepts JSON input and returns sentiment predictions, tested using Postman."
,MolCrafts/molpot,[WIP] Machine Learning Molecular ForceField Training and Deploying Framework
,saeidshirazi/XAI-Android,Explainable Machine Learning Framework for Android Malware Detection
,divyakalasundaram/Object-Detection-System,"The Object Detection System is a deep learning-based project developed using MXNet, an open-source deep learning framework. The project aims to detect and classify objects in images or video streams using advanced machine learning models. "
,boradpreet/GANs-Fake---Real-Image-Classification,"Generative Adversarial Networks (GANs) are a class of machine learning frameworks designed to generate new data instances that resemble a training dataset. They function through an adversarial process, involving two neural networks: a generator and a discriminator."
,Rohithkumarkasarla/Optimized-Ensemble-Framework-with-Unsupervised-Learning-for-Ensuring-Security-in-IoT-Networks,MACHINE LEARNING
,sivakumark4/Hybrid-Machine-Learning-Framework-to-Forecast-Peak-Load-Days-for-Cost-Optimization,THIS IS THE REPOSITORY FOR THE PROJECT
,sharc-lab/HLSFactory,HLSFactory: A Framework Empowering High-Level Synthesis Datasets for Machine Learning and Beyond
,nirajm06/Fake_News_Detection_System,This project is a machine learning-based web app built with Python and the Streamlit framework to detect whether a news article is real or fake. It uses Natural Language Processing (NLP) techniques to process text data and classify it using a Logistic Regression model.
,Klus3kk/fit,A lightweight machine learning framework built from scratch in Python. 
,coop-columb/quantum-neural-network,Quantum Neural Network Framework - A comprehensive implementation of quantum neural networks integrating quantum computing with classical machine learning.
,IntelPython/scikit-learn_bench,"scikit-learn_bench benchmarks various implementations of machine learning algorithms across data analytics frameworks. It currently support the scikit-learn, DAAL4PY, cuML, and XGBoost frameworks for commonly used machine learning algorithms."
,htetarkarlinn/Per-title-Encoding,"Deploy a trained Machine Learning model for the ""per-title encoding"" task into a RESTful API using the FastAPI framework."
,pejmantheory/Bleu.js,Advanced quantum computing and machine learning framework
,Akmuhammet01/featureinteraction-analysis,A Machine Learning 2025 course project analyzing feature interactions in neural networks using the Neural Interaction Detection (NID) framework on synthetic and real-world datasets.
,saracherif123/Optimizing-File-Similarity-Search-Techniques-in-Data-Lakes-using-Big-Data-Frameworks-,This project explores scalable techniques for detecting similar or duplicate datasets in large-scale data lakes using Big Data frameworks like Apache Spark. It reimplements the DS-Prox early pruning algorithm and evaluates two machine learning modelsRandom Forest and Multilayer Perceptron (MLP).
,URK21CS1092/A-MACHINE-LEARNING-FRAMEWORK-FOR-EARLY-STAGE-DETECTION-OF-AUTISM-SPECTRUM-DISORDERS-,
,dewminigunasekera/Forest_Fire_Mathematical_Modelling,"Mathematical modeling of forest fire occurrence and spread using a two-stage machine learning framework. Binomial ignition and overdispersed fire area are modeled with Random Forest and Negative Binomial Regression, respectively."
,haseebmanzur/PredictBC,"PredictBC is a machine learning framework for breast cancer prediction using microbial and metabolic features. It includes complete script with preprocessing, feature selection, custom ensemble model, and evaluation metrics. The approach integrates metagenomic and metabolomic abundances data to identify key biomarkers."
,ZygoteCode/AI-Frameworks,"A complete, curated list of all Open Source frameworks for developing Artificial Intelligences and Machine Learning Algorithms for Python, C++ and C#."
,blackportal-ai/delta,An Open-Source Machine Learning Framework in Rust 
,JavithHussainShareef/Battery-Recycling-Digital-Twin,"This project implements a machine learning-based Digital Twin framework for the battery recycling industry. It integrates data from recycled battery bags and blackmass chemical analysis to simulate, predict, and optimize the recycling process. "
,khutaleanant/MyProjects," What Youll Find Here:  Python Automation  Scripts for simplifying tasks  Data Science & Analytics  Pandas, NumPy, and Matplotlib-based projects  Machine Learning Models  Using Scikit-Learn and other frameworks  Jupyter Notebooks  Interactive data analysis and visualization"
,Ananth864/Machine-Learning-Framework,"A standardized pipeline for efficient development, deployment, and monitoring of machine learning projects. The framework incorporates most features required for model development while maintaining generalizability."
,lanre-adams/vm-security-automation,"This framework automates and optimizes virtual machine security and cloud resource usage across large-scale Azure deployments using PowerShell, Azure CLI, Terraform, and Machine Learning. It enhances compliance, reduces costs, and improves performance."
,izzad2413/django_project,This is a simple example of deploying machine learning model using django framework
,Sisira-reddy15/Fake-News-Detection-Using-Machine-Learning,"The present project proposes Adaptive Hyperdimensional Inference (AHI), a machine learning framework combining Hyperdimensional Computing (HDC), Deep Learning, and Evolutionary Learning to improve the ability to detect fake text and images instantaneously."
,fiorenzotittaferrante/API50CH_MicrobialPrediction,This repository provides a comprehensive machine learning framework for predicting microbial activity based on AFLP (Amplified Fragment Length Polymorphism) data and API 50 CH test results.
,officiallokeshyadav/With-The-Help-Of-Python-We-Ai-create-Ai,"It's widely used because of its rich ecosystem of libraries and frameworks like TensorFlow, PyTorch, scikit-learn, and many others that simplify AI and machine learning development."
,grvkr0807/Machine-Learning-of-Lipid-Nanoparticles,Machine Learning Framework to predict activity and cell viability of LNPs for gene delivery
,MatasMartinkus/E-Commerce-clusterisation,A comprehensive framework for automatically clustering e-commerce products using various machine learning approaches. This project implements and compares multiple clustering techniques to provide optimized product categorization for e-commerce applications.
,Jayyp1234/HybridShockWaveSim,"This repository implements a hybrid computational framework for simulating shock waves in non-ideal gases. It integrates extended RankineHugoniot models (using PengRobinson and RedlichKwong EOS), high-fidelity FVM/FDM simulations with adaptive mesh refinement, and machine learning for rapid predictions. Case studies include Real Gases"
,LomashB/100_days_of_AI-ML,"A 100-day journey to master Data Science, AI and Machine Learning through daily blogs, hands-on code implementations, and exploration of essential tools and frameworks. Follow along for consistent progress, fun facts, and practical insights to build expertise and unlock better career opportunities! "
,yugankahuja/PCOSCare-Machine-Learning-Simulation-Framework-for-PCOS-Risk-Assessment,PCOSCare: AI-powered PCOS risk assessment & treatment simulator using machine learning (98.2% accuracy) and agent-based modeling. Web-based tool built with Python/Streamlit to predict risks and simulate treatment outcomes.
,tum-pbs/PhiFlow,A differentiable PDE solving framework for machine learning
,madeeha-balouch/resume-fit-dual-approach,"IntersectMatch is a hybrid AI framework that combines semantic similarity and supervised machine learning to evaluate resume-job fit. Built for the Advanced AI (MLR555) course, the model selects candidates based on the intersection of both methods."
,nishanth1072003/autism-flask-app,This project aims to develop a robust machine learning framework to predict Autism Spectrum Disorder (ASD) in individuals based on questionnaire-based inputs
