framework,full_name,description
,kf5131/NNFS,"A basic neural network from scratch in Python, demonstrating the fundamental concepts of deep learning without using any machine learning frameworks."
,Faisal4119/RAG_ChatBot,A conversational chatbot designed for the North South University ECE Department. This project utilizes advanced machine learning techniques with the LangChain framework and Gradio UI to create an interactive chatbot capable of answering questions about the department.
,janosh/matbench-discovery,An evaluation framework for machine learning models simulating high-throughput materials discovery.
,SATWIKOJHA/Performa-AI-Employee-Performance-Prediction-System,"Performa AI is a machine learning-powered system for predicting employee performance. It offers predictive analytics, customizable models, and intuitive visualizations, integrating seamlessly with HR systems. Built with Python and AI frameworks, it empowers organizations with data-driven insights for optimized workforce management and growth."
,lamalab-org/MoleculeBind,"MoleculeBind is a machine-learning framework for chemistry, where we target unifying various molecular representations into one common latent space (SELFIES, SMILES, Graph, Structures, Fingerprints, Molecular Spectra)"
,patilaakash619/DILEAP-Digital-Literacy-Education-Analysis-Platfo,"A comprehensive analytics framework for evaluating digital literacy education programs, tracking learner progress, and identifying factors that influence learning outcomes. This analysis uses statistical methods and machine learning to provide insights into program effectiveness and learner engagement"
,KennethTebogo/StreamlitApp,"Streamlit is an open-source app framework primarily used for building interactive, data-driven web applications in Python. It is especially popular for its simplicity and ease of use, allowing you to create web apps with just a few lines of code. You can use it to visualize data, deploy machine learning models, or even create dashboards."
,atomix-studio/AtomixML,(Self) Educational Machine Learning Framework
,awslabs/graphstorm,Enterprise graph machine learning framework for billion-scale graphs for ML scientists and data scientists.
,Kaju1611/Machine-Learning-Project,A magical web development portfolio showcasing my projects and skills using modern frameworks like React.js and Next.js. Explore the enchanting digital experiences I've crafted with the power of JavaScript and Jamstack.
,Project-AgML/AgML,"AgML is a centralized framework for agricultural machine learning. AgML provides access to public agricultural datasets for common agricultural deep learning tasks, with standard benchmarks and pretrained models, as well the ability to generate synthetic data and annotations."
,YihaoHua/-Supporting-Information,Supporting information for the paper 'Comprehensive Evaluation Framework for Compost Maturity with Biochar Amendment: A Meta-Analysis and Machine Learning Approach'
,QuAIR/QuAIRKit,"QuAIRKit is a Python research framework for quantum computing, quantum information, and quantum machine learning algorithm development. It focuses on flexible design, real-time simulation and rapid verification of quantum and classical algorithms."
,AlkaidCheng/aliad,Framework for anomaly detection with machine learning
,abdullah-essam-1/Predictive-Modeling-of-CDK5-Inhibitors-A-Machine-Learning-Filtration-Approach-for-VS,"A machine learning-driven framework for virtual screening and drug discovery targeting CDK5 inhibitors. This project integrates cheminformatics, molecular feature extraction, and classification models to identify potential CDK5 inhibitors. It uses ChEMBL and PubChem data, SMOTE for balancing classes, and Random Forest and SVM models."
,marikaba/Market-Scenario-Optimization,"This repository is part of the implementation of the article ""A Comprehensive Framework for Market Scenario Prediction and Trading Strategy Simulation: Integrating Machine Learning with Optimized Technical Indicators Across S&P 500 Sectors"" by Maryam Bastani and Hossein Mohseni."
,vjaykr/Ai-for-financial-fraud-detection,we will use machine learning   to train our model for decision making and we will use flask framework to to create gui for easy accessibility of our project
,PFund-Software-Ltd/pfund,"An All-in-One Algo-Trading Framework: Backtest -> Train -> Trade -> Monitor. Machine / Deep Learning Ready. Supports All Trading: TradFi+CeFi+DeFi. Code Once, Trade Anywhere."
,edtechre/pybroker,Algorithmic Trading in Python with Machine Learning
,aws/sagemaker-distribution,"A set of Docker images that include popular frameworks for machine learning, data science and visualization."
,kayung-developer/AI-Intelligent-System,"AI Intelligent System is a sophisticated application that integrates artificial intelligence (AI), machine learning (ML), and computer vision to perform advanced data processing, object detection, facial recognition, and human pose estimation. The system leverages modern deep learning models and cutting-edge frameworks such as TensorFlow, PyTorch"
,Chinmay313/Initial-Coin-Offering-ICO-s-Success-Prediction,"Initial Coin Offerings (ICOs) are innovative but high-risk fundraising methods due to regulatory gaps, transparency issues, and volatility. Operating under an ""all-or-nothing"" framework, success hinges on meeting fundraising targets. This report develops a machine-learning model to predict ICO success."
,leoxiang66/research-trends-analysis,"This is the official repo for the paper ""TrendFlow: A Machine Learning Framework for Research Trend Analysis""."
,basalt-org/basalt,A Machine Learning framework from scratch in Pure Mojo 
,FederatedAI/eggroll,A Simple High Performance Computing Framework for [Federated] Machine Learning
,azizp128/income-prediction-flask,An experiment with machine learning model deployment using the Flask framework on Heroku & Streamlit. This project features a simple machine learning model that utilizes the Gradient Boosting Classifier algorithm to predict an employee's income.
,arjunpaud/Air_Quality_Predictor,In project we have build use machine learning model and flutter framework  to predict the quality of air.
,Renan-amc/Self-Service-Machine,Project aimed at learning the vue.js framework
,Hasibshamshad/Maxwell-Sutterby-Nanofluid-Data,"This repository is about an project entitled ""Advanced Modeling and Simulation of Bioconvection Nanofluid Flow Dynamics with Machine Learning and Explainable AI: An Interdisciplinary Framework"""
,NimraAslamkhan/AI-Health-Doctor-,"AI Health Doctor is an intelligent health recommendation system designed to predict diseases based on user-provided symptoms. Technologies Used:  Backend: Python (Flask Framework) Frontend: HTML, CSS, and Jinja2 templates for dynamic web pages Machine Learning: Symptom-based disease prediction using predictive models"
,gopalakrishnanarjun/autoxplainai,autoxplainai is an Automatic Model Explanation Framework that simplifies the process of interpreting machine learning models. It provides tools for generating explanations and visualizing them in an intuitive way.
,Vaidehi-M-P/Clinical-Parameters-Monitoring-Framework-Using-Image-Processing-and-Machine-Learning,
,franyatta/llm-finetuning-project,"A lightweight framework for fine-tuning small language models, designed to run on basic hardware"
,roshni-1/-Generative-Adversarial-Networks-GANs-for-Image-Generation,This project demonstrates how to implement Generative Adversarial Networks (GANs) using the MNIST dataset. GANs are a class of machine learning frameworks designed by Ian Goodfellow and his colleagues in 2014. The goal is to generate new data samples that resemble the training data.
,sunnyydv-git/Machine-Learning,"This repository explores Machine Learning (ML), covering fundamental concepts, algorithms, and hands-on projects. It includes supervised and unsupervised learning, feature engineering, model evaluation, and optimization techniques. Using frameworks like Scikit-Learn and TensorFlow, I document my learning journey and real-world applications."
,sofremahi/pytorch_projects,projects coded with pytorch framework for machine learning and deep learning
,Shahzod-CBU/BCC_liquidity,"This repository provides a comprehensive forecasting framework that integrates econometric models, machine learning techniques, and ensemble learning methods to predict banking system liquidity"
,Lakshaygoel4321/Car-Price-Prediction,This model is used to predict the cars prices after enter the details. Here i am using the machine learning framework.
,firefly-cpp/NiaAML,Python automated machine learning framework.
,Shotbylu/TensorWorks,"A versatile tensor library designed for efficient machine learning operations. This library provides robust tools for tensor manipulation, enabling seamless integration with various machine learning frameworks. Ideal for researchers and developers aiming to optimize their machine learning workflows."
,codecentric-oss/canaryml,"Welcome to CanaryML , a python-based framework to speed up the implementation and customization of your Machine Learning project ."
,SciML/ModelingToolkit.jl,An acausal modeling framework for automatically parallelized scientific machine learning (SciML) in Julia. A computer algebra system for integrated symbolics for physics-informed machine learning and automated transformations of differential equations
,hpides/End-to-end-ML-System-Benchmark,"A modular suite for benchmarking all stages of Machine Learning pipelines. To find bottlenecks in such pipelines and compare different ML tools, this framework can calculate and visualize several metrics in the data preparation, model training, model validation and inference stages."
,Sourabh9595/SalesPredictionModel,"A machine learning framework for predicting sales at potential store locations using demographic, competition, and store data. Combines PCA for feature reduction and Random Forest for prediction. Includes data preprocessing, model tuning, and visualizations to assist in strategic retail site selection and decision-making."
,YoussefSalem582/Multi-Emotion-Recognition-Healthcare,"A multimodal machine-learning framework to enhance mental health diagnostics by analyzing audio, video, and physiological signals. This system enables early detection of depression, improves diagnostic accuracy, and supports personalized treatment, adhering to ethical and data privacy standards."
,SeldonIO/seldon-core,"An MLOps framework to package, deploy, monitor and manage thousands of production machine learning models"
,sharonowino/Predicting-Road-Surface-Conditions-Using-SAR-Satellite-Imagery-and-Deep-Learning-Models,"This research focuses on predicting road surface conditions using Synthetic Aperture Radar (SAR) satellite imagery combined with a machine learning framework.  Few-shot learning falls under meta-learning(learning to learn), the way we are able to identify new classes of data easily using only a few examples using our previously learned knowledge. "
,ddroberts77/ml-trading-bot,Advanced Machine Learning Trading Bot Framework
,RaphaelMPimentel/rossmann_sales,"This project focuses on predicting store sales using historical sales data combined with store metadata. The analysis spans data preparation, feature engineering, and machine learning modeling to build a robust predictive framework for sales forecasting."
,LuisCBaez/well-log-ml,"A framework for processing, analyzing, and predicting well log data using advanced machine learning techniques. Features tools for data cleaning, depth-based interpolation, comprehensive visualization, and model optimization with GridSearch and Optuna."
,sktime/sktime,A unified framework for machine learning with time series
,aldojacopovirno/HybridHeartClassifier,"HybridHeartClassifier is an advanced R-based framework for heart disease classification and prediction, integrating statistical and machine learning approaches. "
,amisha-coderculb25/Machine-Learning-Based-Prediction-of-Social-Media-Performance-Metrics-Using-Instagram-Data,"It utilizes advanced machine learning and data visualization techniques to analyze  engagement metrics like likes, comments, shares, and impressions to optimize content strategies.Developed expertise in applying machine learning to real-world social media  data, creating insightful visualizations, and building a robust predictive framework."
,roodriigoooo/Machine-Learning-in-Finance-Labeling-Guide,"Exploration of ML applications in finance, drawing inspiration and summarizing the currently available and relevant literature. The objective is to deepen my understanding of key concepts, re-implement them with improvements, and explore alternative, non-widely used frameworks. "
,ivy-llc/ivy,Convert Machine Learning Code Between Frameworks
,DaronPopov/Pyptx,A python based ML framework for tensor operations and machine learning but with PTX (parrellel thread execution) enabled 
,fairen-group/mof-biocompatibility,Guiding the rational design of biocompatible metal-organic frameworks for drug delivery using machine learning
,AI4A-lab/Nanofluid-Thermophysical-Property-Prediction_Thermal-Conductivity_Hybrid-ML-DL,"This repository contains code for a comprehensive hybrid machine learning and deep learning frameworks for accurately predicting nanofluid thermal conductivity using stacking ensembles, advanced data augmentation, and metaheuristic optimization techniques."
,AungchitUnina/Data-Source-Global-Chla-Compiled-Data,"Global-Scale Chlorophyll-a Monitoring for Inland Lake Water Quality Framework: Advancements, Machine Learning Models, and Transferability Challenges"
,Sheethz-06/FinanceGPT,"This project focuses on the development of an advanced financial planning chatbot that integrates cutting edge language models and custom machine learning algorithms to deliver personalized financial insights. Utilizing the LangChain framework and the LLaMA language model, the chatbot is designed to engage users in a conversational manner."
,discovery-unicamp/dasf-core,Framework for computing Machine Learning algorithms in Python using Dask and RAPIDS AI. 
,PERSIMUNE/MAIT,"Medical artificial intelligence toolbox (MAIT): an explainable machine learning framework for binary classification, survival modelling, and regression analyses"
,Tanujkumar24/ChainlitQ-A-main,"ChainlitQ-A is a Python-based conversational AI project using the Chainlit framework. It enables asynchronous message handling and user-friendly chatbot interactions. The project is customizable, allowing enhanced response logic and integration with APIs or machine learning models. Ideal for creating responsive chat interfaces"
,mdabo/MLOps-Pipeline-Framework,A generic end-to-end machine learning pipeline framework supporting multiple types of data and learning tasks
,ParthrajVeluri/Fault-Detection-App,A machine learning framework developed for detecting and isolating faults in electrical grids
,ZJUEarthData/Geochemistrypi,an open-sourced highly automated machine learning Python framework for data-driven geochemistry discovery
,SHASANKsp/Machine_learning_framework,Machine learning tutorials
,Deekshahb2001/Object-Detection,"This project aims to develop a real-time object detection system using Python and popular deep learning frameworks. Object detection is a crucial task in computer vision, enabling machines to identify and locate objects within images or video streams."
,CryAndRRich/npmod,Building a simple deep learning framework and some machine learning/deep learning model from scratch (pure Numpy and Pytorch)
,dixita-29/Portfolio,"Welcome to my Data Science & Analytics portfolio! Here, I showcase projects where I extract insights from data, build predictive models, and create compelling visualisations using Python, SQL, and machine learning frameworks."
,julioQuantico/Machine-Learning-,Machine Learning Frameworks
,bmonikraj/ml-inference-candle.rs,Rust Machine Learning Inference with HF Candle framework
,yesMohanHere/Timeseries-Transformer-model-for-motor-fault-detection,"This repository provides a framework for analyzing vibration data from machinery to detect and classify operational conditions. By leveraging transformers and machine learning models, it processes raw vibration data to identify and predict faults, supporting predictive maintenance initiatives."
,t2cr7/Stockmarketprediction,"stock market web application using machine learning(ARIMA,LSTM,Linear Regression) and RMSE .For web framework django is used."
,gruchh/FactoryMaintenanceManagement,"This project was created for learning Java, specifically the Spring framework. The application aims to manage machines, breakdowns, and maintenance staff in a factory."
,Pharezzzz/Predictive-Maintenance-Pipeline-with-Machine-Learning,"A detailed machine learning pipeline for predictive maintenance, showcasing data preprocessing, feature encoding, and model preparation, using Python's powerful libraries and frameworks like NumPy, Pandas, Matplotlib, and Scikit-learn. Perfect for exploring data-driven solutions to optimize equipment reliability."
,unitaryfund/pennylane-qrack,The PennyLane-Qrack plugin integrates the Qrack quantum computing framework with PennyLane's quantum machine learning capabilities.
,dsmyl6/OpenPyStruct,Open-source toolkit that provides finite element model based optimization frameworks for generating training data and machine learning models for global structural optimization of indeterminate continuous structures
,AlexMourao19/Master-Thesis,"This repository contains a document that reviews popular frameworks for deploying Machine Learning models, focusing on efficiency, compatibility, and performance in production environments."
,MvMukesh/FeatureEngineering-Framework-ML,Industry specific framework of Feature Engineering in Machine Learning
,MvMukesh/DataPreprocessing-Framework-ML,"Least Discussed topic Data Preparation, most important part of a machine learning project"
,DOE-NCI-MOSSAIC/bardi,BARDI is a specialized framework engineered to facilitate the development of reproducible data pre-processing pipelines within machine learning workflows.
,Akshitha-Patnam/Wildlife-Detection-Framework,"Bio-Eye, an advanced wildlife detection framework that processes images of wildlife to identify the species name using machine learning and computer vision techniques. Integrated image processing methods with deep learning models for accurate species recognition, contributing to wildlife conservation and habitat monitoring efforts."
,pauloarayasantiago/portafolio,"Data Scientist passionate about Machine Learning and visualization. Skills in Python, SQL, and modern ML frameworks. Currently focused on AI applications for EVs, renewable energy, and resource optimization"
,odnil/FlowModel,FlowModel is a lightweight and extensible machine learning framework designed for beginners to easily experiment with AI development through a modular plugin architecture.
,AyeshaM67/Construction-accident-cost-prediction,Claasification_regression based two-tiered machine learning framework
,mattaq31/GelGenie,Open-Source package for segmentation and analysis of gel electrophoresis images using machine learning.  Both a python framework for training/running models and a QuPath GUI extension are available.
,KAJAL-CODER-BOT/StudentPerformancePrediction,"This repository presents a machine learning framework designed to predict student academic performance. The methodology integrates data preprocessing, SMOTE, feature selection, and model optimization techniques (ABC and ACO) to enhance prediction accuracy."
,JuliaAI/MLJ.jl,A Julia machine learning framework
,luizesser/caretSDM,"caretSDM applies a geoprocessing framework to the caret machine learning package, facilitating the access of Species Distribution Modeling community to state-of-the-art methods."
,bit-web24/silver-engine,Machine Learning Framework in C++
,ArcaneLightning/MLCancerDrugPrediction,A machine learning framework using ScanPy and Tensorflow to predict anti-cancer drug efficacy and response. The goal is to enable personalized treatment strategies.
,charithnukarapu/Machine-Learning-AI,tensorflow/tensorflow  Google's open-source ML framework. scikit-learn/scikit-learn  ML library for Python. pytorch/pytorch  Facebooks deep learning framework. OpenAI/gym  Toolkit for reinforcement learning.
,ca0108/HFML,Code of hybrid flow machine learning (HFML) framework
,ahmedali724/Web-Page-Phishing-Detection,A machine learning-based phishing detection framework that identifies phishing URLs using advanced algorithms and feature selection techniques.
,PROAkshat21112005/Advance-sentiment-analysis,This repository houses an advanced sentiment analysis framework that leverages state-of-the-art natural language processing (NLP) techniques to derive meaningful insights from textual data. The project is designed to push the boundaries of conventional sentiment analysis by integrating modern methodologies and advanced machine learning models.
,jakelevi1996/juml,Unified framework for multi-paradigm machine learning research
,entelecheia/hyfi-ml,A Python package that extends the Hydra Fast Interface (HyFI) framework with machine learning capabilities.
,SpeechCARE/SpeechCARE_Linguistic_Explainability_Framework,A collection of methods and experiments for improving explainability in machine learning models.
,tanish-0909/ImageSuperRes_using_ESRGAN,Complete framework for deploying an android app with image super resolution using machine learning
