framework,full_name,description
,manola1109/Introduction-to-PyTorch,"This repository contains Jupyter notebooks that cover the basics and practical applications of PyTorch, a popular deep learning framework. The notebooks are designed to help you build foundational knowledge in PyTorch and guide you through hands-on implementations of various neural network architectures and machine learning task"
,Joeroberts1601/Random_Forest_ADR_Prediction,This repository contains all the data and code used within the paper 'An Interpretable Machine Learning Framework for Adverse Drug Reaction Prediction from Drug-Target Interactions'. The data and code within this repository contain all methods used and unused
,vigyat13/ml-crop-recommendation-Flaskapp," Crop Prediction Web Application This project is a machine learning-powered web application that predicts the most suitable crop to cultivate based on environmental parameters. Built using Python's Flask framework, it leverages a trained Random Forest model to assist farmers and agricultural enthusiasts in making informed decisions."
,rayanahmedkakomo/Multivariate-risk-factor-analysis-model.,"This machine learning framework integrates lifestyle factors, demographics, medical history, and clinical symptoms to enhance the sensitivity and accuracy of early lung cancer detection."
,ai-wes/AutoMol-v2,"The AutoMol Framework is a multi-phase computational pipeline designed for the automated generation, analysis, and testing of novel molecular structures. This system integrates machine learning techniques, molecular dynamics simulations, and bioinformatics tools to create and optimize molecules tailored to specific biological functions."
,Sisira-reddy15/Fake-News-Detection-Using-Machine-Learning,"The present project proposes Adaptive Hyperdimensional Inference (AHI), a machine learning framework combining Hyperdimensional Computing (HDC), Deep Learning, and Evolutionary Learning to improve the ability to detect fake text and images instantaneously."
,mrturo/PredicTick,Framework for forecasting market direction using technical indicators and machine learning.
,Oluyimide25/attack_detector_2025,DEVELOPMENT OF A MACHINE LEARNING-BASED FRAMEWORK FOR REAL-TIME DETECTION AND MITIGATION OF DISTRIBUTED DENIAL OF SERVICE (DDOS) ATTACKS
,ProfEspinosaAIML/CSCN8010_Introduction,Foundations of Machine Learning Frameworks - Week 1 - Introduction
,jstoops/product-pricing-agent,"Compares base LLMs, as well as fine-tuned frontier and open-sources models, to traditional machine-learning (ML) techniques and human prediction of product prices based on a description. The winner, along with 6 other agents, is productionized in an AI agentic framework that sends push notifications to you when a deal is found."
,galafis/Machine-Learning-R-Framework,Professional repository showcasing advanced development skills
,Osmane97/LTE-Coverage-Prediction-Using-Machine-Learning,"This project develops a machine learning framework to predict LTE (4G) signal quality metricsRSRP, RSRQ, and SINRusing models trained on suburban and urban environments. It evaluates and compares Random Forest, Gradient Boosting, SVR, and Extra Trees for accurate signal prediction."
,gagansingh894/jams-rs,Rust based model serving solution for popular machine learning frameworks
,unitaryfoundation/pennylane-qrack,The PennyLane-Qrack plugin integrates the Qrack quantum computing framework with PennyLane's quantum machine learning capabilities.
,aluiziobrito/CADIM-,Cloud-Aware DEM Inundation Mapping (CADIM) : A geospatial framework for flood mapping under cloud cover using machine learning and digital elevation models (DEMs).
,calvinyeungck/Football-1-vs-1-Shot-Taking-Situations-Analysis,"Repo for the paper ""A Strategic Framework for Optimal Decisions in Football 1-vs-1 Shot-Taking Situations: An Integrated Approach of Machine Learning, Theory-Based Modeling, and Game Theory"""
,vidisha999/Developing-a-Scalable-Machine-Learning-Framework-for-Healthcare-Analytics-Using-Snowflake-and-AWS,"End-to-end machine learning framework that bridges data engineering, predictive modeling, and healthcare analytics toward data-driven decision-making."
,amnaabdelrazek/ML-With-Streamlit,"This repository contains a collection of machine learning models deployed using Streamlit, a Python-based framework for building interactive web applications. The project demonstrates how to effectively integrate machine learning workflows with a user-friendly interface,making it easier for end users to interact with and understand machine learning"
,AyeshaM67/Construction-accident-cost-prediction,Claasification_regression based two-tiered machine learning framework
,BioSystemsUM/DeepMol,DeepMol: A Machine and Deep Learning Framework for Computational Chemistry
,CheropS/LegalizeMe,machine learning model that check legal framework 
,janosh/matbench-discovery,An evaluation framework for machine learning models simulating high-throughput materials discovery.
,azhermurad/azhermurad,"I'm a passionate Data Scientist and AI/ML Engineer with hands-on experience building intelligent systems using machine learning, deep learning, and natural language processing. I specialize in developing scalable models using frameworks like PyTorch, TensorFlow, and Python  from research to real-world deployment."
,Rohit8983/Security-ML,"This research aims to enhance  cybersecurity by applying advanced  machine learning  techniquesRandom Forest, SVM,  Stacking Classifier, and CNN to  improve threat detection. It will  develop a comprehensive  framework integrating these  methods, assess their performance  across diverse datasets."
,tflinkow/property-driven-ml,"A generalised framework for property-driven machine learning, combining input region specification via hyper-rectangles with differentiable logics to compile logical constraints into loss."
,neoml-lib/neoml,Machine learning framework for both deep learning and traditional algorithms
,CiferAI/ciferai,"Cifer provides a decentralized AI development ecosystem with data-ownership proof on the Cifer blockchain, using a Privacy-Preserving Machine Learning (PPML) framework offers several methods for secure, private, collaborative machine learning Federated Learning and Fully Homomorphic Encryption"
,GabrieleQuintavalle/Short-Term-Stock-Movement-Prediction-Long-Short-Portfolio-Optimization,"Python-based machine learning framework to forecast short-term stock price direction and dynamically construct a long-short portfolio optimized for maximum risk-adjusted returns. The project covers data cleaning, feature engineering, model evaluation, backtesting, and comprehensive risk-return analysis."
,Narasimhamanam/QuizGame," Machine Learning Quiz App This is a responsive and interactive web-based quiz application focused on Machine Learning fundamentals, built using HTML, CSS, and JavaScript (no frameworks)."
,Prashant-patil-ux/Machine-Learning-paper,"Health Insurance Premium Prediction using Machine Learning  A regression-based ML framework to predict health insurance premiums using features like age, BMI, smoking status, and more. Includes data preprocessing, multiple regression models, evaluation metrics, and visualizations."
,Eris-Leksi/PracticalLab1---Univariate-Linear-Regression-on-the-California-Housing-Prices-Dataset,CSCN8010 - Foundations of Machine Learning Frameworks - Practical Lab 1 
,NwaoghorPraise2/ARMS-project,A machine learning based fault recovery framework built on apache Kafka for AI workload pipeline.
,smitbhatt20/Cybersecurity-Threat-ML-Model,An advanced threat intelligence tool integrating MITRE ATT&CK framework with machine learning to prioritize cybersecurity threats and visualize attack tactics.  A machine learning-powered threat prioritization and visualization platform mapping cybersecurity data to MITRE ATT&CK techniques. 
,AntonioRamos11/mloptimizer,"MLOptimizer is a comprehensive framework for automatically generating optimized machine learning models while capturing detailed hardware performance metrics. It provides a distributed system for model training, hyperparameter optimization, and hardware resource monitoring."
,serigela/SharpEdge-Quant,"SharpEdge-Quant is a high-performance quantitative trading framework combining Python-based machine learning with a C++ backtesting engine. It features a Flask API for serving signals, a React dashboard for visualizing strategy performance, and a modular architecture for financial experimentation. "
,ishita110/Fake-Tweet-Detection-using-Machine-Learning,"Developed a machine learning framework to detect fake tweets by analyzing tweet content and using neural networks to store credibility predictions. Tackled noisy auxiliary data to build a robust, efficient system that filters fake tweets and promotes credible info."
,thieu1995/X-ANFIS,X-ANFIS: An Extensible and Cross-Learning ANFIS Framework for Machine Learning Tasks
,markdewing/AI_kernels,Machine learning and AI kernels implemented in various languages and frameworks
,MG2005-git/Online-Payment-Fraud-Detection,"This project presents a comprehensive framework for detecting online payment fraud using machine learning. With effective preprocessing, EDA, model training and evaluation, the Random Forest model demonstrated promising performance."
,Aldrin7/Sustainable-Detection-of-Fake-Social-Media-Profiles-Using-Machine-Learning-and-Pattern-Analysis,"Fake social media profiles undermine online trust,  enabling misinformation and fraud. This study presents a sus tainable framework for detecting such profiles using energy efficient machine learning and pattern mining, aligning with green computing principles."
,searchyoto231/machine-learning-research-027,Advanced machine-learning research framework #27 - Distributed computing platform for educational and research purposes
,cirosantilli/china-dictatorship,"Anti Chinese government propaganda.  996.ICU709Friends who live in China and have real name on account, please don't star this repo, or else the police might pay you a visit.  Home to the mega-FAQ, news compilation, restaurant and music recommendations.Heil Xi . 6.4"
,PerfVec/PerfVec,A generalizable machine learning-based performance modeling framework.
,alinabil74568/onnxruntime,"ONNX Runtime is a powerful tool for accelerating machine learning tasks across various platforms. It enhances both inference and training, making it easier to deploy models from popular frameworks like PyTorch and TensorFlow. "
,Prannav-Bansal/Advanced-Ensemble-Framework-For-Malware-Detection,"Advanced Ensemble Framework capable of detecting and defending against obfuscated malware threats by leveraging the combined strengths of multiple machine learning models. Our core objective is to design a robust, scalable, and adaptive detection framework that intelligently integrates static, dynamic, and behavioral analysis techniques. "
,simadma/causal-machine-learning,Exploring some causal machine learning modeling techniques. The project uses the DoWhy framework.
,LaPetiteBird/six-mpc-preprocessing,"Implementation and evaluation of six special preprocessing protocols for secure multiparty computation (MPC) in privacy-preserving machine learning. This project benchmarks CDNN15, SecureML, SecureNN, CKRRSW20, RRHK23, and LowGear 2.0 using the MP-SPDZ framework."
,tai-almeida/AIML_apple_ecosystem,"This repository explores Artificial Intelligence and Machine Learning in the Apple ecosystem, focusing on the tools and frameworks to develop high-performance AI applications."
,edtechre/pybroker,Algorithmic Trading in Python with Machine Learning
,PennyLaneAI/pennylane-qulacs,The PennyLane-Qulacs plugin integrates the Qulacs quantum computing framework with PennyLane's quantum machine learning capabilities.
,RezaAramjou/BB84_Simulation,An Advanced Simulation Framework for BB84 Quantum Key Distribution: Towards Real-Network Conditions and Data Generation for Machine Learning Applications.
,jakelevi1996/juml,"A Judicious, Unified and extendable framework for multi-paradigm Machine Learning research, powered by jutility and PyTorch."
,jaywyawhare/C-ML,Machine learning framework written in C.
,ShengDong207/quantum-ml-framework,A tool for quantum computing approaches to machine learning
,ZygoteCode/AI-Frameworks,"A complete, curated list of all Open Source frameworks for developing Artificial Intelligences and Machine Learning Algorithms for Python, C++ and C#."
,RekhaGiduthuri19/Weather-Predictor,"The proposed system introduces a machine learning-based framework for accurate weather prediction, designed to overcome the limitations of traditional forecasting methods. The system focuses on predicting temperature, rainfall, and humidity using historical weather data from NOAA"
,saicharannetha/Machine-Learning-Based-Malware-Detection-Framework-for-Reverse-Engineered-Android-Applications,
,gomlx/gomlx,GoMLX: An Accelerated Machine Learning Framework For Go
,jacksonbuilds/digit-classifier,A demo project for TensorFlow. TensorFlow is an open-source machine learning (ML) and deep learning (DL) framework developed by Google.
,silvermete0r/oikan,"OIKAN is a neuro-symbolic machine learning framework inspired by Kolmogorov-Arnold representation theorem. It combines the power of modern neural networks with techniques for extracting clear, interpretable symbolic formulas from data. OIKAN is designed to make machine learning models both accurate and Interpretable."
,BarionLP/MachineLearning,A performant and dynamic MachineLearning framework written in .NET
,avi2924/A-Robust-Ensemble-Based-Framework-for-Credit-Card-Fraud-Detection-Using-Advanced-Machine-Learning-Te,
,searchyoto231/machine-learning-research-007,Advanced machine-learning research framework #7 - Distributed computing platform for educational and research purposes
,yuliuqian/MachineLearning-O2-drivers,Machine learning framework analyzing coastal oxygen depletion drivers.
,VedantPai24/Made-With-ML,"This project leverages the ""Made With ML"" framework and resources to explore and build machine learning applications. "
,Hongwei-Z/SC-MLIDS,SC-MLIDS: Fusion-based Machine Learning framework for intrusion detection in wireless sensor networks
,Rozzay22/cyber-risk-assessment,"The AI-Powered Cyber Risk Assessment System is a comprehensive cybersecurity platform designed to help organizations identify, assess, and mitigate cyber risks. Leveraging advanced AI algorithms and machine learning techniques, this system provides a robust framework for threat analysis, vulnerability management, and risk assessment."
,mahirshah13/alpha-regime,A machine learning framework for regime-aware market strategies.
,Tanvir7898/Classification-of-Heat-Related-Illness-Risk-Using-Machine-Learning-and-Explainable-AI,"Designed a machine learning-based framework for the prediction of heat-related illnesses based on the analysis of environmental and physiological factors. It will help in the identification of those at risk through data inputs such as temperature, humidity, heat index, and other personal health parameters so as to give warnings for severe outcomes."
,ivy-llc/ivy,Convert Machine Learning Code Between Frameworks
,mfaria-p/ZeoPropNet,A TensorFlow-based machine learning framework for predicting zeolite propertiesparticularly framework densityusing neural networks and composite building unit fingerprints
,joshbrown901/Implementation-of-Diffusion-Transformer-within-NNTile-Machine-Learning-Framework,"Efficient CPU-based Diffusion Transformer in NNtile (on STARPU), optimized for scalable, high-fidelity generative modeling. Benchmarked against PyTorch and Hugging Face. Roadmap includes training and generation pipelines, plus scalability testing for larger models and datasets."
,MLShukai/pamiq-core,Framework for building AI agents with real-time adaptive learning capabilities.
,gyu29/Machine-Learning-Strat,A comprehensive machine learning framework for predicting S&P 500 price movements and implementing a data-driven trading strategy across multiple time horizons.
,Ikeoguoma/Ikechukwu-Chiwueze-Oguoma,"This repository showcases selected projects by Ikechukwu Chiwueze Oguoma in the areas of mathematical modeling, data science, and STEM education research. Each project demonstrates the application of mathematical frameworks, statistical analysis, machine learning, and data-driven methodologies to solve real-world challenges."
,debeshkapali/Machine-Learning-Framework-and-Tools,
,JQ-Zeng/Precision-groundwater-pollution-control-in-brownfields,"A machine learning-based framework for sustainable and precision groundwater pollution management at industrial brownfields, integrating dimensionality reduction, clustering, and deep multi-view fusion of multi-source data."
,anacostiaAI/anacostia-pipeline,Anacostia is a framework for creating machine learning operations (MLOps) pipelines
,etorresram/LPI-Prediction-with-MLModels,This repository presents a machine learning-based framework to predict the World Bans's Logistics Performance Index (LPI). 
,JavithHussainShareef/Battery-Recycling-Digital-Twin,"This project implements a machine learning-based Digital Twin framework for the battery recycling industry. It integrates data from recycled battery bags and blackmass chemical analysis to simulate, predict, and optimize the recycling process. "
,Tynoee/Loan-Approval-Prediction,"This project is a web application for predicting loan approval status based on various financial and personal attributes. It uses a machine learning model that I trained on historical loan data to make predictions. I built the web application using Flask for the web framework, SQLite for the database, and the pre-trained model saved with joblib."
,google-parfait/tensorflow-federated,An open-source framework for machine learning and other computations on decentralized data.
,heyitshawaiz/Efficient-Pediatric-Heart-Transplant-Predictions,Developed an advanced machine learning framework utilizing synthetic data generation and self-supervised learning to enhance 1-year mortality prediction in pediatric heart transplantation. Achieved up to 100% accuracy using ensemble modeling techniques.
,99sbr/fastapi-template,"Completely Scalable FastAPI based template for Machine Learning, Deep Learning and any other software project which wants to use Fast API as an API framework."
,Sferratore/CodeStresser,"CodeStresser is a ML-driven static analysis framework that scans source code in multiple programming languages to detect security vulnerabilities. It extracts per-vulnerability features and uses machine learning models to predict severity and confidence, generating a structured, developer-friendly security report."
,saracherif123/Optimizing-File-Similarity-Search-Techniques-in-Data-Lakes-using-Big-Data-Frameworks-,This project explores scalable techniques for detecting similar or duplicate datasets in large-scale data lakes using Big Data frameworks like Apache Spark. It reimplements the DS-Prox early pruning algorithm and evaluates two machine learning modelsRandom Forest and Multilayer Perceptron (MLP).
,ParamThakkar123/Machine-Learning-Projects,"This repository contains all the machine learning and deep learning model I have implemented using various frameworks like keras, tensorflow, scikit-learn, pytorch, etc."
,lamalab-org/MoleculeBind,"MoleculeBind is a machine-learning framework for chemistry, where we target unifying various molecular representations into one common latent space (SELFIES, SMILES, Graph, Structures, Fingerprints, Molecular Spectra)"
,Waikato/moa,"MOA is an open source framework for Big Data stream mining. It includes a collection of machine learning algorithms (classification, regression, clustering, outlier detection, concept drift detection and recommender systems) and tools for evaluation."
,Iqbalrzl/ML-BigData-FareAmount-LinearRegression,"In this project, we built a Machine Learning Model using the linear regression method for a regression task predicting fares on the ""New York City Taxi Fare Prediction"" dataset. We utilized the PySpark framework to handle the large dataset of 55 million records (categorized as Big Data). "
,josephmisiti/awesome-machine-learning,"A curated list of awesome Machine Learning frameworks, libraries and software."
,rohanmistry231/Deep-Learning-Projects,"A collection of deep learning projects implemented in Python, focusing on neural networks, computer vision, and NLP using frameworks like TensorFlow and PyTorch. Includes practical examples, datasets, and tutorials for building and evaluating advanced machine learning models."
,officiallokeshyadav/With-The-Help-Of-Python-We-Ai-create-Ai,"It's widely used because of its rich ecosystem of libraries and frameworks like TensorFlow, PyTorch, scikit-learn, and many others that simplify AI and machine learning development."
,hadFares/NN-from-scratch,"A collection of neural networks implemented from scratch in Python using NumPy, including a fully connected feedforward network and an upcoming convolutional neural network (CNN). No machine learning frameworks used."
,gtsagkatakis/soil-moisture-bayesian-fusion,Bayesian machine learning framework that fuses forecasting and remote sensing retrieval for accurate and uncertainty-aware soil moisture estimation.
,Prashant-patil-ux/Machine-Learning-Research-paper,"Health Insurance Premium Prediction using Machine Learning  A regression-based ML framework to predict health insurance premiums using features like age, BMI, smoking status, and more. Includes data preprocessing, multiple regression models, evaluation metrics, and visualizations."
,amiteshks/amiteshks,"This repository serves as a hub for my ML/AI explorations, implementations, and tutorials. It includes:   Exploratory Data Analysis (EDA) projects  Machine Learning models for predictions and classifications  Deep Learning projects using frameworks like TensorFlow, PyTorch, and Hugging Face  Natural Language Processing (NLP) applications "
,PFund-Software-Ltd/pfund,"An All-in-One Algo-Trading Framework: Backtest -> Train -> Trade -> Monitor. Machine / Deep Learning Ready. Supports All Trading: TradFi+CeFi+DeFi. Code Once, Trade Anywhere."
,WANS170651/Predictive-and-Spatial-Analysis-of-HIVAIDS-Outcomes-in-New-York-City,A unified framework combining machine learning and spatial analysis to uncover disparities in HIV care linkage and viral suppression across NYC regions.
,AJECooper/Nebula,"NEBULA is a lightweight, modular machine learning framework for .NET developers."
