framework,full_name,description
,Laxmi-krvt/Flood-prediction-model-lstm-,A Flood prediction model for UP and Assam using Machine learning and the Gradio framework
,helmholtz-analytics/heat,Distributed tensors and Machine Learning framework with GPU and MPI acceleration in Python
,Sairithvik-2003/A-Machine-Learning-framework-for-detection-of-Autism-Spectrum-Disorder,
,pimaja/AutoML-Efficient-Development-of-Application-Specific-Machine-Learning-Models,"With the uptake of machine learning applications for edge devices, we are seeing an increase in model-requirements including memory, bandwidth, and inference time. For many applications these requirements come in the form of upper bounds on several different metrics - something that guarantees an application can be deployed efficiently.    Today, these requirements are met through a combination of both training and post-training work, such as pruning and quantization. However, by relying on post"
,demml/opsml,"A common interface for registering, validating and auditing machine learning artifacts"
,Apra-Labs/ApraPipes,A pipeline framework for developing video and image processing application. Supports multiple GPUs and Machine Learning tooklits
,AFOliveira/MLonBAO,Framework for Impact Analysis of Contention on Multi-Core Platforms for Real-Time Critical Applications and Machine Learning
,jaseempaloth/nifty50-index-ml-forecasting-lstm,"A mini project implementing machine learning techniques to forecast the Nifty 50 index using a Random Forest classifier. It involves data preprocessing, feature engineering, model training, and evaluation, along with a backtesting framework to assess prediction accuracy."
,SeldonIO/seldon-core,"An MLOps framework to package, deploy, monitor and manage thousands of production machine learning models"
,guobin8216/T1HG-UCBguider,"Machine learning model construction was performed silimilarly as previously described (PMID: 34875674), the 18 mRNA markers and 7 MHB markers were integrated with 4 clinical variables (age, gender, tumor stage, and grade) to construct two machine learning sub-models within the T1HG-UCBguider framework."
,AashaNagar/Machine-Learning-Framework,
,serdaraltin/Watch-Data-Service,"The project provides a framework for real-time data processing and analysis using machine learning models to detect and interpret camera data. It integrates with a database for efficient data storage and retrieval, suitable for applications requiring quick and reliable analysis."
,HarryME-zh/EdgeFL,The EdgeFL Framework simplifies the integration of decentralized federated learning into your machine learning applications.
,bolticio/automl-templates,"This repository contains a collection of Automated Machine Learning (AutoML) templates and examples implemented in various programming languages and frameworks. AutoML aims to automate the end-to-end process of applying machine learning to real-world problems, making it more accessible to users without extensive machine learning expertise."
,D0nG4667/favorita_products_demand_forecasting,"As a data scientist at Corporation Favorita, I'm tasked with ensuring that we always maintain the right quantity of products in stock. To achieve this, I've chosen to develop a series of machine learning models to forecast the demand for products across different locations. I adhered to the CRISP-DM Framework for Data Science projects."
,TsLu1s/Atlantic,Atlantic: Automated Data Preprocessing Framework for Supervised Machine Learning
,Interactml/iml-unity,This is an interactive machine learning framework for Unity3D. It allows developers the ability to use interactive machine learning in running games. 
,VedantK1604/Flight-price-prediction-using-ml,"This project aims to predict flight prices using machine learning with the help of AWS Sagemaker. The project leverages the XGBoost framework for prediction and Streamlit for the user interface. The end-to-end pipeline includes data storage, feature engineering, model training, and prediction."
,Monchiwjxie/Hazardous-waste-generation,"A machine learning based and data-driven methodological framework to predict the generation quantity of HW at the firm-level in every month through linking different datasets across domains, which were used as proxies to indicate both static characteristics and real-time activities of enterprises."
,iqbal1201/Apache_SparkML,Machine Learning Model Development using Big Data Framework Apache Spark ML
,Taha0229/UNetR-MachineLearning,"Implemented research paper on UNETR on a custom multi-class dataset,  built modular pipelines, served the model as REST API, developed the backend on Django REST Framework, deployed on AWS, developed frontend on Next.Js, deployed on Vercel. Implemented MLOps and DevOps."
,bytedance/fedlearner,A multi-party collaborative machine learning framework
,saiaswath07/HealthHub,"Developed a user-friendly Hospital Recommendation System employing machine learning for symptom detection and doctor recommendation.Leveraged Django framework and Oracle DB to manage backend operations and data storage, integrating a diverse range of functionalities."
,hessionjason/Sentiment-Analysis,"This project is a sentiment analysis application developed using Python, TensorFlow, and Flask. The primary purpose of this project is to learn and understand the integration of machine learning models with a web framework to create a complete and interactive web application."
,douglasbc/tennis_model,"End-to-end tennis prediction model. Data ingested with Python and transformed with dbt on BigQuery. Model implemented with Google JAX, a Python machine learning framework."
,manulthanura/LapPricePrognosticator,End-to-end machine learning project that can predict the price of a laptop based on its features. The application is built using the Flask web framework and deployed on Azure.
,shumwaymark/sentinelcam,A computer vision and machine learning pipeline on a distributed framework. Designed for an embedded network on low voltage IoT hardware.
,Sakib1263/AHN-Severity-Stratification,"This repository contains the codes for our study involving an end-to-end deep machine learning framework developed to sequentially detect ultrasound regions of interest, segment kidneys from US images, and classify AHN severity."
,BhushanProg/Python,"As a passionate Python developer, I excel in using libraries like NumPy, Pandas, and Matplotlib for data insights, and frameworks like Django and Flask for web applications. My projects on GitHub include machine learning with TensorFlow and automation with Selenium. I ensure my code is efficient, robust, and up-to-date with Python best practices."
,irx76/ATM-Machine,"Welcome to the demonstration of my fully functional ATM machine project, developed using the Java Swing framework and JDBC for database operations. This project is my first endeavor after learning Java from scratch and showcases various ATM functionalities with a touch of internationalization and CRUD operations."
,JuliaAI/MLJ.jl,A Julia machine learning framework
,secretflow/secretpad,"SecretPad is a privacy-preserving  computing web platform based on the Kuscia framework, designed to provide easy access to privacy-preserving data intelligence and machine learning functions. "
,aphp/edspdf,"EDS-PDF is a generic, pure-Python framework for text extraction from PDF documents. It provides the machinery to use rule- or machine-learning-based approaches to classify text blocs between body and meta-data."
,Egjfour/dsti_goodreads_rating_predictions,Using machine learning to predict Goodreads ratings. Follows the Kedro framework
,kirangajjana/Machine-Learning,"Welcome to the Machine Learning Projects repository! This collection showcases a diverse range of machine learning projects implemented in Python, utilizing popular libraries and frameworks. Each project is designed to demonstrate various machine learning concepts, techniques, and applications."
,aws-samples/twingraph,"TwinGraph is a Python framework for distributed container orchestration using Kubernetes clusters, Docker Compose/Swarm or cloud resources on AWS (AWS Lambda, AWS Batch, Amazon EKS). Applications include high-throughput simulations, simulation-driven optimization, Digital Twins and machine learning."
,ml-master/ENDEF-framework,machine learning homework
,AI4HealthUOL/CardioLab,This is the official repository for CardioLab. A machine and deep learning framework for the estimation and monitoring of laboratory values throught ECG data.
,microsoft/DeepGNN,DeepGNN is a framework for training machine learning models on large scale graph data.
,MolCrafts/molpot,[WIP] Machine Learning Molecular ForceField Training and Deploying Framework
,tensorflow/tensorflow,An Open Source Machine Learning Framework for Everyone
,AvinashKant/avinashkant,"I have approx 2 year IT industry experience as Python and PHP Development. I have knowledge of several frameworks like Django, Laraval,Lumen, and CodeIgniter. I have a passion for computer applications and currently learning machine learning algorithm and technique. I am a conscientious person who works hard and pays attention to detail. I'm flexible, quick to pick up new skills and eager to learn from others."
,usmanayub14/Pytorch-Projects,Welcome to the PyTorch Projects Repository! This repository showcases a collection of projects that demonstrate my skills in using the PyTorch deep learning framework to build machine learning (ML) and deep learning (DL) models. 
,mala-project/mala,Materials Learning Algorithms. A framework for machine learning materials properties from first-principles data.
,DOE-NCI-MOSSAIC/bardi,BARDI is a specialized framework engineered to facilitate the development of reproducible data pre-processing pipelines within machine learning workflows.
,secretx51/scGeneInsight,Machine learning framework using shap feature importance and an MLP model that predicts gene importance related to biological pathway using GSVA enrichment scores.
,Hema-ch/AI-BASED-APPLICATION-FOR-PERSONALISED-JOB-SEARCH-LEVERAGING-NLP-ML,"The project streamlines job searching by using NLP and web scraping to extract skills from resumes and fetch job opportunities from Naukri.com. Machine learning improves job matching accuracy, offering a personalized job-hunting experience. Technologies include NLP libraries, ML frameworks, and Selenium."
,tlie03/machinelearning,My attempt to build a machine learning framework from scratch
,pranil25/-Building-web-framework-addressing-learning-disability-using-machine-learning-and-computer-vision,
,Sujithhh/Organic-farm-E-Commerce-Website,Created an Organic Farm E-commerce Platform enabling users to buy fresh produce while offering agricultural insights. Implemented machine learning for crop predictions based on environmental factors. Used python django framework.
,phourcouch/HD-IDHV,Framework to run machine learning datasets with a Hyperdimensional Computing model using the original encoding with C++ and Eigen Library 
,aai-institute/nnbench,A small framework for benchmarking machine learning models.
,discovery-unicamp/Minerva,Minerva is a framework for training machine learning models for researchers.
,izzad2413/django_project,This is a simple example of deploying machine learning model using django framework
,hardik-yadav1729/stockforecasting," A single-page web application built using Dash (a Python framework) and integrated with machine learning models. This application displays company information (logo, registered name, and description) and stock plots based on the stock code provided by the user. Additionally, the ML model predicts stock prices for user-specified dates."
,gregory-kyro/CardioGenAI,CardioGenAI: A Machine Learning-Based Framework for Re-Engineering Drugs for Reduced hERG Liability
,Iamtahirsiddique/Car-Evaluation-System,"Car Evaluation System is developed in backend in Python Language using FAST API framework and using different algorithms of machine learning and front-end using (HTML, JS, CSS, BOOTSTRAP). Car buyer can check the car is fair or not to buy by entering some features result with 5 different algorithms."
,TwoAiDevelopers/DeepAIKit,"DeepAIKit is an open-source library developed entirely from scratch to provide comprehensive tools for machine learning and deep learning. Without relying on existing frameworks like scikit-learn, PyTorch, or TensorFlow, DeepAIKit simplifies the development, training, and deployment of ML and DL models."
,jmjaaseth/masterthesis,"Python framework for quantum machine learning, developed for my master thesis."
,SriHari506/Mask-Aware-System,"Mask Aware System is a Machine Learning, Deep Learning based project Which has build by using several Frameworks such as Numpy, Keras, Tensorflow, Flask, OpenCV, Scipy. This project has developed for the purpose of monitoring  the people whether they have weared the Face mask or not to be stay away from the Diseases Like Carona, Sinflu etc.,"
,fotsingriemann/test_model,Machine learning model testing on a django framework app
,github2mahesh/Big-Data-Analytics,"This repository showcases lab assignments completed in a Big Data Analytics course. It provides examples of working with various technologies and frameworks for processing and analyzing large datasets, including SQL, Spark, Spark SQL, and Machine Learning with Spark."
,devyanshbatra/TENSOR-FLOW,"TensorFlow is an open-source machine learning framework developed by Google Brain, primarily used for deep learning applications. With TensorFlow, you can build, train, and deploy various machine learning models efficiently."
,ivy-llc/ivy,Convert Machine Learning Code Between Frameworks
,lorenzofamiglini/CalFram,Calibration Framework for Machine Learning and Deep Learning
,Azure/Azure-Machine-Learning-Adoption-Framework,"this repo provides best practice guidance, plan template, solution assessment tool etc. to help Machine Learning Studio(classic) customer adopt Azure Machine Learning."
,tjqJ62cESiHPj6DdR6vXDAcPp/cihna-dictatorshrip-8,"Anti Chinese government propaganda. https://github.com/cirosantilli/china-dictatorship backup.  996.ICU709Friends who live in China and have real name on account, please don't star this repo, or else the police might pay you a visit.  Home to the mega-FAQ, news compilation, restaurant and music recommendations.Heil Xi . "
,IntelPython/scikit-learn_bench,"scikit-learn_bench benchmarks various implementations of machine learning algorithms across data analytics frameworks. It currently support the scikit-learn, DAAL4PY, cuML, and XGBoost frameworks for commonly used machine learning algorithms."
,Kavindu-J22/-Enhancing-Personalized-E-Learning-Platform-Learnpath-,"E-learning platforms often use static content  distribution, failing to meet individual learners'  needs, which hinders engagement and  retention. ""LearnPath+: Enhancing Personalized  E-Learning"" aims to develop an adaptive learning  framework using machine learning and user  experience design to provide tailored learning  experiences."
,madscientist42/meta-edgeml,"Yocto layer for varying ""BSP"" items for several different Deep/Machine Learning devices and frameworks"
,lazywulf/Basic-ML-Framework,Straightforward implementation of some important machine learning algorithms and components.
,alicembera/Building-Machine-Learning-API-s-With-FastAPI,"The project focused on analyzing trends and predictors in patient data to uncover the factors contributing to sepsis occurrences. Machine learning models were developed to provide accurate and efficient classification of sepsis cases, utilizing the FastAPI framework and Docker for implementation."
,tcnicholas/hZIF-data,"Supporting dataset for: Coarse-grained versus fully atomistic machine learning for zeolitic imidazolate frameworks; Zo Faure Beaulieu, Thomas Nicholas, John Gardner, Andrew Goodwin, and Volker Deringer"
,20NN1A1220/Online-Phishing-URL-Detection-Using-Machine-Learning-Techniques-and-Flask-Framework,
,simplyYan/GalaktaGlare," A broad, easy and fast framework for machine/deep learning in Go."
,sharc-lab/HLSFactory,HLSFactory: A Framework Empowering High-Level Synthesis Datasets for Machine Learning and Beyond
,ChamaraKasun99/Stock-Price-Prediction-using-LSTM-code-alpha,Generative Adversarial Networks (GANs) are a cutting-edge machine learning framework composed of two neural networksthe generator and the discriminatorthat compete against each other in a game-theoretic scenario.
,lanl/ALF,A framework for performing active learning for training machine-learned interatomic potentials.
,Anionex/MNIST-handwritten-digit-classification,hello world project for machine learning and deep neural networks without deep learning framework.
,edtechre/pybroker,Algorithmic Trading in Python with Machine Learning
,Hon-Hai-Quantum-Computing/QuantumTrain,A framework to compress classical machine learning model during training by quantum machine learning
,AkiRusProd/numpy-nn-model,"ustom torch style machine learning framework with automatic differentiation implemented on numpy, allows build GANs, VAEs, etc."
,GeoNosX/Spam-vs-Ham-Classifier,"This project is an implementation of a machine learning classifier designed to distinguish between spam (unsolicited or unwanted messages) and ham (legitimate messages) in text data. Built using Python and popular machine learning libraries like scikit-learn, it provides a robust framework for classifying text data into spam or ham categories."
,Jignesh749/ML_Projects,This repository contains various Machine Learning Projects built using different frameworks and libraries.
,google/paxml,"Pax is a Jax-based machine learning framework for training large scale models. Pax allows for advanced and fully configurable experimentation and parallelization, and has demonstrated industry leading model flop utilization rates."
,zamax14/ML_DL_Frameworks,Examples of different libraries and frameworks for machine learning and deep learning techniques.
,Ean-Warrick/mlua,A Machine Learning Framework that uses Neural Networks. Developed for Roblox Studio.
,cran/BioM2,:exclamation:Thisisaread-onlymirroroftheCRANRpackagerepository.  BioM2BiologicallyExplainableMachineLearningFramework  
,dotnet/machinelearning-samples,"Samples for ML.NET, an open source and cross-platform machine learning framework for .NET."
,alteryx/predict-customer-churn,A general-purpose framework for solving problems with machine learning applied to predicting customer churn
,aws-solutions-library-samples/guidance-for-ultra-low-latency-machine-learning-feature-stores-on-aws,"This Guidance shows how you can build an ultra-low latency online feature store using Amazon ElastiCache for Redis, a fully managed Redis service from AWS, and Feast, an open-source store framework"
,Project-AgML/AgML,"AgML is a centralized framework for agricultural machine learning. AgML provides access to public agricultural datasets for common agricultural deep learning tasks, with standard benchmarks and pretrained models, as well the ability to generate synthetic data and annotations."
,SCUS3/Classification-Model-Evaluation,This project provides a comprehensive framework for evaluating classification models and selecting the best algorithm based on performance metrics. It demonstrates the importance of hyperparameter tuning and model comparison in machine learning workflows.
,AtrCheema/AI4Water,framework for developing machine (and deep) learning models for structured data
,luca-vita/Implementing-core-Machine-Learning-models-to-predict-the-popularity-of-online-news-articles,From scratch and framework free implementation of core machine learning models
,Fabian12Florin/Node2Vec_study,# Node2Vec Project  ## Introduction Node2Vec is an algorithmic framework for learning continuous feature representations for nodes in networks. These representations can be used for various downstream machine learning tasks.
,xavier-orcutt/TrialTranslator,Framework for exposing heterogeneity of treatment effect for cancer therapies in real-world patients through machine learning-based emulations of landmark oncology RCTs. 
,Daniel-Andarge/AiML-credit-risk---loan-optimization-ml,"This project focuses on leveraging advanced data analytics and machine learning techniques to develop a comprehensive credit risk assessment, credit scoring, and loan optimization framework. "
,KStruniawski/TfELM,Extreme Learning Machines Framework with Python and TensorFlow
,nemwelamoro/Titanic-Prediction,"Web based prediction app built using Django framework. Used the famous titanic dataset to build a machine learning model ,pickled it and integrated it with Django framework to build the app"
