framework,full_name,description
,saiadvaith2004/Car-Price-Predictor,"The Car Price Predictor is a web application built using Flask, a light weight framework for python. This application allows users to input various details regarding the car and it predicts the selling price in a particular year. It predicts the price using a machine learning model trained on a particular Car prices Dataset."
,ninpnin/days-since-last-ml-framework,Keep track of the newest machine learning frameworks on GitHub
,Semsary/Backend,The backend of this project is built using the .NET framework and SQL Server. and support the applications machine learning components with reliable and high-performance backend services.
,HoomaanMoradi/ReedsShepp-MLOps,"An MLOps framework for developing, training, and deploying machine learning models aimed at solving the Reeds-Shepp path planning"
,josephmisiti/awesome-machine-learning,"A curated list of awesome Machine Learning frameworks, libraries and software."
,TaimoorKhan10/AI-Fairness-Explainability-Toolkit,"AI Fairness and Explainability Toolkit (AFET) is an open-source project aimed at providing tools and frameworks to assess, visualize, and mitigate bias in machine learning models. It supports multiple ML frameworks and offers a comprehensive suite of metrics and visualization components to enhance model transparency and fairness."
,fate1997/MoIma,Molecule Imagination: A framework aims to accelare machine learning in Chemistry
,Itachi0906/Machine-Learning-Framework-in-Cpp,
,sktime/sktime,A unified framework for machine learning with time series
,maliknaik16/machine-learning,"ML journey to explore concepts and framework through code and math. It serves as a personal log of my learning experiences, revisiting foundational topics, and delving into new areas within the field."
,tai-almeida/AIML_apple_ecosystem,"This repository explores Artificial Intelligence and Machine Learning in the Apple ecosystem, focusing on the tools and frameworks to develop high-performance AI applications."
,ci-group/learning_machines_robobo,Framework for the Learning Machines Course at VU Amsterdam
,brain4j-org/brain4j,Open-source machine learning framework for Java. Designed with speed and lightweight in mind.
,discovery-unicamp/Minerva,Minerva is a framework for training machine learning models for researchers.
,jackgerrits/reductionml,Reduction-based machine learning framework with a focus on contextual bandits
,Flameboy2003/x-tweet,"X-Tweet is a full-stack web application for analyzing real-time Twitter trends using NLP and machine learning. It provides insights through sentiment analysis, topic modeling, anomaly detection, influencer tracking, bot detection, and more. Built with Vue.js, Django REST Framework, PostgreSQL, and Chart.js."
,MehrdadJalali-AI/MOFGalaxyNet,MOFGalaxyNet aims to create a social network for Metal-Organic Frameworks (MOFs) and predict their properties using Graph Convolutional Networks (GCN). It fosters collaboration and exploration in the field of MOFs through social network analysis and machine learning.
,guilherme-machado-ceo/Hubstree,"Framework operativo e visual baseado na rvore da Vida da Cabala, aplicando isso a pipelines de dados, IA generativa, machine learning, desenvolvimento gil e engenharia de produtos digitais. Disruptivo tanto no design quanto na arquitetura de software."
,JinukMoon/CatBench,CatBench - Benchmark Framework of Machine Learning Interatomic Potentials in Adsorption Energy Predictions
,vidisha999/Developing-a-Scalable-Machine-Learning-Framework-for-Healthcare-Analytics-Using-Snowflake-and-AWS,"End-to-end machine learning framework that bridges data engineering, predictive modeling, and healthcare analytics toward data-driven decision-making."
,slavatlsn/NeuroForge,A framework that allows to perform machine learning on embedded devices. Light and efficient
,xjaweiofj/An-Efficient-Distributed-Machine-Learning-Inference-Framework-with-Byzantine-Fault-Detection,An Efficient Distributed Machine Learning Inference Framework with Byzantine Fault Detection
,nagaramshiva/A-malware-detection-framework-for-reverse-engineered-Android-applications-using-machine-learning-alg,Designed a system to detect malware in reverse-engineered Android applications using machine learning techniques. Implemented feature extraction and classification models to enhance detection accuracy.
,BioSystemsUM/DeepMol,DeepMol: A Machine and Deep Learning Framework for Computational Chemistry
,SoyGema/The-Lord-of-The-Words-The-two-frameworks,Translation exploration with Transformers and Machine Learning Experimentation Platfroms
,meghahu-07/eduai,"EduAi is a full-stack AI-powered education platform designed to provide personalized learning experiences to students. By leveraging machine learning models, natural language processing, and modern UI frameworks, EduAi adapts to individual student needs and empowers them to learn smarter, not harder."
,FernandoCsm-Knight/Pineapple,A machine learning framework in c++
,WilfredAuxilian/Realtime-Fish-Detection-GUI,It is an AI Hybrid Framework Graphical User Interface system consisting of Real-Time Underwater Fish Detection using two Machine Learning algorithms & traditional Computer Vision Algorithm and an Image Enhancement Pipeline to improve the Efficiency and Accuracy.
,ShengDong207/quantum-ml-framework,A tool for quantum computing approaches to machine learning
,CryAndRRich/npmod,Building a simple deep learning framework and some machine learning/deep learning models from scratch (pure Numpy and Pytorch)
,Bandavarapuvenila/Adaptive-machine-learning-framework-for-phishing-detection,
,Cha-Len-From-ISE-Lab/LoomUI,"LoomUI is an automatic UI generation framework that transforms machine learning task specifications into fully functional, interactive web interfaces using LLMs."
,JuliaAI/MLJ.jl,A Julia machine learning framework
,Sharon-codes/Machine-Learning-Framework-for-Drug-Efficacy-Prediction-in-Breast-Cancer,
,MubashirWani/PyE-Plus,Multi-Criteria Decision Making (MCDM) Framework for Building Energy Systems with Expedited Computation using Machine Learning (ML) Techniques
,DeLaphante/CynkyAutomation,"Powered by Selenium, Reqnroll and ML.Net with detailed HTML reporting, Machine Learning Analysis and Logging capabilities - CynkyAutomation framework can handle any website that is built using AJAX, React, AngularJS, Vue.js, Single Page Applications, Salesforce, Dynamics 365 CRM and many more."
,psztswcbyy/EVA-S3PC,"A de-centralized framework for secure multi-party matrix computation, included varies of secure 2-party operator and 3-party operators, well applied for scientific computing and machine learning."
,waleedgeo/FSM-PK,"The repository contains data for the paper titled""High-resolution flood susceptibility mapping and exposure assessment in Pakistan: An integrated artificial intelligence, machine learning and geospatial framework"""
,Shreehari-sys/Machine-Learning-Framework-for-Predicting-Student-Performance-Using-Regression-and-Spectral-Methods,
,hdeza/backend-clima-tour,This project utilizes a machine learning model to predict temperature based on various weather features. It has been implemented using Django and Django REST Framework to create an API that allows POST requests to obtain predictions.
,tudou1231/EnDM-CPP,A Multi-View Framework Based on Deep Learning and Machine Learning for Identifying Cell-Penetrating Peptides with Transformers and Analyzing Sequence Characterizations
,gagansingh894/jams-rs,Rust based model serving solution for popular machine learning frameworks
,DeshantGogia/IplMatchPredicionSystem,"Built an end-to-end machine learning framework to forecast IPL match results and scores with Random Forest algorithms, attaining 82.3% accuracy in game win prediction and 9.8 runs MAE in score prediction. Designed 15+ dynamic features (pressure indices, momentum scores) from ball-by-ball data (20082023)."
,CiferAI/ciferai,"Cifer provides a decentralized AI development ecosystem with data-ownership proof on the Cifer blockchain, using a Privacy-Preserving Machine Learning (PPML) framework offers several methods for secure, private, collaborative machine learning Federated Learning and Fully Homomorphic Encryption"
,Teijen/IntermediateDragon,The main reposititory that holds the submodules for the analysis on the impact of different intermediate language representations of the Dragon Type Identification Machine Learning Framework
,rayanahmedkakomo/Multivariate-risk-factor-analysis-model.,"This machine learning framework integrates lifestyle factors, demographics, medical history, and clinical symptoms to enhance the sensitivity and accuracy of early lung cancer detection."
,aimclub/FEDOT,Automated modeling and machine learning framework FEDOT
,neurons-me/all.this,"All.This is a modular framework for managing and standardizing data structures, enabling seamless interaction across the neurons.me ecosystem. It transforms objects like images, text, and audio into structured formats optimized for machine learning and deep learning applications."
,hyunilyoo/ml-framework-kagglemonthly,A machine learning framework designed for Kaggle competitions with a focus on tabular data processing
,gtsagkatakis/soil-moisture-bayesian-fusion,Bayesian machine learning framework that fuses forecasting and remote sensing retrieval for accurate and uncertainty-aware soil moisture estimation.
,IntelPython/scikit-learn_bench,"scikit-learn_bench benchmarks various implementations of machine learning algorithms across data analytics frameworks. It currently support the scikit-learn, DAAL4PY, cuML, and XGBoost frameworks for commonly used machine learning algorithms."
,CryptureVauIt/CryptureVault-,"AI framework for the CryptureVault ecosystem  blending machine learning with on-chain analytics to power secure tracking, smart predictions, and vault-grade intelligence"
,ShreyashSutar0404/X_Sentiment_Analysis,"X_Sentiment Analysis is a machine learning project focused on detecting offensive language and analyzing sentiment in text. It includes trained models, preprocessing tools, and Jupyter notebooks for development and testing. Designed for content moderation and emotion-aware applications, it offers a practical framework for real-world NLP solutions."
,Sehaj2016/Chatbot,"  This project focuses on developing a machine learning-based chatbot application using Python and the Tkinter GUI library, integrated with the ChatterBot framework. The goal is to create a user-friendly chatbot that can simulate human-like conversation and provide intelligent responses based on trained data."
,Chiragxiao/qnf-qaoa,"Hybrid Quantum-Classical framework integrating Quantum Neural Fields (QNF) with the Quantum Approximate Optimization Algorithm (QAOA) for solving combinatorial optimization problems. Explores variational circuit design, quantum machine learning, and optimization strategies using Qiskit."
,VaishnaviMarachi/wildlife-detection-framework,Creating a wildlife detection framework using machine learning algorithm
,younesnoorzahi/TensorFlow-in-Python,TensorFlow is an open-source machine learning framework developed by Google Brain Team.
,AtlantaJimmy/DigitRecognizer,"A machine learning-based digit recognition system that accurately identifies handwritten or printed digits from images. Built to demonstrate image processing, feature extraction, and classification techniques using popular frameworks."
,vibhores19/Remote-Sensing-Landcover-Classification,"A machine learning and deep learning-based framework for classifying remote sensing data from Landsat 5 in mountainous Colorado. Includes traditional ML models (SVM, RF, DT) and deep learning architectures (CNN, LSTM, ResNet) to classify 14 land cover types with high accuracy."
,febincf-mle/stock-price-prediction-portal,"This repository builds a complete stock prediction portal from scratch using Django REST Framework, React, and Machine Learning"
,Bismarrck/tensoralloy,Tensor-graph based machine learning framework for metal alloys.
,Sharath-p-g/Deef_Fake-Detection,Deepfake Detection is a machine learning project that identifies whether a video is real or fake. The model is trained on real video data to learn natural facial patterns and detects deepfakes by spotting inconsistencies in facial features or movements. Built using Python and deep learning frameworks.
,k-rajat42/Deep-Learning-and-Machine-Learning-Based-Early-Diagnosis-of-Alzheimers-from-MRI---Clinical-Data,"An advanced machine learning framework for early Alzheimer's diagnosis, integrating MRI imaging with clinical data. Using a fine-tuned VGG16 CNN for brain scans and an SVM model for clinical indicators, NeuroDetect ensures precise classification, aiding researchers, neurologists, and healthcare applications in neurodegenerative disease detection."
,lorenzofamiglini/CalFram,Calibration Framework for Machine Learning and Deep Learning
,PFund-Software-Ltd/pfund,"An All-in-One Algo-Trading Framework: Backtest -> Train -> Trade -> Monitor. Machine / Deep Learning Ready. Supports All Trading: TradFi+CeFi+DeFi. Code Once, Trade Anywhere."
,KapilTanwarr/KapilTanwarr,"A curated showcase of my skills and experience in Data Science, Machine Learning, AI, and Big Data Engineering. This repository serves as a dynamic resume highlighting tools, libraries, frameworks, cloud platforms, and languages I've mastered through real-world projects, problem-solving, and continuous learning."
,MikeCoder2025/AI-Framework-for-Reaction-System-Optimization,"This repository contains python code that solves optimization routine, and data-driven approach (Machine Learning) for optimizing KPIs, and reducing uncertainties in complex reaction system"
,jstoops/product-pricing-agent,"Compares base LLMs, as well as fine-tuned frontier and open-sources models, to traditional machine-learning (ML) techniques and human prediction of product prices based on a description. The winner, along with 6 other agents, is productionized in an AI agentic framework that sends push notifications to you when a deal is found."
,CBaby830/A-MACHINE-LEARNING-FRAMEWORK-FOR-INTRUSION-DETECTION-IN-IOT-ENVIRONMENTS,A MACHINE LEARNING FRAMEWORK FOR  INTRUSION DETECTION IN IOT ENVIRONMENTS
,FrancoisRibreau/igmoid,The Machine Learning framework and backend for zeta.ml. Deployed using Docker and Kubernetees. The Official Project f
,yangfa-zhang/lunax,Lunax is a machine learning framework specifically designed for the processing and analysis of tabular data.
,Yogesh-333/CW-Foundations-of-Machine-Learning-Frameworks-CSCN8010,
,SufiyanUK/AI-powered-fitness-and-nutrition-assistant,"Conversational AI application leveraging RAG technology and Minsearch, built on Python and various machine learning frameworks."
,vedurmaliya/Intrusion-Detection,"Using Sampling Techniques, this project aims to solve the class imbalance problem in detecting various types of Network Intrusions via the use of Machine Learning and Deep Learning Frameworks."
,Apoth3osis-ai/quant_quat,Augmented Quaternion Frameworks: A Unified Approach to Quantum and Hypercomplex Machine Learning
,sahrishmustafa/TORCS-Self-Driving-Car-AI,"A Python-based framework for TORCS that enables data collection from manual driving sessions and trains AI drivers using machine learning models such as Decision Trees, Random Forests, and MLP Regressors."
,IshikaWagh/Fraud-Detection,"This project proposes a robust anomaly detection framework for financial fraud prevention, addressing the limitations of traditional methods. By integrating advanced machine learning techniques ."
,google-parfait/tensorflow-federated,An open-source framework for machine learning and other computations on decentralized data.
,vikingkai/UTScan,"UTScan is a hybrid machine learning framework that quantifies daily urban travel intensity using continuous seismic noise recordings. Leveraging CatBoost and LSTM, UTScan extracts features from the 220Hz seismic power spectrum to deliver accurate, generalizable travel predictions across regions and time periods."
,RAW-Ayyubi/defect-classification-in-stem-images,Unsupervised machine learning framework for defect classification and clustering in atomic-resolution images using CVAE-based image reconstruction.
,StillbitTech/Stillbit-,"The silent engine beneath Stillbit. This AI framework fuses machine learning with chain logic  delivering focused, noise-free analytics for risk, volatility, and market behavior. "
,Prashant-patil-ux/Machine-Learning-paper,"Health Insurance Premium Prediction using Machine Learning  A regression-based ML framework to predict health insurance premiums using features like age, BMI, smoking status, and more. Includes data preprocessing, multiple regression models, evaluation metrics, and visualizations."
,Kitware/SMQTK,Python toolkit for pluggable algorithms and data structures for multimedia-based machine learning.
,Aamod007/Human-Activity-Recognization,"The Human Activity Recognition (HAR) framework collects raw sensor data and applies machine learning and deep learning methods to classify human movement. The UCI HAR Dataset contains data from 30 subjects performing various activities, recorded via smartphones worn at the waist."
,JomaMinoza/ml-ecolyzer,ML-EcoLyzer: Machine Learning Environmental Impact Analysis Framework
,openlangrid/mlgrid-services,A framework to serve various generative AIs and other machine learning functions via WebSocket and JSONRPC.
,parkerhayashi/lungscope,Multimodal machine learning-based framework for overall survival prediction in non-small cell lung cancer
,drbenedictpaul/hepatitis_B,A Julia-based machine learning framework to identify predictive biomarkers for chronic Hepatitis B progression from sparse clinical data.
,LINGAKARTHIK/Hybrid-Machine-Learning-Approach-for-Cyberattacks-Correlation-and-Mitigation-in-Distribution-System,"A hybrid machine learning framework for detecting, correlating, and mitigating cyberattacks in power distribution systems."
,aws-solutions/media-insights-on-aws,"A serverless framework to accelerate the development of applications that discover next-generation insights in your video, audio, text, and image resources by utilizing AWS Machine Learning and Media services."
,Madhavkabra/top-Semantic-Search-tools,"A curated list of powerful semantic search tools and frameworks that leverage vector embeddings, natural language understanding, and machine learning to deliver accurate search experiences."
,yongNotgio/Car_Auction_Predicting,Predicting Car Auction Prices: A Machine Learning Approach Using the CRISP-DM Framework
,Abddallah-MLSA/Nile-Shield,"Neile Shield is a scalable cybersecurity framework for nuclear plants, replacing traditional SCADA systems. It uses machine learning (TensorFlow, Scikit-learn), tools like Scapy and Wireshark, and runs in a simulated GNS3 environment. Agile development enabled rapid adaptation to evolving cyber threats."
,lgrosan/NeuralkFoundry-CE,NeuralkFoundry-CE offers a flexible framework for machine learning in industrial applications. Explore our dashboard and tutorials to enhance your projects! 
,ahsantushar12/airline-satisfaction-prediction,A school project using the CRISP-DM framework and machine learning to predict airline passenger satisfaction
,sivakumar240703/Integrated-Machine-Learning-Framework-for-Smart-Farming-,
,JuliaF23/AI_MODEL,Machine Learning Framework. / Modelo de aprendizado de mquina.
,Rohit8983/Security-ML,"This research aims to enhance  cybersecurity by applying advanced  machine learning  techniquesRandom Forest, SVM,  Stacking Classifier, and CNN to  improve threat detection. It will  develop a comprehensive  framework integrating these  methods, assess their performance  across diverse datasets."
,Isomorphic-07/Kolmo,"Kolmo is a project that combines physics informed machine learning, statistical learning, sensor fusion and stochastic analysis to provide a robust framework for real-time modelling of dynamical systems under uncertainty"
,SimonLarsen/frogbox,An opinionated machine learning framework.
