framework,full_name,description
,imrannasrullah/quantum-machine-learning,Using Pennylane's QML framework to optimize molecular geometries + interaction energies
,Shaoib72/Machine-Learning-Algorthms,"A library of ready-to-use algorithms for simplifying machine learning development and deployment. It offers tools for tasks like classification, regression, clustering, and more, plus data preprocessing and model evaluation. Ideal for all levels, it integrates with frameworks like Seaborn, Matplotlib, MLxtend, and scikitlearn to accelerate work."
,Isac001/Huawei-MindSpore," MindSpore  um framework de IA de cdigo aberto da Huawei, focado em simplificar o desenvolvimento de modelos de machine learning e deep learning. Com suporte para execuo em dispositivos de borda, servidores e nuvem, oferece alta performance, treinamento distribudo, segurana de dados e APIs intuitivas para projetos escalveis."
,josephmisiti/awesome-machine-learning,"A curated list of awesome Machine Learning frameworks, libraries and software."
,apax-hub/apax,A flexible and performant framework for training machine learning potentials.
,nischalk987/jarvis-ai,"arvis AI, built with Python, uses libraries like TensorFlow and NLTK for natural language processing and machine learning. Its simplicity allows efficient development of conversational agents. Developers can use frameworks like Flask or Django to create web applications, making Jarvis AI accessible for various tasks and user interactions."
,AlkaidCheng/aliad,Framework for anomaly detection with machine learning
,Ronald-Tatchemo-Guiafaing/Framework-for-Tiny-Machine-Learning-TinyML-Acceleration-on-FPGA,
,lamideakanni/Developing-an-Enhanced-Credit-Scoring-Model-Using-Machine-Learning-Techniques-Achieving-Explainabil,"This project focuses on developing a credit scoring model using advanced machine learning techniques, specifically Random Forest, integrated with the Dalex framework for interpretability. Utilizes the ""Default of Credit Card Clients"" dataset to predict credit risk while addressing the trade-off between accuracy and explainability."
,yashamre/DisQuorNet-A-Machine-Learning-Framework-for-Identifying-Duplicate-Question-Pairs-on-Quora,
,peii14/Flower-AWS-FederatedLearning,An implementation of federated learning using the Flower framework on AWS. It enables distributed machine learning across multiple devices while preserving data privacy. The system leverages AWS services for scalable and secure deployment.
,fahim-douna6/Machine-Learning-Projects-,In this repository I will upload my Created Machine Learning Projects Deployed the Algorithms in Django Framework.
,CiferAI/ciferai,"Cifer's Privacy-Preserving Machine Learning (PPML) framework offers several methods for secure, private, collaborative machine learning Federated Learning and Fully Homomorphic Encryption"
,Selich/DeCaPH,"DeCaPH framework based on C. Fang et al., ""Decentralised, collaborative, and privacy-preserving machine learning for multi-hospital data,"" eBioMedicine, vol. 101, p. 105006, Mar. 2024, doi: 10.1016/j.ebiom.2024.105006."
,SamuelAsong/Interactive-ML-Model-Deployment-with-GUI,"This project focuses on embedding machine learning models into an interactive, user-friendly application using Streamlit, enabling third-party stakeholders to make real-time predictions without technical knowledge. The project follows the final step of the CRISP-DM frameworkdeployment, ensuring the model is accessible for practical decision-making"
,aws-solutions/mlops-workload-orchestrator,The MLOps Workload Orchestrator solution helps you streamline and enforce architecture best practices for machine learning (ML) model productionization. This solution is an extendable framework that provides a standard interface for managing ML pipelines for AWS ML services and third-party services.
,durdure/HeadStarter,"Headstarter AI is an advanced artificial intelligence framework designed to jumpstart your AI projects. Whether you're working on machine learning, natural language processing, or computer vision, Headstarter AI provides the tools and resources to get you up and running quickly."
,Maheshkarri4444/Movie-Recommendation-System,Movie Recommender Model powered by Python Machine Learning and Streamlit framework .This is a ML Project to recommend the list of movies based on your search
,KhRabii/backend-ML,backend application for machine learning developed with Flask framework (python)
,rajveerb/lotus,Lotus: Characterization of Machine Learning Preprocessing Pipelines via Framework and Hardware Profiling
,mimiquate/candlex,An Nx backend for candle machine learning framework
,SSugumar2/Advanced-AI-and-Deep-Learning-Projects-Portfolio,"This repository showcases a collection of advanced AI projects, featuring techniques like optimization, machine learning fundamentals, CNNs, RNNs, sequence models, transformers (BERT, GPT-2), chatbots, reinforcement learning, GANs, AutoML, XAI, and deep learning frameworks such as TensorFlow, Keras, and PyTorch."
,RohanBhardwaj10/DriveSafe,"This repository contains a web-based application for predicting Accident Severity, built using Flask as the backend framework. The application leverages Machine Learning model like Voting Classifiers,Random Forest,Gradient Boosting, Logistics Regression to predict  risk scores of the accident based on various input features. "
,JiggiJiggi/Medical-Recommendation-System,Medical-Recommendation-System Using Machine Learning Techniques and Flask Framework
,truevoxasia/DVC,DVC is an open-source framework and distributed version control system for machine learning projects.
,risu1139/Hybrid-Price-Optimisation-Framework,"An end-to-end optimization framework utilizing multiple linear regression, SVM-based polynomial regression, and optimization techniques like Simplex and COBYLA. This project demonstrates a hybrid approach to solving complex optimization problems in machine learning."
,thecog19/HATETRIS-public-beamsearch,The tool used to generate machine learning networks using the NNUE framework and beam searches to achieve the HATETRIS world record. 
,Sakshi-0302/Customer-Lifetime-Value-Analysis,A Machine and Deep Learning Framework to Retain Customers based on their Lifetime Value
,aai-institute/nnbench,A small framework for benchmarking machine learning models.
,Brionengine/quantum_ai_agent_prototype.py," Cloud QT A Description   QT A is an advanced, cloud-native framework designed to integrate quantum computing, AI-powered optimization, and automated workflows. This project capitalizes on the convergence of parallel processing and machine learning to maximize performance and scalability."
,SeldonIO/seldon-core,"An MLOps framework to package, deploy, monitor and manage thousands of production machine learning models"
,discovery-unicamp/dasf-core,Framework for computing Machine Learning algorithms in Python using Dask and RAPIDS AI. 
,Shrinivasdumbali/Fire_Prediction-Flask-ML-,Deploying Machine learning over web application using Flask - web framework (Python).
,Correia-jpv/fucking-awesome-machine-learning,"A curated list of awesome Machine Learning frameworks, libraries and software. With repository stars and forks"
,Project-AgML/AgML,"AgML is a centralized framework for agricultural machine learning. AgML provides access to public agricultural datasets for common agricultural deep learning tasks, with standard benchmarks and pretrained models, as well the ability to generate synthetic data and annotations."
,2ndthoughts/symphonyGPT,"A platform developed from an open framework to help AI researchers and developers to rapidly prototype, test and deploy workflows that include machine learning models as worker components. The workflow can be invoked on command line or web service, as well as integrated into UX/UI as part of a larger intelligent solution."
,alanoudaq/Utilizing-Machine-Learning-to-Implement-Zero-Trust-Framework-for-Detecting-Malicious-Behavior-,Utilizing Machine Learning to Implement Zero Trust Framework for Detecting Malicious Behavior in Military UAVs by using ECU-IoFT_Dataset
,saptawtf/AAGP,AAGP: A machine learning framework for prediction of anti-aging peptides using diverse physicochemical and compositional features
,joshuamoses926/Handwritten-Digit-Recognition,"A python project designed to detect Handwritten numbers using the tensorflow machine learning framework. Uses a dataset with handwritten numbers from 0 to 9.  To run this project use pip install tensorflow matplotlib, and python main.py."
,Boehm92/cagr_framework,Machine learning framework with data generator for CAD meshes and Graph Neural Network Regression
,explainX/explainx,Explainable AI framework for data scientists. Explain & debug any blackbox machine learning model with a single line of code. We are looking for co-authors to take this project forward. Reach out @ ms8909@nyu.edu
,eMapR/sundial,Workflow / framework for machine learning with data sourced from Google Earth Engine on a bare metal machine.
,bhupeshwar/TensorFlow-Tutorial-By-Bhupeshwar-Pathania,TensorFlow is an open source machine learning framework for all developers. It is used for implementing machine learning and deep learning applications
,obertcoy/ai-from-scratch,Making machine learning and deep learning algorithm from scratch or not heavily reliant on modern framework
,BVISHNU78/Streamlite-Exploratory-Data-Analysis-APP,Streamlit is an open-source Python framework that lets you build and share interactive web apps for data science and machine learning projects.
,jiahzengW/IL-Research-in-PSCs,All machine learning frameworks and codes from IL Research in PSCs
,ppppangu/sword,framework of machine learning made by myself
,THUMNLab/AutoGL,An autoML framework & toolkit for machine learning on graphs.
,MalikAhmerImran/Machine-Learning,This repository contain the code in which different built in frameworks of python is used to understand the basic concepts of Supervised Machine Learning and how it is implemented using built frameworks of python
,matfonseca/vanna_example,This project is a basic Proof of Concept (POC) using the Vanna framework to demonstrate how to integrate a simple machine learning model with a vector store and execute SQL queries.
,zwang1995/ML-MOF,Machine learning accelerating the discovery of metal-organic frameworks
,GITHUBETERNAL/AsanaAi,"AsanaAi is a Yoga posture detection and correction system which uses machine learning algorithms such as KNN and K Means Clustering. It uses several other frameworks such as TensorflowJs, Mediapipe, Custom Image Processing etc."
,stirelli/used-car-price-prediction-crispdm,Analysis and prediction of used car prices using machine learning models following the CRISP-DM framework.
,yessinek97/ML_DevOps_Nanodegree,"In this repo, we build an end-to-end machine learnign framework, this is an exercice of the Udacity Machine Learning Engineer nanodegree course"
,zwang1995/IML-MOF,Interpretable machine learning accelerating the discovery of metal-organic frameworks 
,alquimodelia/MuadDib,Beyond Mentalic - A Machine Learning Framework
,rosewithane/Google-Advanced-Data-Analytics-Professional-Certificate,"A comprehensive program focused on advanced data analytics techniques, including data visualization, machine learning, and statistical analysis. This course emphasizes practical, hands-on skills using tools such as Python, SQL, and machine learning frameworks to analyze complex datasets and derive actionable insights."
,rasikasrimal/DeepLearning.AI,"This repository contains my solutions and implementations of assignments from the course, where I learned best practices for using TensorFlow to build scalable AI-powered algorithms. TensorFlow is a popular open-source framework widely used in machine learning."
,divvybloc/payments-fraud-model,"A machine learning-powered fraud detection framework to enhance transaction security for payment gateways, reducing fraud incidents by 35%."
,sureshkasula/Traceable-business-to-safety-analysis-framework-for-safety-critical-machine-learning-system,
,ginnybhatt7579/Image-recognition-chatbot,"This repository features an image recognition chatbot that analyzes images and provides contextual responses. Key features include object detection, a conversational interface, and support for multi-modal inputs (text and images). Built with machine learning frameworks like TensorFlow and NLP libraries such as spaCy, "
,spymavro/NLP-Greek-Language-Proficiency-Classification,"Automated classification of Greek texts into CEFR (Common European Framework of Reference for Languages) proficiency levels using NLP and machine learning techniques. This project leverages Python, scikit-learn, spaCy, and Word2Vec to provide tools for assessing language skills."
,AI-fatima/Mastering-AI-02---Python-Libraries-Frameworks-for-AI,"Welcome to the `Mastering AI 02 - Python Libraries/Frameworks for AI` repository! This repository aims to provide a detailed and structured overview of essential Python libraries and frameworks for AI, including data handling, machine learning, deep learning, and more."
,xbouroseu/thesis-nnlib,"A machine-learning framework  written in C++ and OpenACC-CUDA, inspired by Tensorflow and Keras, for training and evaluation of deep neural networks in Nvidia GPU-accelerated systems. "
,Anuradha210803/read.md," Intrusion Detection System (IDS) using the KDD dataset. It employs machine learning techniques to identify anomalies and potential security threats within network traffic. The project includes data preprocessing, feature selection, model training, and performance evaluation, offering a comprehensive framework for network intrusion detection."
,nsswifter/AISightQuest,"Utilizing AI and machine learning, the project extracts text from images via Apple's Vision Framework and offers instant answers to questions in documents through the BERT model."
,AkiRusProd/numpy-nn-model,"ustom torch style machine learning framework with automatic differentiation implemented on numpy, allows build GANs, VAEs, etc."
,arushriv/Medifusion-Nexus-AI,"Doctors Handwriting Prediction Tool Using Generative AI, Machine Learning, and Deep Learning. This project uses handwriting recognition to recognize the names of medicines from a doctor's prescription. This is done using a Convolutional Neural Network (CNN) developed using the Tensorflow Framework and OpenCV."
,Jojo1268jrs/Prediction-of-Diabetes,A Machine Learning Based Framework
,Bismarrck/tensoralloy,Tensor-graph based machine learning framework for metal alloys.
,eniocc/viana_ff,"VIANA Forensic Framework is a solution for forensic analysis of video, image, and audio data using neural networks. It provides tools for identification, authentication, and enhancement of multimedia evidence, applying advanced machine learning techniques. Ideal for digital forensics, security, and law enforcement professionals."
,thakkarvishal96/CSCN8010-Labs,Foundation Machine Learning Framework
,ETOgaosion/BambooSimulator,simulator for bamboo and other distributed machine learning frameworks
,Sayanghosh400/plant-disease-detection-backend,"The Backend API serves as the intermediary between the frontend applications (React Native app and Next.js website) and the machine learning model. It is built using Python and the FastAPI framework, providing a robust and efficient interface for handling image uploads, model predictions, and data management."
,syedwaseem1/Real-Time-Gesture-Recognation,Real-time gesture recognition can be implemented in Python using libraries like OpenCV for image processing and machine learning frameworks such as TensorFlow or PyTorch for gesture classification.
,Hawthorne001/Mainh_on,Machine Learning Framework for Everyone
,NadhaPT/Assessing-Online-class-Efficiency-Using-ML-Based-Face-Detection,"Applied Convolutional Neural Networks (CNNs) using frameworks like PyTorch and Keras to develop a machine learning model for face detection and student engagement analysis during online classes. Enhanced skills include expertise in CNNs, machine learning modeling, data preprocessing, and presentation of insights."
,leondavi/NErlNet,Nerlnet is a framework for research and development of distributed machine learning models on IoT
,dongphuthanh/Convolutional-Neural-Network-Python-without-machine-learning-framework,"There are alot of Convolutional Neural Network(CNN) project in Github. But all of them used machine learning framework such as Tensorflow, Keras, Pytorch"
,jysru/ML_Tools,Regular tools for Machine Learning Frameworks such as Pytorch or Tensorflow
,cntrvsy/burn-ids,attempt at building a regression model using burn (machine learning framework) using the  UNSW-NB15 dataset
,ElusAegis/ai-passport,"AI Passport delivers cryptographic passports for machine learning models, enabling the tamper-proof verification of AI outputs. This project represents a major advancement in AI governance, providing a critical framework for tracking AI threats and validating the authenticity of harmful content to ensure greater safety and transparency."
,PaddlePaddle/Paddle,PArallel Distributed Deep LEarning: Machine Learning Framework from Industrial Practice &
,theSalted/ScalarGrad,A tiny machine learning framework written in Swift
,ajaymaroju111/Efficient-Authentication-for-Mobile-and-Pervasive-Computing,"This project developed lightweight authentication mechanisms for mobile devices, enhancing security while minimizing resource use. Utilizing machine learning and biometrics, we designed context-aware algorithms that improved accuracy and user experience. The framework addresses critical security challenges in pervasive computing environments."
,DhruvByteCode/Water-Quality-Analysis-for-Sustainable-Water-Resource-Management-using-Machine-Learning,"Designed and implemented a sophisticated machine learning framework for water potability prediction, incorporating a novel architecture and advanced ensemble methods to enhance classification accuracy and reliability."
,fairen-group/mof-biocompatibility,Guiding the rational design of biocompatible metal-organic frameworks for drug delivery using machine learning
,Shivangimodi1/College_Enquiry_Chabot,"Python is a versatile tool for developing a College Inquiry Chatbot, utilizing advanced technologies like NLP libraries, machine learning frameworks, and database management systems to understand natural language queries, classify intents, and provide personalized responses."
,dartl0l/spiking-learn,Framework for machine learning with spiking neural networks
,vishalharkal15/BERT-model-ML-NLP-,BERT language model is an open source machine learning framework for natural language processing (NLP). BERT is designed to help computers understand the meaning of ambiguous language in text by using surrounding text to establish context.
,JH-UCB/A_Framework_for_the_Metamorphosis_of_Algorithmic_Harm,"This data engineering paper employs graph algorithms to examine how bias impacts machine learning workflows, industry, and the world."
,SciML/MultiScaleArrays.jl,A framework for developing multi-scale arrays for use in scientific machine learning (SciML) simulations
,oluseye-akomolede/Machine-Learning-Framework,A custom machine learning framework similar to pytorch. Created for learning purposes.
,Devanshi-Bavaria/Water-Quality-Analysis-for-Sustainable-Water-Resource-Management-using-Machine-Learning,"Designed and implemented a sophisticated machine learning framework for water potability prediction, incorporating a novel architecture and advanced ensemble methods to enhance classification accuracy and reliability."
,rohit211-s/CUDA-Kernels,"The primary aim of this project was to assess the performance bottlenecks introduced by high-level machine learning frameworks like PyTorch, and to explore how much speedup could be achieved by implementing a low-level CUDA solution."
,oaustegard/ihp-framework,"Integrative Historical Prediction (IHP) Framework: Analyzing and forecasting complex societal phenomena. Combines Riemannian geometry, network theory, and machine learning to model societal dynamics. Includes case studies on Arab Spring, cryptocurrency adoption, and climate migration. Advanced math meets data science meets history meets AI fiction."
,PJF9/Animefaces-GAN,"AnimeFaces-GAN is a deep learning project focused on generating high-quality anime faces using Generative Adversarial Networks (GANs). Whether you are a researcher, a developer, or an enthusiast, AnimeFaces-GAN provides a solid foundation and a flexible framework to experiment with and enhance your machine learning projects."
,martinp95/Computer-Vision-Experimentation-Framework,"This project provides a framework for running machine learning experiments involving image classification. It includes components for data loading, preprocessing, model training, and result reporting."
,QuAIR/QuAIRKit,"QuAIRKit is a Python research framework for quantum computing, quantum information, and quantum machine learning algorithm development. It focuses on flexible design, real-time simulation and rapid verification of quantum and classical algorithms."
,ELMAHDAOUIAbdelghani22/Universal-Machine-Learning-Framework,"Ce projet propose un cadre de machine learning flexible capable de fonctionner avec n'importe quel dataset. Il intgre des modles pr-entrans et des outils d'valuation pour faciliter l'exprimentation et l'optimisation des performances, permettant aux utilisateurs de s'adapter rapidement  diffrents types de donnes"
