framework,full_name,description
,godrays/AIX,A single header Torch like C++ machine learning framework with multiple device acceleration support.
,rdsea/ROHE,An orchestration framework for End-to-End Machine Learning Serving with Resource Optimization on Heterogeneous Edge
,mahsunaltin/3DMesh,"The project aims to develop a versatile time series data analysis framework that employs advanced machine learning models in conjunction with 3D mesh visualization. The system will be capable of addressing various tasks, including anomaly detection, prediction of future data, classification, regression, and clustering."
,microsoft/DeepGNN,DeepGNN is a framework for training machine learning models on large scale graph data.
,Azure/PyRIT,The Python Risk Identification Tool for generative AI (PyRIT) is an open access automation framework to empower security professionals and machine learning engineers to proactively find risks in their generative AI systems.
,microsoft/LightGBM,"A fast, distributed, high performance gradient boosting (GBT, GBDT, GBRT, GBM or MART) framework based on decision tree algorithms, used for ranking, classification and many other machine learning tasks."
,mala-project/mala,Materials Learning Algorithms. A framework for machine learning materials properties from first-principles data.
,easyAGI/.github,easy Augmented Generative Intelligence LLM enhancement framework
,bhupeshwar/TensorFlow-Tutorial-By-Bhupeshwar-Pathania,TensorFlow is an open source machine learning framework for all developers. It is used for implementing machine learning and deep learning applications
,Brayan010702/Flask-ML-API,This project focuses on building a machine learning API using Python's Flask framework to automate the classification of images into over 1000 categories. The goal is to develop a web interface where users can upload an image and receive the predicted classification in real-time. 
,AI-fatima/Mastering-AI-02---Python-Libraries-Frameworks-for-AI,"Welcome to the `Mastering AI 02 - Python Libraries/Frameworks for AI` repository! This repository aims to provide a detailed and structured overview of essential Python libraries and frameworks for AI, including data handling, machine learning, deep learning, and more."
,TheIonicDiamond82/portafolio,"Portafolio de desarrollador con experiencia en frameworks como Angular, Vue, Ionic, Node.js, React, C# y .NET Core. Ingeniero en Sistemas Computacionales, cursando una maestra en IA, especializndome en Data Science y machine learning. Actualmente, trabajo como Software Developer Analyst gestionando APIs con IBM API Connect."
,hdeza/backend-clima-tour,This project utilizes a machine learning model to predict temperature based on various weather features. It has been implemented using Django and Django REST Framework to create an API that allows POST requests to obtain predictions.
,YazKzirius/KzMedecine,This software is an AI chatbot which can instruct how to perform medical procedures/polices using machine learning algorithms. Using Python's framework Django and machine learning libraries like Pytorch or Tensorflow and large datasets.
,cirosantilli/china-dictatorhsip-7,"Anti Chinese government propaganda. https://github.com/cirosantilli/china-dictatorship backup.  996.ICU709Friends who live in China and have real name on account, please don't star this repo, or else the police might pay you a visit.  Home to the mega-FAQ, news compilation, restaurant and music recommendations.Heil Xi . "
,markdewing/AI_kernels,Machine learning and AI kernels implemented in various languages and frameworks
,Blacksujit/ML-Flow,"An end-to-end machine learning project implementing MLflow for comprehensive experiment tracking and model lifecycle management. This project demonstrates a complete ML pipeline using Random Forest Classification, showcasing MLflow's powerful capabilities in managing machine learning workflows."
,ankumar/Programming-machine-learning,"The landscape of machine learning (ML) is constantly evolving with new techniques, tools, and frameworks emerging at a rapid pace."
,JH-UCB/A_Framework_for_the_Metamorphosis_of_Algorithmic_Harm,"This data engineering paper employs graph algorithms to examine how bias impacts machine learning workflows, industry, and the world."
,abhinavreddychilkuri/Enhancing-Credit-Risk-Prediction-with-Integrated-Machine-Learning-and-Blockchain-Solutions.,"This research integrates machine learning, deep learning, and blockchain to enhance credit risk prediction. Models like Logistic Regression and RandomForestClassifier are used, with LSTM achieving 95% accuracy. Blockchain ensures data integrity, providing a robust framework for informed lending decisions and reduced defaults."
,farshadabdulazeez/Image-classifier,This project is an image classification web application built using Django as the backend framework and scikit-learn for the machine learning model. The application allows users to upload images and receive predictions based on a pre-trained machine learning model.
,cirosantilli/china-dictatorship,"Anti Chinese government propaganda.  996.ICU709Friends who live in China and have real name on account, please don't star this repo, or else the police might pay you a visit.  Home to the mega-FAQ, news compilation, restaurant and music recommendations.Heil Xi . 6.4"
,yogeshtarone/Design-and-Implementation-of-Diabetes-Detection-using-Machine-Learning,"A robust framework was proposed where outlier rejection, filling the missing values, data standardization, K-fold validation, and different Machine Learning (ML) classifiers were used. Finally, to improve the result, weighted ensembling of different ML models also proposed."
,NVIDIA/tensorflow,An Open Source Machine Learning Framework for Everyone 
,Ummaarr/PREDICTING-WATER-QUALITY-INDEX-USING-MANCHINE-LEARNING," Predicting Water Quality Index (WQI) using machine learning and deep learning models like MLP, LSTM, Random Forest, and Gradient Boosting. Features include robust preprocessing, hyperparameter tuning, and evaluation with MSE. This scalable framework supports accurate water quality assessment and environmental monitoring"
,rexcoleman/CRISP-DM-Machine-Learning-Framework-Pima-Indians,
,saifee79/ML_ProjectHub,"Experimenting with machine learning and AI models to solve real-world problems. This repository showcases projects in supervised and unsupervised learning, NLP, and image processing, using a variety of popular frameworks."
,davidlamprecht/AutoRDF2GML,AutoRDF2GML is a novel framework that semi-automatically transforms RDF data into heterogeneous graph datasets suitable for graph-based machine learning such as graph neural network (GNNs).
,JakubSzczepanowski/Network-Scan-Detection,Using classic machine learning methods to detect network scanning in Linux kernel based on the AB-TRAP framework
,cx0y/open-ml-libraries,"A useful machine learning repository, for research and business use. This repository contains hundreds of open-source framework for artificial intelligence, you can use those for research and also can use in your business."
,Xza85hrf/ML-Framework_Checker,"ML Framework and CUDA Checker is a Python-based GUI application for checking PyTorch, TensorFlow, and CUDA installations. It provides detailed system specs, compatibility checks, advanced GPU management, and offers options to view instructions, export logs, and update machine learning frameworks."
,Astero0803/Machine-Learning-Frameworks-,
,tcbenchstack/tcbench,tcbench is a Machine Learning and Deep Learning framework to train model from traffic packet time series or other input representations.
,taed2-2425q1-gced-upc/TAED2_DataExplorers,"Repository for best practices, tools, and frameworks to develop a machine learning system for classifying images of natural landscapes into categories. The system uses a CNN to provide a reliable solution to track environmental changes that indicate climate change effects."
,Vedant1808/Machine-Learning-Framework,"It is a machine learning framework written entirely in C, featuring projects to predict ice cream and insurance sales. This framework includes a custom-built library and various C-based tools, all developed from scratch without relying on external libraries"
,AkhilTech1/Machine-learning-,"""Machine learning projects transform industries via image classification, NLP, predictive analytics, audio analysis & robotics. Applications include virtual assistants, self-driving cars, sentiment analysis & predictive maintenance. Frameworks: TensorFlow, PyTorch, Scikit-Learn&OpenCV."""
,tolgatasci/ai-farm,"AI-Farm is a distributed deep learning training framework that enables efficient model training across multiple machines. It provides a scalable infrastructure with real-time monitoring through a web admin panel, adaptive task distribution, and support for both CPU and GPU training."
,karimosman89/customer-support-chatbot,Create a chatbot to handle customer inquiries.Create an intelligent chatbot that can handle customer queries using NLP techniques.Use frameworks like Rasa or Dialogflow with a machine learning backend.Enhance customer service efficiency by automating responses to common inquiries.
,SSugumar2/Advanced-AI-and-Deep-Learning-Projects-Portfolio,"This repository showcases a collection of advanced AI projects, featuring techniques like optimization, machine learning fundamentals, CNNs, RNNs, sequence models, transformers (BERT, GPT-2), chatbots, reinforcement learning, GANs, AutoML, XAI, and deep learning frameworks such as TensorFlow, Keras, and PyTorch."
,zherujiang/minitorch,"A minimalistic machine learning framework that replicates core functionalities of PyTorch, including tensor operations, auto-differentiation, and neural network modules."
,LinUxTo5re/crypto_hybrid_analysis,"A web application that uses historical cryptocurrency data to train machine learning models and live data to determine trade weightage, built with Python and Django REST Framework for the backend and React.js for the frontend"
,ivy-llc/ivy,Convert Machine Learning Code Between Frameworks
,basalt-org/basalt,A Machine Learning framework from scratch in Pure Mojo 
,MuhammadMuhsiSidik/portofolio-streamlit,"This repository contains my Data Science portfolio, showcasing projects I've worked on using Streamlit as a framework to create interactive web applications. The portfolio highlights my expertise in data analysis, machine learning, and data visualization by presenting insights and models in an engaging and easy-to-understand format."
,ROHITH0601/Image-Generation-using-GAN-Generative-Adversarial-Networks-,This project is focused on generating images using GANs (Generative Adversarial Networks). GANs are a class of machine learning frameworks designed for generating new data that is similar to a given dataset. The core idea of a GAN is to pit two neural networks against each other in a game-like scenario: a generator and a discriminator.
,subhani2125/CKD-Prediction-Framework,This repository contains a comprehensive framework for analyzing and predicting Chronic Kidney Disease (CKD) using machine learning techniques. 
,hcmlab/nova,"NOVA is a tool for annotating and analyzing behaviours in social interactions. It supports Annotators using Machine Learning already during the coding process. Further it features both, discrete labels and continuous scores and a visuzalization of streams recorded with the SSI Framework."
,kaminiyuvaraju/IPL_Score_Predictor,An IPL score prediction web app built using machine learning and Flask. The model predicts match scores based on historical IPL data. The Flask framework provides the backend for serving the model and handling user input via an intuitive web interface
,ABnano/NanoPhasePredictor,"NanoPhasePrediction is an AI-driven framework designed to predict material phases using a hybrid CNN-SVM approach. This project focuses on optimizing phase discovery in nano scale phase prediction of PVDF, through advanced machine learning techniques."
,gabriel-messas/sAIfe,Artificial Intelligence/Machine Learning Application and Pipeline Security-Focused Development Framework
,Namir50/Future_Bitcoin_Price_Predictor_Web_App,This is a Machine learning model that is deployed using flask web framework . It predicts the bitcoin prices on the future date by taking input from the user.
,devpsiarch/Nero,A framework for machine learning written from scratch in C 
,j-raghavan/MLWatch,"MLWatch  is an open-source observability tool for AI/ML workloads, providing real-time monitoring of model performance, data pipeline health, and resource utilization. It integrates with popular frameworks like TensorFlow and PyTorch, enabling anomaly detection, metrics tracking, and optimization insights for reliable machine learning operations"
,CAIYIAHUAI/Optimizing-Diabetes-Classification-with-a-Machine-Learning-Based-Framework,Optimizing Diabetes Classification with a Machine Learning-Based Framework
,stephenhky/ml-experiment,Machine Learning Experiment Framework
,amd/ryzen-ai-documentation,Onboarding documentation source for the AMD Ryzen AI Software Platform.   The AMD Ryzen AI Software Platform enables developers to take pretrained machine learning models in popular frameworks and run them on laptops powered by AMD Ryzen AI technology.
,codecentric-oss/niceml," niceML  is a Python-based MLOps framework designed to streamline the development and maintenance of machine learning projects, offering efficient and scalable pipelines using TensorFlow and Dagster."
,fairen-group/mof-biocompatibility,Guiding the rational design of biocompatible metal-organic frameworks for drug delivery using machine learning
,Ahmed-alzarooni/Machine-Learning-Driven-Backtesting-Framework-for-Stock-Market-Decision-Making,
,sentinel-hub/eo-learn,Earth observation processing framework for machine learning in Python
,PFund-Software-Ltd/pfund,"An All-in-One Algo-Trading Framework: Backtest -> Train -> Trade -> Monitor. Machine / Deep Learning Ready. Supports All Trading: TradFi+CeFi+DeFi. Code Once, Trade Anywhere."
,HashamAkram18/Neutron-Pulsar-Classification,"This repository presents a comprehensive machine learning framework for classifying neutron stars and pulsars based on their observed features. Leveraging advanced algorithms such as Gradient Boosting, Random Forest, and Support Vector Machines, the model achieved a validation accuracy of 0.9785."
,dotnet/machinelearning,ML.NET is an open source and cross-platform machine learning framework for .NET.
,GITHUBETERNAL/AsanaAi,"AsanaAi is a Yoga posture detection and correction system which uses machine learning algorithms such as KNN and K Means Clustering. It uses several other frameworks such as TensorflowJs, Mediapipe, Custom Image Processing etc."
,rahad-1309/-Building-Secure-Federated-Learning-Frameworks-for-Privacy-Preserving-AI,"Federated Learning (FL) represents a decentralized approach to machine learning where multiple clients collaboratively train a model without sharing their raw data. This technique enhances privacy by keeping sensitive information on local devices, reducing the risk of data exposure."
,alirezaafzalaghaei/fokker-planck,"Implementation of the paper ""A Machine Learning Framework for Efficiently Solving Fokker-Planck Equations."""
,SarangKumar/nerd-logger,"Nerd-Logger is a powerful and flexible Python package designed to simplify logging and tracking your machine learning experiments. It seamlessly integrates with various ML frameworks and tasks, providing a robust solution for recording key metrics, hyperparameters, and other essential details."
,lamideakanni/Developing-an-Enhanced-Credit-Scoring-Model-Using-Machine-Learning-Techniques-Achieving-Explainabil,"This project focuses on developing a credit scoring model using advanced machine learning techniques, specifically Random Forest, integrated with the Dalex framework for interpretability. Utilizes the ""Default of Credit Card Clients"" dataset to predict credit risk while addressing the trade-off between accuracy and explainability."
,AlinaXZ/synergy-based-co-adaptive-framework-for-ulp-control,Master Thesis - Simultaneous Control of Multiple Degrees of Freedom in Upper Limb Prosthetics using sEMG and IMU Sensors with a CoAdaptive Machine Learning Framework
,kavehkarimadini/ARC_101_Tensorflow_Zero2Hero,"TensorFlow is an open-source machine learning framework developed by the Google Brain team. It is designed to facilitate the development and deployment of machine learning models, particularly deep learning models. TensorFlow provides a comprehensive set of tools, libraries, and community resources to support various machine learning tasks."
,buriihenry/AI-Nutrition-Assistance,"Conversational AI application leveraging RAG technology and Minsearch, built on Python and various machine learning frameworks."
,KxSystems/automl,Automated Machine Learning Framework for kdb+
,Venchislaw/lunar_max,Machine Learning Framework for dummies
,SofaDefrost/SofaGym,Machine Learning framework for Sofa
,raonilourenco/MLDebugger,"Code for ""Debugging Machine Learning Pipelines"".  the Algorithms of MLDebugger are now part of BugDoc, a general pipeline debugger framework. This repository will keep the experiments for the DEEM paper,  please check BugDoc's repository for the latest developments."
,rasoolzada/SmartExpenseTracker,SmartExpenseTracker is an ASP.NET Core web app for tracking expenses. It allows users to log expenses and uses Machine Learning with ML.NET to predict next months spending based on historical data. The app integrates Entity Framework and SQL Server for efficient data management and storage.
,google/paxml,"Pax is a Jax-based machine learning framework for training large scale models. Pax allows for advanced and fully configurable experimentation and parallelization, and has demonstrated industry leading model flop utilization rates."
,PennyLaneAI/pennylane-qulacs,The PennyLane-Qulacs plugin integrates the Qulacs quantum computing framework with PennyLane's quantum machine learning capabilities.
,alanoudaq/Utilizing-Machine-Learning-to-Implement-Zero-Trust-Framework-for-Detecting-Malicious-Behavior-,Utilizing Machine Learning to Implement Zero Trust Framework for Detecting Malicious Behavior in Military UAVs by using ECU-IoFT_Dataset
,Rajpratik71/anomaly-detection-operator-merlion,"Prometheus metrics based anomaly detection operator using Merlion, Machine Learning Framework for Time Series Intelligence"
,PadmaSriVIT2023/UNVEILING-THE-LUNG-CANCER-ENIGMA-A-MULTI-AGENT-SYSTEMS-ML-FOR-PRECISION-PREDICTION-AND-ANALYSIS,"Unraveling the complexities of lung cancer through a groundbreaking multi-agent systems framework. Our project leverages machine learning for precision prediction and analysis, offering a novel approach to combat this deadly disease."
,LewyseK/IncomePredictor-Predicting-Economic-Disparities-Using-ML,"This project follows the CRISP-DM framework with the objective of developing a machine learning model that predicts whether an individual, based on specific characteristics, is likely to earn above or below a $50,000 threshold. The models will then be deployed for practical use."
,sunndae/Portfolio,"This repository showcases a list of my personal and academic projects, highlighting the tools and technologies Ive mastered. From web development,  development machine learning algorithms to API REST design and development, my projects are aimed at solving real-world problems with modern programming languages and frameworks. "
,42Kesara/Tensors-and-Graph-Neural-Networks-GNN-Implementation,"Tensors are just multi-dimensional arrays which generalizes scalars, vectors and matrices to higher dimensions. They are essential data structures in most machine learning frameworks and even more so in Deep Learning."
,FastyFresh/crypto-trading-system,"A crypto trading system framework with automated analysis, risk management, and backtesting capabilities. Integrates with an exchange API and uses machine learning for market analysis."
,varunbudati/Almgren-Chriss-model,"This project implements an advanced trading execution system based on the research paper ""A reinforcement learning extension to the Almgren-Chriss framework for optimal trade execution"" by Hendricks and Wilcox. The system combines traditional algorithmic trading methods with machine learning to optimize trading performance."
,XiaoWei-i/PT4Rec,A Universal Prompt-Tuning Framework for Graph Contrastive Learning-Based Recommendations (ACML2024 & Machine Learning Journal)
,dwitidibyajyoti/explore_stream_lit_for_data-_visualisation,"Streamlit is an open-source framework that simplifies the creation of interactive web applications, specifically designed for data science and machine learning projects. With its intuitive API, Streamlit allows developers and data enthusiasts to turn their data scripts into shareable web apps with minimal effort,"
,mmdai-blcc/paper,An interpretable predictive framework based on rules and machine learning: rule extractionvalidation and adaptive integration with machine learning
,sleeplessCoderrr/quote-machine,"This is a Random Quote Machine app built with React and SCSS. It generates random quotes from a predefined list and allows users to tweet them directly. The app is designed to meet the project requirements outlined by freeCodeCamp's Frontend Libraries section, specifically focusing on learning frontend frameworks like React."
,joecode77/subzero,A machine learning framework for AI enthusiasts.
,devanshugupta/Image-Recognitioin-as-Service,"Auto scaling cloud-based image recognition service using AWS infrastructure. Utilized EC2 for deploying machine learning models, S3 for object storage, and SQS to handle 1,000 concurrent requests via a Flask framework."
,sp46d/django-finance-analyzer,"This project aims to help people with budgeting their money. The project itself is a fully functional app built with Django web framework and it implements cutting-edge machine learning features, fine-tuned specifically for each user's unique financial situations."
,bobghosh91/cypress-reportportal-integration,This is a Cypress.io based framework integrated with machine learning analytics based report management platform 'ReportPortal'.
,Ahmed3atef/DRF_Classifier,A Django-based REST API that classifies images as either cats or dogs using machine learning. The API is built with Django REST framework and provides endpoints for image classification with confidence scores.
,nischalk987/jarvis-ai,"arvis AI, built with Python, uses libraries like TensorFlow and NLTK for natural language processing and machine learning. Its simplicity allows efficient development of conversational agents. Developers can use frameworks like Flask or Django to create web applications, making Jarvis AI accessible for various tasks and user interactions."
,Apra-Labs/ApraPipes,A pipeline framework for developing video and image processing application. Supports multiple GPUs and Machine Learning tooklits
,MarcoWrightk/Scalability-Optimization-Framework,"A scalable co-framework designed to enhance machine learning performance in TensorFlow by addressing infrastructure scalability issues. The framework integrates multiple algorithms, advanced optimization techniques, and complex neural network architectures "
,kishorekumar1212/AI-workshop,"This AI workshop provides an introduction to key concepts in Artificial Intelligence, including machine learning, deep learning, and NLP, with hands-on coding exercises using popular AI frameworks. Participants will learn to build and deploy AI models for real-world applications."
,Hamid-Rezaei/Could-Computing,"This repository contains three cloud computing projects that showcase the power of distributed computing and machine learning algorithms using platforms like Apache Hadoop, Apache Spark, and modern frameworks."
