framework,full_name,description
,chrispfae/ART-SM,Fragment-based machine learning framework for backmapping CG structures to atomistic resolution
,WadeedRahman/ChatterBot,This is AI ChatBot code make using Machine Learning Library Chatterbot. This is a basic conversational AI chatbot. You can use it and train it using  YML language. The chatbot is also integrated into web using Flask which is a very popular framework in Python
,tlie03/machinelearning,My attempt to build a machine learning framework from scratch
,cran/assignPOP,":exclamation:Thisisaread-onlymirroroftheCRANRpackagerepository.  assignPOPPopulationAssignmentusingGenetic,Non-GeneticorIntegratedDatainaMachineLearningFramework.Homepage:https://github.com/alexkychen/assignPOP  "
,gregory-kyro/CardioGenAI,CardioGenAI: A Machine Learning-Based Framework for Re-Engineering Drugs for Reduced hERG Liability
,SciML/MultiScaleArrays.jl,A framework for developing multi-scale arrays for use in scientific machine learning (SciML) simulations
,leonism/Customer-Predictive-Analysis,"Explore this repository, a comprehensive resource offering an in-depth guide to conducting customer predictive analysis using cutting-edge machine learning techniques, all within the intuitive framework of Dataiku."
,jasonscotth/Apache-Spark-Multithreading-Performance-on-ML,"Group project where performance of different multithreading models used under the Apache Spark framework were assessed.  Machine learning models that were assessed were Logistic Regression, Support Vector Classifier, and Random Forest.  A research paper and presentation are included."
,secretflow/secretflow,A unified framework for privacy-preserving data analysis and machine learning
,vedantjawanjal/Forest-Fire-Prediction,"I've developed a machine learning algorithm for forecasting forest fires. Subsequently, I've implemented this algorithm within a Python Flask framework to create an application."
,junaidulhassan/Machine-Learning-Pipeline-with-Flask,Create Machine Learning Pipeline and add it into Production Flask web framework .
,aws-solutions/mlops-workload-orchestrator,The MLOps Workload Orchestrator solution helps you streamline and enforce architecture best practices for machine learning (ML) model productionization. This solution is an extendable framework that provides a standard interface for managing ML pipelines for AWS ML services and third-party services.
,lucasrussell01/MLTools,Framework for machine learning developments.
,DeLaphante/CynkyAutomation,"Powered by Selenium, Specflow and ML.Net with detailed HTML reporting, Machine Learning Analysis and Logging capabilities - CynkyAutomation framework can handle any website that is built using AJAX, React, AngularJS, Vue.js, Single Page Applications, Salesforce, Dynamics 365 CRM and many more."
,arpitachy/Diabetes-prediction-using-Machine-learning-Model,"A framework for diabetes prediction employing data preprocessing, hyperparameter tuning, different machine learning classifiers and data visualizations. Logistic regression (LR), Support Vector machine (SVM), Decision Tree (DT) and Multilayer Perceptron (MLP) classifiers are deployed."
,phngbh/IMML,An interpretable multimodal machine learning framework that utilises prior biological knowledge to study complex multifactorial diseases
,RiomaxGit/Data_Gen_Model,"The Data Generation for Models project is designed to facilitate the creation of synthetic datasets for training, validating, and testing machine learning models across diverse domains. Leveraging Python's Faker library, the project offers a flexible framework to generate artificial data that closely resembles real-world scenarios."
,Aakash001Chouhan/Predicting-Electricity-Consumption-Using-a-MultiModel-Machine-Learning-Framework,
,chenan666/multi-view, An interpretable multi-view machine learning framework with three feature engineering modules
,Apisteftos/onnx-exporter-guide,"Comprehensive guide for exporting machine learning models to ONNX format, emphasizing PyTorch compatibility for seamless deployment across platforms and frameworks."
,hpides/End-to-end-ML-System-Benchmark,"A modular suite for benchmarking all stages of Machine Learning pipelines. To find bottlenecks in such pipelines and compare different ML tools, this framework can calculate and visualize several metrics in the data preparation, model training, model validation and inference stages."
,WeberSouzaWeb/Pytorch_Lightning,PyTorch Lightning is the deep learning framework for professional AI researchers and machine learning engineers who need maximal flexibility without sacrificing performance at scale. Lightning evolves with you as your projects go from idea to paper/production.
,frost-beta/node-mlx,Machine learning framework for Node.js.
,uchihapk07/IPL-Score-Predictor-Web-Application,"The IPL Score Predictor project aims to create a user-friendly web application that predicts cricket scores for Indian Premier League (IPL) matches using machine learning techniques. The project utilizes various Python libraries for data science, machine learning, and web application development using Streamlit framework."
,rehankhan88/Self-Driving-Car.github.io,"A self-driving car leverages machine and deep learning in Python to analyze data from sensors and cameras. Using algorithms, it identifies objects, predicts movements, and makes driving decisions. Python frameworks like TensorFlow and PyTorch enable continuous learning and improvement, enhancing safety and efficiency."
,Ayushverma135/GMAC-Intelligence-LLP-Internship-Assessment,This GMAC Intelligence LLP Machine Learning Work From Home Internship Assessment is Based on Pytorch Framework in Which you Have to Write a Pytorch Programs on Some Certain Parameters.
,RaimbekovA/credit_card_fraud_detection_using_machine_learning,Credit card fraud detection using machine learning. Web application using Streamlit framework
,charlie2951/mlkit,A Machine Learning framework in MicroPython
,spamela/neural_parareal,Parareal framework to use Machine Learning surrogates as coarse solver
,rostydovga/Brain_tumor_detection,"This GitHub repository hosts code for the classification of brain tumors utilizing MRI (Magnetic Resonance Imaging) images. Leveraging a diverse array of Machine Learning and Deep Learning algorithms, including transfer learning, this repository provides a comprehensive framework for accurately identifying brain tumors from MRI scans. (UNI project)"
,WJMacro/ContinualMT,A Continual Learning framework for Neural Machine Translation
,Maheshkarri4444/Movie-Recommendation-System,Movie Recommender Model powered by Python Machine Learning and Streamlit framework .This is a ML Project to recommend the list of movies based on your search
,yu-hsun/MachineLearning_MLP_LGBM_CNN,"This machine learning framework tackles classification and regression with models like MLP, LightGBM, and CNN. It features advanced preprocessing, PCA, and k-means clustering for enhanced performance. Designed for flexibility, it suits both beginners and experts, enabling easy model switching and optimization."
,gulelaat/Chatbot-with-Machine-Learning-and-Python,"If you are interested in developing a chatbot, you may find that there are many powerful bot development frameworks, tools, and platforms that can be used to implement smart chatbot programs. In this article, Ill walk you through how to create a Chatbot with Python and Machine Learning."
,mathewanthony/predicting-fraud-with-tensorflow,"Predicting Fraud with TensorFlow"" is a machine learning project aimed at developing and implementing fraud detection models using TensorFlow, a popular deep learning framework."
,deveshcode/mlxplain,MLXplain is an open-source model-agnostic Responsible AI framework. This framework aims to enhance the trustworthiness of machine learning models by providing comprehensive explanations for model behavior.
,LewyseK/Machine-Learning-model-using-three-steps-of-the-CRISP-DM-framework,This is an ML model using the dollar tree data set.
,ci-group/learning_machines_robobo,Framework for the Learning Machines Course at VU Amsterdam
,microsoft/LightGBM,"A fast, distributed, high performance gradient boosting (GBT, GBDT, GBRT, GBM or MART) framework based on decision tree algorithms, used for ranking, classification and many other machine learning tasks."
,jihadzakki/proyek-prediksi-berat-ayam,Model prediksi berat ayam berdasarkan model machine learning dengan mask rcnn r50 fpn dan framework detectron2 adalah algoritma yang canggih dan akurat yang dapat membantu peternak ayam untuk meningkatkan efisiensi dan profitabilitas operasi mereka.
,AbdullahAljojo/-Neural-Network-Heartbeat-Classifier-A-Bayesian-Framework,Automated Heartbeat Classification: Utilizing a Neural Network Classifier within a Bayesian Framework for precise categorization of heartbeats. Streamline cardiac analysis with advanced machine learning techniques
,suhas2228/Political-Security-Threat-Prediction,Political Security Threat Prediction Framework Using Hybrid Lexicon-Based Approach and Machine Learning Technique
,WesKwong/FLMMS,Federated Learning Multi-Machine Simulator: A Docker-based federated learning framework for simulating multi-machine training
,zugzwang03/eduApp,"Our EduApp is specifically designed to address the educational challenges faced by rural students. It uses an Angular frontend with robust Express engine facilitating the Node.js framework and uses MongoDB for scalable data handling. To enhance the user experience, we've implemented machine learning techniques with the help of the Gemini Pro model "
,Revith-Kumar/Age-and-Gender-Detection,A web Applicarion can able to identify a persons Gender and their Age .And this project is based on Machine Learning. The framework used in this project is OpenCV and Flask.
,midenda/ml,Machine Learning framework written from scratch in C++
,tuan220199/Prosthetic_hand_private,"This is prosthetic hand project, whcih includes techiniques: EMG signal, signal procesisng, PyQT, framework, machine learning, Robot Operating System (ROS), Simulation"
,sovietdevil/Multi_fidelity,Projects of the machine learning frameworks aimed at multi-fidelity.
,47dhiraj/Movie-Recommendation-System-Django-and-ML,Movie Recommendation System using Django Framework & Machine Learning
,SRrollins/Basic-Chatbox,"Chatbot_using_python -This code is an implementation of a simple chatbot using TensorFlow, which is a machine learning framework developed by Google. The chatbot is trained using a neural network to classify user inputs into predefined intents and provide appropriate responses based on the detected intent. "
,R300-AI/ultralytics,"This repository contains Ultralytics v8.2.0, specifically packaged to support the `ultralytics-train-export` project. The goal of this repository is to provide a Docker image that simplifies the process of training and exporting machine learning models using the Ultralytics framework."
,gizatechxyz/orion_ml,A ZKML framework for traditional machine learning
,Fabian12Florin/Node2Vec_study,# Node2Vec Project  ## Introduction Node2Vec is an algorithmic framework for learning continuous feature representations for nodes in networks. These representations can be used for various downstream machine learning tasks.
,romuro-pauliv/PS-MLAI,Basic framework for complex machine learning/AI projects.
,calt-laboratory/kotlin_machine_learning_lifecycle_framework,Kotlin-based machine learning lifecycle framework
,tensorflow/tensorflow,An Open Source Machine Learning Framework for Everyone
,Enimbuild/Stable_diffusion_On_Kaggle,This document provides a concise summary of the tools and steps required to open and utilize the Stable Diffusion WebUI on Kaggle. The process involves using Python and machine learning (ML) models to harness the capabilities of the Stable Diffusion framework within the Kaggle environment.
,NVIDIA/tensorflow,An Open Source Machine Learning Framework for Everyone 
,mala-project/mala,Materials Learning Algorithms. A framework for machine learning materials properties from first-principles data.
,entelecheia/hyfi-ml,A Python package that extends the Hydra Fast Interface (HyFI) framework with machine learning capabilities.
,anacostiaAI/anacostia-pipeline,Anacostia is a framework for creating machine learning operations (MLOps) pipelines
,gbragafibra/Random_Learning,Exploring some machine learning frameworks.
,JackVittori/QML-early_exit,A repositories that contains strategies about how to implement Early-Exit in a Quantum Machine Learning Framework 
,Maheshkarri4444/Bangalore_House_Price_Predictor,"Advance House Price Prediction ( Bangalore ) Model powered by Python Machine Learning and Streamlit framework .Give the Location Name , Area (sq-ft) , no of bathrooms , bhk to Get the best Accurate Price of the House . Hope this ML and Streamlit  project  helps Realestate and People Live in Banglore."
,z0i0s/building-machine-learning-algorithms-without-frameworks,"As the name suggests, no framework is used to build machine learning algorithms."
,utkarsh007007/DDOS-Attack-Detection-And-Research,"Exploring DDoS Defense with ML: This research applies machine learning to enhance defenses against Application Layer DDoS attacks. A machine learning framework was developed, its effectiveness tested on scalable cloud platforms, showcasing potential improvements in cybersecurity measures."
,lhcee3/Weather-Forecasting,Weather Forecasting with Machine Learning algorithm and compare some frameworks for further classification.
,Muntasir2179/sentiment-detector,It is an AI powered application that predicts sentiments from text data. The brain beind the applicaiton is a Machine Learning model. I have used Django framework to build this versetile application. I have worked on this project while I was enrolled in CSE445 course which is basically a Machine Learning undergrade course.
,Charu21/Term-deposit-Marketing-Prediction,"Developed a Machine Learning framework tailored to discern the most promising prospective customers from a dataset marked by significant imbalances. Attained an impressive accuracy rate of 97%, furnishing the sales team with invaluable insights into essential client attributes, thereby amplifying the likelihood of successful sales endeavors."
,iqbal1201/Apache_SparkML,Machine Learning Model Development using Big Data Framework Apache Spark ML
,Apra-Labs/ApraPipes,A pipeline framework for developing video and image processing application. Supports multiple GPUs and Machine Learning tooklits
,itstheprashant/Duplicate-Question-Pair-Analysis-,"Developed a system to detect duplicate question pairs using Python, NLP libraries (NLTK, SpaCy), and machine learning frameworks (Scikit-Learn)."
,thomasmonahan/RTide,A Python implementation of the tidal ML Response Framework developed in: https://www.researchsquare.com/article/rs-3289185/v1. Python package is currently under development and will be released in late 2024. Applying scientific machine learning to improve the spatiotemporal prediction of tides and tidal currents. 
,Dipika99/credit-card-fraud-detection,"Our goal in this research is to use big data analytics to advance the detection of credit card fraud. Through the utilisation of sophisticated machine learning models and scalable data processing frameworks, we enable financial institutions to effectively counteract fraudulent transactions. "
,google-parfait/tensorflow-federated,An open-source framework for machine learning and other computations on decentralized data.
,dotnet/machinelearning-samples,"Samples for ML.NET, an open source and cross-platform machine learning framework for .NET."
,aarda55/Singularity,A Machine learning framework
,ankumar/Programming-machine-learning,"The landscape of machine learning (ML) is constantly evolving with new techniques, tools, and frameworks emerging at a rapid pace."
,RauPro/Torogoz-Trade-Engine,Torogoz Trade Engine is a trading framework for MT5 that uses machine learning and personalized indicators.
,FederatedAI/eggroll,A Simple High Performance Computing Framework for [Federated] Machine Learning
,IPE-lab/XGBoost_SHAP_conglomerate,This method applies the explainable machine learning framework (XGBoost-SHAP) to realize the accurate prediction of fracture morphology and to provide the interpretation for the prediction results. 
,pragadeesh0720/HousePrice-Prediction-Web-App,This Application is build using Django Framework with Machine Learning Logic
,badalaryal11/CreateML,This is a repository in which I build my own machine learning model to be used in my iOS app by using CreateML Framework by Apple. 
,MonitSharma/Learn-Quantum-Machine-Learning,Learn Quantum Machine Learning using pennylane framework
,discovery-unicamp/dasf-core,Framework for computing Machine Learning algorithms in Python using Dask and RAPIDS AI. 
,SidharthVerma-tech/Car-Price-Prediction,This is my Car Price Prediction Project which used Django Framework and Machine Learning
,Shahalt1/House-Price-Prediction-Webapp," House Price Prediction Webapp:  The House Price Prediction Webapp is an innovative tool that leverages machine learning to estimate house prices based on user-provided parameters, offering a seamless and insightful experience for individuals exploring real estate. Developed using the Flask web framework for Python"
,SeethalakshmiJagan/Diabetes-Prediction,Created a Diabetes prediction model with Flask framework using Machine learning.
,Iyanuadeleye01/Machine-Learning-API,This project aims to develop a machine learning API using Fast API web framework for predicting patients with Sepsis.
,mounishvatti/FedCustom,Comparing centralised machine learning and federated learning using flower framework. Building a custom strategy over the base FedAvg called FedCustom which has a higher learning rate and several other hyper parameters to increase the accuracy.
,Benny-Nottonson/voodoo,A working machine learning framework in pure Mojo 
,Correia-jpv/fucking-awesome-machine-learning,"A curated list of awesome Machine Learning frameworks, libraries and software. With repository stars and forks"
,aimclub/FEDOT,Automated modeling and machine learning framework FEDOT
,neobundy/Deep-Dive-Into-AI-With-MLX-PyTorch,"""Deep Dive into AI with MLX and PyTorch"" is an educational initiative designed to help anyone interested in AI, specifically in machine learning and deep learning, using Apple's MLX and Meta's PyTorch frameworks."
,tahaalikhan123/Tensorflow-detection,"develop a machine learning model for the detection of spam emails using the TensorFlow framework. Spam email detection is a common application of natural language processing and machine learning, where the goal is to classify emails into spam and non-spam categories."
,ruby199/Tensorflow,"Dive deep into TensorFlow, one of the leading machine learning and deep learning frameworks, through hands-on coding examples and exercises."
,Julius-1993/DiabetesPrediction,This system was developed with django framework and Logistic Regression for Machine Learning
,SFETNI/PINNs_MPF--a-Physics-Informed-Neural-Network-for-Multi-Phase-Field-problems,"PINNs-MPF is a comprehensive framework designed for simulating interface dynamics using Physics-Informed Neural Networks (PINNs). Leveraging machine learning techniques, this framework offers an efficient implementation for the multi-phase-field model"
,Krishnacoder528/Heart-Disease-Prediction,"The project aims to predict the risk of heart disease for individuals using machine learning models, specifically Support Vector Machine (SVM) and LightGBM. The application allows users to input various health parameters and receive a prediction of their risk level for heart disease. We have also developed the web interface using flask framework"
,Noemiglois/medAI-ML-practice,"A practical framework applying machine learning techniques to a medical dataset (mammographic mass data), showcasing the potential of ML in healthcare."
