framework,full_name,description
,JakubSzczepanowski/Network-Scan-Detection,Using classic machine learning methods to detect network scanning in Linux kernel based on the AB-TRAP framework
,OpendTect/dgbpy,dgbpy is a framework for research and deployment of machine learning models from seismic and well data.
,LomashB/AI-ML_100_Days_Challange,"A 100-day journey to master Data Science, AI and Machine Learning through daily blogs, hands-on code implementations, and exploration of essential tools and frameworks. Follow along for consistent progress, fun facts, and practical insights to build expertise and unlock better career opportunities! "
,Project-AgML/AgML,"AgML is a centralized framework for agricultural machine learning. AgML provides access to public agricultural datasets for common agricultural deep learning tasks, with standard benchmarks and pretrained models, as well the ability to generate synthetic data and annotations."
,soerenbrockmann/core-concepts-tensors,"A hands-on guide to understanding tensors, starting from Python lists and progressing through NumPy, PyTorch, and TensorFlow. This repo covers tensor creation, operations, and comparisons across frameworks, helping learners solidify their knowledge of tensors in machine learning and deep learning."
,fhswf/MLPro,MLPro - The Integrative Middleware Framework for Standardized Machine Learning in Python
,arushriv/Neuro-Learnix-AI,"Doctors Handwriting Prediction Tool Using Generative AI, Machine Learning, and Deep Learning. This project uses handwriting recognition to recognize the names of medicines from a doctor's prescription. This is done using a Convolutional Neural Network (CNN) developed using the Tensorflow Framework and OpenCV."
,aws-solutions/media-insights-on-aws,"A serverless framework to accelerate the development of applications that discover next-generation insights in your video, audio, text, and image resources by utilizing AWS Machine Learning and Media services."
,sudipto0315/LearnML,"A comprehensive repository for exploring the fundamentals and advanced concepts of Machine Learning. Features hands-on projects, practical examples, and tutorials to master ML algorithms, frameworks, and tools."
,Urz1/Awesome_Chat,"Awesome_Chat is an AI-powered chatbot designed to provide intelligent, real-time conversations. Built using cutting-edge machine learning algorithms, this chatbot can understand and respond to natural language inputs, providing personalized and insightful interactions. The project uses modern frameworks for seamless integration and scalability."
,aculanarbsp/RMD1_CBAP,A machine learning framework for forecasting US government bond yields using recurrent neural networks
,Sourabh9595/SalesPredictionModel,"A machine learning framework for predicting sales at potential store locations using demographic, competition, and store data. Combines PCA for feature reduction and Random Forest for prediction. Includes data preprocessing, model tuning, and visualizations to assist in strategic retail site selection and decision-making."
,mlbala/MLOps,"A comprehensive framework for managing the entire machine learning lifecycle, from model development to deployment and monitoring. "
,bohblue2/particles,"This repository contains Python implementations and simulations related to the Fokker-Planck equation and Langevin dynamics, two fundamental mathematical frameworks for modeling stochastic processes in physics, chemistry, finance, and machine learning."
,Nivedh12121/A-Machine-Learning-Framework-for-Detecting-Hate-Speech-and-Fake-Narratives-in-Hindi-English-Tweets,A Machine Learning Framework for Detecting Hate Speech and Fake Narratives in Hindi-English Tweets
,soumik12345/ml-framework-bot,An agentic workflow to translate machine learning codebases across ML frameworks reliably at scale.
,AnHan42/Flake,"Code for the paper ""A Privacy-Preserving Framework for Collaborative Machine Learning with Kernel Methods"""
,saifee79/ML_ProjectHub,"Experimenting with machine learning and AI models to solve real-world problems. This repository showcases projects in supervised and unsupervised learning, NLP, and image processing, using a variety of popular frameworks."
,goodarzilab/MolMiR-1,Machine learning framework for molecular miRNA target prediction
,raju164/cyberattack-detection-using-machine-learning-in-power-grid-systems,"Developed a collaborative machine learning framework to detect cyberattacks in power grid systems. Preprocessed 15+ datasets, using PCA for dimensionality reduction and DBSCAN for clustering."
,stephenhky/ml-experiment,Machine Learning Experiment Framework
,fawaz165/Prediction-of-solid-waste-using-ML,"A machine learning framework leveraging SARIMA, XGBoost, and Optuna for real-time prediction and optimization of urban solid waste generation patterns. Enables smarter, data-driven waste management solutions with dashboards for visualization and strategic decision-making."
,SupriyaChirukuri/water_quality_prediction,"This repository provides a comprehensive framework for predicting water quality using environmental and chemical datasets. It includes data preprocessing, exploratory analysis, and machine learning models to evaluate water quality based on key parameters like pH, turbidity, dissolved oxygen, and more."
,Cheslaff/lunar_max,Machine Learning Framework for dummies
,ppdebreuck/modnet,MODNet: a framework for machine learning materials properties
,roodriigoooo/Machine-Learning-in-Finance-Labeling-Guide,"Exploration of ML applications in finance, drawing inspiration and summarizing the currently available and relevant literature. The objective is to deepen my understanding of key concepts, re-implement them with improvements, and explore alternative, non-widely used frameworks. "
,akshsgaur/SoftwareEngineeringManagement,"This project aims to investigate the relationship between mitochondrial dysfunction and dementia using single-cell RNA sequencing data and advanced machine learning techniques. By leveraging Nvidia frameworks, we analyze various biological and clinical features to gain insights into the molecular mechanisms underlying neurodegenerative diseases."
,atomix-studio/AtomixML,(Self) Educational Machine Learning Framework
,NimraAslamkhan/AI-Health-Doctor-,"AI Health Doctor is an intelligent health recommendation system designed to predict diseases based on user-provided symptoms. Technologies Used:  Backend: Python (Flask Framework) Frontend: HTML, CSS, and Jinja2 templates for dynamic web pages Machine Learning: Symptom-based disease prediction using predictive models"
,awslabs/graphstorm,Enterprise graph machine learning framework for billion-scale graphs for ML scientists and data scientists.
,rosewithane/Google-Advanced-Data-Analytics-Professional-Certificate,"A comprehensive program focused on advanced data analytics techniques, including data visualization, machine learning, and statistical analysis. This course emphasizes practical, hands-on skills using tools such as Python, SQL, and machine learning frameworks to analyze complex datasets and derive actionable insights."
,kishorekumar1212/AI-workshop,"This AI workshop provides an introduction to key concepts in Artificial Intelligence, including machine learning, deep learning, and NLP, with hands-on coding exercises using popular AI frameworks. Participants will learn to build and deploy AI models for real-world applications."
,ShihabXSarar/Book_Recommender_System-with-website,This repository implements a book recommendation system that leverages machine learning algorithms to suggest relevant books to users based on their preferences. It's designed to be a flexible and extensible framework for exploring various recommendation techniques.
,TsLu1s/atlantic,Atlantic: Automated Data Preprocessing Framework for Machine Learning
,SATWIKOJHA/Performa-AI-Employee-Performance-Prediction-System,"Performa AI is a machine learning-powered system for predicting employee performance. It offers predictive analytics, customizable models, and intuitive visualizations, integrating seamlessly with HR systems. Built with Python and AI frameworks, it empowers organizations with data-driven insights for optimized workforce management and growth."
,AvinashKant/avinashkant.github.io,"I have approx. 5 years of IT industry experience in Python and PHP development. I know several frameworks like Laraval, Lumen, and CodeIgniter. I am passionate about computer applications and am learning machine learning algorithms and techniques. I'm flexible, quick to learn new skills, and eager to learn from others."
,Engelbert107/WineQuality,"In this project, we aimed to classify wine quality using machine learning models with a dataset from the UCI Machine Learning Repository. Our approach included data preparation, exploratory data analysis (EDA), preprocessing, model training, evaluation, and deploying the best-performing model using the Flask framework."
,2ndthoughts/symphonyGPT,"A platform developed from an open framework to help AI researchers and developers to rapidly prototype, test and deploy workflows that include machine learning models as worker components. The workflow can be invoked on command line or web service, as well as integrated into UX/UI as part of a larger intelligent solution."
,jysru/ML_Tools,Regular tools for Machine Learning Frameworks such as Pytorch or Tensorflow
,respailab/CLMUL,A comprehensive framework consisting of sequential continual learning and machine unlearning requests for improving classification tasks
,ElusAegis/ai-passport,"AI Passport delivers cryptographic passports for machine learning models, enabling the tamper-proof verification of AI outputs. This project represents a major advancement in AI governance, providing a critical framework for tracking AI threats and validating the authenticity of harmful content to ensure greater safety and transparency."
,AICarope/Machine-Learning-and-Artificial-Intelligence-Exercises,"Demonstrate the application of technical and analytical capabilities in Machine Learning (ML) and Artificial Intelligence (AI). Utilize various tools and frameworks such as Python, Jupyter, Pandas, Seaborn, Plotly, PyTorch, and ChatGPT. Hands-on experience in Generative AI."
,adriank31/Networking_Exploit_Script,"This script is an advanced AI-powered web exploit framework. It utilizes various technologies such as Deep Learning (GPT-4), Machine Learning (AutoML), and conventional attack methods (SQL Injection, XSS, etc.). It's designed to automatically test a target web application for known vulnerabilities and exploits."
,KORINZ/in-silico-bioink-viability-prediction,[Research Article] Machine learning-based prediction and optimisation framework for as-extruded cell viability in extrusion-based 3D bioprinting
,rrefaat/sonnen-energy-management-task,"A Python-based implementation and testing task for simulating energy management in a sonnenBatterie system. Includes energy flow algorithm testing using pytest, a Fibonacci generator, and insights into integrating machine learning in hardware-dependent automation frameworks."
,Rqcker/MLap,A framework  which can capture information  on both the development and operation stages in machine learning 
,tripzero/aizero,framework for automation and machine learning
,SimonLarsen/frogbox,An opinionated machine learning framework.
,AIEnthousiast/MachineLearningFramework,Learning project: 
,spbalatech/AI-Agent,An intelligent AI agent framework with advanced machine learning capabilities
,marcpinet/neuralnetlib, A flexible machine & deep learning framework built from scratch using only NumPy
,lanl/ALF,A framework for performing active learning for training machine-learned interatomic potentials.
,HARRIXJANG/SSLFR_master,A self-supervised learning framework for machining feature recognition.
,Kriti-Data-Business/Case-study-energy-sector,"Harness AI and data science to revolutionize energy operations! This project optimizes efficiency, detects anomalies, and reduces emissions using advanced machine learning. Inspired by McKinsey's Vistra Corp. case, it showcases a scalable framework for cost savings, sustainability, and operational excellence in the energy sector."
,HashamAkram18/Neutron-Pulsar-Classification,"This repository presents a comprehensive machine learning framework for classifying neutron stars and pulsars based on their observed features. Leveraging advanced algorithms such as Gradient Boosting, Random Forest, and Support Vector Machines, the model achieved a validation accuracy of 0.9785."
,ANL-CEEESA/MIPLearn,Framework for solving discrete optimization problems using a combination of Mixed-Integer Linear Programming (MIP) and Machine Learning (ML)
,Chetan3110/Chetan3110,"This repository showcases my personal and professional projects, where I explore various technologies, tools, and frameworks. It contains a variety of coding experiments, full-stack machine learning applications, and automation solutions that I have built and continue to improve."
,Sing0165/bug-free-spork,Circulating Hope: A Novel Framework Leveraging Generative APIs and Machine Learning for Cardiovascular Disease Prediction and Prevention Full Code
,JiayiLi21/NanoML-5moU,NanoML-5moU: A Machine Learning framework to detect 5mou modification in IVT direct RNA sequencing data
,chunquanlipathway/FunlncModel,A machine learning computational framework for the identification of functional long noncoding RNAs by integrating multi-omics network
,andreimihalcea97/HLCNet,A didactic framework geared towards Data Science and Machine Learning enthusiasts of all levels of experience.
,digitalcytometry/spatialecotyper,Spatial EcoTyper is a machine learning framework for systematic identification of spatially distinct multicellular communities from single-cell spatial transcriptomics data.
,jordankanghm/NVIDIA,Exploring Machine Learning using NVIDIA Frameworks
,usersstfu/puskesmas-buntok,Website penyamapain informasi tentang puskesmas buntok dengan fitur sistem antrian yang terintegrasi dengan machine learning prediksi waktu tunggu menggunakan framework laravel 8 dan PHP-ML
,YihaoHua/-Supporting-Information,Supporting information for the paper 'Comprehensive Evaluation Framework for Compost Maturity with Biochar Amendment: A Meta-Analysis and Machine Learning Approach'
,RohanBhardwaj10/DriveSafe,"This repository contains a web-based application for predicting Accident Severity, built using Flask as the backend framework. The application leverages Machine Learning model like Voting Classifiers,Random Forest,Gradient Boosting, Logistics Regression to predict  risk scores of the accident based on various input features. "
,ghubnerr/machine-learning,"A dump to all things LLMs, CUDA, DL frameworks, Tokenization Methods, and latest stuff Im building/researching with"
,quanta-guy/Pose2COCO-Converter,Pose2COCO Converter is a tool designed to transform pose annotations generated by OpenPose into the COCO format. This conversion is crucial for using pose data in COCO-based machine learning models and frameworks.
,DatoXx8/grads,A machine learning framework in C and OpenCL.
,DavidNbEE/DeployMLonCloudRUn,This is a tutorial how to deploy Machine Learning model in Cloud Run with flask framework
,Correia-jpv/fucking-awesome-machine-learning,"A curated list of awesome Machine Learning frameworks, libraries and software. With repository stars and forks"
,cssanchit/REMEDII-Malware-Detection,"""Robust malware detection system using iterative adversarial training with Generative Adversarial Networks (GANs). This repository implements the REMEDII framework, enhancing the resilience of machine learning-based malware detectors against adversarial attacks, while maintaining high detection accuracy."""
,janelia-cellmap/dacapo,"A framework for easy application of established machine learning techniques on large, multi-dimensional images."
,enggabhishek/glioma-prediction,"This project tackles glioma grade classification by analyzing 20 mutation genes and 3 clinical features from TCGA brain glioma datasets. Using scikit-learn and Qiskit frameworks, researchers developed machine learning models to distinguish between Lower-Grade Gliomas (LGG) and Glioblastoma Multiforme (GBM)."
,aimclub/FEDOT,Automated modeling and machine learning framework FEDOT
,ivy-llc/ivy,Convert Machine Learning Code Between Frameworks
,syedwaseem106/Real-Time-Gesture-Recognation,Real-time gesture recognition can be implemented in Python using libraries like OpenCV for image processing and machine learning frameworks such as TensorFlow or PyTorch for gesture classification.
,AbhiComp/AbhiComp,"Welcome to Abhishek Zanje's repository! A Java Full Stack Developer passionate about software development and machine learning, currently exploring the Spring Framework. Open to collaborations on Java Full Stack projects. Connect with me at LinkedIn or via email: abhishekzanje.comp@gmail.com"
,hussar01/HyperParameterTuning_main," This repository contains the research and implementation for my thesis project titled ""Exploring Hyperparameter Tuning Methods for Machine Learning in Brain-Computer Interface (BCI) Framework"
,PerfVec/PerfVec,A generalizable machine learning-based performance modeling framework.
,Xtley001/Twitter-Sentiment-Investment-Strategy,"An investment strategy using Twitter sentiment analysis to guide trading decisions. The project processes live tweets, analyzes sentiment trends with NLP, and integrates them with stock data to predict performance. Features data preprocessing, machine learning models, and a backtesting framework for evaluating profitability."
,theSalted/ScalarGrad,A tiny machine learning framework written in Swift
,cmacha2/phishing-detection-py,"Phishing Detection Framework is a cutting-edge Python library designed for developers to detect phishing attempts in URLs and emails with ease. It integrates pre-trained machine learning models from Hugging Face, ensuring industry-leading performance and simplicity."
,pat2echo/AI-Project-Starter-Pack,"The AI Project Starter Pack is a meticulously structured directory and module framework designed for creating machine learning and data science projects. This starter pack aims to streamline the project setup process, helping data scientists and developers organize their code, data, and documentation efficiently. "
,ayyagarisujanreddy123/Machine-Learning-based-security-approach-for-IOT,"Designed a security framework for IoT ecosystems by integrating machine learning algorithms to enhance detection and prevention of security threats in IoT networks.  Focused on merging machine learning with IoT technologies to create a resilient system against emerging cyber threats, showcasing innovation at the intersection of ML and IoT."
,ETOgaosion/BambooSimulator,simulator for bamboo and other distributed machine learning frameworks
,Eleojo/SmartWAAM," An advanced framework integrating machine learning, computer vision, and robotics to monitor and analyze Wire Arc Additive Manufacturing (WAAM) processes. SmartWAAM is designed to detect and predict issues like irregular bead shapes and temperature gradients, ensuring high-quality, defect-free production."
,itsAnupamMahato/machine-learning-projects,"A collection of end-to-end machine learning projects, from data processing to model deployment, where used frameworks like Scikit-Learn, TensorFlow, and PyTorch. "
,manili/ctorch,"CTorch is a super lightweight C implementation of PyTorch, built for learning and exploration. It's a ""just for fun"" project to dive into understanding the basics of machine learning frameworks."
,vanshdeepsingh1/Deploy_ML_Pipeline_Vertex_AI,Build a machine learning model using Gradient Descent XGBoost. Containerize the application in cloud build by creating a cloudbuild.yaml file. store this file in artifact registry. Deploy a Vertex AI pipeline using this container image for the model. The model also implements and runs on AutoML framework of Vertex AI. 
,TheIonicDiamond82/portafolio,"Portafolio de desarrollador con experiencia en frameworks como Angular, Vue, Ionic, Node.js, React, C# y .NET Core. Ingeniero en Sistemas Computacionales, cursando una maestra en IA, especializndome en Data Science y machine learning. Actualmente, trabajo como Software Developer Analyst gestionando APIs con IBM API Connect."
,CheropS/LegalizeMe,machine learning model that check legal framework 
,JuliaAI/MLJ.jl,A Julia machine learning framework
,AI4HealthUOL/CardioLab,This is the official repository for CardioLab. A machine and deep learning framework for the estimation and monitoring of laboratory abnormalities throught ECG data.
,one-2/catalyst,Machine learning framework from scratch in C++. Watch out Tensorflow!
,hyouteki/cerberus,C Federated Machine Learning Library  
,Rajmathan22/CloudShield-AI-DDOS-Prevention-System-using-CNN-RNN,"CloudShield AI is an AI-driven security framework designed to protect cloud infrastructure from DDoS attacks. It employs machine learning algorithms for real-time threat detection, anomaly detection, and automated mitigation across multiple layers, ensuring minimal service disruption while providing detailed analytics for continuous improvement."
,SnapperML/SnapperML,SnapperML is a framework for machine learning. It has many functionalities including scalability through docker instances and reproducibility.
,AbhiBhavsar/Machine_Learning_Python,Contains notebooks for ML with python Scikit Learn and PyTorch frameworks.
,aai-institute/nnbench,A small framework for benchmarking machine learning models.
