framework,full_name,description
,rasheed89034/Machine-Learning-Advance-Python-Flask-FrameWork,
,kethanachowdary/Stock_prize-prediction,"This project focuses on predicting stock prices using machine learning and deep learning techniques. It provides a simple yet extensible framework for analyzing historical market data, building models, and visualizing predictions."
,Milo-Jsb/LEMONsc,Framework for experiments regarding the mass estimation of massive objects in astrophysical collision-driven systems using machine learning models
,douglasbc/tennis_model,"End-to-end tennis prediction model. Data ingested with Python and transformed with dbt on BigQuery. Model implemented with Google JAX, a Python machine learning framework."
,Abraham75/MovieTool_Predictive-Probability-of-Success-PPOS,"Multimodal machine learning framework for probabilistic success estimation in cinematic productions. MovieTool integrates natural language understanding, financial modeling, and historical metadata to compute calibrated Predictive Probability of Success (PPOS) scores. Built for strategic film development and investor decision intelligence, it appli"
,NaveenNani25/Stroke-Classification-and-Detection-Using-Neuroimage-Based-ML-Models,"Developed a machine learning framework for stroke detection and classification using MRI/CT neuroimages. Applied preprocessing, segmentation (U-Net, CNN), and feature extraction to distinguish ischemic vs. hemorrhagic strokes. Achieved high accuracy with ML/DL models, enabling faster, reliable, and AI-driven clinical decision support."
,thekarunakarreddy/Automated-Detection-of-Insider-Threats-in-SOC-Using-SIEM-Data-and-Machine-Learning-Techniques,Explainable AI insider threat detection system with 100% precision. Isolation Forest + SHAP framework processing 26.2GB multi-modal behavioral data (CERT/TWOS datasets). Designed for SOC analyst workflow integration.
,Pushpita05/E-commerce-Customer-Review-Prediction,This project focuses on building a predictive machine learning model to identify customers who are most likely to leave a positive review on an e-commerce platform. It helps them improve customer satisfaction and allocate resources effectively. The project follows the CRISP-DM framework.
,PLAID-lib/plaid-bridges,A collection of PLAID interfaces to machine learning frameworks
,MeharAbdulla/AI-Portfolio,"A curated portfolio of AI, Machine Learning, and Automation projects showcasing expertise in deep learning, NLP, web scraping, and data visualization. Includes work on recommendation systems, face embeddings, financial forecasting, and applied AI solutions built with Python, FastAPI, Django, and modern ML frameworks."
,Sandumini123/stroke-risk-prediction-xai,Explainable Machine Learning Framework for Personalized Stroke Risk Prediction
,amd/ryzen-ai-documentation,Onboarding documentation source for the AMD Ryzen AI Software Platform.   The AMD Ryzen AI Software Platform enables developers to take pretrained machine learning models in popular frameworks and run them on laptops powered by AMD Ryzen AI technology.
,BufferOverthrow/ai-battery-materials,Machine learning pipeline for next-generation battery materials discovery. Currently focused on predicting electronic band gaps using MatBench datasets and graph neural networks (GNNs). The goal is to extend the framework toward broader materials property prediction and generative design for advanced lithium- and sodium-ion battery compounds.
,apache/brpc,"brpc is an Industrial-grade RPC framework using C++ Language, which is often used in high performance system such as Search, Storage, Machine learning, Advertisement, Recommendation etc. ""brpc"" means ""better RPC""."
,SeldonIO/MLServer,"An inference server for your machine learning models, including support for multiple frameworks, multi-model serving and more"
,nhangen/model-checkpoint-engine," A comprehensive checkpoint management and experiment tracking system for machine learning models. Intelligent model checkpointing with automated experiment tracking, performance analytics, and training resumption. Built for production ML workflows with support    for PyTorch, TensorFlow, JAX, and custom model frameworks."
,ProfessorSchuster/Hausarbeit-Paper-Comparison-3-Algorithms-NIDS-CICIDS2017,"This GitHub repository contains the following paper: Comparison of an established supervised and an unsupervised machine learning model with a novel self-supervised framework for network anomaly detection using the CIC-IDS2017 dataset. Additionally, the used Jupyter Notebooks are provided as well. Check out the README."
,ahmedosman2a/Basel-AML-Index-Analysis,"Comprehensive quantitative analysis of global anti-money laundering risks across 203 countries using advanced statistical methods and machine learning. Provides evidence-based policy frameworks for international AML/CFT cooperation, regional coordination strategies, and strategic intervention targeting."
,FelipeSSpina/Transformer_com_Controle_de_Versao-,"Este repositrio contm a implementao de um modelo Transformer para traduo automtica de Portugus para Ingls (PTEN). O projeto  uma reproduo e extenso do tutorial oficial do TensorFlow, utilizando o framework Keras e o dataset TED HRLR disponvel no TFDS.  O pipeline de machine learning abrange desde o pr-processamento dos dados "
,dan-paquin/Predicting-Student-Success,"This project investigates whether machine learning models can accurately predict student academic performance using demographic, social, and early academic indicators, developing a comprehensive framework that identifies at-risk students, reveals key performance factors, and enables targeted interventions before critical learning gaps develop."
,Ziyu-Zhang96/MOFs,Machine learning prediction of metalorganic frameworks (MOFs) properties
,samreen0719/Chatbot,"This code uses TensorFlow, a machine learning framework created by Google, to implement a basic chatbot.  In order to categorize user inputs into predefined intents and respond appropriately based on the intent detected, the chatbot is trained using a neural network."
,penny4nonsense/cleands,"CleanDS is a lightweight Python framework for statistical modeling and machine learning. It supports regression, classification, clustering, shrinkage, ensembles, distributions, and dimension reduction with a unified API, formula notation, and model selection tools."
,vaibhavdb/brainstorm-ai,"A collection of AI and machine learning projects built while exploring concepts, frameworks, and real-world applications."
,senbarnika/Customer-Segmentation-and-Churn-Prediction,"This is not just another predictive model, it's a strategic weapon for business growth, forged by a fusion of machine learning and actionable intelligence. This project integrates customer segmentation using K-Means clustering with XGBoost for churn prediction, providing a comprehensive framework to identify at-risk customers."
,Yasmiinmuniz/mqttset-dt-rf-replication,"Reproduo simplificada dos experimentos Decision Tree e Random Forest do artigo ""Secure Enhancement for MQTT Protocol Using Distributed Machine Learning Framework""."
,tensorflow/tensorflow,An Open Source Machine Learning Framework for Everyone
,sujata1712/EnsembleACPredict---Machine-Learning-Project,EnsembleACPredict: An Ensemble Machine Learning Framework for Anticancer Peptide (ACP) Classification with LGBMBased Feature Importance
,waikittt/Machine-Learning-IoT-DoS-Detection,A resource-efficient machine learning (ML) framework using CICIoT2023 dataset for real-time Denial-of-Service (DoS) attack detection in IoT environments.
,CryptureVauIt/CryptureVault-,"AI framework for the CryptureVault ecosystem  blending machine learning with on-chain analytics to power secure tracking, smart predictions, and vault-grade intelligence"
,kapsner/mlexperiments,An extensible framework for reproducible machine learning experiments
,darryl-john/condo-amenity-proximity,A Geospatial Hedonic Machine Learning Framework for Amenity-Based Segmentation and Condominium Price Prediction in Metro Manila
,maxdlcl/TC3006C_ML_Algorithm_Implementation,Implementation of a Machine Learning algorithm without making use of frameworks such as scikit-learn
,Andrew-Gan/Sentry,An end-to-end GPU framework for authenticating machine learning artifacts.
,robertjmaneno/diabetes-prediction-ml,"Diabetes Prediction ML is a machine learning project that predicts whether a patient has diabetes using multiple machine learning frameworks: Scikit-learn, PyTorch, and TensorFlow. The project demonstrates end-to-end ML workflow, including data exploration, preprocessing, model training, evaluation, and serving predictions via FastAPI."
,aws/sagemaker-distribution,"A set of Docker images that include popular frameworks for machine learning, data science and visualization."
,MadeBy-luke/Advanced-Sentiment-Analysis-and-Thematic-Insights-from-Amazon-Product-Reviews,"Developing a sophisticated AI-enhanced analytical framework to extract comprehensive sentiment and thematic insights from Amazon product reviews, transforming unstructured customer feedback into actionable business intelligence through advanced machine learning and topic modeling techniques."
,QiningDeng/An-interpretable-machine-learning-framework-for-slope-stability-analysis,"This is an ensemble learning model that utilizes the stacking ensemble strategy. Using the 3D slope stability coefficient regression prediction task as an example, this ensemble regression model demonstrates good prediction accuracy and generalization capabilities. We welcome code contributions to improve this model and validate it on more tasks."
,SiddhalingSP/A-Machine-Learning-Framework-for-Detecting-Hate-Speech-and-Fake-Narratives-in-Hindi-English-Tweets,
,Catjane816/volcanic_prediction,"A machine learning framework for predicting rare extreme volcanic eruptions (VEI  6) using ensemble models, SHAP explainability, and calibrated probability assessment. Features comprehensive rare event detection metrics, baseline comparisons, and publication-quality visualizations for volcanic risk research."
,udaydomadiya08/Federated-Learning-for-Genomic-Insights-A-Privacy-Preserving-Framework,"Federated Learning (FL) is a decentralized machine learning paradigm that enables multiple clients to collaboratively train a shared model without the need to exchange raw data, thereby preserving data privacy and security. In this project, three distinct models were developed "
,rhod-dev/Learnsat,"Learnsat is a collection of frameworks, libraries, software and resources for machine learning and AI within the space industry"
,garyxqx/Construction-of-Potential-Energy-Surface-for-Molecular-Simulation-Based-on-Artificial-Intelligence,"focuses on the one-dimensional triatomic collision reaction Ne + H2+  NeH+ + H, a classical reaction in physical chemistry. Starting with quantum chemistry calculations, we developed a user-friendly open-source package in Python, leveraging the machine learning framework PyTorch to fit the PES of this reaction."
,arbitcoper/Sentiment-driven-Stock-Prediction,A machine learning framework for stock price movement prediction that integrates social media sentiment with traditional market indicators to improve the reliability of short-term forecasts.
,sambitmahapatra/ML-Based-Anomaly-Detection-in-Retail-Product-Descriptions,"This study presents a machine learning (ML)-based anomaly detection framework designed to identify and eliminate suspicious product descriptions from retail datasets. By replacing rigid keyword-based cleaning with a scalable ML approach, the framework enhances the robustness and adaptability of retail analytics pipelines."
,Archa-Reji/Mapping-of-Small-Water-Body-Using-Remote-Sensing-and-ML-Algorithms,"This repository encompasses the semantic segmentation of land and water pixels utilizing the U-Net deep learning framework in the Nayagarh District of the Mahanadi River Basin, along with the deployment of water body detection by machine learning frameworks. Random Forest and Support Vector Machine algorithms were executed on the cloud-based platfo"
,afrasiab2k4/AI-LAB-TASK-2,"Basic python code, Machine Learning, Searching Algorithm DI, Library, Framework"
,Harish-57-AIML-A/BUILD-AND-DEPLOY-MACHINE-LEARNING-APPLICATIONS,"Focuses on ML application design, using frameworks for Windows-based web apps. Covers APIs, Flask, and Docker for deploying ML models. Students gain hands-on experience in building scalable and production-ready ML systems."
,Sebastian-Espinoza-25/Machine-Learning-Implementation-With-Framework,This is the repository to implement a machine learning algorithm using a framework.
,JuliaAI/MLJTuning.jl,Hyperparameter optimization algorithms for use in the MLJ machine learning framework
,hoyathalis/ML_Framework_Ecosystem_Flowchart,"Explore how machine learning frameworks transform your Python code into optimized instructions that run efficiently on diverse hardware platforms including CPUs, GPUs, TPUs, and specialized AI chips."
,Aman100/Machine-Learning-Framework-From-Scratch,Creating machine learning framework from scratch
,TimeFreeze025/Machine-Learning-Driven-Framework-for-Sustainable-Development-Assessment-in-the-Philippines,
,NeginS98/Precipitation-Induced-Infiltration-Using-Machine-Learning-and-Uncertainty-Framework,"Machine learning-based analysis of precipitation-induced groundwater infiltration trends in an specific basin in Iran using historical hydrological data and CMIP6 climate projections. Includes evapotranspiration estimation (Thornthwaite), water balance analysis, and a novel bias-correcting framework for downscaling CMIP6 data.."
,longaxoloti/AI_B-SAFE,This is a repository that applies NLP and Machine Learning to the blockchain security framework (B-SAFE) projects.
,Nivedita-Saha/cardiac-contraction-ml,"Repository Description  Cardiac disease prediction framework integrating 2D and 3D cardiomyocyte contraction analysis with machine learning models (Random Forest, SVM, KNN). Includes workflows for data preprocessing, visualization, model development, automation (Prefect), and explainability (SHAP & LIME)."
,Sapna-04/CodeAlpha_Car-Price-Prediction,"A machine learning project to predict used car prices. Using a Random Forest Regressor, a model was built to accurately forecast a car's selling price, achieving a high R-squared score of 0.96. This provides a robust framework for price forecasting in the automotive industry."
,pratikghub/Harvard-Business-School-Enginius-Marketing-Analytics-Case-Studies,"A curated collection of Marketing Analytics Case Studies from Harvard Business School and Enginius, showcasing real-world business challenges solved with quantitative modeling, econometric frameworks, and predictive machine learning algorithms. Built as a resource for students, researchers, and professionals."
,zerfoo/zerfoo,"A modular, accelerator-ready machine learning framework built in Go that speaks float8/16/32/64. Designed with clean architecture, strong typing, and native concurrency for scalable, production-ready AI systems. Ideal for engineers who value simplicity, speed, and maintainability."
,abbi776/woody-plant-encroachment-remote-sensing,"Open-source framework for monitoring woody plant encroachment using Sentinel-2, spectral indices, and machine learning (RF & XGBoost)"
,chandanabalaji/Ensemble-Machine-Learning-Framework-for-Detection-and-Classification-of-Obfuscated-Malware-,"Developed an ensemble machine learning framework for detecting and classifying obfuscated malware using the CIC-MalMem-2022 dataset. Applied feature selection, data balancing, and models like RF, XGBoost, and MLP, achieving robust detection across binary and multiclass tasks."
,ananta-01verma/Machine-Learning-Framework-for-the-Detection-of-Mental-Stress-main,
,Daneshpajouh/ChromeCRISPR,Hybrid Machine Learning Framework for CRISPR/Cas9 On-Target Activity Prediction
,Manda404/SparkBatchTrainer,"This project provides a scalable and modular framework for training machine learning models in **batches** using **Spark DataFrames**.   It is designed to support large datasets, incremental learning, and integration with **XGBoost**, **CatBoost**, and **LightGBM**."
,MadhavSinghGandharav/anvil,Anvil is a Rust-based machine learning framework designed to combine the performance of low-level linear algebra with the ease of high-level ML APIs.
,Shreyas7-10/IPL-Outcome-Prediction,Machine learning framework for IPL match outcome prediction and player role segmentation.
,ahuber33/PlasmaMLPALLAS,"The PALLAS simulation is a Geant4-based framework designed for modeling plasma-based particle beams. It combines traditional Geant4 particle sources with machine learning-based ONNX inference for beam generation, and provides high-fidelity magnetic field and quadrupole tracking."
,CryAndRRich/npmod,Building a simple deep learning framework and some machine learning/deep learning models from scratch (pure Numpy and Pytorch)
,saiteja0737/SBA-Loan-Default-Prediction-and-Profit-Optimization-using-ML,Machine learning framework for predicting Small Business Administration loan defaults with profit-maximizing decision thresholds
,Zong-my/Fepfm,Fepfm: A Post-Disturbance Frequency Extremes Prediction Framework for Power Systems Based on Trustworthy Machine Learning
,peacefulotter/pyroml, Machine Learning framework allowing plug-and-play training for pytorch models
,manvendrasingh108/RTrap-Ransomware-Detection-Containment-using-Decoy-Files-and-ML,"RTrap is a Python research framework that detects and contains ransomware attacks using decoy (honeypot) files and machine learning clustering. It plants realistic fake files in user directories and monitors them. If ransomware touches a decoy, RTrap kills the malicious process and disconnects the network to stop damage and spread."
,MahiShah30/Medical-Cost-Prediction,"A full-stack web application that predicts medical insurance costs based on user inputs. The project leverages a machine learning model built with Scikit-learn and is deployed as an interactive, multi-step web interface using the Django framework."
,brsynth/PINN-v2,"This repository contains a hybrid model based on the Physics-Informed Neural Network (PINN) framework, which integrates neural networks with ordinary differential equations (ODEs) to incorporate biological constraints into machine learning."
,huiju-lee/PhonoMatic,A high-throughput framework for automated harmonic and anharmonic phonon calculations using DFT and machine learning interatomic potentials (MLIPs).
,Juni-Viaa/ifmalam3d1,Machine Learning Testing dan Optimasi Framework untuk Prediksi komposisi Produk Fraksinasi Pada Industri Oleokimia
,yaz008/machine-learning,Lightweight machine learning framework implemented in pure Python (for educational purposes only)
,sagar-2425/Interpretable-Machine-Learning-Framework-for-Liver-Cancer-Diagnosis-from-Gene-Expression-Data-,
,stephenlb/rust-machine-learning,Rust simple machine learning framework with deep learning
,KarmBhatt1/Intelligent-Spam-Detection-Framework-with-NLP-and-Naive-Bayes,"Advanced Spam Detection using NLP and Naive Bayes A machine learning framework for classifying SMS and email messages as ham or spam. It employs text preprocessing, TF-IDF vectorization, and Naive Bayes classifiers to deliver accurate predictions with clear insights from exploratory data analysis."
,janosh/matbench-discovery,An evaluation framework for machine learning models simulating high-throughput materials discovery.
,Cannistra94/Brain-Age-prediction,A Machine Learning framework for brain age prediction using MRI scans
,laca-is/MASPY,A Python Framework for Multi-Agent Programming with Machine Learning
,Opee99/Machine-Learning-Framework,"A Machine Learning Framework GitHub repository  is a hub of code, tools, and resources that help developers build, train, and deploy ML models easily. It usually includes pre-built algorithms, data preprocessing utilities, evaluation metrics , and documentation . Popular examples include TensorFlow, PyTorch, and Scikit-learn ."
,Aravindsetti77/Machine-Learning-fundamentals,"This is my work on the the basic fundamentals and frameworks in machine learning. This includes training the the data, preparing a classification report and plotting the data"
,pic-ai-robotic-chemistry/BOMLIP-CSP,"An open-source Python framework that integrates machine learning interatomic  potentials (MLIPs) with a tailored batched optimization strategy, enabling rapid,  unbiased structure prediction across the full density range"
,helmholtz-analytics/heat,Distributed tensors and Machine Learning framework with GPU and MPI acceleration in Python
,Ahmed-Hamam94/XrayClassifier,"A real-time iOS application that uses machine learning to classify X-ray images captured from your device's camera. Built with Swift, Core ML, and Vision frameworks, this project enables fast and accurate classification directly on your device. The classification model was created using Roboflow."
,Shuvam-M-Astro/AI-Data-Engineering-Portfolio,"A curated collection of projects showcasing my experience, research, and interests across the fields of Artificial Intelligence and Data Engineering. This repository highlights hands-on implementations using diverse tools, frameworks, and techniquesincluding machine learning, deep learning, real-time data pipelines, cloud services, and MLOps"
,bhavya647/Enhancing-Web-Application-Attack-Detection-via-a-Machine-Learning-Driven-Honeypot-Framework,Tool Built For Master's Degree
,singhrohanittu-commits/Financial-Transaction-Security,"To analyze existing fraud patterns, evaluate current fraud detection techniques, and propose a robust framework that combines machine learning, anomaly detection, and security enhancements for improving the reliability and safety of financial transactions."
,shikhaachoudhary/IMAGE-RECOGNITION-AND-OBJECT-DETECTION-IN-SOCIAL-MEDIA-,"The topic IMAGE RECOGNITION AND OBJECT DETECTION IN SOCIAL MEDIA. This topic is build by using Machine Learning and some frameworks like YOLO and OpenCV. In this project we made 3 types of detection i.e. Car-Counter using pre-loaded video, People Counter using pre-loaded video, and Real time object and face detection using Web-Cam."
,IntelPython/scikit-learn_bench,"scikit-learn_bench benchmarks various implementations of machine learning algorithms across data analytics frameworks. It currently support the scikit-learn, DAAL4PY, cuML, and XGBoost frameworks for commonly used machine learning algorithms."
,Jasimus/machine_learning,"implementacin ""naive"" de modelos de machine learning; Utilizacin de frameworks para aprendizaje automtico"
,siddhivdash/Intelligent-Water-Sensor-Fault-Detection-and-Quality-Monitoring,This project implements an intelligent machine learning framework for fault detection in water sensors and quality monitoring of water resources. It calibrates multi-channel sensor data into meaningful parameters and classifies sensor health (Good/Faulty) to ensure reliable monitoring.
,Fasepulveda/CodingExercises,"Data Structures, Machine Learning, Frameworks, Coursework, Research, etc."
,sarweshwaran-rs/Deep-Learning-Framework-for-Acoustic-Anomaly-Detection-in-Industrial-Machines,
,mastikhorr/Quantum-error-mitigation,"This project presents a machine learning-based framework for recommending optimal quantum error mitigation strategies for quantum circuits. It provides a complete, reproducible pipeline covering data generation, model training, and prediction. The work was developed during my internship at IBM, under the guidance of Dr. Anupama Ray."
,Mr-Afeef/Advanced-AI-Medical-Chatbot,"AI-powered Medical Chatbot that provides reliable health guidance, symptom analysis, and preliminary medical advice using advanced Natural Language Processing and Machine Learning. Built with modern frameworks for accuracy, security, and scalability to assist patients and healthcare providers."
,nedumije/DATA_ANALYTICS_PROJECTS_DATA_SCIENCE_PROCESS_DESIGN,"This repository delivers a production-ready, modular framework for solving a wide range of machine learning problems that arise in process design and operations. It supports the full lifecycle; from data acquisition and feature engineering through modelling, uncertainty quantification, optimization, and deployment."
