framework,full_name,description
,sagarkuranagi/multiple-disease-prediction-stream-lit,"The Multiple Disease Prediction Streamlit App is a machine learning-based web application designed to help users predict the risk of multiple diseases based on their health information. This app is built using Python, Machine Learning models, and the Stream lit framework, which allows the models to be deployed as an easy-to-use web app."
,agtzrubio/GODML,"GODML es un framework de MLOps que unifica la gobernanza, la observabilidad y la implementacin declarativa de modelos de Machine Learning en produccin. Diseado para empresas que no solo quieren que su modelo funcione, sino tambin entender por qu funciona, cundo dejar de hacerlo y cmo mantener el control."
,SAKTHI-75/Employee-Salary-Prediction-Project,"I have built my project using Machine Learning Algorithm , Python and its frameworks "
,deepgarg13/Transcriptomic-Machine-Learning-Framework-for-TDP-43,A TranscriptomicMachine Learning Framework Reveals TDP-43Driven Molecular Signatures in NeurodegenerationandCancer
,ParamThakkar123/ML_and_DL-algos,"This repository contains all the machine learning and deep learning model I have implemented using various frameworks like keras, tensorflow, scikit-learn, pytorch, etc."
,VinitaSilaparasetty/Deep-Drift-Detection,"This project provides a comprehensive framework to detect data drift and concept drift in deployed machine learning systems. Includes logging, alerting, and retraining triggers."
,yuxxhoo/Natural-gas-LLM-Causal-analysis1,LLM-Augmented Hybrid Causal Machine Learning Framework for Key Driver Discovery and Forecasting of Natural Gas Price
,Sreeja-dev14/Medipredict,"this project is a web project created using python language and django framework.it takes input from users,ie,the risk factors such as the age blood pressure,cholestrol,etc,and uses the machine learning models to predict whether the person has a risk of getting the disease and it gives a suitable medicine for it and the correlation chart ."
,MoonMeAndHerr/Harper-AGI,"Harper is a next-generation AI project exploring a new way for machines to think. Unlike conventional neural networks, Harper is designed with a novel cognitive architecture, dynamic learning mechanisms, and persistent memory, enabling it to reason, adapt, and evolve over time. Inspired by cognitive science, AGI research, and modern ML frameworks, "
,nomaan-raza/Flask-for-Machine-Learning.,"Flask is often used to deploy trained models as web services. This allows users to interact with the models through a user-friendly interface or API, enabling real-world applications of machine learning solutions.  Flask is a popular Python micro-framework frequently utilized for deploying machine learning models as web services or APIs."
,AJECooper/Nebula,"NEBULA is a lightweight, modular machine learning framework for .NET developers."
,anthonychm/TBML,Tensor Basis Machine Learning (TBML) is a package containing machine learning frameworks for enhancing Reynolds averaged Navier-Stokes predictions of turbulence variables
,eatsalad239/ai-nexus-framework,"Advanced AI development framework with integrated models, automation pipelines, and next-generation machine learning capabilities for cutting-edge artificial intelligence applications."
,lmboat/ciaa_model,Structure-based machine learning framework for de novo prediction of functional cysteines for protein engineering
,francesc30/Cultural-Ecosystem-Modelling,This is a methodological framework to model Cultural Ecosystem Services at large scales. It is composed by an Artificial Intelligence and a Machine Learning model.
,sudhishhreddyy/GHG-Emission-Machine-Learning,A machine learning-based framework for forecasting greenhouse gas emissions using historical EDGAR data and ensemble modelling techniques.
,recodehive/machine-learning-repos,"A curated list of awesome machine learning frameworks, libraries and software (by language). I"
,zmj-szu/SANN,Enhancing Malignant Transformation Predictions in Oral Potentially Malignant Disorders: A Novel Machine Learning Framework Using Real-World Data
,peacefulotter/pyroml, Machine Learning framework allowing plug-and-play training for pytorch models
,r0nlt/Space-Radiation-Tolerant,"Space Labs AI presents: A radiation-tolerant machine learning framework enabling neural networks to operate reliably in space environments. Features adaptive protection, Reed-Solomon error correction, and breakthrough architecture optimizations that improve performance under radiation."
,ewhu/UnityengineCore,"Modular framework for Unity engine, integrating real-time physics, machine learning, and GPU-accelerated graphics processing pipelines."
,Correia-jpv/fucking-awesome-machine-learning,"A curated list of awesome Machine Learning frameworks, libraries and software. With repository stars and forks"
,nirw4nna/dsc,Tensor library & inference framework for machine learning
,SeldonIO/seldon-core,"An MLOps framework to package, deploy, monitor and manage thousands of production machine learning models"
,Poluxin21/coreml-framework,"coreml-framework  um framework open-source, modular e multi-plataforma para machine learning rpido e flexvel. Suporta aplicaes 2D, 3D e diversos mercados, integrando-se facilmente a engines como Unreal e Unity. Usa ONNX Runtime para alta performance, oferecendo uma base robusta para projetos escalveis e versteis."
,ewhu/ProjectmanagementCore,Collaborative workflow optimization framework utilizing graph theory and machine learning for intelligent task allocation sequencing.
,maryamanwer/Machine-Learning-Based-Intrusion-Detection-System-for-Enhanced-Network-Security,"presents a Machine Learning-based IDS framework designed for general-purpose enterprise networks, using the TII-SSRC-23 dataset "
,ludo53/UltraSpectra,"Cloud-native, AI-driven microservices framework for scalable, machine-learning powered color grading and palette optimization."
,MLSysBook/TinyTorch,TinyTorch is a minimalist framework for building machine learning systems from scratchfrom tensors to systems.
,talachem/machine-learning,Pure Numpy Machine Learning Framework
,haashini1412/Allora-Network-Zero-Knowledge-Machine-Learning-zkML-Framework,
,Gimmi-07/2025-Summer-Internship-at-iHub-Data-IIIT-Hyderabad,"Work from my 2025 Summer Internship at iHub-Data, IIIT Hyderabad, focusing on data-driven research and machine learning applications. Includes literature review, model development, data preprocessing, feature engineering, and performance optimization using Python and ML frameworks."
,NaginaAbbas/SecureScan-QR-FYP,"This project presents SecureScan, a hybrid framework for secure QR code scanning that integrates traditional URL validation, blacklist detection, and machine learning-based malicious URL analysis. The system ensures protection against phishing, malicious websites, and security vulnerabilities. Developed as a Final Year Project 2025."
,Teijen/IntermediateDragon,The main reposititory that holds the submodules for the analysis on the impact of different intermediate language representations of the Dragon Type Identification Machine Learning Framework
,SATWIKOJHA/Performa-AI-Employee-Performance-Prediction-System,"Performa AI is a machine learning-powered system for predicting employee performance. It offers predictive analytics, customizable models, and intuitive visualizations, integrating seamlessly with HR systems. Built with Python and AI frameworks, it empowers organizations with data-driven insights for optimized workforce management and growth."
,cran/BioM2,:exclamation:Thisisaread-onlymirroroftheCRANRpackagerepository.  BioM2BiologicallyExplainableMachineLearningFramework  
,poppopjmp/VMDragonSlayer,"Automated multi-engine framework for unpacking, analyzing, and devirtualizing binaries protected by commercial and custom Virtual Machine based protectors. Combines Dynamic Taint Tracking, Symbolic Execution, Pattern & Semantic Classification, and Machine Learningdriven prioritization to dramatically reduce manual reverse engineering time."
,cerenyilmazjinx/SmartCybernetic,Revolutionary AI-powered machine learning framework for autonomous industrial automation and precision manufacturing
,Marques-079/2025-algothon,"Quantitative reasearch project exploring trading systems that integrates advanced machine learning, signal processing, and statistical techniques within a flexible backtesting framework to analyze, forecast, and evaluate financial market behavior."
,bipashaa18/Blinklytics-Insight-Engine,"Blinklytics Insight Engine is a business analytics and machine learning framework using Blinkit data to segment 5,000+ customers via RFM and K-Means, predict churn, and forecast delivery delays. It provides actionable insights to optimize marketing strategies and improve logistics efficiency."
,Omer-alt/Climate-AI,"A machine learning framework to correct the ""aridity blindspot"" by distinguishing drought from chronic aridity. It enables accurate spatio-temporal analysis and forecasting of water stress in Central Africa, offering a robust tool for risk management in vulnerable regions."
,battistg/Natural_Gas_Forecasting_For_Hedging,Can forecasting natural gas and market regimes improve hedging performances? A machine learning framework
,sreevathsa888/-Advanced-Flood-Susceptibility-Mapping-for-Vellore-India,"  Advanced Flood Susceptibility Mapping - Vellore, India This project implements a data-driven framework to predict flood-prone zones in the Palar River Basin using machine learning and geospatial analysis. "
,PennyLaneAI/pennylane-qulacs,The PennyLane-Qulacs plugin integrates the Qulacs quantum computing framework with PennyLane's quantum machine learning capabilities.
,VictorBrasileiroo/Projeto_Observatorio_de_Permanencia,"O Observatrio de Permanncia  uma plataforma integrada que utiliza Machine Learning, Django REST Framework e um dashboard interativo para prever e monitorar o risco de evaso estudantil. Permite anlise de dados acadmicos, gerao de relatrios e visualizao em tempo real, auxiliando instituies de ensino a tomar decises estratgicas."
,Harb1nger001/GlobalConflictFXStress,"GlobalConflictFXStress is a machine learning framework to predict currency stress using macroeconomic indicators and global conflict data. Includes Ridge, XGBoost, and RNN models, with SHAP-based interpretability and geographic heatmaps.  #MachineLearning #Geopolitics #CurrencyStress #XGBoost #RNN #DataScience"
,Dan-Popescu/Machine-Learning-Framework,
,danieleschmidt/DiffFE-Physics-Lab,"DiffFE-Physics-Lab provides a unified framework for combining finite element methods with automatic differentiation, enabling gradient-based optimization of physical systems. The library seamlessly integrates machine learning models into PDE solvers, supporting inverse problems, optimal control, and physics-informed neural networks."
,ewhu/InsurtechFramework,Actuarial risk modeling framework leveraging Bayesian networks and machine learning for claims assessment optimization.
,Harish-57-AIML-A/BUILD-AND-DEPLOY-MACHINE-LEARNING-APPLICATIONS,"Focuses on ML application design, using frameworks for Windows-based web apps. Covers APIs, Flask, and Docker for deploying ML models. Students gain hands-on experience in building scalable and production-ready ML systems."
,lovnishverma/Diabetes-Prediction-Flask-ML,"Diabetes Prediction Project Using Machine Learning. This app is a simple web application using the Flask framework, where users can input health data (like glucose levels, BMI, etc.) to predict if they are diabetic or not based on a Logistic Regression model."
,Kanchanchaturvedi/chatbot_project,"A Chatbot integrated on a college website for as an academic counsellor and providing educational assistance made using Machine Learning, Agentic AI, Gen AI model, Langchain, using Django framework. "
,mrturo/PredicTick,Framework for forecasting market direction using technical indicators and machine learning.
,Muramatsuu/AdvancedPeta,"Scalable, real-time data processing framework for machine learning-driven business intelligence with intelligent monitoring and analytics"
,trieu/leo-cdp-framework,"LEO CDP is an open-source, AI-first Customer Data Platform for building customizable, self-hosted, privacy-friendly CDP infrastructure. It unifies data collection, enables real-time analytics, audience segmentation, and personalized marketing  powered by big data and machine learning."
,Sudam23/Wildfire-Prediction-using-Distributed_ML_H2O,Distributed Machine Learning using the H2O framework with Random Forest Classifier.
,apax-hub/apax,A flexible and performant framework for training machine learning potentials.
,entelecheia/hyfi-ml,A Python package that extends the Hydra Fast Interface (HyFI) framework with machine learning capabilities.
,anannyay/AI-CAPTCHA-Solver-,CAPTCHA-X is an advanced AI-powered vulnerability assessment framework that evaluates the security effectiveness of text-based and image-based CAPTCHAs against modern machine learning attacks. This project helps organizations identify weaknesses in their human verification systems and provides actionable recommendations for improvement.
,vishuRizz/vishuml-docs,VishuML is a comprehensive machine learning library implementing fundamental algorithms from scratch in Python. This library provides educational implementations of popular ML algorithms without relying on external ML frameworks like scikit-learn
,Sonali292004/Sonali292004-Hybrid-Machine-Learning-and-Deep-Learning-Framework-for-autism-Diagnosis,
,Manjesh501/Cerberus-ai-cybershield,"Cerebrus is an intelligent malware analysis framework designed to provide multi-layered defense against modern cyber threats. It integrates static analysis, machine learning, external threat intelligence, and explainable AI (XAI) to deliver a robust platform for detecting known and unknown malware across various file formats."
,AsalMehradfar/LANTERN,The implementation of LANTERN: A Machine Learning Framework for Lipid Nanoparticle Transfection Efficiency Prediction
,Ahnuf-Karim-Chowdhury/Machine-Learning-Deep-Learning-Projects,"A curated collection of machine learning and deep learning projects, exploring topics like regression, classification, image recognition, and model optimization. Built with real-world datasets and frameworks like TensorFlow, PyTorch, and Scikit-learn. Ideal for learners and practitioners alike!"
,mattaq31/GelGenie,Open-Source package for segmentation and analysis of gel electrophoresis images using machine learning.  Both a python framework for training/running models and a QuPath GUI extension are available.
,Milo-Jsb/LEMONsc,Framework for experiments regarding the mass estimation of massive objects in astrophysical collision-driven systems using machine learning models
,WalkingDevFlag/ChessAI_MLProj," This project is designed to provide a comprehensive framework for training machine learning models using both TensorFlow and PyTorch, alongside a robust chess engine that utilizes the Minimax algorithm with Alpha-Beta pruning for optimal decision-making."
,ludo53/SpectraIO,"A cloud-native, AI-powered microservices framework for building scalable, machine-learning driven applications with intelligent monitoring and analytics"
,Mohammad-Vahed/G2PDeep,"G2PDeep is an interpretable machine learning framework for genotype-to-phenotype prediction using bulk and single-cell omics data. It supports biomarker discovery, pathway enrichment, and phenotype classification using logistic regression, CNN, and transformer-based models."
,Ajay6601/ivy,Convert Machine Learning Code Between Frameworks
,LaPetiteBird/six-mpc-preprocessing,"Implementation and evaluation of six special preprocessing protocols for secure multiparty computation (MPC) in privacy-preserving machine learning. This project benchmarks CDNN15, SecureML, SecureNN, CKRRSW20, RRHK23, and LowGear 2.0 using the MP-SPDZ framework."
,Laudarisd/MLOps,"Comprehensive MLOps project covering the end-to-end machine learning lifecycle. Includes tools, frameworks, and best practices for model development, deployment, monitoring, and automation."
,EHB99/Brain-Tumor-ML-DL-Radiomics-Radiogenomics-,"This project pioneers a multi-tumor, multi-modal radiogenomics framework that unites machine learning, deep learning, radiomics, and advanced diffusion MRI microstructural modeling to transform brain tumor characterization. Leveraging large-scale glioma, vestibular schwannoma, and radiogenomic datasets."
,cerenyilmazjinx/ProNeural,High-performance open-source machine learning framework for large-scale deep learning computations enabling seamless API integration workflows
,Drxmukesh/unified-ai-library,"A powerful and extensible deep learning + machine learning + NLP framework built in Python. Designed to be educational, modular, and production-ready."
,ASHIQ02KHAN/Python-Code,"Python is a high-level, interpreted programming language known for its simplicity, readability, and versatility. It supports procedural, object-oriented, and functional programming, and with its vast libraries and frameworks, Python is widely used in web development, data analysis, machine learning, automation, and more."
,NVIDIA/tensorflow,An Open Source Machine Learning Framework for Everyone 
,Codewith-Disha/Rice-Plant-Disease-Detection-using-Machine-Learning,An Intelligent Disease Diagnostic Framework on Rice Plant Using  Machine Learning
,microsoft/DeepGNN,DeepGNN is a framework for training machine learning models on large scale graph data.
,dogusariturk/MaterialsFramework,"A modular Python framework for deploying, benchmarking, and analyzing state-of-the-art machine learning potentials and simulation workflows in materials science."
,devpsiarch/Nero,A framework for machine learning written from scratch in C 
,k4yt3x/video2x,"A machine learning-based video super resolution and frame interpolation framework. Est. Hack the Valley II, 2018."
,discovery-unicamp/dasf-core,Framework for computing Machine Learning algorithms in Python using Dask and RAPIDS AI. 
,garrettiverson/ML_Framework,This is a machine learning framework built to work with results from camsim. Requires camsim to run.
,geekyAman493/Earthquake-risk-analytics-framework,"An end-to-end analytics framework for real-time earthquake prediction, risk assessment, and disaster mitigation using machine learning and geospatial intelligence."
,punya1103/Hybrid-Machine-Learning-Model-for-Network-Anomalies-Detection,"This project implements a **hybrid machine learning framework** that combines supervised and unsupervised learning methods to detect **network anomalies**. It aims to improve accuracy, robustness, and adaptability for real-time and large-scale network environments."
,AnisElahi/LogSense-AI-Hybrid-Log-Classification-Framework,"LogSense AI is a hybrid log classification tool that combines Regex, Machine Learning, and LLMs to accurately label structured and unstructured log messages  even when patterns are complex or training data is limited."
,jaywyawhare/C-ML,Machine learning framework written in C.
,vishalp99/MLF_Final_Project_SocialMedia_Sentiment_Analysis,A Social Media Sentiment Analysis Project for Machine Learning Frameworks Course.
,AKKI0511/QuantTradeAI,A comprehensive machine learning framework for quantitative trading strategies
,SciML/ModelingToolkit.jl,An acausal modeling framework for automatically parallelized scientific machine learning (SciML) in Julia. A computer algebra system for integrated symbolics for physics-informed machine learning and automated transformations of differential equations
,dotnet/machinelearning,ML.NET is an open source and cross-platform machine learning framework for .NET.
,ninpnin/days-since-last-ml-framework,Keep track of the newest machine learning frameworks on GitHub
,sahishnu111/Event-Sequence-Analysis-and-Machine-Learning-for-Real-Time-Anomaly-Detection-in-Windows-11-Logs,"This project introduces a hybrid system for real-time anomaly detection in Windows 11 logs. By converting logs into unique event sequences using machine learning and the MITRE ATT&CK framework, it accurately identifies malicious threats, offering robust cybersecurity for modern operating systems."
,ewhu/NetworksecurityLabs,Real-time traffic analysis framework utilizing machine learning anomaly detection for IoT network intrusion prevention systems.
,nathnaelg/Chatbot-with-Machine-Learning-and-Python,"If you are interested in developing a chatbot, you may find that there are many powerful bot development frameworks, tools, and platforms that can be used to implement smart chatbot programs. In this article, Ill walk you through how to create a Chatbot with Python and Machine Learning."
,marcmotta/FutureAurora,"Next-generation cloud-native Swift framework for scalable, AI-powered microservices architecture and machine learning-driven applications"
,phd-mht/exstraqt,A supervised machine learning framework for identifying money laundering transactions in bank data.
,rahimnadan/Machine-learning-projects,"The ""Machine Learning Projects"" repository is a collection of machine learning projects that utilize various algorithms, frameworks, and libraries to solve data-related problems such as prediction and classification."
,ewhu/EsportsTech,Real-time Machine Learning Framework for Predictive Esports Analytics and Strategic Decision Support Systems Development
