framework,full_name,description
,MehrdadJalali-AI/MOFGalaxyNet,MOFGalaxyNet aims to create a social network for Metal-Organic Frameworks (MOFs) and predict their properties using Graph Convolutional Networks (GCN). It fosters collaboration and exploration in the field of MOFs through social network analysis and machine learning.
,hyunilyoo/ml-framework-kagglemonthly,A machine learning framework designed for Kaggle competitions with a focus on tabular data processing
,Madhavkabra/top-Semantic-Search-tools,"A curated list of powerful semantic search tools and frameworks that leverage vector embeddings, natural language understanding, and machine learning to deliver accurate search experiences."
,zishengmo77/Machine-Learning,"This code focuses on biochar property prediction, covering machine learning models, training processes, and core algorithm frameworks. Interested peers are welcome to review and use it. For further technical exchanges, please feel free to contact me."
,rohanmistry231/Complete-Machine-Learning-With-Real-World-Deployment,"A comprehensive guide to machine learning with Python, covering algorithms, model training, and real-world deployment using frameworks like Scikit-learn and Flask. Includes end-to-end projects with datasets and tutorials for building and deploying ML applications."
,fhswf/paper-mlwa-mlpro-2.0,"Paper ScienceDirect MLWA - Arend e.a. - ""MLPro 2.0 - Online machine learning in Python"""
,ADiTyaRaj8969/Internship-At-AI-Guru,"Contributed to AI-driven solutions by developing and refining machine learning models. Performed data cleaning, feature engineering, and model evaluation using Python-based ML frameworks. Supported deployment and integration of intelligent systems."
,Professor-G/pyBIA,"Machine learning-based classification framework for detecting spatially extended and diffuse emission in the high redshift universe, using multi-band broadband imaging."
,PFund-Software-Ltd/pfund,"An All-in-One Algo-Trading Framework: Backtest -> Train -> Trade -> Monitor. Machine / Deep Learning Ready. Supports All Trading: TradFi+CeFi+DeFi. Code Once, Trade Anywhere."
,uogbuji/mlx-notes,Shared personal notes created while working with the Apple MLX machine learning framework
,acvanzant1/gravitational-wave-detection,"A machine learning framework for real-time gravitational wave (GW) signal classification using 1D-CNN and ResNet architectures. Developed and tested entirely on Apple Silicon hardware, the models are trained to distinguish binary black hole merger signals from realistic LIGO-like noise using open-source black hole data."
,douglasbc/tennis_model,"End-to-end tennis prediction model. Data ingested with Python and transformed with dbt on BigQuery. Model implemented with Google JAX, a Python machine learning framework."
,mahirshah13/alpha-regime,A machine learning framework for regime-aware market strategies.
,BAMeScience/equitrain,Equitrain: A Unified Framework for Training and Fine-tuning Machine Learning Interatomic Potentials
,awesomelistsio/awesome-ai,"A curated list of awesome frameworks, libraries, tools, and resources for Artificial Intelligence (AI). This list covers everything from foundational machine learning and deep learning to specialized areas like NLP, computer vision, and AI ethics."
,veningstonk/Curriculum-Content-Matching-Model,CCMM is an AI-powered framework designed to align digital educational content with K-12 curriculum standards while delivering personalized content recommendations for learners. It leverages sentence transformer embeddings and classic machine learning classifiers to semantically match educational resources with structured curriculum topics.
,mit-han-lab/torchquantum,"A PyTorch-based framework for Quantum Classical Simulation, Quantum Machine Learning, Quantum Neural Networks, Parameterized Quantum Circuits with support for easy deployments on real quantum computers."
,reverseame/RAMPAGE,RAMPAGE is a framework aimed at training and comparing machine learning models for the detection of Algorithmically Generated Domains.
,LAN-Z-L/Public-Transportation-Flow-ML-Framework,"An AI-driven machine learning framework for estimating, characterizing, and predicting public transportation flows. This repository includes models for OD flow estimation using unsupervised learning, trip purpose inference using probabilistic modeling, and long-range flow prediction using transformer-based architectures."
,secretflow/secretpad,"SecretPad is a privacy-preserving  computing web platform based on the Kuscia framework, designed to provide easy access to privacy-preserving data intelligence and machine learning functions. "
,tflinkow/property-driven-ml,"A generalised framework for property-driven machine learning, combining input region specification via hyper-rectangles with differentiable logics to compile logical constraints into loss."
,Itachi0906/Machine-Learning-Framework-in-Cpp,
,bjoernbethge/astro-lab,A machine learning framework for astronomical data analysis and interactive 3D visualization with advanced cosmic web analysis capabilities.
,gyu29/Machine-Learning-Strat,A comprehensive machine learning framework for predicting S&P 500 price movements and implementing a data-driven trading strategy across multiple time horizons.
,Prashant-patil-ux/Machine-Learning-Based-Regression-Framework-to-Predict-Health-Insurance-Premiums,
,DatoXx8/grads,A machine learning framework in Zig and OpenCL.
,Shreehari-sys/Machine-Learning-Framework-for-Predicting-Student-Performance-Using-Regression-and-Spectral-Methods,
,KapilTanwarr/KapilTanwarr,"A curated showcase of my skills and experience in Data Science, Machine Learning, AI, and Big Data Engineering. This repository serves as a dynamic resume highlighting tools, libraries, frameworks, cloud platforms, and languages I've mastered through real-world projects, problem-solving, and continuous learning."
,Shafiqul1884/ML,"A repository for Machine Learning (ML) projects, experiments, and implementations. Covers data preprocessing, model training, evaluation, and deployment using popular frameworks like Scikit-Learn, TensorFlow, and PyTorch. "
,brbtavares/machine-learning-ohlc,Early-stage modular framework for OHLCV financial data.
,RamanEbrahimi/Research,Implementing the mathematical modeling and machine learning algorithms in analysis of complex multi-layer networks. The research involves developing new mathematical optimization frameworks and simulation environments.
,chamiz/ai_test_framework,AI Test Framework is a robust and flexible tool designed to simplify and streamline the testing of AI and machine learning (ML) models.
,brain4j-org/brain4j,Open-source machine learning framework for Java. Designed with speed and lightweight in mind.
,Correia-jpv/fucking-awesome-machine-learning,"A curated list of awesome Machine Learning frameworks, libraries and software. With repository stars and forks"
,clay-arras/lamppp,"lamp++ fast and lightweight machine learning framework in cpp, supporting tensors and autograd. includes implementations of basic neural networks"
,foxysky21/Data-Science-Ecosystem," Data Science Ecosystem A curated list of essential data science tools including Python libraries, Jupyter notebooks, data visualization frameworks, machine learning packages, and deployment platforms."
,hocnguyen12/automated-log-analysis,"A tool for analyzing Robot Framework test failures by parsing logs, auto-labeling errors with rule-based logic, and classifying failures using machine learning"
,HoomaanMoradi/ReedsShepp-MLOps,"An MLOps framework for developing, training, and deploying machine learning models aimed at solving the Reeds-Shepp path planning"
,Oluyimide25/attack_detector_2025,DEVELOPMENT OF A MACHINE LEARNING-BASED FRAMEWORK FOR REAL-TIME DETECTION AND MITIGATION OF DISTRIBUTED DENIAL OF SERVICE (DDOS) ATTACKS
,CBaby830/A-MACHINE-LEARNING-FRAMEWORK-FOR-INTRUSION-DETECTION-IN-IOT-ENVIRONMENTS,A MACHINE LEARNING FRAMEWORK FOR  INTRUSION DETECTION IN IOT ENVIRONMENTS
,Saatvik538/AcousticTB,AcousticTB: A machine learning framework leveraging XGBoost and audio signal processing for detecting tuberculosis from cough recordings.
,anacostiaAI/anacostia-pipeline,Anacostia is a framework for creating machine learning operations (MLOps) pipelines
,Forward20250630/IMTCDG,"PyTorch implementation for ""A novel integrated multidomain temporal contrastive domain generalization  learning framework for time-series quality prediction of batch machining"""
,fabP258/Driving_Simulator,A PyTorch based training framework for a Machine Learning Driving Simulator
,aai-institute/nnbench,A small framework for benchmarking machine learning models.
,aws-solutions/media-insights-on-aws,"A serverless framework to accelerate the development of applications that discover next-generation insights in your video, audio, text, and image resources by utilizing AWS Machine Learning and Media services."
,YadavYash089/Flask_Based_Multiple_disease_predictor_Using_ML_and_DL,"A Flask-based multiple disease predictor is a web application that leverages Machine Learning (ML) and Deep Learning (DL) techniques to predict the likelihood of various diseases based on input symptoms, medical history, or other relevant health data. Built using the Flask web framework, it provides a user-friendly interface for patients ."
,yangfa-zhang/lunax,Lunax is a machine learning framework specifically designed for the processing and analysis of tabular data.
,jackgerrits/reductionml,Reduction-based machine learning framework with a focus on contextual bandits
,2ndthoughts/symphonyGPT,"A platform developed from an open framework to help AI researchers and developers to rapidly prototype, test and deploy workflows that include machine learning models as worker components. The workflow can be invoked on command line or web service, as well as integrated into UX/UI as part of a larger intelligent solution."
,gia-uh/autogoal,A Python framework for program synthesis with a focus on Automated Machine Learning.
,99sbr/fastapi-template,"Completely Scalable FastAPI based template for Machine Learning, Deep Learning and any other software project which wants to use Fast API as an API framework."
,Sharon-codes/Machine-Learning-Framework-for-Drug-Efficacy-Prediction-in-Breast-Cancer,
,Jaredabera/Q-Poisoning-Adversarial-Attack,"Implements a quantum state poisoning algorithm designed to explore adversarial attacks in quantum machine learning using the PennyLane framework. The algorithm modifies quantum states through angle phase-shifting, demonstrating how small perturbations can significantly impact the performance of quantum models. "
,eviser1/achine-Learning-Framework-Comparison-Project,"This project demonstrates the implementation of machine learning models using different frameworks (scikit-learn, TensorFlow, and PyTorch) on the Breast Cancer Wisconsin dataset."
,EmilBuch/Condition-Monitoring-with-Machine-Learning,This work is from my master thesis: Condition Monitoring with Machine Learning: A Data-Driven Framework for Quantifying Wind Turbine Energy Loss.
,thieu1995/IntelELM,IntelELM: A Python Framework for Intelligent Metaheuristic-based Extreme Learning Machine
,Bandavarapuvenila/Adaptive-machine-learning-framework-for-fishing-detection,
,genissrruiz/Formation-Analysis-DML,"Analyzes whether defensive formations like parking the bus offer real advantages in football. Uses 22k+ matches and a Double Machine Learning framework adapted for categorical treatments. Includes data from Sportmonks API, formation grouping, team strength features, and SHAP-based model interpretation."
,DeshantGogia/IplMatchPredicionSystem,"Built an end-to-end machine learning framework to forecast IPL match results and scores with Random Forest algorithms, attaining 82.3% accuracy in game win prediction and 9.8 runs MAE in score prediction. Designed 15+ dynamic features (pressure indices, momentum scores) from ball-by-ball data (20082023)."
,matei-birleanu/ML-Air_quality,"ML-Air_quality is a project to analyze and predict air quality using machine learning. It loads datasets (pollutants, weather), preprocesses data, trains models to estimate AQI or detect pollutant trends, and validates results (MAE, RMSE) with visualizations, providing a reproducible framework."
,ArcaneLightning/OncoML,A machine learning framework using ScanPy and Tensorflow to predict anti-cancer drug efficacy and response. The goal is to enable personalized treatment strategies.
,Saranya1202/Veritas-Cardis-A-Machine-Learning-Framework-for-Detecting-Subterfuge-in-Credit-Applications-,
,ShadyEgypt/adas,"ADAS (Advanced Driving Autonomous System) is a modular, full-stack framework for building and deploying self-driving car technologies. It includes machine learning workflows, backend services, a GraphQL API, and a user-friendly frontendorganized into clean, decoupled modules for flexibility and scalability."
,Himanshu7921/SparksNet,"SparksNet is a lightweight deep learning framework built from scratch to help you learn the core principles of neural networks and machine learning. It implements key components like activations, layers, loss functions, optimizers, and more, with a focus on simplicity and extensibility."
,MolCrafts/molpot,[WIP] Machine Learning Molecular ForceField Training and Deploying Framework
,MasFana/BaccoSense,"BaccoSense adalah platform monitoring dan manajemen inventaris berbasis web yang terintegrasi dengan teknologi IoT, AI (ARIMA Forecasting), dan dikembangkan menggunakan framework Laravel untuk frontend/backend serta Python Flask untuk machine learning & komunikasi IoT."
,awesomelistsio/awesome-machine-learning,"A curated list of awesome frameworks, libraries, tools, tutorials, datasets, and research papers in machine learning. This list covers a wide array of topics, from foundational algorithms to modern techniques in supervised, unsupervised, and reinforcement learning."
,microsoft/LightGBM,"A fast, distributed, high performance gradient boosting (GBT, GBDT, GBRT, GBM or MART) framework based on decision tree algorithms, used for ranking, classification and many other machine learning tasks."
,OrFachima1/software-projects,"A collection of academic and personal software projects, covering machine learning, deep learning, NLP, and data-driven applications. Implemented using Python, PyTorch, Hugging Face Transformers, and other modern frameworks."
,wd7512/seu-injection-framework,A Framework for Developing Robust Machine Learning Models in Harsh Environments
,sivakumar240703/Integrated-Machine-Learning-Framework-for-Smart-Farming-,
,gomlx/gomlx,GoMLX: An Accelerated Machine Learning Framework For Go
,maslo-sh/goneural,Go machine/deep learning framework
,aimclub/FEDOT,Automated modeling and machine learning framework FEDOT
,luigibonati/mlcolvar,A unified framework for machine learning collective variables for enhanced sampling simulations
,dns-king/MetaLearning-TransformerNeuralTranslationMachine,Neural Architecture Search (NAS) Framework
,awslabs/graphstorm,Enterprise graph machine learning framework for billion-scale graphs for ML scientists and data scientists.
,Gabriel-Machado-GM/Machine-Learning-Air-Quality-Analysis,"Using Machine Learning Algorithms to monitor the Air Quality in an urban area, the project evolves by applying AI 4 Good Framework"
,Kitware/SMQTK,Python toolkit for pluggable algorithms and data structures for multimedia-based machine learning.
,eZWALT/eZAutoML,"A Democratized, lightweight and modern framework for Python Automated Machine Learning"
,Tensor-Array/Tensor-Array-Python,A high level frontend Python machine learning framework/library for Tensor Array.
,google-parfait/tensorflow-federated,An open-source framework for machine learning and other computations on decentralized data.
,AshwiniN76/health-insurance-prediction,Machine Learning-Based Regression Framework to Predict Health Insurance Premiums
,simadma/causal-machine-learning,Exploring some causal machine learning modeling techniques. The project uses the DoWhy framework.
,galafis/Machine-Learning-R-Framework,Professional repository showcasing advanced development skills
,jacksonbuilds/digit-classifier,A demo project for TensorFlow. TensorFlow is an open-source machine learning (ML) and deep learning (DL) framework developed by Google.
,Ibrahim-Afsar/Ibrahim-Afsar,"IGCSE student at Roots International Schools & Colleges, tech enthusiast, and beginner in machine learning. Skilled in many relevant Python frameworks. Passionate about contributing to impactful projects."
,hamblin-ku/AGNBoost,A felxible machine learning framework for AGN identification and photometric redshift estimation
,DeLaphante/CynkyAutomation,"Powered by Selenium, Reqnroll and ML.Net with detailed HTML reporting, Machine Learning Analysis and Logging capabilities - CynkyAutomation framework can handle any website that is built using AJAX, React, AngularJS, Vue.js, Single Page Applications, Salesforce, Dynamics 365 CRM and many more."
,dancewithDianTong/poster-CUHKSZ-Anker-Capstone,the poster for the project: An Offline Advertising Framework Based on Causal Inference Machine Learning 
,vibhores19/Remote-Sensing-Landcover-Classification,"A machine learning and deep learning-based framework for classifying remote sensing data from Landsat 5 in mountainous Colorado. Includes traditional ML models (SVM, RF, DT) and deep learning architectures (CNN, LSTM, ResNet) to classify 14 land cover types with high accuracy."
,PuscasRaul/skForget,machine learning framework for ai class
,is-leeroy-jenkins/Sake,"Sake is your go-to, modular machine learning framework for Budget Execution data analysis built in Python with Scikit, XGBoost, PyTorch, and TensorFlow. "
,eteh1/Hybrid-Machine-Learning-Framework-for-Water-Quality-Assessment-and-Contamination-Clustering,Hybrid Machine Learning Framework for Water Quality Assessment and Contamination Clustering in the Niger Delta
,fate1997/MoIma,Molecule Imagination: A framework aims to accelare machine learning in Chemistry
,Nana-uOvOu/FedAverage-NjustMachineLearning,"This is the machine learning final project from NJUST (Jiang Ying's class), implementing the Federated Learning framework FedAvg. All the code was written by Zijun Wang."
,PaplomatasP/AutoLDLStack-,"AutoLDLStack is a machine learning-based framework that enhances LDL cholesterol estimation by integrating traditional equations, clinical parameters, and an ensemble stacking model. It offers a fully automated solution, allowing users to train, update, and apply predictive models tailored to their patient populations."
,TaimoorKhan10/AI-Fairness-Explainability-Toolkit,"AI Fairness and Explainability Toolkit (AFET) is an open-source project aimed at providing tools and frameworks to assess, visualize, and mitigate bias in machine learning models. It supports multiple ML frameworks and offers a comprehensive suite of metrics and visualization components to enhance model transparency and fairness."
,epanner/EPFL-NWML-25,A deep learning framework for automatic epileptic seizure detection in EEG recordings. Completed as part of the EPFL Network Machine Learning 2025 course.
