framework,full_name,description
,jabl-94/XMT_forgotten_items_prediction,"Framework for predicting forgotten items in retail environments using interpretable machine learning. Implements XMT and TXMT methods that combine multiple evidence types to identify potentially forgotten items, with emphasis on explainable predictions."
,SoyGema/The-Lord-of-The-Words-The-two-frameworks,Translation exploration with Transformers and Machine Learning Experimentation Platfroms
,BioSystemsUM/DeepMol,DeepMol: A Machine and Deep Learning Framework for Computational Chemistry
,azizp128/income-prediction-flask,An experiment with machine learning model deployment using the Flask framework on Heroku & Streamlit. This project features a simple machine learning model that utilizes the Gradient Boosting Classifier algorithm to predict an employee's income.
,henriceriocain/HenriAI,"HenriAI is a custom fine-tuned conversational AI model built using GPT-Neo. It demonstrates my skills in AI development, including dataset curation and optimization techniques. The project focuses on creating engaging, human-like interactions and showcases my ability to work with advanced machine learning frameworks."
,RAVOdclic2023/RfsefESFE,RfsefESFE is a cutting-edge software framework designed for seamless integration of real-time data stream processing with advanced machine learning algorithms. It provides a user-friendly interface for developers to create high-performance applications for data analysis and prediction in various industries.
,LomashB/100_days_of_AI-ML,"A 100-day journey to master Data Science, AI and Machine Learning through daily blogs, hands-on code implementations, and exploration of essential tools and frameworks. Follow along for consistent progress, fun facts, and practical insights to build expertise and unlock better career opportunities! "
,DS-Kushagra/Machine-Learning-Repo,"Explore the essential concepts and advanced techniques of machine learning. This repository includes a detailed roadmap, real-world project examples, and resources covering traditional ML algorithms, modern frameworks like TensorFlow and PyTorch, and deployment strategies. Perfect for anyone aiming to build and deploy ML models effectively.."
,sarosh2/ML4MDE_Project,Project for the Machine Learning for MDE course. A framework for training unstructured neural network architectures
,Ziad-Abaza/chatbot-QueryBot-python,chatbot built using Natural Language Processing (NLP) techniques. The chatbot can interact with users by processing input and predicting appropriate responses based on pre-defined intents. The models use different machine learning frameworks: tflearn and Keras.
,PurvaMavani/ReCell,"ReCell is a Supervised Learning Framework (SLF) project focused on predicting the prices of used mobile devices. With the rise of the refurbished device market, ReCell leverages machine learning techniques to develop a dynamic pricing model."
,anshsoni0512/House-Price-Prediction-using-Machine-Learning,"I created a house price prediction system using Python for the core logic and Django for the user interface. The system leverages machine learning algorithms to predict property prices based on various features, and the Django framework provides a user-friendly web interface for easy interaction with the model."
,JuliaAI/MLJBase.jl,Core functionality for the MLJ machine learning framework
,PaddlePaddle/Paddle,PArallel Distributed Deep LEarning: Machine Learning Framework from Industrial Practice &
,SnapperML/SnapperML,SnapperML is a framework for machine learning. It has many functionalities including scalability through docker instances and reproducibility.
,shubham15400/Machine_Learning_Framework,
,W3STY11/Neural-Blueprint,"An expansive, evolving repository designed to tackle the unfathomable depth of AI and Machine Learning through research, analysis, and cross-disciplinary exploration of advanced concepts, frameworks, and philosophical implications"
,gogaliyaprerna/Face-Recognition,"A Face Recognition System using Django is a web-based application that leverages machine learning to detect and recognize human faces from images or video streams. This system integrates Django as the backend framework and uses OpenCV and deep learning models (e.g., FaceNet, Dlib, or OpenCVs Haar cascades) for facial recognition."
,ML4Net/SSH-Shell-Attacks,"Project for Machine Learning for Networking Exam @ Polito - SSH Shell Attacks Analysis: a project to classify attacker tactics and identify patterns in 230,000 honeypot-captured Unix shell attacks using MITRE ATT&CK framework and ML techniques."
,helmholtz-analytics/heat,Distributed tensors and Machine Learning framework with GPU and MPI acceleration in Python
,manemsai/MCQ-Generator,"The MCQ Generator is a cutting-edge application designed to harness the power of Artificial Intelligence for educational content creation. This project streamlines the process of generating high-quality, multiple-choice questions by leveraging advanced machine learning frameworks, making it an invaluable tool for educators, students, and content cr"
,Cameron-zgl/Biostat_625_umich_final_project,This project consists of a two-step framework for analyzing mental health-related posts and predicting depression risk using machine learning and deep learning models. The dataset used is sourced from Zenodo and includes Reddit posts from various mental health subreddits.
,lonestarcode/data-framework,"Comprehensive data science platform featuring advanced scraping, machine learning, and automated workflow capabilities. This framework provides a production-ready foundation for building and deploying data-driven applications."
,simondereuver/ml-exploration,A hands-on repository for implementing machine learning algorithms from scratch and exploring frameworks like PyTorch.
,SCAI-BIO/causal-npi-effects,A causal machine learning framework to assess effects of non-pharmaceutical interventions on pandemic disease spread.
,arjunpaud/Air_Quality_Predictor,In project we have build use machine learning model and flutter framework  to predict the quality of air.
,chrispfae/ART-SM,Fragment-based machine learning framework for backmapping CG structures to atomistic resolution
,damiasyam314/Football-Match-Prediction-Home-vs-Away," This project demonstrates a framework to predict English Premier League match outcomes using machine learning. The project involves data engineering for 30 seasons (1993/1994 to 2022/2023), followed by training and testing models like SVM, Random Forest & Logistic Regression"
,MvMukesh/DataPreprocessing-Framework-ML,"Least Discussed topic Data Preparation, most important part of a machine learning project"
,Shafiqul1884/ML,"A repository for Machine Learning (ML) projects, experiments, and implementations. Covers data preprocessing, model training, evaluation, and deployment using popular frameworks like Scikit-Learn, TensorFlow, and PyTorch. "
,neonite2217/AIML,"This repository contains a collection of AI and Machine Learning projects built using various libraries and frameworks such as TensorFlow, PyTorch, Scikit-learn, and others. It includes algorithms, models, and applications that demonstrate the power of machine learning and artificial intelligence to solve real-world problems."
,supercgor/AmorAFM,Machine learning Framework for Amorphous Ice Layer Detection on AFM image
,IDASLab/InTec_Framework,"This repository contains the implementation code for InTec (Integrated Things-Edge Computing), a novel framework for distributing machine learning (ML) pipelines across Things, Edge, and Cloud layers in IoT environments. "
,Varun-Mayilvaganan/GAN-Enhanced-Phishing-Detection,"A phishing detection framework that utilizes machine learning, adversarial training, and multi-modal feature extraction. It analyzes various data sources, including URLs, HTML, metadata, and user behavior, while leveraging GAN-generated samples to protect against adversarial attacks."
,ALIhertgit/FinalProject,Python Script for Car Insurance Claim Prediction: An End-to-End Machine Learning Framework 
,TsLu1s/mlimputer,MLimputer: Missing Data Imputation Framework for Machine Learning
,Data-Science-Big-Data-Research-Lab/MetaGen,MetaGen: A framework for metaheuristic development and hyperparameter optimization in machine and deep learning
,258shoumiki08/Stock-Trend-Prediction,"Engineered a dynamic machine learning model to predict stock market trends using S&P 500 data.Utilized a Random Forest Classifier with a backtesting framework, incorporating rolling averages and trend analysis to improve accuracy and insights."
,ATOMworkplace/FinanceCraft,"FinanceCraft is a quantitative framework leveraging technical indicators and machine learning for stock market trend analysis and prediction.  It employs yfinance for data acquisition and Pandas for preprocessing, laying the groundwork for feature engineering, model training, and the implementation of trading algorithms."
,franyatta/llm-finetuning-project,"A lightweight framework for fine-tuning small language models, designed to run on basic hardware"
,TsLu1s/atlantic,Atlantic: Automated Data Preprocessing Framework for Machine Learning
,clee-ai/3d-ml,A versatile framework for 3D machine learning built on Pytorch Lightning and Hydra [looking for contributors!]
,microsoft/DeepGNN,DeepGNN is a framework for training machine learning models on large scale graph data.
,bniladridas/distributed_ml,High-performance distributed machine learning framework leveraging MPI for parallel training across multiple nodes.
,Iyanuadeleye01/MachineLearning-WebApp,This project integrates a custom machine learning pipeline into a web application built with the Flask framework. The pipeline combines both classification and regression models to deliver versatile predictive capabilities within a unified system.
,ytopt-team/ytopt,ytopt: machine-learning-based autotuning and hyperparameter optimization framework using Bayesian Optimization
,gomlx/gomlx,GoMLX: An Accelerated Machine Learning Framework For Go
,wilfredpine/Python-Tutorial,"Notebook tutorials for Python Programming Language (Fundamentals, OOP, MVT, Frameworks, Django, Machine Learning, NLP)"
,openlangrid/mlgrid-services,A framework to serve various generative AIs and other machine learning functions via WebSocket and JSONRPC.
,DarkStarStrix/Auto_Api,A simplified machine learning framework 
,i6dxtr/project-showcase,"implementation of a pre-trained image labeling machine learning model using tensorflow/pytorch frameworks (ResNet50, EfficientNet, VGG16) for use in the project showcase"
,AmmarSaleh50/Handwritten-Digit-Recognition-Model,"A machine learning model that accurately recognizes handwritten digits (0-9) using deep learning. Built with [mention framework, e.g., TensorFlow/PyTorch] and trained on the MNIST dataset, it achieves high accuracy in classifying digits. Ideal for exploring computer vision and neural networks."
,bmcastrow/Office-CCTV-Monitoring,"Initially conceived as an idea for a university project, this initiative transformed into a robust computer vision-powered framework leveraging machine learning, deep learning, and YOLOv8 object detection to classify and track activities like walking, sitting, talking and falling in office environments, enhancing workplace safety and productivity."
,Botti01/SSH-Shell-Attacks,"Project for Machine Learning for Networking Exam @ Polito - SSH Shell Attacks Analysis: a project to classify attacker tactics and identify patterns in 230,000 honeypot-captured Unix shell attacks using MITRE ATT&CK framework and ML techniques."
,ibrahimsaleem/DDoS-Detection-and-Mitigation-Framework-Using-Software-Defined-Networking-SDN-,"Developed a real-time DDoS detection and mitigation system leveraging SDN's centralized control and machine learning algorithms. Implemented traffic analysis, feature extraction, and dynamic threat mitigation using tools like Mininet, Ryu Controller, and KNN."
,gege-circle/home,"GitHubThis is GitHub grassland, and the community place for Gege circle lovers, mainly discusses anime, games, technology, lifing and other topics. You are welcome to share interest things here.     MySQL    996icu     Bitcoin  Leetcode    Java"
,Ifem2BXvz4N4gh1gGn0bkR3Lp/cihna-dictatorshrip-8,"Anti Chinese government propaganda. https://github.com/cirosantilli/china-dictatorship backup.  996.ICU709Friends who live in China and have real name on account, please don't star this repo, or else the police might pay you a visit.  Home to the mega-FAQ, news compilation, restaurant and music recommendations.Heil Xi . "
,aparna2071/Chatbot-using-Rasa-machine-learning-framework,
,vikash029/AutoAlgoRecommender,"AutoMLSelector is a Python framework that automates the selection of the best machine learning algorithm for your dataset. It preprocesses data, tests multiple models, and recommends the top performer based on metrics like accuracy or MSE, streamlining your ML workflow."
,BReact/BReact-sdk,"BReact's platform is a comprehensive framework designed to automate manual processes across various business domains by integrating advanced AI technologies such as Large Language Models (LLMs), Machine Learning (ML), and Computer Vision (CV). "
,tsyet12/Chemsy,A Minimalistic Automatic Framework for Chemometrics and Machine Learning
,riashrma24/machine-learning-framework,
,lamalab-org/MoleculeBind,"MoleculeBind is a machine-learning framework for chemistry, where we target unifying various molecular representations into one common latent space (SELFIES, SMILES, Graph, Structures, Fingerprints, Molecular Spectra)"
,BBVA/mercury-explainability,mercury-explainability is a library with implementations of different state-of-the-art methods in the field of explainability. They are designed to work efficiently and to be easily integrated with the main Machine Learning frameworks.
,SS-research/bacflow,machine learning framework for blood alcohol content estimation
,gruchh/FactoryMaintenanceManagement,"This project was created for learning Java, specifically the Spring framework. The application aims to manage machines, breakdowns, and maintenance staff in a factory."
,PranithaKondipamula/Text-data-mining-and-Machine-Learning-Optimisation,"A comprehensive framework for categorizing Adobe support cases, utilizing machine learning and Large Language Models (LLM) to enhance problem classification, resolution tracking, and root cause analysis."
,Project-AgML/AgML,"AgML is a centralized framework for agricultural machine learning. AgML provides access to public agricultural datasets for common agricultural deep learning tasks, with standard benchmarks and pretrained models, as well the ability to generate synthetic data and annotations."
,digitalcytometry/spatialecotyper,Spatial EcoTyper is a machine learning framework for systematic identification of spatially distinct multicellular communities from single-cell spatial transcriptomics data.
,SciML/ModelingToolkit.jl,An acausal modeling framework for automatically parallelized scientific machine learning (SciML) in Julia. A computer algebra system for integrated symbolics for physics-informed machine learning and automated transformations of differential equations
,ivy-llc/ivy,Convert Machine Learning Code Between Frameworks
,DharshiniR1953/AI-Framework-for-Conversational-Bot-by-Vision-Transformers-in-Health-Care-Systems,"This project presents an automated system that utilizes machine learning algorithms to identify medicinal plants from images. It integrates a chatbot interface to provide users with reliable information about plant identification, properties, and medicinal uses."
,Hitoshi-Kazuto/WaterWise,"WaterWise is a cutting-edge project that utilizes machine learning to predict groundwater contamination levels with high accuracy. It builds on the robust DRASTIC model, a widely accepted framework for assessing groundwater vulnerability."
,hashemUOP/Bootstrap-Django-website,"A dynamic and responsive e-commerce website for electronics named Electro, built with Django as the backend framework and Bootstrap for the frontend design. The platform features a robust product recommendation  engine powered by a machine learning model developed using scikit-learn and cosine similarity. This recommendation system provides persona"
,bilkentli88/ARTSC,"Autoregressive Time Series Classification (ARTSC) ARTSC is a domain-independent machine learning framework for time series classification. By leveraging autoregressive modeling, the method extracts meaningful features to achieve competitive accuracy across diverse datasets. Developed in R, ARTSC provides a simple yet effective solution for research"
,Vishalvk2219/Vishalvk2219,"A collection of my projects that demonstrate my skills in AI, machine learning, web development, and data analysis. This repository includes various implementations and experiments, showcasing my expertise with tools like Python, React, Node.js, and deep learning frameworks."
,UCFLeiHan/Spatial-ML,"A novel spatial Machine Learning (ML) framework that integrates multiple ML modelsRandom Forest, XGBoost, and LightGBMwith geographically weighted regression to account for spatial heterogeneity. The framework has been successfully applied to intersection crash frequency modeling, achieving excellent performance."
,chanjunha0/SBE2025-wearable-io-classification,"Code for A Multi-Modal Wearable and Machine Learning Framework for Accurate Indoor-Outdoor Classification in Urban Climate Studies, presented at SBE25 Zrich (June 25-27, 2025). This study integrates wearable sensor data and ML to improve indoor-outdoor classification for urban heat exposure analysis."
,tanvir5386/Final-Django-ML-course-,"This repository showcases a Machine Learning-powered web application built using Django. It integrates ML models into a web framework, enabling real-time predictions through a user-friendly interface."
,Arpik/smart-tests-for-e-commerce,"An AI-powered automation framework for testing e-commerce functionalities on the E-Commerce demo site.  It uses Playwright for efficient end-to-end testing and integrates machine learning to prioritize test cases and detect anomalies,  ensuring quality and reliability in e-commerce platforms."
,coder-chitra/DeepDefender,"DeepDefender is an AI-powered security tool for real-time threat detection using machine learning models. It integrates computer vision for video analysis and provides a simple web interface for monitoring. The project uses frameworks like TensorFlow, PyTorch, and OpenCV to enhance system protection."
,patilaakash619/PANCPRED-Pancreatic-Cancer-Survival-Analytics-Mod,"A comprehensive machine learning framework for predicting pancreatic cancer survival outcomes using patient demographics, clinical indicators, and socioeconomic factors."
,leondavi/NErlNet,Nerlnet is a framework for research and development of distributed machine learning models on IoT
,HarshithaMegharaj/Classification-of-Music-Genre,"This project proposes a framework for music genre classification using the GTZAN dataset. Advanced signal processing techniques extract features like MFCCs and chroma features, while ensemble machine learning models achieve high accuracy. The findings support applications in music recommendation systems, music therapy, and computational musicology."
,Luwen-Zhang/SNEnsemble,"This work proposes a framework that integrate empirical models and machine learning models for better extrapolation, exemplified by fatigue life prediction of fiber-reinforced composites."
,Vaidehi-M-P/Clinical-Parameters-Monitoring-Framework-Using-Image-Processing-and-Machine-Learning,
,M-Abdullah-H/ml-project-MA,"A collection of data science and machine learning projects, showcasing exploratory data analysis, predictive modeling, and advanced visualization techniques. Each project highlights unique datasets and methodologies, leveraging Python, machine learning frameworks, and interactive tools for actionable insights."
,Lakshaygoel4321/Car-Price-Prediction,This model is used to predict the cars prices after enter the details. Here i am using the machine learning framework.
,ErdemAslans/Hydra-with-Classification,"A robust and flexible framework for training MNIST classification models using PyTorch Lightning and Hydra. This project leverages Hydra's powerful configuration management to enable modular, scalable, and reproducible machine learning workflows."
,Gokulm29/AutoML-For-Job-Placement-Prediction,"AutoML in empowers users to automate the entire machine learning pipeline, from data preprocessing to model deployment, through user-friendly libraries like scikit-learn, TensorFlow AutoML, and H2O.ai. By automating tasks like model selection, hyperparameter tuning, and feature engineering, Python-based AutoML frameworks make machine learning"
,sujitmahapatra/Diabetes-Prediction-ML-Web-App,"Diabetes Prediction ML Web App. Includes machine learning models such as Logistic Regression, Random Forest, Gradient Boosting, and Support Vector Machine (SVM). For Web App - HTML, CSS and Django framework."
,entelecheia/hyfi-ml,A Python package that extends the Hydra Fast Interface (HyFI) framework with machine learning capabilities.
,calt-laboratory/kotlin_machine_learning_lifecycle_framework,Kotlin-based machine learning lifecycle framework
,geekscape/aiko_services,"Distributed service framework using asynchronous messages supporting IoT, Machine Learning and Video"
,roodriigoooo/Machine-Learning-in-Finance-Labeling-Guide,"Exploration of ML applications in finance, drawing inspiration and summarizing the currently available and relevant literature. The objective is to deepen my understanding of key concepts, re-implement them with improvements, and explore alternative, non-widely used frameworks. "
,theSalted/Alloy,Machine Learning Framework Written In Swift and Metal
,fairen-group/mof-biocompatibility,Guiding the rational design of biocompatible metal-organic frameworks for drug delivery using machine learning
,mstrYoda/ml-from-scratch,A comprehensive collection of practical machine learning examples using popular frameworks and libraries.
,hugoestradas/MLOps-Template,"Structured framework or project layout designed to streamline and standardize the development, deployment, and maintenance of machine learning (ML) projects.  It provides a foundation for implementing MLOps best practices and principles throughout the ML lifecycle."
,peacefulotter/pyroml, Machine Learning framework allowing plug-and-play training for pytorch models
